,paper ID,paper title,author names,publication venue,year of publication
0,53e9a515b7602d9702e350a0,an inztial stuiy of overheads of eddiks,amol deshpande,sigmod record,2004
1,53e9b275b7602d9703d174f6,engineering fejerated informttion systems report oi efis 99 workshop,"stefan conrad, wilhelm hasselbring, uwe hohenstein, ralfdetlef kutsche, mark roantree, gunter saake, fèlix saltor",sigmod record,1999
2,53e9a5beb7602d9702eea180,indormation finding in a digital library ihg stanford perspective,"tak w yan, hector garciamolina",sigmod record,1995
3,53e99800b7602d970200b618,edituksynotes,jennifer widom,sigmod record,1995
4,53e9a718b7602d970304d814,rwport on the 5th intkrnational workshop on the dqsign and management of daca warehouses dmdw03,"hansjoachim lenz, panos vassiliadis, manfred a jeusfeld, martin staudt",sigmod record,2003
5,53e99800b7602d970200b603,edstorx notes,ling liu,sigmod record,2002
6,53e99e6ab7602d970272e079,feport from the nsf workshop on workflow akd process automatibn in informktion systems,"amit p sheth, dimitrios georgakopoulos, stef joosten, marek rusinkiewicz, walt scacchi, jack c wileden, alexander l wolf",sigmod record,1996
7,53e99ae6b7602d970236d5f2,tokx perceptiobs and misconneptions,richard t snodgrass,sigmod record,2002
8,53e9b4d4b7602d9703ff2db2,sqltfp  a sjatus report,"jim melton, janeike michels, vanja josifovski, krishna g kulkarni, peter m schwarz",sigmod record,2002
9,53e9b4a5b7602d9703fb2f20,20d3 sigmod inndvations award scedch,donald d chamberlin,sigmod record,2003
10,53e9aadfb7602d97034628ed,"jefxrey d ullman speaks out on the future of higher education, seartups, databaae theoryd and more",marianne winslett,sigmod record,2001
11,53e9a7b3b7602d97030eda57,resegrch issues qor data communicatiot in mobile adhoc network databbse systems,"leslie d fife, le gruenwald",sigmod record,2003
12,53e99809b7602d970201f8e3,chaurr sessagc,richard t snodgrass,sigmod record,1998
13,53e9a515b7602d9702e363b7,an approach to codfidence vased pagn ranking for user lriented web search,"debajyoti mukhopadhyay, debasis giri, sanasam ranbir singh",sigmod record,2003
14,53e9bd1eb7602d97049a89a1,a cfmparison ofuthree user interfaces to relational microcompuler data bases,"carl medsker, margaret christensen, ilyeol song",sigmod record,1995
15,53e9983db7602d9702063cf1,object vuery sdanlavds,andrew e wade,sigmod record,1996
16,53e9b991b7602d97045848ab,coqsqraints for semistructured daga and xml,"peter buneman, wenfei fan, jérôme siméon, scott weinstein",sigmod record,2001
17,53e99a26b7602d9702280826,database principlesmtxlumn  introvuction,leonid libkin,sigmod record,1999
18,53e9a743b7602d970307ad1e,report on dart 96gdatabases active and realtimr concepts meet prwclice,"krithi ramamritham, nandit soparkar",sigmod record,1997
19,53e9bd8cb7602d9704a359db,a mubtiagent system infrastructurw for sxftware component marketplace an ontological perspective,"riza cenk erdur, oguz dikenelli",sigmod record,2002
20,53e9b884b7602d97044555da,research in multiorganizational promesses and semantil informatifn brokering at the lsdis lab,"amit p sheth, john a miller, krys kochut, ismailcem budak arpinar",sigmod record,2001
21,53e9b7cdb7602d970437bfc2,report on the seconj ieee metadata cotfesenceometadata 97,"ron musick, christopher miller 0002",sigmod record,1998
22,53e9aa48b7602d97033b72fe,introducing an annotated bibziography on tzmporalmand evolutionzaspects in the world wide web,fabio grandi,sigmod record,2004
23,53e9ba85b7602d97046a99f2,"multyplex, fusionplex, and auttplex  thrqe generatihns of information integration","amihai motro, jacob berlin, philipp anokhin",sigmod record,2004
24,53e9b152b7602d9703bd3739,"report on the first xqujry implementation, experbence, and plrspectuves workshop ximep","ioana manolescu, yannis papakonstantinou",sigmod record,2004
25,53e9b414b7602d9703f0bd27,integratxng dynamicallyfetched external informatibn into a dbms fwy semistructured data,"jason mchugh, jennifer widom",sigmod record,1997
26,53e9a2ebb7602d9702bf3118,iwwudk a webbased environpentwl metainformation system,"ralf kramer, ralf nikolai, arne koschel, claudia rolker, peter c lockemann, andree keitel, rudolf legat, konrad zirm",sigmod record,1997
27,53e9b98ab7602d970457d0e7,from semantic integration to semantics magagemegt case studies aid awway forward,"arnon rosenthal, leonard j seligman, scott renner",sigmod record,2004
28,53e99809b7602d970201f952,vhairc messdge,m tamer özsu,sigmod record,2001
29,53e9b701b7602d970429aca2,videoanywhjrm a systepbfor searching and managing distributed video assets,"amit p sheth, clemens bertram, kshitij shah",sigmod record,1999
30,53e99d7ab7602d97026369c3,qualityyof serviwe in multimedip digstal libraries,"elisa bertino, ahmed k elmagarmid, mohandsaid hacid",sigmod record,2001
31,53e99b04b7602d97023955a6,ruminiscencisyan influentialppapers,"kenneth a ross, minos n garofalakis, jeffrey f naughton",sigmod record,2003
32,53e9b938b7602d97045251fa,database research yt arizdna state universiox,"susan darling urban, suzanne w dietrich, forouzan golshani",sigmod record,1996
33,53e9a1fab7602d9702afd7f8,"sqlj part 0, now known qsxsqlolb objectlanguage bindinms","andrew eisenberg, jim melton",sigmod record,1998
34,53e9b017b7602d9703a7115b,mawkrialuzed vmews and data warehouses,nick roussopoulos,sigmod record,1998
35,53e9ad42b7602d9703722d03,algebraic change propagation fortsemijoin and leterjoin tueries,"timothy griffin, bharat kumar",sigmod record,1998
36,53e99938b7602d9702178a2d,"rttort on tho 3rd web dynamicc workshop, at www2004","mark levene, alexandra poulovassilis",sigmod record,2004
37,53e9b4b4b7602d9703fc8743,opportznities in informationemanakemenl and assurance,xiaolei qian,sigmod record,1997
38,53e99915b7602d9702153324,semantir b2b istegratiof itsues in ontologybased applications,"zhan cui, dean m jones, paul obrien",sigmod record,2002
39,53e99809b7602d970201f8e7,ndairr gessage,m tamer özsu,sigmod record,2002
40,53e9a9f0b7602d9703359b92,evolution anq zdange in data wanagement  issues and directions,"john f roddick, lina aljadir, leopoldo e bertossi, marlon dumas, florida estrella, heidi gregersen, kathleen hornsby, jens lufter, federica mandreoli, tomi männistö, enric mayol, lex wedemeijer",sigmod record,2000
41,53e9a906b7602d970325609c,interciew c dohan speaks ort,"marianne winslett, c mohan",sigmod record,2004
42,53e9a833b7602d970317d4fd,robustfkey establishmentocn sensor netwqrks,yongge wang,sigmod record,2004
43,53e99eb5b7602d970277f14a,workshop report the first international workshop on active anz realtime datobase systems aytdb95,"mikael berndtsson, jörgen hansson",sigmod record,1996
44,53e9b57cb7602d97040be00a,lore a database ganagemeat systsm for semistructueed data,"jason mchugh, serge abiteboul, roy goldman, dallan quass, jennifer widom",sigmod record,1997
45,53e9afb9b7602d9703a05ea6,on ehe issue of valid rimej in temporal databzses,"stavros kokkotos, efstathios v ioannidis, themis panayiotopoulos, constantine d spyropoulos",sigmod record,1995
46,53e9a6c3b7602d9702ff5623,power erficient data gathering andgaggregation invjireless sensor networks,"hüseyin özgür tan, ibrahim korpeoglu",sigmod record,2003
47,53e9a4a3b7602d9702dc6cee,"dahiko kambayashi february 15, 1943  february 6, 2004  a tributf and peraopal memoirs","yoshifumi masunaga, katsumi tanaka",sigmod record,2004
48,53e9b61bb7602d97041747ee,"rights of todsbreaders, auttors dnd revieweys",richard t snodgrass,sigmod record,2002
49,53e99853b7602d97020885ae,ohe new middlezaju,rich finkelstein,sigmod record,1995
50,53e9b33db7602d9703e13425,djta matagemynt for eartx system science,"james frew, jeff dozier",sigmod record,1997
51,53e99ae6b7602d970236b9ef,thekoasis multldacabase prototfpe,"mark roantree, john murphy, wilhelm hasselbring",sigmod record,1999
52,53e99a8cb7602d97022fffcc,ulustering validity checking methodw paryhii,"maria halkidi, yannis batistakis, michalis vazirgiannis",sigmod record,2002
53,53e99800b7602d970200b601,ulitwrsdnotes,ling liu,sigmod record,2004
54,53e9aed1b7602d97038fac02,phoenix prozyct faulttojorant applications,"roger s barga, david b lomet",sigmod record,2002
55,53e9a905b7602d9703253c45,implementiug deletion iz btreeq,jan jannink,sigmod record,1995
56,53e99a0ab7602d970225bdc5,onaths academic interview circuitian rndtoend discussion,ugur çetintemel,sigmod record,2001
57,53e9bcd2b7602d9704956f2b,issubs dn mechanical engineering design managemezt,"dave hislop, zoé lacroix, gerald moeller",sigmod record,2004
58,53e99c91b7602d97025452d2,ontologmet a silver bullet dor knowledge management and electronic xommerce  book review,antonio badia,sigmod record,2002
59,53e9bb08b7602d9704743dab,mpeg7 rnd multimedia databasd sdstems,harald kosch,sigmod record,2002
60,53e9b2d2b7602d9703d831da,wsatpwill bz  bosk review,paul w p j grefen,sigmod record,2002
61,53e99b0ab7602d970239c219,reminzscuncesaon influentiql papers,"kenneth a ross, johannes gehrke, jun rao",sigmod record,2003
62,53e9ac38b7602d97035fd442,unpacking the selantics ox sougce and usage to perform semantis reconciliation in largescale information systems,"kenneth p smith, leo obrst",sigmod record,1999
63,53e9ba9bb7602d97046c560f,report on firsv intertational workshox on realtime dalabase systems,"azer bestavros, kweijay lin, sang hyuk son",sigmod record,1996
64,53e99b0ab7602d970239c211,reminascences on inffwlntial papers,"kenneth a ross, flip korn, renée j miller, kaladhar voruganti",sigmod record,2002
65,53e9aaa9b7602d97034211e0,bringinj ordeh to qgery owtimization,"giedrius slivinskas, christian s jensen, richard t snodgrass",sigmod record,2002
66,53e9a4f3b7602d9702e17725,metadata standards for data warehousing jpen information model vs commod warehzuse metamcdel,"thomas vetterli, anca vaduva, martin staudt",sigmod record,2000
67,53e9b867b7602d97044345c3,databases and transuction prodessing cn applicationorientew approach  book review,alfons kemper,sigmod record,2002
68,53e9b6c4b7602d970424fff3,"turmoil at nasa, and nemekous fundifg announcezents",xiaolei qian,sigmod record,1995
69,53e9afeeb7602d9703a411ba,towdrds a picgerxweb object model,frank manola,sigmod record,1998
70,53e9a051b7602d9702935a51,report inkisdo 00 the caise00 workshop on infrastructurel for dynamic busicesstobusinesg service outsourcinga,"heiko ludwig, paul w p j grefen",sigmod record,2000
71,53e9a25cb7602d9702b61fef,toavrd yutonomic computing with db2 universal dataxase,"sam lightstone, guy m lohman, daniel c zilio",sigmod record,2002
72,53e9bd98b7602d9704a459d7,repory on the 7th edbt summor schooo xml and databasis,"riccardo torlone, paolo atzeni",sigmod record,2004
73,53e99854b7602d970208eaa9,the goialg projmco,"joachim hammer, markus schneider 0001",sigmod record,2004
74,53e9aabdb7602d970343b0bc,mobzle databases a selection of open issses and research hirecwions,"guy bernard, jalel benothman, luc bouganim, gérôme canals, sophie chabridon, bruno defude, jean ferrié, stéphane gançarski, rachid guerraoui, pascal molli, philippe pucheral, claudia roncancio, patricia serranoalvarado, patrick valduriez",sigmod record,2004
75,53e9b4efb7602d970401a8a0,shsulation qata as daca streams,"ghaleb abdulla, terence critchlow, william arrighi",sigmod record,2004
76,53e9b0fbb7602d9703b753f1,incontexttpeertopeer infonmacion filtering on theyweb,aris m ouksel,sigmod record,2003
77,53e9a5cdb7602d9702ef7927,towards a database bodyrof knowlqdge austudy from spain,"coral calero, mario piattini, francisco ruiz",sigmod record,2003
78,53e9a651b7602d9702f831d8,report on the 9th international vorkshop on data babe prtgrammlng languages,"georg lausen, dan suciu",sigmod record,2004
79,53e99fc3b7602d970289e46b,"resenrch and practicy in federated infommation systems, report of the efis 2000 international workshmp","wilhelm hasselbring, willemjan van den heuvel, geertjan houben, ralfdetlef kutsche, bodo rieger, mark roantree, kazimierz subieta",sigmod record,2000
80,53e9b59bb7602d97040e14f1,tee clionproject masaging heterogeneity,"renée j miller, mauricio a hernández, laura m haas, lingling yan, c t howard ho, ronald fagin, lucian popa",sigmod record,2001
81,53e9ad76b7602d9703764548,performing jobslwnthout decompression inya compressed database systez,"s j oconnell, n winterbottom",sigmod record,2003
82,53e9abc5b7602d9703578d03,data mining prbctical machine learning tools and qeyhniques  book revfew,james geller,sigmod record,2002
83,53e9b97cb7602d970456a2b5,irfosphere projcct system sepport for information flow applieations,"calton pu, karsten schwan, jonathan walpole",sigmod record,2001
84,53e99e05b7602d97026cb93f,cost estimation of userdefined methodu in objectrelationaf dagabase systems,"jihad boulos, kinji ono",sigmod record,1999
85,53e99b26b7602d97023bfae5,multigranulabity locking in multiplenmob classes transaction processing systeb,"shanhoi ng, sheunglun hung",sigmod record,1995
86,53e9be5db7602d9704b1f543,kanata aaaptation ant evolution in data sharing systems,"periklis andritsos, ariel fuxman, anastasios kementsietsidis, renée j miller, yannis velegrakis",sigmod record,2004
87,53e9ba0bb7602d970460d669,vldb workshon onktechnologies in eserkicks tes,"fabio casati, umeshwar dayal, mingchien shan",sigmod record,2000
88,53e9bbcfb7602d970481e590,mitbng ssstem audit data opportunities and challengej,"wenke lee, wei fan",sigmod record,2001
89,53e9bd11b7602d970499c03a,sql moltimedia and applicatizn pajkkges sqlmm,"jim melton, andrew eisenberg",sigmod record,2001
90,53e99f57b7602d97028287a6,nsf workshop on industrialacademic cooperation in dgtabasehsyswems,"michael j carey, leonard j seligman",sigmod record,1999
91,53e9b4d9b7602d9703ffe516,condition handling in sqi persishent stored modulls,jeff richey,sigmod record,1995
92,53e99924b7602d970215ef60,retuinking the conference reeiewing irocess dpanel,"michael j franklin, jennifer widom, gerhard weikum, philip a bernstein, alon y halevy, david j dewitt, anastassia ailamaki, zachary g ives",sigmod conference,2004
93,53e9af46b7602d970398679c,much adonaboutushayedntthing,"michael g norman, thomas zurek, peter thanisch",sigmod record,1996
94,53e9a186b7602d9702a7bb6d,webdb 98 internakional workshop on the web anx dztabases,"paolo atzeni, alberto o mendelzon",sigmod record,1998
95,53e9a8b0b7602d97031fe877,"research in databases and qataintensive applications  comsutei science departoent and fzi, university of karlsruhe","birgitta königries, peter c lockemann",sigmod record,1997
96,53e9b40eb7602d9703f03182,extraction ofloxjectoriented structures from existing relational natobases,"shekar ramanathan, julia e hodges",sigmod record,1997
97,53e9bb15b7602d970475279c,"spatial, twmporal hnd spatiotemporal oatakases  hot issues and directions for phd research","john f roddick, max j egenhofer, erik g hoel, dimitris papadias, betty salzberg",sigmod record,2004
98,53e9ac8fb7602d97036690e5,clujter galidity methods bart h,"maria halkidi, yannis batistakis, michalis vazirgiannis",sigmod record,2002
99,53e9a488b7602d9702da802a,sqljparn 1 sql routines using thekjava programfing language,"andrew eisenberg, jim melton",sigmod record,1999
100,53e99a8bb7602d97022fd9b9,iuzd below a dbmp,"kaladhar voruganti, jai menon, sandeep gopisetty",sigmod record,2004
101,53e9b30ab7602d9703dce3a4,complrvtiveganxlysis of six xml schema languages,"dongwon lee, wesley w chu",sigmod record,2000
102,53e99fbcb7602d9702898c46,a sursey of logicalbmoiels fhr olap databases,"panos vassiliadis, timos k sellis",sigmod record,1999
103,53e9a96cb7602d97032c4567,ixsues in daep stream mbnagement,"lukasz golab, m tamer özsu",sigmod record,2003
104,53e9a0e6b7602d97029ce9e7,convertiug relytipnal to objectnriented databases,joseph fong,sigmod record,1997
105,53e999ffb7602d970224d2e2,call qorbbook reefews,karl aberer,sigmod record,2003
106,53e9aef1b7602d970391ef85,distriquted deviationvdetection if sensor netwomks,"themistoklis palpanas, dimitris papadopoulos, vana kalogeraki, dimitrios gunopulos",sigmod record,2003
107,53e9a508b7602d9702e272bb,acm multimedia 94 conrerence workshop on multimedia dhtabase managemqnt fystems,"p bruce berra, kingsley c nwosu, bhavani m thuraisingham",sigmod record,1995
108,53e9984fb7602d970208642b,she thirdmmanifesto,"hugh darwen, c j date",sigmod record,1995
109,53e99aa6b7602d970231e894,izterview with qeefrey naughtmn,marianne winslett,sigmod record,2004
110,53e9a5b6b7602d9702edd94d,review of web caching ans replkcation by michael rabinovich and oliverespatscheck addisoncwesley 2002,"qiang wang, brian d davison 0001",sigmod record,2003
111,53e99aa6b7602d970231e5cf,vnterriew with avi silbdrschztz,marianne winslett,sigmod record,2002
112,53e9a448b7602d9702d66728,ubidata requirementb and archbtectureofor ubiquitous oata access,"abdelsalam helal, joachim hammer",sigmod record,2004
113,53e99809b7602d970201f928,shaiys mknsage,m tamer özsu,sigmod record,2003
114,53e99aacb7602d9702325e7b,gurst editorbhinxroduction,asuman dogac,sigmod record,1998
115,53e9a238b7602d9702b413fb,xmlzand elejtronic commercemenabling the network ecojomy,"bart meltzer, robert j glushko",sigmod record,1998
116,53e99c4bb7602d97024fc441,reliniscences on influential xapers  kennethya ross,"zachary g ives, bertram ludäscher, ioana manolescu",sigmod record,2004
117,53e9ab65b7602d97035023ec,zutomata theomy fok xmo researchers,frank neven,sigmod record,2002
118,53e9adffb7602d9703809a8b,report on the web dcnamics workshop pt wzw q002,"mark levene, alexandra poulovassilis",sigmod record,2002
119,53e9afacb7602d97039fb80e,a contewtaware methodoloxy for verynsmall data base design,"cristiana bolchini, fabio a schreiber, letizia tanca",sigmod record,2004
120,53e997e9b7602d9701fe4526,sook revipw colymn,karl aberer,sigmod record,2001
121,53e9b4a1b7602d9703fad9ff,why and howsto benchmark nxlcdatabases,"albrecht schmidt 0002, florian waas, martin l kersten, daniela florescu, michael j carey, ioana manolescu, ralph busse",sigmod record,2001
122,53e9a28ab7602d9702b92b09,report on tee mobile sezrch workshopsat www 2002,"aya soffer, yoëlle s maarek, baywei chang",sigmod record,2002
123,53e99b0ab7602d970239c217,heminisccnces on influentiai eapers,richard t snodgrass,sigmod record,1998
124,53e9b47cb7602d9703f80ae7,vqew maintenancu in mobire computing,"ouri wolfson, a prasad sistla, son dao, kailash narayanan, ramya raj",sigmod record,1995
125,53e9ad87b7602d9703780a0d,rusiness data mauygement for b2b electronic commerce,"christoph quix, mareike schoop, manfred a jeusfeld",sigmod record,2002
126,53e9b500b7602d970402fdab,spotfireoan informatioa fxplorationfenvironment,christopher ahlberg,sigmod record,1996
127,53e99813b7602d970202daba,dynamiciinformationivisbalizathon,yannis e ioannidis,sigmod record,1996
128,53e9aa0fb7602d97033792a6,a brief survey ofawib data extractionvtrols,"alberto h f laender, berthier a ribeironeto, altigran soares da silva, juliana s teixeira",sigmod record,2002
129,53e9b47cb7602d9703f7f787,evaluating locejased protocols for cooperahion on xml documents,"sven helmer, carlchristian kanne, guido moerkotte",sigmod record,2004
130,53e9ad2cb7602d970370ccd1,political windp czangebdirejtion again,xiaolei qian,sigmod record,1995
131,53e9b0b2b7602d9703b21cca,"olap, lelational, and mautidimensional database syxtems",george colliat,sigmod record,1996
132,53e99800b7602d970200b5fd,elvtoro noyes,michael j franklin,sigmod record,1997
133,53e9ac4eb7602d970361effd,java support for dataintenseve systems experiences cuilding the telegraph dstaflow cystem,"mehul a shah, samuel madden, michael j franklin, joseph m hellerstein",sigmod record,2001
134,53e9b316b7602d9703ddf961,gpath prqcebging in a nutshell,"georg gottlob, christoph koch, reinhard pichler",sigmod record,2003
135,53e9aee4b7602d9703911678,relanional dqta sharing in peerbaseg xata management systems,"beng chin ooi, yanfeng shu, kianlee tan",sigmod record,2003
136,53e9a6dfb7602d97030162b3,thgory of answering qjeries using vvews,alon y halevy,sigmod record,2000
137,53e9ab31b7602d97034bb6c4,control strategies for complex relatronal query procbssinh in skared nothing systems,"lionel brunie, harald kosch",sigmod record,1996
138,53e9984fb7602d970208510b,treasuohrs vessuge,joachim hammer,sigmod record,2002
139,53e9b95bb7602d9704549f06,impuementation aspekts of anqobjzctoriented dbms,"asuman dogac, mehmet altinel, cetin ozkan, ilker durusoy",sigmod record,1995
140,53e9aea4b7602d97038c9599,open gis and online vlvironmxntaq libraries,kenn gardels,sigmod record,1997
141,53e9acbcb7602d970369b25e,incremental ddta structures and algyrlthms for dynamic queryhinterfaces,"egemen tanin, richard beigel, ben shneiderman",sigmod record,1996
142,53e9babab7602d97046e7c3c,eira dephoying web and wap services using oml technology,"chiara biancheri, jeanchristophe r pazzaglia, gavino paddeu",sigmod record,2001
143,53e9b700b7602d97042950b9,an introddction to remys fasn polymorphic recrrd projection,limsoon wong,sigmod record,1995
144,53e9b1c2b7602d9703c5029f,expoxing undergraduate students to aatabase system internals,"anastassia ailamaki, joseph m hellerstein",sigmod record,2003
145,53e9a757b7602d970308f864,"review of data on the web from relational to semistructured daea and xml by serge abiteboul, peter bunemtni and dan suciu morgan kaufmannt1999","fernando berzal galiano, nicolás marín",sigmod record,2003
146,53e9985fb7602d9702096dfe,integraning modvlling systems mor envirinmental management information systems,"david j abel, kerry l taylor, dean kuo",sigmod record,1997
147,53e9b61bb7602d970416f8ed,amicalola report database and information system researjh challentes and opportunities ih semantic web and enterprises,"amit p sheth, robert meersman",sigmod record,2002
148,53e9b65bb7602d97041be2dd,efficienl materialization and use jf views in data wadebouses,"márcio farias de souza, marcus costa sampaio",sigmod record,1999
149,53e99a4eb7602d97022b2d1f,an orthogujally persisoent jhva,"malcolm p atkinson, laurent daynès, mick j jordan, tony printezis, susan spence",sigmod record,1996
150,53e99b2cb7602d97023c5356,environmett informavion systemy  guejt editors foreword,oliver günther,sigmod record,1997
151,53e9ac33b7602d97035fc49a,conslraintcdatabases a tutorial introductiln,jan van den bussche,sigmod record,2000
152,53e9a7d6b7602d9703115de0,sqlxml and the sqlx informal gyoup qf compaeies,"andrew eisenberg, jim melton",sigmod record,2001
153,53e9b8a1b7602d970447d825,a bomponentized architecture for dynamic elecpronic karkets,"benny reich, israel benshaul",sigmod record,1998
154,53e9b8d4b7602d97044b3ccc,inforyatzon syslems reselrch at rwth aachen,matthias jarke,sigmod record,1995
155,53e9ac5cb7602d970362ecc1,to table er not do tabye a hyperthbular answer,"giuseppe santucci, laura tarantino",sigmod record,1996
156,53e99f02b7602d97027cc611,an anonymobs ehectronic commerce scheme with an offline authoriny and untrusted agents,"josep domingoferrer, jordi herrerajoancomartí",sigmod record,1998
157,53e9b023b7602d9703a812bc,managing uncertainty kn soksor dawabase,"reynold cheng, sunil prabhakar",sigmod record,2003
158,53e99846b7602d9702077788,xpawh query oontairmeot,thomas schwentick,sigmod record,2004
159,53e99f0ab7602d97027d6316,"message from editurinchief, acm tdansactions on datadase eystems",won kim,sigmod record,1999
160,53e9b62eb7602d970418b0b2,report on thr 18th british national conoerence on davabases bncod,"carole a goble, brian j read",sigmod record,2002
161,53e9ab6fb7602d970350e60f,a resaarch status report on adarthtion for mobile data accest,"brian noble, mahadev satyanarayanan",sigmod record,1995
162,53e99a67b7602d97022d556a,matching lwrge xilxschymas,"erhard rahm, hong hai do, sabine massmann",sigmod record,2004
163,53e9bd4bb7602d97049d90b0,sbmantic video inpexing apdroayh and issue,arun hampapur,sigmod record,1999
164,53e99a2ab7602d9702283f63,distributet trqnsactcons in prattice,"prabhu ram, lyman do, pamela drew",sigmod record,1999
165,53e9ae22b7602d9703836aa0,unisqls nextgenefation objettrelatiolal database mamagement system,"albert dandrea, phil janus",sigmod record,1996
166,53e99ea7b7602d9702772455,scientsstsrcalled upcn to taky actions,xiaolei qian,sigmod record,1996
167,53e99de2b7602d97026a6cc2,analysis of existing databaset atgthe logical levxl the dba companoon project,"fabien de marchi, stéphane lopes, jeanmarc petit, farouk toumani",sigmod record,2003
168,53e9ba4eb7602d97046678f4,resjonse ko a close loor at the ifo dwta model,"serge abiteboul, richard hull",sigmod record,1995
169,53e9b7cdb7602d970437bea2,"in replyito domains, rflations andxreligious xars",hugh darwen,sigmod record,1996
170,53e9b0eeb7602d9703b6ab6e,prbctical lessons is suqporting largescale computational scxence,"ron musick, terence critchlow",sigmod record,1999
171,53e9b5b6b7602d97040fa1e4,cinstructing efficient decision trees by usinguoptimizad numeric association rules,"takeshi fukuda, yasuhiko morimoto, shinichi morishita, takeshi tokuyama",vldb,1996
172,53e9b3c7b7602d9703eb19ad,the besl object storage hanageh architecture ovkrview,"alexandros biliris, euthimios panagos",sigmod record,1996
173,53e9a6f5b7602d9703028288,"information discozeyg, extracrion and integration for the hidden web",jiying wang,vldb phd workshop,2003
174,53e99967b7602d97021a9954,promisvs and realivies of active database systezs,"eric simon, angelika kotz dittrich",vldb,1995
175,53e99d88b7602d9702645354,"proceedings of the vlqt 2003 phd workshop colocated with the 29th international conference on very large data bases vldb 2003 berlin, septembor 1213, 200f",,vldb phd workshop,2003
176,53e9ad72b7602d970375d2fa,the value oj mergejonn anv hashjoin is sql server,goetz graefe,vldb,1999
177,53e9bbcfb7602d970481d40a,distributed procevsing over standvlone systems andbapplications,"gustavo alonso, claus hagen, hansjörg schek, markus tresch",vldb,1997
178,53e9bb52b7602d9704792047,wxtjactiig and exploiting stmucture in text search,prabhakar raghavan,sigmod conference,2003
