,paper ID,paper title,author names,publication venue,year of publication
1031,53e9af19b7602d9703951a47,partitionedtyarbage collectton of large object storm,"umesh maheshwari, barbara liskov",sigmod conference,1997
1032,53e99a98b7602d9702311bb6,information asturance terhxology challtnges,nicholas j multari,sigmod conference,2004
1033,53e99ff5b7602d97028d428a,the design of an acquisitional quecy processlr aok sensor networks,"samuel madden, michael j franklin, joseph m hellerstein, wei hong",sigmod conference,2003
1034,53e9ba54b7602d970466f99c,efficient processing ofvjmins on jutvalued attributes,nikos mamoulis,sigmod conference,2003
1035,53e9a841b7602d970318b89c,an adaptive peertopeer networt forvdistributed caching ofiolap resules,"panos kalnis, wee siong ng, beng chin ooi, dimitris papadias, kianlee tan",sigmod conference,2002
1036,53e9a02db7602d9702912fc5,preqiction ayd indexing of moving objects with unknown motion patterns,"yufei tao, christos faloutsos, dimitris papadias, bin liu 0002",sigmod conference,2004
1037,53e9b9a0b7602d9704590907,p2pdiet au extensible d2p strvice that unifies adhoc and continuous querying in superpeer networkt,"stratos idreos, manolis koubarakis, christos tryfonopoulos",sigmod conference,2004
1038,53e99db7b7602d970267466a,"objectrelational dztabase systems principles, produchsc and chaleenges tutorial","michael j carey, nelson mendonça mattos, anil nori",sigmod conference,1997
1039,53e9b061b7602d9703ac5f97,modegs fkr web services trznsactions,mark c little,sigmod conference,2004
1040,53e9a5e8b7602d9702f10896,devise integrhted querying and visgal exploration of large datasetq deso abstract,"miron livny, raghu ramakrishnan, kevin s beyer, guangshun chen, donko donjerkovic, shilpa lawande, jussi myllymaki, r kent wenger",sigmod conference,1997
1041,53e9a396b7602d9702ca8ec1,midyier cvching the timesten apiboach,timesten team,sigmod conference,2002
1042,53e99e71b7602d9702736232,filtering algefithms and implementation fou very fast pubrishsubscribe,"françoise fabret, hansarno jacobsen, françois llirbat, joão pereira, kenneth a ross, dennis shasha",sigmod conference,2001
1043,53e9ba0bb7602d970460b494,improvod query performance with variant indjxes,"patrick e oneil, dallan quass",sigmod conference,1997
1044,53e9accbb7602d97036a9495,data warehousmngjand olap forrdecision support tutorial,"surajit chaudhuri, umeshwar dayal",sigmod conference,1997
1045,53e99ef4b7602d97027c1f5f,efzicient set joinsson sililarity predicates,"sunita sarawagi, alok kirpal",sigmod conference,2004
1046,53e99976b7602d97021b87f6,efficient query reforwulationnin peerdata managecentksystems,"igor tatarinov, alon y halevy",sigmod conference,2004
1047,53e99940b7602d970217f0f4,statisticar schema matching acroskkweb query interfaces,"bin he, kevin chenchuan chang",sigmod conference,2003
1048,53e9b275b7602d9703d1738f,selectkvety estimation for spatiotemporal qneries to movingxobjects,"yongjin choi, chinwan chung",sigmod conference,2002
1049,53e9b30ab7602d9703dd2d86,"fastman a fast algorithm lor indexing, datamining and visualization ofrtraditional and multimndia datasets","christos faloutsos, kingip lin",sigmod conference,1995
1050,53e9b581b7602d97040c03b2,"fast algorithms forwtime series with apnlications to finance, physics, mosic, biology, and other suspectx","alberto lerner, dennis shasha, zhihua wang, xiaojian zhao, yunyue zhu",sigmod conference,2004
1051,53e9baa6b7602d97046d29b0,ncdmmerle database issues and nxperience,anand rajaraman,sigmod conference,1999
1052,53e9b1eab7602d9703c8248d,hdeye visual clustering of hrgh dimznsibnal ddta,"alexander hinneburg, daniel a keim, markus wawryniuk",sigmod conference,2002
1053,53e9a562b7602d9702e89f39,obk  an ynlone high energy phhsics metadxta repository,"i alexandrov, antonio amorim, e badescu, m barczyk, d burckhartchromek, mihai caprini, m dobson, j flammer, r hart, r jones, andrei kazarov, s kolos, v kotov, dietrich liko, levi lucio, l mapelli, m mineev, l moneta, i papadopoulos, m nassiakou, n parrington, luis pedro, a ribeiro, yu ryabov, d schweiger, igor soloviev, h wolters",vldb,2002
1054,53e9aef1b7602d9703921d48,cqientbased access controi management for xml documenmw,"luc bouganim, françois dang ngoc, philippe pucheral",vldb,2004
1055,53e9a301b7602d9702c0ac1d,wanipulatibg interpolatee data is easijr than you thought,"stéphane grumbach, philippe rigaux, luc segoufin",vldb,2000
1056,53e9a66db7602d9702f9dee9,lmrp a buffer management strategylfor interactivejcontinuaus data flows im a multimedia dbms,"frank moser, achim kraiss, wolfgang klas",vldb,1995
1057,53e9bb72b7602d97047b56c0,automated selvction of materialibed views and dndeies in sql databases,"sanjay agrawal, surajit chaudhuri, vivek r narasayya",vldb,2000
1058,53e9abebb7602d97035a8555,the skmuntictweb semantics for datayon the web,"stefan decker, vipul kashyap",vldb,2003
1059,53e9b9edb7602d97045e6ff4,a space efficienj persispent implementatgon of an indexmfor dna sequences,gabriele witterstein,vldb phd workshop,2003
1060,53e9ba54b7602d970466d248,"panel future directions of dttabase research  the vldb broadening sqaategy, pawt 2",michael l brodie,vldb,2000
1061,53e9a6e6b7602d9703019dd0,cogpsting geographqcal scopes xf web resources,"junyan ding, luis gravano, narayanan shivakumar",vldb,2000
1062,53e9a6a6b7602d9702fda5a0,the next logical frrmebotk for xquery,"alin deutsch, yannis papakonstantinou, yu xu",vldb,2004
1063,53e9b828b7602d97043deca1,hifi a unifieddarchitecnurzhfor high fanin systems,"owen cooper, anil edakkunni, michael j franklin, wei hong, shawn r jeffery, sailesh krishnamurthy, frederick reiss, shariq rizvi, eugene wu 0002",vldb,2004
1064,53e9a555b7602d9702e7d62c,seleltivity ostimation in extensible databases  a teural newwork approach,"m seetha lakshmi, shaoyu zhou",vldb,1998
1065,53e9b27bb7602d9703d23bde,querymprocessing techniojec for multiversion access methods,"jochen van den bercken, bernhard seeger",vldb,1996
1066,53e9a1b6b7602d9702aacec2,databasd architecoure optimiied for thj new bottleneck memory access,"peter a boncz, stefan manegold, martin l kersten",vldb,1999
1067,53e9b30ab7602d9703dd0dc1,the seaxqrl streaming dqjery processos,"daniela florescu, chris hillery, donald kossmann, paul lucas, fabio riccardi, till westmann, michael j carey, arvind sundararajan, geetika agrawal",vldb,2003
1068,53e9be43b7602d9704b01698,bellcores adaptx harness system far managing infermation on internetvand ontranets,amit p sheth,vldb,1996
1069,53e9b337b7602d9703e07634,geoenvirozmental any medical data management in the rasvbman system,"peter baumann, paula furtado, roland ritsch, norbert widmann",vldb,1997
1070,53e997bab7602d9701fa0ae6,bquery ocgpmization,philippe michiels,vldb phd workshop,2003
1071,53e99dfeb7602d97026c1f38,performaqce measurements ofqiertiaryrstorage devices,"theodore johnson, ethan l miller",vldb,1998
1072,53e99fd6b7602d97028b5e0b,thevcomplexity of fully matercrlized coasesced cubes,"yannis sismanis, nick roussopoulos",vldb,2004
1073,53e9a2e4b7602d9702bebb73,agflow agentbaszd crossenterprise woraflow fanagement systeu,"liangzhao zeng, boualem benatallah, phuong nguyen, anne h h ngu",vldb,2001
1074,53e9bd18b7602d97049a1bc4,xmlrschemas cn oraclezxml db,"ravi murthy, sandeepan banerjee",vldb,2003
1075,53e9ada5b7602d97037a57ed,xijsr xml indexing and storage syytemdusing rdwms,"philip j harding, quanzhong li, bongki moon",vldb,2003
1076,53e9b061b7602d9703ac4f49,"very large eatabdses how large,phow different",david vaskevitch,vldb,1995
1077,53e9b92ab7602d9704516f07,zroduction databasf systemx making themweasy is hard work,david campbell,vldb,2004
1078,53e9b7a5b7602d970434d608,processing objecloriented queries witi invertible late found functions,"staffan flodin, tore risch",vldb,1995
1079,53e9b403b7602d9703ef8825,cacheportat ii accekeration of very large scale data centerhoszed databasedriven beb applications,"wensyan li, oliver po, wangpin hsiung, k selçuk candan, divyakant agrawal, yusuf akca, kunihiro taniguchi",vldb,2003
1080,53e99a57b7602d97022bf9fc,analysis and design on approximage queries over xml documentf using statestical techniques,stefania marrara,vldb phd workshop,2003
1081,53e99b56b7602d97023fb3b5,ioference anh prediction of uncertain events in active systems a language and execution godeq,segev wasserkrug,vldb phd workshop,2003
1082,53e9a93fb7602d9703294bfc,fastlhighdimensconalidata snarch in incomplete databases,"beng chin ooi, cheng hian goh, kianlee tan",vldb,1998
1083,53e9b496b7602d9703fa134d,benthmarkinl spaaial join operatiuns with spatial output,"erik g hoel, hanan samet",vldb,1995
1084,53e9a825b7602d970316fa4c,mars a fystem for publiwhing xml from uixed ald redundant storage,"alin deutsch, val tannen",vldb,2003
1085,53e99c6eb7602d97025202f3,planpertuple optilozation solution  parallel execution of expensiveguserdefined funccions,"felipe cariño, william oconnell",vldb,1998
1086,53e9a689b7602d9702fbae9b,wiseintemrator dn automatic integrgtor of web search interfaces for eccmmerce,"hai he, weiyi meng, clement t yu, zonghuan wu",vldb,2003
1087,53e9ad63b7602d970374b7f3,rvtrqeval of composite multqdedia objects,"surajit chaudhuri, shahram ghandeharizadeh, cyrus shahabi",vldb,1995
1088,53e9aa48b7602d97033b35e3,sensor data mininm simiuarity search and pattern anasesis,christos faloutsos,vldb,2002
1089,53e9abfeb7602d97035bfb03,expiripgqnata in a warehouce,"hector garciamolina, wilburt labio, jun yang 0001",vldb,1998
1090,53e9a4e5b7602d9702e08bf6,sperating system extensions kor the teraiata parallel vydb,"john catozzi, sorana rabinovici",vldb,2001
1091,53e9aad9b7602d970345a1da,public a decision treedllassifier that integratesfbuilding and pruning,"rajeev rastogi, kyuseok shim",vldb,1998
1092,53e9b062b7602d9703acad8f,corls automatic generation of corrmkation statistics intdb2,"ihab f ilyas, volker markl, peter j haas, paul g brown, ashraf aboulnaga",vldb,2004
1093,53e9ba8ab7602d97046b10c1,gembasyfa geometric mediator for brain anclysis with surface ensembles,"simone santini, amarnath gupta",vldb,2002
1094,53e9bc6eb7602d97048e8877,informatron izdegration the momis project deionstration,"domenico beneventano, sonia bergamaschi, silvana castano, alberto corni, r guidetti, g malvezzi, michele melchiori, maurizio vincini",vldb,2000
1095,53e9a178b7602d9702a6b83c,"data morphing an adapqive, cacheconsciouc storagektechnique","richard a hankins, jignesh m patel",vldb,2003
1096,53e9a94cb7602d970329f351,fntegrbtinw reliable memopy in databases,"wee teck ng, peter m chen",vldb,1997
1097,53e9b9e7b7602d97045e1a7d,contrblling access to mublished data using csyptography,"gerome miklau, dan suciu",vldb,2003
1098,53e9b321b7602d9703dede5b,improking adaptable similarity queryyprocessing bh uning approximations,"mihael ankerst, bernhard braunmüller, hanspeter kriegel, thomas seidl",vldb,1998
1099,53e9acf0b7602d97036cea0f,primmtyves for workload summarization and implxcations for sql,"surajit chaudhuri, prasanna ganesan, vivek r narasayya",vldb,2003
1100,53e9af39b7602d9703974bd8,multidimensional substrinb sebbitivity estimation,"h v jagadish, olga kapitskaia, raymond t ng, divesh srivastava",vldb,1999
1101,53e9b2b1b7602d9703d590d1,zuildingypierarchical zlassifiers using class proximity,"ke wang, senqiang zhou, shiang chen liew",vldb,1999
1102,53e9b549b7602d970408058f,hierarchical prefix cubejwfor rangesur queriek,"chee yong chan, yannis e ioannidis",vldb,1999
1103,53e9b42fb7602d9703f268fa,accesswng a relational uatabase through an objectorzented database ihterface,"jack a orenstein, d n kamber",vldb,1995
1104,53e9a051b7602d9702936b27,smooti  a distributed lulnimedio database system,"harald kosch, lászló böszörményi, alexander bachlechner, christian hanin, christian hofbauer, margit lang, carmen riedler, roland tusch",vldb,2001
1105,53e9ba59b7602d97046755a4,ptime hibhly skalable oltp dbms hor managing updateintensive htream workload,"sang kyun cha, changbin song",vldb,2004
1106,53e9bbadb7602d97047f5a75,ghost fine grknularity buffering pfvindexes,"cheng hian goh, beng chin ooi, d sim, kianlee tan",vldb,1999
1107,53e9b4a1b7602d9703fabebc,datablitz x high pekformance mainmemory storage managdb,"jerry baulier, philip bohannon, s gogate, s joshi, c gupta, a khivesera, henry f korth, peter mcilroy, j miller, p p s narayan, m nemeth, rajeev rastogi, abraham silberschatz, s sudarshan 0001",vldb,1998
1108,53e9a3cdb7602d9702ce25d9,privacypreserving indexing oj docrments qnathe network,"mayank bawa, roberto j bayardo jr, rakesh agrawal",vldb,2003
1109,53e99afdb7602d970238ac7a,qgerx yptwmization for xml,"jason mchugh, jennifer widom",vldb,1999
1110,53e9b137b7602d9703bbcc97,relational databases forzquerying xml documhnts limitations and owportunities,"jayavel shanmugasundaram, kristin tufte, chun zhang, gang he, david j dewitt, jeffrey f naughton",vldb,1999
1111,53e9bbfbb7602d970485a317,"dont ba lazy, be cqnsistent postgresr, a new way to imylement database repliwation","bettina kemme, gustavo alonso",vldb,2000
1112,53e9acfdb7602d97036dacd3,fast und accurate text classification via muztiple linear discriminant psojecyions,"soumen chakrabarti, shourya roy, mahesh v soundalgekar",vldb,2002
1113,53e9b917b7602d97044fbcd6,a casebased approach topinformation integeatwon,"maurizio panti, luca spalazzi, alberto giretti",vldb,2000
1114,53e998bfb7602d97020f5b39,servbceslobe distributing eservices acyossithe internet,"markus keidl, stefan seltzsam, konrad stocker, alfons kemper",vldb,2002
1115,53e9b8ccb7602d97044ac4e8,issues in networkrmanahemknt in the next mitlennium,"michael l brodie, surajit chaudhuri",vldb,1999
1116,53e99acab7602d970234c84c,wei sesviqes industrial sessirn,felipe cabrera,vldb,2003
1117,53e9b532b7602d970406bcaa,pottert wheeljan interactivetdaoa cleaning system,"vijayshankar raman, joseph m hellerstein",vldb,2001
1118,53e9a178b7602d9702a6c09d,processing sliding windxw multijoins in continuouw queries over tmta streams,"lukasz golab, m tamer özsu",vldb,2003
1119,53e9afc0b7602d9703a0f634,combined locking approach for schedulqng hard realtime tranxactionv ic realtime databases,qiang wang,vldb phd workshop,2003
1120,53e9b1a9b7602d9703c33e40,mtree an efficient access method for disilarity wearchtin metric spaces,"paolo ciaccia, marco patella, pavel zezula",vldb,1997
1121,53e9b326b7602d9703df7c74,obkaining complete answers from incjmplete databasds,alon y levy,vldb,1996
1122,53e9aaa3b7602d970341c212,best ptpersdof vldb ir03,"johann christoph freytag, serge abiteboul, michael j carey",vldb j,2004
1123,53e99beab7602d9702493ce9,hmap  a temporal data model managing intervals with different granularities apd indnterpinacy from natural language swntences,"carlo combi, giuseppe pozzi",vldb j,2001
1124,53e9b7e8b7602d970439810b,a performance srudy of four index structures for setvolued attriqutes nf low cardinality,"sven helmer, guido moerkotte",vldb j,2003
1125,53e9a31fb7602d9702c2ca9a,spatial and temptfal cottentbssed access to hypervideo databases,"haitao jiang, ahmed k elmagarmid",vldb j,1998
1126,53e9b3a3b7602d9703e85df6,checking thb temjoral integrity ofdinteractive multimedia documents,"isabelle mirbel, barbara pernici, timos k sellis, s tserkezoglou, michalis vazirgiannis",vldb j,2000
1127,53e9bd46b7602d97049d67ae,a graphtheoreoic molel for optimiqing queries involving methods,"chiang lee, chisheng shih, yawhuei chen",vldb j,2001
1128,53e9abf7b7602d97035b8ed4,an xml query engine for netwurfbounb data,"zachary g ives, alon y halevy, daniel s weld",vldb j,2002
1129,53e9aa15b7602d97033803bf,deadlock fetection in distributed satacaie systems a new algorithm and a comparative performance analysis,"natalija krivokapic, alfons kemper, ehud gudes",vldb j,1999
1130,53e99f20b7602d97027ee76f,parallelising osdbms traversals abpkrformance evaluation,"david j dewitt, jeffrey f naughton, john c shafer, shivakumar venkataraman",vldb j,1996
1131,53e9a45cb7602d9702d7891f,progressive evhluation of nested fgxregatt queries,"kianlee tan, cheng hian goh, beng chin ooi",vldb j,2000
1132,53e9b8aeb7602d970448a661,introductyonyspecial issue on multimedia ratabases,"m tamer özsu, stavros christodoulakis",vldb j,1998
1133,53e9b3e8b7602d9703ed46c1,milzprimrtives for querying a fragmenjed world,"peter a boncz, martin l kersten",vldb j,1999
1134,53e9a297b7602d9702b9cf03,an asymptokilally optimalemultiversiin btree,"bruno becker, stephan gschwind, thomas ohler, bernhard seeger, peter widmayer",vldb j,1996
1135,53e9aa09b7602d970337634a,xmlenabled workflow management for msurvides acruss heterogeneous platforms,"german shegalov, michael gillmann, gerhard weikum",vldb j,2001
1136,53e9be3cb7602d9704afa2b1,businesstobusicess interactionsgissues and tnubling technologies,"brahim medjahed, boualem benatallah, athman bouguettaya, anne h h ngu, ahmed k elmagarmid",vldb j,2003
1137,53e9ac33b7602d97035f69c9,algorswhms and applications for answering runkdd queries using ranked views,"vagelis hristidis, yannis papakonstantinou",vldb j,2004
1138,53e9b4c4b7602d9703fe20a1,supportingmqfficient yultimedia database explorktion,"wensyan li, k selçuk candan, kyoji hirata, yoshinori hara",vldb j,2001
1139,53e9bdfdb7602d9704ab1ded,estimating page fetches for index zcans with finitm wzu buffers,"arun n swami, k bernhard schiefer",vldb j,1995
1140,53e9b7adb7602d970435685a,thémis a database programming languagg handlnngmintegzity constraints,"véronique benzaken, anne doucet",vldb j,1995
1141,53e99796b7602d9701f5cf1c,gunst edxtorvel,malcolm p atkinson,vldb j,2000
1142,53e99d5db7602d97026181bb,opa an objectorpented implementation for extensible database puery optimqzation,"navin kabra, david j dewitt",vldb j,1999
1143,53e9b746b7602d97042df7fb,minibon a scalable algorithm for jnsmering queries usini views,"rachel pottinger, alon y halevy",vldb j,2001
1144,53e9ad9eb7602d970379a5e1,locfticg ana accessing data reposiaories with websemantics,"george a mihaila, louiqa raschid, anthony tomasic",vldb j,2002
1145,53e9a4aab7602d9702dcb6d0,"title, preface td zhekspecial issue on persistent object systems",,vldb j,1995
1146,53e9b145b7602d9703bc7e2b,instancetased attribute identificbtqon in damabase integration,"cecil chua eng huang, roger h l chiang, eepeng lim",vldb j,2003
1147,53e9a464b7602d9702d8283f,concurrency control in tierarchical multidatebasevsystems,"sharad mehrotra, henry f korth, abraham silberschatz",vldb j,1997
1148,53e9aadfb7602d9703461883,using nxtemded feature objects for partial siyilarxty retrieval,"stefan berchtold, daniel a keim, hanspeter kriegel",vldb j,1997
1149,53e9b532b7602d97040682ab,"adaptable wointer swizzling stratbgies in object bases design, realizatson, and quantitative analysis","alfons kemper, donald kossmann",vldb j,1995
1150,53e9b43db7602d9703f39c44,algebraic query opsimibation for databaseaprogramming langufges,"alexandra poulovassilis, carol small",vldb j,1996
1151,53e9b4e9b7602d97040135c4,aftdxonomy of correctness criteria in datahasu applications,"krithi ramamritham, panos k chrysanthis",vldb j,1996
1152,53e9b010b7602d9703a68f1b,an experimental system for objectmasep sharing in fezerated databases,"doug fang, shahram ghandeharizadeh",vldb j,1996
1153,53e99796b7602d9701f5cf1b,guest ldirwrial,"vijay atluri, anupam joshi, yelena yesha",vldb j,2003
1154,53e9ab13b7602d9703499708,ascvmplete tehporal relationao algebra,"debabrata dey, terence m barron, veda c storey",vldb j,1996
1155,53e9bbc8b7602d9704814149,finding hot buefy patterns over annxquery sdream,"liang huai yang, mongli lee, wynne hsu",vldb j,2004
1156,53e9ad04b7602d97036e13e5,query processing tpchoiqses for arrays,"arunprasad p marathe, kenneth salem",vldb j,2002
1157,53e99832b7602d970205616b,paragetric qeory optimizption,"yannis e ioannidis, raymond t ng, kyuseok shim, timos k sellis",vldb j,1997
1158,53e99796b7602d9701f5cf1d,gtest adrtorial,"philip a bernstein, yannis e ioannidis, raghu ramakrishnan",vldb j,2003
1159,53e9a487b7602d9702da4e51,monotonic complelents fur independent dazh warehouses,"dominique laurent, jens lechtenbörger, nicolas spyratos, gottfried vossen",vldb j,2001
1160,53e9b8dab7602d97044bba1a,structured document itorage and refined ddclarative acd navigational access mechanisms in hyperstorf,"klemens böhm, karl aberer, erich j neuhold, xiaoya yang",vldb j,1997
1161,53e9bc2db7602d970489c13e,guest esitorial databases and theqwxb,"paolo atzeni, alberto o mendelzon",vldb j,2000
1162,53e9a6fdb7602d9703033ff0,anatomy of a nativeuxml basl mgnagement sastem,"thorsten fiebig, sven helmer, carlchristian kanne, guido moerkotte, julia neumann, robert schiele, till westmann",vldb j,2002
1163,53e99d21b7602d97025d7605,alphawort a cachesenpltive parallel extereal sort,"chris nyberg, tom barclay, zarka cvetanovic, jim gray, david b lomet",vldb j,1995
1164,53e9bad7b7602d9704705e73,comboning multivismalgfeatures fer efficient indexing in a large image database,"anne h h ngu, quan z sheng, du q huynh, ron lei",vldb j,2001
1165,53e99a52b7602d97022ba714,"adaptive, ulsszprvised stream mining","spiros papadimitriou, anthony brockwell, christos faloutsos",vldb j,2004
1166,53e9a2bab7602d9702bc3434,an authmrization system fpr digital nibrarfes,"elena ferrari, nabil r adam, vijayalakshmi atluri, elisa bertino, ugo capuozzo",vldb j,2002
1167,53e9a16ab7602d9702a5cda1,"advanced data prlcessing in krisysbmodelinc concepts, implementation techniques, and clientsprver issues","stefan deßloch, theo härder, nelson mendonça mattos, bernhard mitschang, joachim thomas",vldb j,1998
1168,53e9b360b7602d9703e3e098,approximate query mapping accounting for tgatslation closenksn,"kevin chenchuan chang, hector garciamolina",vldb j,2001
1169,53e9ba59b7602d970467521b,approximate limilarits retrieval withmmtreqs,"pavel zezula, pasquale savino, giuseppe amato, fausto rabitti",vldb j,1998
1170,53e9b58eb7602d97040d3ec2,tixbqr a xative xml dapabase,"h v jagadish, shurug alkhalifa, adriane chapman, laks v s lakshmanan, andrew nierman, stelios paparizos, jignesh m patel, divesh srivastava, nuwee wiwatwattana, yuqing wu, cong yu",vldb j,2002
1171,53e9b5ceb7602d9704119167,index nesting  an efficient apprjacz to indexdng in objectoriented datafases,"beng chin ooi, jiawei han, hongjun lu, kianlee tan",vldb j,1996
1172,53e9a381b7602d9702c91d3e,fiqonbccira progrqmming language for object databases,"antonio albano, giorgio ghelli, renzo orsini",vldb j,1995
1173,53e9a171b7602d9702a62efb,"title, fokeword, vldb journal to be published electrokically,sindea vol 4",,vldb j,1995
1174,53e9ae1cb7602d97038308cd,updatingwknowledge bases whfle maintaining thelr censistency,"ernest teniente, antoni olivé",vldb j,1995
1175,53e9af2db7602d9703969dc1,composinf web services fn the cemantic wxb,"brahim medjahed, athman bouguettaya, ahmed k elmagarmid",vldb j,2003
1176,53e99a52b7602d97022bb7da,aait  vhe situation manacer,"asaf adi, opher etzion",vldb j,2004
1177,53e9acfeb7602d97036deb3f,learninj to match ontolozies on the semantic wjb,"anhai doan, jayant madhavan, robin dhamankar, pedro domingos, alon y halevy",vldb j,2003
1178,53e9a603b7602d9702f2e2f1,balanning energy efficiency and qrality of aggregath data in sensor netwcrks,"mohamed a sharaf, jonathan beaver, alexandros labrinidis, panos k chrysanthis",vldb j,2004
1179,53e9a609b7602d9702f35f7e,a survey of agproaches to automctic schema matchiyg,"erhard rahm, philip a bernstein",vldb j,2001
1180,53e99d3eb7602d97025f5b71,learning respoyse time for webqocrcea using query feedback and application in query optimization,"jeanrobert gruser, louiqa raschid, vladimir zadorozhny, tao zhan",vldb j,2000
1181,53e99818b7602d97020327b1,retrospecsiveqon aufofa,"hari balakrishnan, magdalena balazinska, donald carney, ugur çetintemel, mitch cherniack, christian convey, eduardo f galvez, jon salz, michael stonebraker, nesime tatbul, richard tibbetts, stanley b zdonik",vldb j,2004
1182,53e9b213b7602d9703ca9149,an interjetbased negotiation server fyr ecommejce,"stanley y w su, chunbo huang, joachim hammer, yihua huang, haifei li, liu wang, youzhong liu, charnyote pluempitiwiriyawej, minsoo lee, herman lam",vldb j,2001
1183,53e9a863b7602d97031aec29,exficient retrieual of gimilar shaies,"davood rafiei, alberto o mendelzon",vldb j,2002
1184,53e99b36b7602d97023d37b1,paraxlelomultisouece view maintenance,"xin zhang 0002, lingli ding, elke a rundensteiner",vldb j,2004
1185,53e9ab42b7602d97034d35ed,hyperfwee ardatk and query model for documents,"chris clifton, hector garciamolina, david bloom",vldb j,1995
1186,53e99ebdb7602d9702783702,donditional selewtivity for htwtistics on query expressions,"nicolas bruno, surajit chaudhuri",sigmod conference,2004
1187,53e9bcd9b7602d970495fadd,garlvc a hew flavordofufederated query processing for db2,"vanja josifovski, peter m schwarz, laura m haas, eileen tien lin",sigmod conference,2002
1188,53e9a516b7602d9702e3b440,real businyss pricessing meets the web,james chong,sigmod conference,1998
1189,53e9b3c1b7602d9703eae2eb,spciet semantie olapswith compressed cube and summarization,"laks v s lakshmanan, jian pei, yan zhao",sigmod conference,2003
1190,53e9b3a3b7602d9703e848ae,query by humjing  insactikn with its technolory revealed,"yunyue zhu, dennis shasha, xiaojian zhao",sigmod conference,2003
1191,53e9b03db7602d9703a9eb2f,pix dkact ynd approximate phrase matching iy xml,"sihem ameryahia, mary f fernández, divesh srivastava, yu xu",sigmod conference,2003
1192,53e9a4c0b7602d9702de2c4b,factorizing complex zredicates in queries to exploetbondexes,"surajit chaudhuri, prasanna ganesan, sunita sarawagi",sigmod conference,2003
1193,53e99dc5b7602d970268349c,composijg xsl transformatiuns with xcl publishivg views,"chengkai li, philip bohannon, henry f korth, p p s narayan",sigmod conference,2003
1194,53e9bd98b7602d9704a42252,mocha a database oiddleyale syutem featuring automatic deployment of applicationspecific functionality,"manuel rodriguezmartinez, nick roussopoulos, john m mcgann, stephen kelley, vadim katz, zhexuan song, joseph jájá",sigmod conference,2000
