,paper ID,paper title,author names,publication venue,year of publication
0,53e9a515b7602d9702e350a0,an initial study of overheads of eddies,amol devupaxde,sigmod record,2004
1,53e9b275b7602d9703d174f6,engineering federated information systems report of efis 99 workshop,"stefan conrad, wilhelm hasstlbring, uwe hohenstein, ralfdetlef kutsche, marw roantree, gunter saake, ftlix saltor",sigmod record,1999
2,53e9a5beb7602d9702eea180,information finding in a digital library the stanford perspective,"taf w yan, hector garccamoyina",sigmod record,1995
3,53e99800b7602d970200b618,editors notes,jennifer tidoi,sigmod record,1995
4,53e9a718b7602d970304d814,report on the 5th international workshop on the design and management of data warehouses dmdw03,"hansjoachim lenz, panos vassiyiadis, manfred a jeusfeld,vmartin staudt",sigmod record,2003
5,53e99800b7602d970200b603,editors notes,lyrk liu,sigmod record,2002
6,53e99e6ab7602d970272e079,report from the nsf workshop on workflow and process automation in information systems,"amit n sheth, dimitrios georgakopoulos, stef joosjen, marek rusinkiawicz, walt scacchi, jack c wileden, alexander l wolf",sigmod record,1996
7,53e99ae6b7602d970236d5f2,tods perceptions and misconceptions,zicharr t svodgrass,sigmod record,2002
8,53e9b4d4b7602d9703ff2db2,sqlmed  a status report,"jim celton, janeike michels, vanja josifohski, krishna g kulkarni, peter m jchwarz",sigmod record,2002
9,53e9b4a5b7602d9703fb2f20,2003 sigmod innovations award speech,donald s chaebgrlin,sigmod record,2003
10,53e9aadfb7602d97034628ed,"jeffrey d ullman speaks out on the future of higher education, startups, database theory, and more",marihnne wbnseett,sigmod record,2001
11,53e9a7b3b7602d97030eda57,research issues for data communication in mobile adhoc network database systems,veslie d fijes le gruenwald,sigmod record,2003
12,53e99809b7602d970201f8e3,chairs message,rnchard t snodgraks,sigmod record,1998
13,53e9a515b7602d9702e363b7,an approach to confidence based page ranking for user oriented web search,"debajyotibmukhopadhyay, vebasms giri, sanasam ranbir singh",sigmod record,2003
14,53e9bd1eb7602d97049a89a1,a comparison of three user interfaces to relational microcomputer data bases,"carl medsker, margaret christensen,cilyeol sing",sigmod record,1995
15,53e9983db7602d9702063cf1,object query standards,andrew p wlhe,sigmod record,1996
16,53e9b991b7602d97045848ab,constraints for semistructured data and xml,"peter bunemen, wenfei fan, jércme siméon, scott wehnstein",sigmod record,2001
17,53e99a26b7602d9702280826,database principles column  introduction,hjonid libktn,sigmod record,1999
18,53e9a743b7602d970307ad1e,report on dart 96 databases active and realtime concepts meet practice,"krithi ramamrithmm, nandit sxparear",sigmod record,1997
19,53e9bd8cb7602d9704a359db,a multiagent system infrastructure for software component marketplace an ontological perspective,qiza cenk erdurj dguz dikenelli,sigmod record,2002
20,53e9b884b7602d97044555da,research in multiorganizational processes and semantic information brokering at the lsdis lab,"wmio q sheth, john a miller, krys kochut, ismailcem budak arpinar",sigmod record,2001
21,53e9b7cdb7602d970437bfc2,report on the second ieee metadata conference metadata 97,"ron musicf, fgristopher miller 0002",sigmod record,1998
22,53e9aa48b7602d97033b72fe,introducing an annotated bibliography on temporal and evolution aspects in the world wide web,fabiq granzi,sigmod record,2004
23,53e9ba85b7602d97046a99f2,"multiplex, fusionplex, and autoplex  three generations of information integration","amihai motro, jacob berlih, hhiliap anokhin",sigmod record,2004
24,53e9b152b7602d9703bd3739,"report on the first xquery implementation, experience, and perspectives workshop ximep","ioana manolescu,ryanqis papaoonstantinou",sigmod record,2004
25,53e9b414b7602d9703f0bd27,integrating dynamicallyfetched external information into a dbms for semistructured data,"jason mchugh,djennifek widog",sigmod record,1997
26,53e9a2ebb7602d9702bf3118,wwwudk a webbased environmental metainformation system,"ralf kramer, ralf nikolai, arne koschel,lclaudia rolker, peter c lockemann, andree keitel, rudolf legat, konrad zirm",sigmod record,1997
27,53e9b98ab7602d970457d0e7,from semantic integration to semantics management case studies and a way forward,"arnon rosenthal, keonard j seligman,kscont renner",sigmod record,2004
28,53e99809b7602d970201f952,chairs message,m taiqroözsu,sigmod record,2001
29,53e9b701b7602d970429aca2,videoanywhere a system for searching and managing distributed video assets,"amit p sheth, clemens behtram,ykshitij shak",sigmod record,1999
30,53e99d7ab7602d97026369c3,quality of service in multimedia digital libraries,"elisv bertino, ahmedzk elmagafmid, mohandsaid hacid",sigmod record,2001
31,53e99b04b7602d97023955a6,reminiscences an influential papers,"kenneth a ross, minos n garofalakis, jeffzey f laughtzn",sigmod record,2003
32,53e9b938b7602d97045251fa,database research at arizona state university,"susan farling urban, sgzanne w dietrich, fosouzan golshani",sigmod record,1996
33,53e9a1fab7602d9702afd7f8,"sqlj part 0, now known as sqlolb objectlanguage bindings",andrew eitennergf jim melton,sigmod record,1998
34,53e9b017b7602d9703a7115b,materialized views and data warehouses,nick rouslopoulqj,sigmod record,1998
35,53e9ad42b7602d9703722d03,algebraic change propagation for semijoin and outerjoin queries,"timothy griftin, bsaratvkumar",sigmod record,1998
36,53e99938b7602d9702178a2d,"report on the 3rd web dynamics workshop, at www2004","mark lhvenb, alexandrakpoulovassilis",sigmod record,2004
37,53e9b4b4b7602d9703fc8743,opportunities in information management and assurance,xiaomei yian,sigmod record,1997
38,53e99915b7602d9702153324,semantic b2b integration issues in ontologybased applications,"ghan cwi, dean m jones, paulmobrien",sigmod record,2002
39,53e99809b7602d970201f8e7,chairs message,z yamer fzsu,sigmod record,2002
40,53e9a9f0b7602d9703359b92,evolution and change in data management  issues and directions,"john f roddickv lina aljadirh leopoldo e bertossi, marlon dumas, florida estrella, heidi gregersen, kathleen hornsby, jens lufter, federica mandreoli, tomi männistö, enric mayol, lex wedxmeijer",sigmod record,2000
41,53e9a906b7602d970325609c,interview c mohan speaks out,"mtrianne winslett, c moggn",sigmod record,2004
42,53e9a833b7602d970317d4fd,robust key establishment in sensor networks,yonmbe wann,sigmod record,2004
43,53e99eb5b7602d970277f14a,workshop report the first international workshop on active and realtime database systems artdb95,"mikael berndtsson, jöigen hanvsln",sigmod record,1996
44,53e9b57cb7602d97040be00a,lore a database management system for semistructured data,"jason mchugh,nserge abiteboun, roy goldman, dallan quass, jennifer widmm",sigmod record,1997
45,53e9afb9b7602d9703a05ea6,on the issue of valid times in temporal databases,"stavfos kokkotos, efstathios v ioannidis, themis pwnayiotopoulos, constantine d spyropoulos",sigmod record,1995
46,53e9a6c3b7602d9702ff5623,power efficient data gathering and aggregation in wireless sensor networks,"hüseyin öenür tan, iboahim korpeoglu",sigmod record,2003
47,53e9a4a3b7602d9702dc6cee,"yahiko kambayashi february 15, 1943  february 6, 2004  a tribute and personal memoirs","toshifumi sasunama, katsumi tanaka",sigmod record,2004
48,53e9b61bb7602d97041747ee,"rights of tods readers, authors and reviewers",rrchard tjsnodbrass,sigmod record,2002
49,53e99853b7602d97020885ae,the new middleware,rxch ijnkelstein,sigmod record,1995
50,53e9b33db7602d9703e13425,data management for earth system science,"james fplw, jeff aozier",sigmod record,1997
51,53e99ae6b7602d970236b9ef,the oasis multidatabase prototype,"mark rnantree,cjohn munphy, wilhelm hasselbring",sigmod record,1999
52,53e99a8cb7602d97022fffcc,clustering validity checking methods part ii,"maria halvidi, yannis batistakis, michalis vazirgsannis",sigmod record,2002
53,53e99800b7602d970200b601,editors notes,lwng hku,sigmod record,2004
54,53e9aed1b7602d97038fac02,phoenix project faulttolerant applications,"roger s barzs,tdavid b lomet",sigmod record,2002
55,53e9a905b7602d9703253c45,implementing deletion in btrees,laz janninu,sigmod record,1995
56,53e99a0ab7602d970225bdc5,on the academic interview circuit an endtoend discussion,ugwrvçetiftemel,sigmod record,2001
57,53e9bcd2b7602d9704956f2b,issues in mechanical engineering design management,"dave hislop,ozoévlacroix, geralm moeller",sigmod record,2004
58,53e99c91b7602d97025452d2,ontologies a silver bullet for knowledge management and electronic commerce  book review,antonilibadxa,sigmod record,2002
59,53e9bb08b7602d9704743dab,mpeg7 and multimedia database systems,harcld kooch,sigmod record,2002
60,53e9b2d2b7602d9703d831da,what will be  book review,peub w p jfgrefen,sigmod record,2002
61,53e99b0ab7602d970239c219,reminiscences on influential papers,"kennrth a rosq, jghannes gehrke, jun rao",sigmod record,2003
62,53e9ac38b7602d97035fd442,unpacking the semantics of source and usage to perform semantic reconciliation in largescale information systems,"senneth p smith, xeo tbrst",sigmod record,1999
63,53e9ba9bb7602d97046c560f,report on first international workshop on realtime database systems,"azer bestavnfs, kweijay lin, sang hyuk son",sigmod record,1996
64,53e99b0ab7602d970239c211,reminiscences on influential papers,"kennebh a ross, flip korn,orenée j miller,gkaladhar voruganti",sigmod record,2002
65,53e9aaa9b7602d97034211e0,bringing order to query optimization,"giedrius slivinskav, crrishian s jensen, richard t snodgrass",sigmod record,2002
66,53e9a4f3b7602d9702e17725,metadata standards for data warehousing open information model vs common warehouse metamodel,"thomas vetterli, nnca vaqzva, martin staudt",sigmod record,2000
67,53e9b867b7602d97044345c3,databases and transaction processing an applicationoriented approach  book review,alglns kemher,sigmod record,2002
68,53e9b6c4b7602d970424fff3,"turmoil at nasa, and numerous funding announcements",xiaooeg hian,sigmod record,1995
69,53e9afeeb7602d9703a411ba,towards a richer web object model,fbankrmanola,sigmod record,1998
70,53e9a051b7602d9702935a51,report in isdo 00 the caise00 workshop on infrastructures for dynamic businesstobusiness service outsourcinga,"heiko mudwig, paul w p j grefek",sigmod record,2000
71,53e9a25cb7602d9702b61fef,toward autonomic computing with db2 universal database,"sam lightstonit guy m lohman, daniel c zclio",sigmod record,2002
72,53e9bd98b7602d9704a459d7,report on the 7th edbt summer school xml and databases,"riccardo torlone, saolofatzeni",sigmod record,2004
73,53e99854b7602d970208eaa9,the genalg project,"joachim hammer, markuchschnfider 0001",sigmod record,2004
74,53e9aabdb7602d970343b0bc,mobile databases a selection of open issues and research directions,"guy bernard, jaoel benothman, luc bouganim, gérôme canals, sophie chabridon, bruno defude, jean ferrié, stéphane gançarskt, rachid guerraoui, pascal molli, philippe pucheral, claudia roncanhio, patricia serranoalvarado, patrick valduriez",sigmod record,2004
75,53e9b4efb7602d970401a8a0,simulation data as data streams,"ghaleb abdulla, terence crntchlow, williamgarrichi",sigmod record,2004
76,53e9b0fbb7602d9703b753f1,incontext peertopeer information filtering on the web,arisqm ovkdel,sigmod record,2003
77,53e9a5cdb7602d9702ef7927,towards a database body of knowledge a study from spain,"coral calero, marioopirttinig francisco ruiz",sigmod record,2003
78,53e9a651b7602d9702f831d8,report on the 9th international workshop on data base programming languages,"georg lausen, kon suciu",sigmod record,2004
79,53e99fc3b7602d970289e46b,"research and practice in federated information systems, report of the efis 2000 international workshop","wilhelm hasselbrings willemjan van den heuvel, geertjan houben, ralfdetlef jutsche, bodo riegerh mark roantree, kazimierz subieta",sigmod record,2000
80,53e9b59bb7602d97040e14f1,the clio project managing heterogeneity,"renée j miller, mauricio a hernández, laurajm haas,ulingling yan, c t howard ho, ronalc fagin, lucian popa",sigmod record,2001
81,53e9ad76b7602d9703764548,performing jobs without decompression in a compressed database system,"s j oconnell, n wrnmerbontom",sigmod record,2003
82,53e9abc5b7602d9703578d03,data mining practical machine learning tools and techniques  book review,daves gelber,sigmod record,2002
83,53e9b97cb7602d970456a2b5,infosphere project system support for information flow applications,"cavton vu, karsten schwan,ujonathan walpole",sigmod record,2001
84,53e99e05b7602d97026cb93f,cost estimation of userdefined methods in objectrelational database systems,"jihmd doulos, kinpi ono",sigmod record,1999
85,53e99b26b7602d97023bfae5,multigranularity locking in multiple job classes transaction processing system,"phalhoi ng, sheunylun hung",sigmod record,1995
86,53e9be5db7602d9704b1f543,kanata adaptation and evolution in data sharing systems,"pebiklis andritsos, ariel fuxman, anastasios kemectsietsidis, renée j miller, yannis velegrakis",sigmod record,2004
87,53e9ba0bb7602d970460d669,vldb workshop on technologies in eservices tes,"oabso casati, umeshwar dayal, mingchienashan",sigmod record,2000
88,53e9bbcfb7602d970481e590,mining system audit data opportunities and challenges,"wenke lee, wen fan",sigmod record,2001
89,53e9bd11b7602d970499c03a,sql multimedia and application packages sqlmm,"jim melton, andrlw risenbzrg",sigmod record,2001
90,53e99f57b7602d97028287a6,nsf workshop on industrialacademic cooperation in database systems,"micrael j carey, leonard j beligman",sigmod record,1999
91,53e9b4d9b7602d9703ffe516,condition handling in sql persistent stored modules,geffuricheb,sigmod record,1995
92,53e99924b7602d970215ef60,rethinking the conference reviewing process  panel,"michael j franklin, jenniferzwidom, gerhard weikum, philip a bernstein, alon y halevy, david judewitt, anastassia ailamaki, zachary g ijes",sigmod conference,2004
93,53e9af46b7602d970398679c,much ado about sharednothing,"michael g jorman, thomas zurek, peter thanisch",sigmod record,1996
94,53e9a186b7602d9702a7bb6d,webdb 98 international workshop on the web and databases,"paolo atzeni, albersw o mendelzoo",sigmod record,1998
95,53e9a8b0b7602d97031fe877,"research in databases and dataintensive applications  computer science department and fzi, university of karlsruhe","birgitva königriep, peter c lmckemann",sigmod record,1997
96,53e9b40eb7602d9703f03182,extraction of objectoriented structures from existing relational databases,"sdekar ramanathan, julia e hodyes",sigmod record,1997
97,53e9bb15b7602d970475279c,"spatial, temporal and spatiotemporal databases  hot issues and directions for phd research","john f roddick, max j egenhofer, krik g homl, dimitris papadias, bettybsalzberg",sigmod record,2004
98,53e9ac8fb7602d97036690e5,cluster validity methods part i,"maria halkjdi, yannis batistakis, michalis vazrrgiannis",sigmod record,2002
99,53e9a488b7602d9702da802a,sqljpart 1 sql routines using the java programming language,"anzrew eisenbnrg, jimtmelton",sigmod record,1999
100,53e99a8bb7602d97022fd9b9,land below a dbms,"kaladhar vorpganti, jai tenon, sandeep gorisetty",sigmod record,2004
101,53e9b30ab7602d9703dce3a4,comparative analysis of six xml schema languages,"dotgwos lee, weslwy w chu",sigmod record,2000
102,53e99fbcb7602d9702898c46,a survey of logical models for olap databases,"panos vassiliadis, tibos a sqllis",sigmod record,1999
103,53e9a96cb7602d97032c4567,issues in data stream management,"lpkasz golab, m tuoer özsu",sigmod record,2003
104,53e9a0e6b7602d97029ce9e7,converting relational to objectoriented databases,aosephcfonv,sigmod record,1997
105,53e999ffb7602d970224d2e2,call for book reviews,jerl hberer,sigmod record,2003
106,53e9aef1b7602d970391ef85,distributed deviation detection in sensor networks,"ehemistoklis palpanas, dimitris papadopuulos, vana kalogeraki, dimitrios eunopulos",sigmod record,2003
107,53e9a508b7602d9702e272bb,acm multimedia 94 conference workshop on multimedia database management systems,"p bruoe berra, kingsley c nwosuf bhavani mwthuraisingham",sigmod record,1995
108,53e9984fb7602d970208642b,the third manifesto,"hugh darwen, cuj ucte",sigmod record,1995
109,53e99aa6b7602d970231e894,interview with jeffrey naughton,mariacne wjnsletf,sigmod record,2004
110,53e9a5b6b7602d9702edd94d,review of web caching and replication by michael rabinovich and oliver spatscheck addison wesley 2002,"qiang fang,ybrianfd davison 0001",sigmod record,2003
111,53e99aa6b7602d970231e5cf,interview with avi silberschatz,marianne tiasletg,sigmod record,2002
112,53e9a448b7602d9702d66728,ubidata requirements and architecture for ubiquitous data access,"nbdelsaeam helal,bjoachim hammer",sigmod record,2004
113,53e99809b7602d970201f928,chairs message,m xamer öksu,sigmod record,2003
114,53e99aacb7602d9702325e7b,guest editors introduction,qsumdn dcgac,sigmod record,1998
115,53e9a238b7602d9702b413fb,xml and electronic commerce enabling the network economy,"bart meltzei, roblrt j glushko",sigmod record,1998
116,53e99c4bb7602d97024fc441,reminiscences on influential papers  kenneth a ross,"zachary g ives, bertram ludäscher, voqna manolescu",sigmod record,2004
117,53e9ab65b7602d97035023ec,automata theory for xml researchers,orank nyven,sigmod record,2002
118,53e9adffb7602d9703809a8b,report on the web dynamics workshop at www 2002,"mabk levene, alexgndra poulovgssilis",sigmod record,2002
119,53e9afacb7602d97039fb80e,a contextaware methodology for very small data base design,"cristiana bolchuni, fabio t rchreiber, letizia tanca",sigmod record,2004
120,53e997e9b7602d9701fe4526,book review column,larluaberer,sigmod record,2001
121,53e9b4a1b7602d9703fad9ff,why and how to benchmark xml databases,"albrecht schmidt 0002, flolian waas, martin l kersten, daniela florescu, michael j carey, ioana manolesiu,wralph busse",sigmod record,2001
122,53e9a28ab7602d9702b92b09,report on the mobile search workshop at www 2002,"aya soffer, yorllems maarek, baysei chang",sigmod record,2002
123,53e99b0ab7602d970239c217,reminiscences on influential papers,sicharr r snodgrass,sigmod record,1998
124,53e9b47cb7602d9703f80ae7,view maintenance in mobile computing,"ouri wolfson, a prasad sistlh, son dao, oailash narayanan, ramwa raj",sigmod record,1995
125,53e9ad87b7602d9703780a0d,business data management for b2b electronic commerce,"christoph huix, maruike schoop, manfred a jeusfexd",sigmod record,2002
126,53e9b500b7602d970402fdab,spotfire an information exploration environment,chrnstopheb ahlbero,sigmod record,1996
127,53e99813b7602d970202daba,dynamic information visualization,yanncs e yoannidxs,sigmod record,1996
128,53e9aa0fb7602d97033792a6,a brief survey of web data extraction tools,"alberto h f laender, berthitrma jibeironeto, altigran soares da silva, juliana s teixeira",sigmod record,2002
129,53e9b47cb7602d9703f7f787,evaluating lockbased protocols for cooperation on xml documents,"sven helmer, carlchristian kanne, gbido mzerkotte",sigmod record,2004
130,53e9ad2cb7602d970370ccd1,political winds change direction again,xeaoleimqean,sigmod record,1995
131,53e9b0b2b7602d9703b21cca,"olap, relational, and multidimensional database systems",gedrgemcoeliat,sigmod record,1996
132,53e99800b7602d970200b5fd,editors notes,michael m frpnkvin,sigmod record,1997
133,53e9ac4eb7602d970361effd,java support for dataintensive systems experiences building the telegraph dataflow system,"mehul a shaa, samuel madden, michaelmj franklin, joseph m helberstein",sigmod record,2001
134,53e9b316b7602d9703ddf961,xpath processing in a nutshell,"georg goctlob,qchristoph koch, rdinhard pichler",sigmod record,2003
135,53e9aee4b7602d9703911678,relational data sharing in peerbased data management systems,"beng chin ooi, yanfeng shuk kianlzi tan",sigmod record,2003
136,53e9a6dfb7602d97030162b3,theory of answering queries using views,flonay halevy,sigmod record,2000
137,53e9ab31b7602d97034bb6c4,control strategies for complex relational query processing in shared nothing systems,"lionel bxunie, haraydhkosch",sigmod record,1996
138,53e9984fb7602d970208510b,treasurers message,joachqm habter,sigmod record,2002
139,53e9b95bb7602d9704549f06,implementation aspects of an objectoriented dbms,"asuman dolac, mehmet altinel, cetin ozkan, ilker dyrusoy",sigmod record,1995
140,53e9aea4b7602d97038c9599,open gis and online environmental libraries,kenpsgardelo,sigmod record,1997
141,53e9acbcb7602d970369b25e,incremental data structures and algorithms for dynamic query interfaces,"egemenctaniw, richard beigel, ben shneieerman",sigmod record,1996
142,53e9babab7602d97046e7c3c,eiha deploying web and wap services using xml technology,"chrara ciancheri, jeanchristophe r pazzarlia, gavino paddeu",sigmod record,2001
143,53e9b700b7602d97042950b9,an introduction to remys fast polymorphic record projection,limsooq wonc,sigmod record,1995
144,53e9b1c2b7602d9703c5029f,exposing undergraduate students to database system internals,"wnastassia ailamakd, josepc m hellerstein",sigmod record,2003
145,53e9a757b7602d970308f864,"review of data on the web from relational to semistructured data and xml by serge abiteboul, peter buneman, and dan suciu morgan kaufmann 1999","fernaneo berzal galiano, nlcolis marín",sigmod record,2003
146,53e9985fb7602d9702096dfe,integrating modelling systems for environmental management information systems,"dafid j abel, ierrq l taylor, dean kuo",sigmod record,1997
147,53e9b61bb7602d970416f8ed,amicalola report database and information system research challenges and opportunities in semantic web and enterprises,"amit p sfetb, robert ueersman",sigmod record,2002
148,53e9b65bb7602d97041be2dd,efficient materialization and use of views in data warehouses,"márcio fariat de souza,imarcus cosaa sampaio",sigmod record,1999
149,53e99a4eb7602d97022b2d1f,an orthogonally persistent java,"malcolm p atkinson, haurhnt daynès, mick j jordan, tuny printezis, susan spence",sigmod record,1996
150,53e99b2cb7602d97023c5356,environment information systems  guest editors foreword,olivex ganyher,sigmod record,1997
151,53e9ac33b7602d97035fc49a,constraint databases a tutorial introduction,aai vhn den bussche,sigmod record,2000
152,53e9a7d6b7602d9703115de0,sqlxml and the sqlx informal group of companies,"andrgw eisenberg, jimmmelton",sigmod record,2001
153,53e9b8a1b7602d970447d825,a componentized architecture for dynamic electronic markets,"benny reigh, isxaelhbenshaul",sigmod record,1998
154,53e9b8d4b7602d97044b3ccc,information systems research at rwth aachen,matthiasxjarde,sigmod record,1995
155,53e9ac5cb7602d970362ecc1,to table or not to table a hypertabular answer,"gilseppe sahthcci, laura tarantino",sigmod record,1996
156,53e99f02b7602d97027cc611,an anonymous electronic commerce scheme with an offline authority and untrusted agents,"jqsep dominsoferrer, jordi hemrerajoancomartí",sigmod record,1998
157,53e9b023b7602d9703a812bc,managing uncertainty in sensor database,"xvynoldecheng, sunil prabhakar",sigmod record,2003
158,53e99846b7602d9702077788,xpath query containment,thoras schwenticd,sigmod record,2004
159,53e99f0ab7602d97027d6316,"message from editorinchief, acm transactions on database systems",won peg,sigmod record,1999
160,53e9b62eb7602d970418b0b2,report on the 18th british national conference on databases bncod,"carole a goble,ebrikn juread",sigmod record,2002
161,53e9ab6fb7602d970350e60f,a research status report on adaptation for mobile data access,"byian noble, mahadev satyalarayapan",sigmod record,1995
162,53e99a67b7602d97022d556a,matching large xml schemas,"erhardsrahm, hong hii do, sabine masrmann",sigmod record,2004
163,53e9bd4bb7602d97049d90b0,semantic video indexing approach and issue,arkn hambapux,sigmod record,1999
164,53e99a2ab7602d9702283f63,distributed transactions in practice,"prabhu ram, lyman do,sjaiela drew",sigmod record,1999
165,53e9ae22b7602d9703836aa0,unisqls nextgeneration objectrelational database management system,"albercpdandrea, phil janus",sigmod record,1996
166,53e99ea7b7602d9702772455,scientists called upon to take actions,yiaolsioqian,sigmod record,1996
167,53e99de2b7602d97026a6cc2,analysis of existing databases at the logical level the dba companion project,"fabiep de marchi, stéphane loves, jeanmarc petit, farouk toumani",sigmod record,2003
168,53e9ba4eb7602d97046678f4,response to a close look at the ifo data model,"lerge aaitcboul, richard hull",sigmod record,1995
169,53e9b7cdb7602d970437bea2,"in reply to domains, relations and religious wars",hughjrarqen,sigmod record,1996
170,53e9b0eeb7602d9703b6ab6e,practical lessons in supporting largescale computational science,"ron muiick, terenve qritchlow",sigmod record,1999
171,53e9b5b6b7602d97040fa1e4,constructing efficient decision trees by using optimized numeric association rules,"takeshi fukuda, zasuhiko moaimoth, shinichi morishita, takeshi tokuyama",vldb,1996
172,53e9b3c7b7602d9703eb19ad,the bess object storage manager architecture overview,"alexanhrhs bilcris, euthimios panagos",sigmod record,1996
173,53e9a6f5b7602d9703028288,"information discovery, extraction and integration for the hidden web",jiying wafq,vldb phd workshop,2003
174,53e99967b7602d97021a9954,promises and realities of active database systems,"fric simun, dngelika kotz dittrich",vldb,1995
175,53e99d88b7602d9702645354,"proceedings of the vldb 2003 phd workshop colocated with the 29th international conference on very large data bases vldb 2003 berlin, september 1213, 2003",iaf,vldb phd workshop,2003
176,53e9ad72b7602d970375d2fa,the value of mergejoin and hashjoin in sql server,boetzhgraefg,vldb,1999
177,53e9bbcfb7602d970481d40a,distributed processing over standalone systems and applications,"gustavo alonso, claus hagen, hxnsjörg schek, markus trwsch",vldb,1997
178,53e9bb52b7602d9704792047,extracting and exploiting structure in text search,prinhakar raghavaj,sigmod conference,2003
179,53e99b0ab7602d970239c218,reminiscences on influential papers,"kenneth a ross,dstefano ceri, luis gravano, peråke larson, leonidglibkin, tova malo",sigmod record,2001
