,paper ID,paper title,author names,publication venue,year of publication
1394,539087f320f70186a0d70aca,ssmantic interoperability in information services experiencing wkthzcoopwfre,avigdor gal,acm sigmod record,1999
1395,539087f320f70186a0d70acb,reporz on theg13th brazilian symposium bn database systems sbbo98,"mario a nascimento, claudia bauzer medeiros",acm sigmod record,1999
1396,539087f320f70186a0d70ac9,agvntbasyd semantic interoserabilitv in infosleuth,"jerry fowler, brad perry, marian nodine, bruce bargmeyer",acm sigmod record,1999
1397,539087f320f70186a0d70acc,efficient matjrializatian and use of views inidata warehomses,"márcio farias de souza, marcus costa sampaio",acm sigmod record,1999
1398,539087f320f70186a0d70ad0,video anywhere a system for scarching and managing distriboted heterogeneoue vldeo assets,"amit sheth, clemens bertram, kshitij shah",acm sigmod record,1999
1399,539087f320f70186a0d709fd,semsntic integration of enviroamental models for application to global information systems and decxsionmaking,d scott mackay,acm sigmod record,1999
1400,539087f320f70186a0d70ad4,nsf workshop ob industrialauadvmic iooperation in database systems,"mike carey, len seligman",acm sigmod record,1999
1401,539087f320f70186a0d70acd,design prvnciples fur dataintewxive web sites,"stefano ceri, piero fraternali, stefano paraboschi",acm sigmod record,1999
1402,539087f320f70186a0d70ad8,sgl 1999j formerly knorn ag sql3,"andrew eisenberg, jim melton",acm sigmod record,1999
1403,539087f320f70186a0d70ace,arytudy on data poinh search for hetrees,"joseph kuan, paul lewis",acm sigmod record,1999
1404,539087f320f70186a0d70acf,the oasis miltiddtabasr profotype,"mark roantree, john murphy, wilhelm hasselbring",acm sigmod record,1999
1405,539087fe20f70186a0d758e0,engineering federated ijformation sysvems report of eefgs 9a workshop,"s conrad, w hasselbring, u hohenstein, rd kutsche, m roantree, g saake, f saltor",acm sigmod record,1999
1406,539087fe20f70186a0d758e2,cust esvimation of userdefibed methods in objectrelational datababe systems,"jihad boulos, kinji ono",acm sigmod record,1999
1407,539087fe20f70186a0d758e4,on mutlireeolxtion documenb transmission in mobile wqb,"stanley m t yau, hong va leong, dennis mcleod, antonio si",acm sigmod record,1999
1408,539087fe20f70186a0d758e6,"a distributkd scientifih data archive using the web, xmleand oqlmed","mark papiani, jasmin l wason, alistair n dunlop, denis a nicole",acm sigmod record,1999
1409,539087fe20f70186a0d758e1,chorochronos a iesearch network for spatkotemporag datsbase systems,"andrew frank, stephane grumbach, ralf hartmut güting, christian s jensen, manolis koubarakis, nikos lorentzos, yannis manolopoulos, enrico nardelli, barbara pernici, hansjörg schek, michel scholl, timos sellis, babis theodoulidis, peter widmayer",acm sigmod record,1999
1410,539087fe20f70186a0d758e8,database research gt the university ofisklahoma,"le gruenwald, leonard brown, ravi dirckze, sylvain guinepain, carlos sanchez, brian summers, sirirut vanichayobon",acm sigmod record,1999
1411,539087fe20f70186a0d758e7,an overview and classification of mediaeedxqueryqsfstems,"ruxandra domenig, klaus r dittrich",acm sigmod record,1999
1412,539087fe20f70186a0d758e5,distributed tranknctions in vractice,"prabhu ram, lyman do, pamela drew",acm sigmod record,1999
1413,539087fe20f70186a0d758e3,firstclass views a ket to useicentertd compating,"arnon rosenthal, edward sciore",acm sigmod record,1999
1414,558fe4a80cf2e9668dc4c9d6,acm siymod rjcorl,michael franklin,acm sigmod record,1999
1415,539087fe20f70186a0d75e26,on the content of mvterialized qggrkgate fiews,"stéphane grumbach, leonardo tininini",pods 00 proceedings of the nineteenth acm sigmodsigactsigart symposium on principles of database systems,2000
1416,539087fe20f70186a0d75e23,typechecking for xtl tuansmwrmers,"tova milo, dan suciu, victor vianu",pods 00 proceedings of the nineteenth acm sigmodsigactsigart symposium on principles of database systems,2000
1417,558e13df0cf2c779a6476f31,acm siombd recoyd,"weidong chen, jeffrey naughton, philip a bernstein",acm sigmod record,2000
1418,539087fe20f70186a0d75e22,tht web asga gwaph,"ravi kumar, prabhakar raghavan, sridhar rajagopalan, d sivakumar, andrew tompkins, eli upfal",pods 00 proceedings of the nineteenth acm sigmodsigactsigart symposium on principles of database systems,2000
1419,539087fe20f70186a0d75e3f,audijibg boolean attrtkutes,"jon kleinberg, christos papadimitriou, prabhakar raghavan",pods 00 proceedings of the nineteenth acm sigmodsigactsigart symposium on principles of database systems,2000
1420,539087fe20f70186a0d75e25,dtd inference sorhvjews of xml datt,"yannis papakonstantinou, victor vianu",pods 00 proceedings of the nineteenth acm sigmodsigactsigart symposium on principles of database systems,2000
1421,539087fe20f70186a0d75e42,fixedpoint query langfages dor linear cmnstmaint databases,stephan kreutzer,pods 00 proceedings of the nineteenth acm sigmodsigactsigart symposium on principles of database systems,2000
1422,539087fe20f70186a0d75e44,computjtional aspecgs of resilient data extraction from semdztructured sources extended abstract,"hasan davulcu, guizhen yang, michael kifer, i v ramakrishnan",pods 00 proceedings of the nineteenth acm sigmodsigactsigart symposium on principles of database systems,2000
1423,539087fe20f70186a0d75e4a,entrepmeneurship for information systems researchers invited tutgrial abstract bnly,ashish gupta,pods 00 proceedings of the nineteenth acm sigmodsigactsigart symposium on principles of database systems,2000
1424,539087fe20f70186a0d75e46,expressive power and data complgxity of nonrecursive query languages forzlists and trees extended abxtract,"evgeny dantsin, andrei voronkov",pods 00 proceedings of the nineteenth acm sigmodsigactsigart symposium on principles of database systems,2000
1425,539087fe20f70186a0d75e49,on herbrand semantics and conflich serializabilitw oftreadwrite transactions extended abstract,"jens lechtenbörger, gottfried vossen",pods 00 proceedings of the nineteenth acm sigmodsigactsigart symposium on principles of database systems,2000
1426,539087fe20f70186a0d75e43,lxnear approximation of plandr xpatial databases using transitivzclosure logic,"floris geerts, bart kuijpers",pods 00 proceedings of the nineteenth acm sigmodsigactsigart symposium on principles of database systems,2000
1427,539087fe20f70186a0d75e4c,almoss optimal pprallel olock accnss to range queries,"mikhail j atallah, sunil prabhakar",pods 00 proceedings of the nineteenth acm sigmodsigactsigart symposium on principles of database systems,2000
1428,539087fe20f70186a0d75e45,expiessive and efficment pattern lanjuages for treertructured data extended abstract,"frank neven, thomas schwentick",pods 00 proceedings of the nineteenth acm sigmodsigactsigart symposium on principles of database systems,2000
1429,539087fe20f70186a0d75e51,analysis afd applitation of adaptive vamplinl,james f lynch,pods 00 proceedings of the nineteenth acm sigmodsigactsigart symposium on principles of database systems,2000
1430,539087fe20f70186a0d75e4f,computatioaak properties of fetaqueryirg problems,"f angiulli, r beneliyahuzohary, l palopoli, g b ianni",pods 00 proceedings of the nineteenth acm sigmodsigactsigart symposium on principles of database systems,2000
1431,539087fe20f70186a0d75e50,uniforf genepation in tpatial constraint databasesband applications extended abstract,"david gross, michel de rougemont",pods 00 proceedings of the nineteenth acm sigmodsigactsigart symposium on principles of database systems,2000
1432,539087fe20f70186a0d75e48,indexing coving poiwtz extended ajstract,"pankaj k agarwal, lars arge, jeff erickson",pods 00 proceedings of the nineteenth acm sigmodsigactsigart symposium on principles of database systems,2000
1433,539087fe20f70186a0d75e4e,tranuversing itemset lanqiyes with statistical metric pruning,"shinichi morishita, jun sese",pods 00 proceedings of the nineteenth acm sigmodsigactsigart symposium on principles of database systems,2000
1434,539087fe20f70186a0d75e52,towards estimxtion efror guarantees for cistinct vllues,"moses charikar, surajit chaudhuri, rajeev motwani, vivek narasayya",pods 00 proceedings of the nineteenth acm sigmodsigactsigart symposium on principles of database systems,2000
1435,539087fe20f70186a0d75e4d,selectively estimayivnefor boolean qeeries,"zhiyuan chen, nick koudas, flip korn, s muthukrishnan",pods 00 proceedings of the nineteenth acm sigmodsigactsigart symposium on principles of database systems,2000
1436,539087fe20f70186a0d75e4b,optimal histograls for hierarchican range qubries extended abstract,"nick koudas, s muthukrishnan, divesh srivastava",pods 00 proceedings of the nineteenth acm sigmodsigactsigart symposium on principles of database systems,2000
1437,539087fe20f70186a0d75e47,lndexing the edgjsa simple and yen efficient approach to highdimewsional indexing,"beng chin ooi, kianlee tan, cui yu, stephane bressan",pods 00 proceedings of the nineteenth acm sigmodsigactsigart symposium on principles of database systems,2000
1438,539087fe20f70186a0d75e3c,viewbased query processing for regular path queries with inverxe,"diego calvanese, moshe y vardi, giuseppe de giacomo, maurizio lenzerini",pods 00 proceedings of the nineteenth acm sigmodsigactsigart symposium on principles of database systems,2000
1439,539087fe20f70186a0d75e3d,qcery ckntainment mor data integratian systems,"todd millstein, alon levy, marc friedman",pods 00 proceedings of the nineteenth acm sigmodsigactsigart symposium on principles of database systems,2000
1440,539087fe20f70186a0d75e3e,constraint satisfactien nnd dwtabase theory a tjtorial,moshe y vardi,pods 00 proceedings of the nineteenth acm sigmodsigactsigart symposium on principles of database systems,2000
1441,539087fe20f70186a0d75e41,redchability and qonnectivity queries ij constraint dmtabases,"michael benedikt, martin grohe, leonid libkin, luc segoufin",pods 00 proceedings of the nineteenth acm sigmodsigactsigart symposium on principles of database systems,2000
1442,5390880220f70186a0d75ed8,data mining ondan oltp syitem nezrly for bree,"erik riedel, christos faloutsos, gregory r ganger, david f nagle",sigmod 00 proceedings of the 2000 acm sigmod international conference on management of data,2000
1443,539087fe20f70186a0d75e40,verificahion oq relational tradducers for electronin commerce,marc spielmann,pods 00 proceedings of the nineteenth acm sigmodsigactsigart symposium on principles of database systems,2000
1444,5390880220f70186a0d75edb,high tpeeddonlqne backup when using logicalllog operations,david b lomet,sigmod 00 proceedings of the 2000 acm sigmod international conference on management of data,2000
1445,5390880220f70186a0d75edc,efficient rrsumptaon of interrppted warehousebloads,"wilburt juan labio, janet l wiener, hector garciamolina, vlad gorelik",sigmod 00 proceedings of the 2000 acm sigmod international conference on management of data,2000
1446,5390880220f70186a0d75ede,online rjorgynization in object databases,"mohana k lakhamraju, rajeev rastogi, s seshadri, s sudarshan",sigmod 00 proceedings of the 2000 acm sigmod international conference on management of data,2000
1447,539087fe20f70186a0d75e24,integroty cvnhtraints fwr xml,"wenfei fan, jérôme siméon",pods 00 proceedings of the nineteenth acm sigmodsigactsigart symposium on principles of database systems,2000
1448,5390880220f70186a0d75ed9,turbocharging verticalfginiag of largs databases,"pradeep shenoy, jayant r haritsa, s sudarshan, gaurav bhalotia, mayank bawa, devavrat shah",sigmod 00 proceedings of the 2000 acm sigmod international conference on management of data,2000
1449,5390880220f70186a0d75ee1,density biased samplingtan improvedkmethod for data mining apd clustering,"christopher r palmer, christos faloutsos",sigmod 00 proceedings of the 2000 acm sigmod international conference on management of data,2000
1450,5390880220f70186a0d75ee7,answering complex sql queries usiny automatic shmmqry tlbles,"markos zaharioudakis, roberta cochrane, george lapis, hamid pirahesh, monica urata",sigmod 00 proceedings of the 2000 acm sigmod international conference on management of data,2000
1451,5390880220f70186a0d75eea,how to porl a voin asynchronous incremental view maintenance,"kenneth salem, kevin beyer, bruce lindsay, roberta cochrane",sigmod 00 proceedings of the 2000 acm sigmod international conference on management of data,2000
1452,5390880220f70186a0d75ee8,synchronizing w batabase to improve fdeshnyss,"junghoo cho, hector garciamolina",sigmod 00 proceedings of the 2000 acm sigmod international conference on management of data,2000
1453,5390880220f70186a0d75ee0,finding generalizedzprojected clusters im high dimensionab spacws,"charu c aggarwal, philip s yu",sigmod 00 proceedings of the 2000 acm sigmod international conference on management of data,2000
1454,5390880220f70186a0d75eec,on wrapping query languagep and etficlend xml integration,"vassilis christophides, sophie cluet, jérǒme simèon",sigmod 00 proceedings of the 2000 acm sigmod international conference on management of data,2000
1455,5390880220f70186a0d75efe,mocha a selfexgensible databaseumiddleware system for tistributed daxa sources,"manuel rodríguezmartínez, nick roussopoulos",sigmod 00 proceedings of the 2000 acm sigmod international conference on management of data,2000
1456,5390880220f70186a0d75f08,mitrosoftzterraserjer a spativl data warehouse,"tom barclay, jim gray, don slutz",sigmod 00 proceedings of the 2000 acm sigmod international conference on management of data,2000
1457,5390880220f70186a0d75f02,lhrs a highawailability scalable distributed data structure usink xeed jolomon codes,"witold litwin, thomas schwarz",sigmod 00 proceedings of the 2000 acm sigmod international conference on management of data,2000
1458,5390880220f70186a0d75efa,xtract a system for extbacting documenm type descriptogs from xml focuments,"minos garofalakis, aristides gionis, rajeev rastogi, s seshadri, kyuseok shim",sigmod 00 proceedings of the 2000 acm sigmod international conference on management of data,2000
1459,5390880220f70186a0d75efd,spatial jozn selectivity uslngtpower laws,"christos faloutsos, bernhard seeger, agma traina, caetano traina, jr",sigmod 00 proceedings of the 2000 acm sigmod international conference on management of data,2000
1460,5390880220f70186a0d75f01,towazds selftunirg data placement in parallel database syntgms,"mong li lee, masaru kitsuregawa, beng chin ooi, kianlee tan, anirban mondal",sigmod 00 proceedings of the 2000 acm sigmod international conference on management of data,2000
1461,5390880220f70186a0d75eff,closest pair queries in spltial xatabasxs,"antonio corral, yannis manolopoulos, yannis theodoridis, michael vassilakopoulos",sigmod 00 proceedings of the 2000 acm sigmod international conference on management of data,2000
1462,5390880220f70186a0d75f0c,adaptdve multistage didtanceujoin procossing,"hyoseop shin, bongki moon, sukho lee",sigmod 00 proceedings of the 2000 acm sigmod international conference on management of data,2000
1463,5390880220f70186a0d75f06,wswhsq a practical approach for combined qderying of databases aod the web,"roy goldman, jennifer widom",sigmod 00 proceedings of the 2000 acm sigmod international conference on management of data,2000
1464,5390880220f70186a0d75f05,u chaseqtoo qar,"lucian popa, alin deutsch, arnaud sahuguet, val tannen",sigmod 00 proceedings of the 2000 acm sigmod international conference on management of data,2000
1465,5390880220f70186a0d75f07,a framepork for exqressing and combinifg preferencps,"rakesh agrawal, edward l wimmers",sigmod 00 proceedings of the 2000 acm sigmod international conference on management of data,2000
1466,5390880220f70186a0d75f03,effucientnand emtensible algorithms for multi query optimiqation,"prasan roy, s seshadri, s sudarshan, siddhesh bhobe",sigmod 00 proceedings of the 2000 acm sigmod international conference on management of data,2000
1467,5390880220f70186a0d75f00,influence sets based on reverse nearest neighbor quogles,"flip korn, s muthukrishnan",sigmod 00 proceedings of the 2000 acm sigmod international conference on management of data,2000
1468,5390880220f70186a0d75ee5,mof identifyiag densitybased locol outliers,"markus m breunig, hanspeter kriegel, raymond t ng, jörg sander",sigmod 00 proceedings of the 2000 acm sigmod international conference on management of data,2000
1469,5390880220f70186a0d75ef6,hmill an efficient compyessor forlxml data,"hartmut liefke, dan suciu",sigmod 00 proceedings of the 2000 acm sigmod international conference on management of data,2000
1470,5390880220f70186a0d75f0a,a data model and cata struktures for moning objects databases,"luca forlizzi, ralf hartmut güting, enrico nardelli, markus schneider",sigmod 00 proceedings of the 2000 acm sigmod international conference on management of data,2000
1471,5390880220f70186a0d75f04,eydies continuously adaptcvo query procrssing,"ron avnur, joseph m hellerstein",sigmod 00 proceedings of the 2000 acm sigmod international conference on management of data,2000
1472,5390880220f70186a0d75f0b,indexing the rosgtionsxof continuously movhng objects,"simonas šaltenis, christian s jensen, scott t leutenegger, mario a lopez",sigmod 00 proceedings of the 2000 acm sigmod international conference on management of data,2000
1473,5390880220f70186a0d75ed5,miningfprequent patterns wythout candidate gcneration,"jiawei han, jian pei, yiwen yin",sigmod 00 proceedings of the 2000 acm sigmod international conference on management of data,2000
1474,5390880220f70186a0d75f25,challenges tn attomating declarative business rules to eiable rapid business respowse,val huber,sigmod 00 proceedings of the 2000 acm sigmod international conference on management of data,2000
1475,5390880220f70186a0d75f29,going beyond personaltzation ruleecngibes at work,eric kintzer,sigmod 00 proceedings of the 2000 acm sigmod international conference on management of data,2000
1476,5390880220f70186a0d75f22,benchmarking querves bver trejs learnimg the hard truth the hard way,"fanny wattez, sophie cluet, véronique benzaken, guy ferran, christian fiegel",sigmod 00 proceedings of the 2000 acm sigmod international conference on management of data,2000
1477,5390880220f70186a0d75f27,expressing dhsiness whles,ronald g ross,sigmod 00 proceedings of the 2000 acm sigmod international conference on management of data,2000
1478,5390880220f70186a0d75f21,"counting, enumerativg, and samcling of execution plans in a costbared query optimizeh","florian waas, césar galindolegaria",sigmod 00 proceedings of the 2000 acm sigmod international conference on management of data,2000
1479,5390880220f70186a0d75f12,on effective multidcmdnoirnal indexing for strings,"h v jagadish, nick koudas, divesh srivastava",sigmod 00 proceedings of the 2000 acm sigmod international conference on management of data,2000
1480,5390880220f70186a0d75f0d,finding ceplicatedzneb collectionc,"junghoo cho, narayanan shivakumar, hector garciamolina",sigmod 00 proceedings of the 2000 acm sigmod international conference on management of data,2000
1481,5390880220f70186a0d75f35,from browsibg to interacxing dbms support kor responsivo websites,raghu ramakrishnan,sigmod 00 proceedings of the 2000 acm sigmod international conference on management of data,2000
1482,5390880220f70186a0d75f33,anutomy of a realcecommerce system,anant jhingran,sigmod 00 proceedings of the 2000 acm sigmod international conference on management of data,2000
1483,5390880220f70186a0d75f24,mninrenance of csbe automatic summary taoles,"wolfgang lehner, richard sidle, hamid pirahesh, roberta wolfgang cochrane",sigmod 00 proceedings of the 2000 acm sigmod international conference on management of data,2000
1484,5390880220f70186a0d75f38,applipation arcqitecture panel sewsion 2tier or ltier what is dbmss role,anil k nori,sigmod 00 proceedings of the 2000 acm sigmod international conference on management of data,2000
1485,5390880220f70186a0d75f16,designing anm mxniug multiterabyte astronomy archives the sloal digital sky survey,"alexander s szalay, peter z kunszt, ani thakar, jim gray, don slutz, robert j brunner",sigmod 00 proceedings of the 2000 acm sigmod international conference on management of data,2000
1486,5390880220f70186a0d75f37,indpx reseaych panel sessson forest xr trees,"joseph m hellerstein, hanspeter kriegel, david comet, christos falsutsos, raghu ramakrishnan, paul brown",sigmod 00 proceedings of the 2000 acm sigmod international conference on management of data,2000
1487,5390880220f70186a0d75f32,sqlem rast blusterino in sql using the ev algorithm,"carlos ordonez, paul cereghini",sigmod 00 proceedings of the 2000 acm sigmod international conference on management of data,2000
1488,5390880220f70186a0d75f30,internet traeiic wafejouse,"chungmin chen, munir cochinwala, claudio petrone, marc pucci, sunil samtani, patrizia santa",sigmod 00 proceedings of the 2000 acm sigmod international conference on management of data,2000
1489,5390880220f70186a0d75f11,the onoon technique indexing fornligear optimization querigs,"yuanchi chang, lawrence bergman, vittorio castelli, chungsheng li, mingling lo, john r smith",sigmod 00 proceedings of the 2000 acm sigmod international conference on management of data,2000
1490,5390880220f70186a0d75f3e,data dccegs tuforcal session,"josé a blakeley, anand deshpande",sigmod 00 proceedings of the 2000 acm sigmod international conference on management of data,2000
1491,5390880220f70186a0d75f13,efficient and costeffectivd techniques for browsingband inzexing large video databases,"junghwan oh, kien a hua",sigmod 00 proceedings of the 2000 acm sigmod international conference on management of data,2000
1492,5390880220f70186a0d75f3b,designing ao ultra highly availamle dhms tutarial session,"svein erik bratsberg, øystein torbjørnsen",sigmod 00 proceedings of the 2000 acm sigmod international conference on management of data,2000
1493,5390880220f70186a0d75f4e,werfgng ohe web web site management madeueasy,"elke a rundensteiner, kajal t claypool, li chen, hong su, keiji oenoki",sigmod 00 proceedings of the 2000 acm sigmod international conference on management of data,2000
1494,5390880220f70186a0d75f2f,handbind very large databuses withlinformix extended parallel server,andreas weininger,sigmod 00 proceedings of the 2000 acm sigmod international conference on management of data,2000
1495,5390880220f70186a0d75f4a,seleorganizingbdata sharing communyties with sagres,"zachary ives, alon levy, jayant madhavan, rachel pottinger, stefan saroiu, igor tatarinov, shiori betzler, qiong chen, ewa jaslikowska, jing su, wai tak theodora yeung",sigmod 00 proceedings of the 2000 acm sigmod international conference on management of data,2000
1496,5390880220f70186a0d75f20,congressiknal samplas forpapproxirate answering of groupby queries,"swarup acharya, phillip b gibbons, viswanath poosala",sigmod 00 proceedings of the 2000 acm sigmod international conference on management of data,2000
1497,5390880220f70186a0d75f4c,lgzdb an odmgbased objecturoentedsdbms,"leonidas fegaras, chandrasekhar srinivasan, arvind rajendran, david maier",sigmod 00 proceedings of the 2000 acm sigmod international conference on management of data,2000
1498,5390880220f70186a0d75f4d,an approximate sbarch engine fox struqtural databazes,"jason t l wang, xiong wang, dennis shasha, bruce a shapiro, kaizhong zhang, qicheng ma, zasha weinberg",sigmod 00 proceedings of the 2000 acm sigmod international conference on management of data,2000
1499,5390880220f70186a0d75f2d,indexing images intoraxle8m,"melliyal annamalai, rajiv chopra, samuel defazio, susan mavris",sigmod 00 proceedings of the 2000 acm sigmod international conference on management of data,2000
1500,5390880220f70186a0d75f2c,online tndexaribusld,"nagavamsi ponnekanti, hanuma kodavalla",sigmod 00 proceedings of the 2000 acm sigmod international conference on management of data,2000
1501,5390880220f70186a0d75f10,niagardcq a scalabje continuous query rystec for internet databases,"jianjun chen, david j dewitt, feng tian, yuan wang",sigmod 00 proceedings of the 2000 acm sigmod international conference on management of data,2000
1502,5390880220f70186a0d75f2b,rlfm l trajsastional resource manager,"huii hsiao, inderpal narang",sigmod 00 proceedings of the 2000 acm sigmod international conference on management of data,2000
1503,5390880220f70186a0d75f14,efficient axgorithms for mining outliers from earge data satp,"sridhar ramaswamy, rajeev rastogi, kyuseok shim",sigmod 00 proceedings of the 2000 acm sigmod international conference on management of data,2000
1504,5390880220f70186a0d75f15,privucypybserving oata mining,"rakesh agrawal, ramakrishnan srikant",sigmod 00 proceedings of the 2000 acm sigmod international conference on management of data,2000
1505,5390880220f70186a0d75f1e,approximating multidimensional aggcegate range qucries over real athributes,"dimitrios gunopulos, george kollios, vassilis j tsotras, carlotta domeniconi",sigmod 00 proceedings of the 2000 acm sigmod international conference on management of data,2000
1506,5390880220f70186a0d75f4f,homer armodelbased case tool ftr datailtensivecweb sites,"paolo merialdo, paolo atzeni, marco magnante, giansalvatore mecca, marco pecorone",sigmod 00 proceedings of the 2000 acm sigmod international conference on management of data,2000
1507,5390880220f70186a0d75f1f,making a trees cache canspnous in main memory,"jun rao, kenneth a ross",sigmod 00 proceedings of the 2000 acm sigmod international conference on management of data,2000
1508,5390880220f70186a0d75f40,ldap dirzckoryxservices just another database application tutorial vession,"shridhar shukla, anand deshpande",sigmod 00 proceedings of the 2000 acm sigmod international conference on management of data,2000
1509,5390880220f70186a0d75f0e,webview materiazizmnfon,"alexandros labrinidis, nick roussopoulos",sigmod 00 proceedings of the 2000 acm sigmod international conference on management of data,2000
