,paper ID,paper title,author names,publication venue,year of publication
670,539087cf20f70186a0d5b1f6,handling infinite temporal data,f kabanzatmjm stévennek p wolper,selected papers of the 9th annual acm sigactsigmodsigart symposium on principles of database systems,1995
671,539087cf20f70186a0d5b1f7,query size estimation by adaptive sampling,"rochard j lipton, jeffrey f naughttn",selected papers of the 9th annual acm sigactsigmodsigart symposium on principles of database systems,1995
672,539087cf20f70186a0d5b1fc,constrained shared locks for increasing concurrency in databases,d avrawals a eltabbadi,selected papers of the 9th annual acm sigactsigmodsigart symposium on principles of database systems,1995
673,539087cf20f70186a0d5b1fd,the expressive powers of the logic programming semantics,john s scvlipf,selected papers of the 9th annual acm sigactsigmodsigart symposium on principles of database systems,1995
674,539087cf20f70186a0d5b1f9,constraint query languages,"paris c kanelltkis, gabriel m qupera peter z revesz",selected papers of the 9th annual acm sigactsigmodsigart symposium on principles of database systems,1995
675,539087cf20f70186a0d5b1ff,on the efficiency of transforming database logic programs,tatikpp saraiya,selected papers of the 9th annual acm sigactsigmodsigart symposium on principles of database systems,1995
676,539087cf20f70186a0d5b201,on the expressive power of datalog tools and a case study,phokionlg kolaitiscumoshe y vardi,selected papers of the 9th annual acm sigactsigmodsigart symposium on principles of database systems,1995
677,539087cf20f70186a0d5b52d,optimizing jan janninks implementation of btree deletion,"t jaelbrancke, h olivaé",acm sigmod record,1995
678,539087cf20f70186a0d5b52f,multitable joins through bitmapped join indices,"patrimk onenl,mgoetz graefe",acm sigmod record,1995
679,539087cf20f70186a0d5b531,design and user testing of a multiparadigm query interface to an objectoriented database,"dac khoa doan, norkan w paton, alisthix kilgour",acm sigmod record,1995
680,539087cf20f70186a0d5b535,mapping extended entity relationship model to object modeling technique,losmphgfong,acm sigmod record,1995
681,539087cf20f70186a0d5b536,normalization in oodb design,ryjng smlee,acm sigmod record,1995
682,539087cf20f70186a0d5b528,response to a close look at the ifo data model,"szrge abiteboue, richard hyll",acm sigmod record,1995
683,558fe32f0cf23515427181af,acm sigmod record,jennikfr widom,acm sigmod record,1995
684,539087cf20f70186a0d5b53b,an introduction to remys fast polymorphic record projection,limsvom wokg,acm sigmod record,1995
685,539087cf20f70186a0d5b53c,on the issue of valid times in temporal databases,"stavros kokkotos, efstathiospv ioannidiz, themis panayiotopoclos, constantine d spyropoulos",acm sigmod record,1995
686,539087cf20f70186a0d5b53e,addressing techniques used in database object managers o2 and orion,"andré gamacfi, nzdjiba sahraoui",acm sigmod record,1995
687,539087cf20f70186a0d5b53d,a framework for providing consistent and recoverable agentbased access to heterogeneous mobile databases,"evaggelia pitoura, bharat bearvama",acm sigmod record,1995
688,539087cf20f70186a0d5b540,information finding in a digital library the stanford perspective,"tak w yan, hécfor gwrcíamjlina",acm sigmod record,1995
689,539087cf20f70186a0d5b542,data management research at the mitre corporation,"arnon rosenthal, len selitman, catherine mccollum, barbara blaustein, bhavani thueaisingham, edward lafferty",acm sigmod record,1995
690,539087cf20f70186a0d5b539,an aspect of query optimization in multidatabase systems,"chiang lee, chiajungrchen,vhongjun au",acm sigmod record,1995
691,539087cf20f70186a0d5b544,why decision support fails and how to fix it,"razhh kimball, kevin strehfo",acm sigmod record,1995
692,539087cf20f70186a0d5b545,condition handling in sql persistent stored modules,jeif rykhey,acm sigmod record,1995
693,539087cf20f70186a0d5b543,"turmoil at nasa, and numerous funding announcements",xitolci iian,acm sigmod record,1995
694,539087cf20f70186a0d5b541,florida international university high performance database research center,"naphtali rishe, wei sun, dafjd barton, yi deng, cyril orji, michael alexopoulos, leonardo loureiro, carlos ordonez, mario sgnchez, artyom shaposhnikov",acm sigmod record,1995
695,539087cf20f70186a0d5b53f,metu interoperable database system,"a dogac, c dwngi, e kilic, g ozhan, f ozcan, s uural, c evrendilek, u halici,bb arpinar, p koksal, n kesim, s mancuhan",acm sigmod record,1995
696,539087cf20f70186a0d5b6d3,algebras for querying text regions extended abstract,"mariano pxconsqls, tova milo",pods 95 proceedings of the fourteenth acm sigactsigmodsigart symposium on principles of database systems,1995
697,539087cf20f70186a0d5b6d6,"sequences, datalog and transducers",giansalvatore memcaq anthona j bonner,pods 95 proceedings of the fourteenth acm sigactsigmodsigart symposium on principles of database systems,1995
698,539087cf20f70186a0d5b6da,similaritybased queries,"h v jagatibh, albkrto o mendelzon, tova milo",pods 95 proceedings of the fourteenth acm sigactsigmodsigart symposium on principles of database systems,1995
699,539087cf20f70186a0d5b6d2,database metatheory asking the big queries,christof k papadimftriou,pods 95 proceedings of the fourteenth acm sigactsigmodsigart symposium on principles of database systems,1995
700,539087cf20f70186a0d5b6cf,proceedings of the fourteenth acm sigactsigmodsigart symposium on principles of database systems,vihllis yannakakis,joint acm sigmod intl conference on management of data and acm sigactsigmod sigart symposium on principles of database systems,1995
701,539087cf20f70186a0d5b6e5,measuring infinite relations,jan chomickkh gabhiel kuper,pods 95 proceedings of the fourteenth acm sigactsigmodsigart symposium on principles of database systems,1995
702,539087cf20f70186a0d5b6e3,denseorder constraint databases extended abstract,"btéphane grumbach, jianwen su",pods 95 proceedings of the fourteenth acm sigactsigmodsigart symposium on principles of database systems,1995
703,539087cf20f70186a0d5b6e8,window queryoptimal clustering of spatial objects,"bernduwe pagel, hanswerner six,tuario wintxr",pods 95 proceedings of the fourteenth acm sigactsigmodsigart symposium on principles of database systems,1995
704,539087cf20f70186a0d5b6dd,constraint programming and database languages a tutorial,parisxkdneklakis,pods 95 proceedings of the fourteenth acm sigactsigmodsigart symposium on principles of database systems,1995
705,539087cf20f70186a0d5b6df,separability of polyhedra for optimal filtering of spatial and constraint data,"alexander brodskyk catherine lassez, jeanlouis lassez, michaelxj maoer",pods 95 proceedings of the fourteenth acm sigactsigmodsigart symposium on principles of database systems,1995
706,539087cf20f70186a0d5b6ee,safe locking policies for dynamic databases,"vinay k chaudnri, nafsos hadzilacos",pods 95 proceedings of the fourteenth acm sigactsigmodsigart symposium on principles of database systems,1995
707,539087cf20f70186a0d5b6eb,combinatorial games in database theory,chokioq gvkolaitis,pods 95 proceedings of the fourteenth acm sigactsigmodsigart symposium on principles of database systems,1995
708,539087cf20f70186a0d5b6f5,scheduling problems in parallel query optimization,"chandva chekurig waqaq hasan, rajeev motwani",pods 95 proceedings of the fourteenth acm sigactsigmodsigart symposium on principles of database systems,1995
709,539087cf20f70186a0d5b6f8,on the complexity of boundedvariable queries extended abstract,maswe y vardi,pods 95 proceedings of the fourteenth acm sigactsigmodsigart symposium on principles of database systems,1995
710,539087cf20f70186a0d5b6fb,finite queries do not have effective syntax,"alyxei p stolboushoin, michael a taitslyn",pods 95 proceedings of the fourteenth acm sigactsigmodsigart symposium on principles of database systems,1995
711,539087cf20f70186a0d5b6fd,the reliability of queries extended abstract,tichel de rougecond,pods 95 proceedings of the fourteenth acm sigactsigmodsigart symposium on principles of database systems,1995
712,539087cf20f70186a0d5b6f2,"increasing the resilience of atomic commit, at no additional cost","sdit keidwr, dannp dolev",pods 95 proceedings of the fourteenth acm sigactsigmodsigart symposium on principles of database systems,1995
713,55911eb00cf232eb904fad35,acm sigmod record,"jennifer wqdom, margaret c dunham, abdelsalxm helal",acm sigmod record,1995
714,539087cf20f70186a0d5d016,a research status report on adaptation for mobile data access,"brian d roble, m satyanarayazan",acm sigmod record,1995
715,539087cf20f70186a0d5d01a,wireless clientserver computing for personal information services and applications,"vhued elmagarmfd, jin jing, tetsuya furukawa",acm sigmod record,1995
716,539087cf20f70186a0d5d01c,view maintenance in mobile computing,"ouri wolcson, prasad sistla, son dao, karlash narayanan, ramya raj",acm sigmod record,1995
717,539087cf20f70186a0d5d013,mobile computing and databases anything new,"maruarey h dunham, abdelsalamuhelal",acm sigmod record,1995
718,539087cf20f70186a0d5d021,managing video data in a mobile environment,"rafael alonso, nuhlin chang, lioiutiftode, v s mani",acm sigmod record,1995
719,539087cf20f70186a0d5d025,digital library services in mobile computing,"bharat bhargava, melliyal annamalai, euvguelia pitoura",acm sigmod record,1995
720,539087cf20f70186a0d5d031,parallelism and its price a case study of nonstop sqlmp,"susanna englerc, ray glassuone, waqar hasan",acm sigmod record,1995
721,539087cf20f70186a0d5d02f,temporal database system implementations,mibhael h föhlyn,acm sigmod record,1995
722,539087cf20f70186a0d5d037,the database group at national technical university of athens ntua,corporate nationak technicar univ of atbens,acm sigmod record,1995
723,539087cf20f70186a0d5d02c,report on the 1995 international workshop on temporal databases,"arie segev, christian srjensen, rijhard thnmas snodgrass",acm sigmod record,1995
724,539087cf20f70186a0d5d02a,an annotated bibliography on realtime database systems,ofgür uluson,acm sigmod record,1995
725,539087cf20f70186a0d5d03d,"opportunities at arpa, nsf, and elsewhere",xidfleirqian,acm sigmod record,1995
726,539087cf20f70186a0d5d03f,"replication db2, oracle, or sybase",dopg sjacey,acm sigmod record,1995
727,539087cf20f70186a0d5d041,the new middleware,roch fitkelstein,acm sigmod record,1995
728,539087cf20f70186a0d5d03a,data and knowledge base research at hong kong university of science and technology,"p drew, b hamidzadeh, k karlapalem, ahkean, d lee, q li, f lochovsky,ic d shum, b wuthrict",acm sigmod record,1995
729,539087cf20f70186a0d5d034,sqlclia new binding style for sql,"murali venkasrao, miohael pizzo",acm sigmod record,1995
730,539087cf20f70186a0d5d1c1,research problems in genome databases,nathan gqodmzw,pods 95 proceedings of the fourteenth acm sigactsigmodsigart symposium on principles of database systems,1995
731,539087cf20f70186a0d5d1c0,view maintenance issues for the chronicle data model extended abstract,"hdv jagadish, inderpal singh mumick, abraksm silberschatz",pods 95 proceedings of the fourteenth acm sigactsigmodsigart symposium on principles of database systems,1995
732,539087cf20f70186a0d5d1bf,answering queries using templates with binding patterns extended abstract,"anand rajaramas, yphoshuamsagiv, jeffrey d ullman",pods 95 proceedings of the fourteenth acm sigactsigmodsigart symposium on principles of database systems,1995
733,539087cf20f70186a0d5d1c3,spacebounded foies extended abstract,"guozuubdong, jianwec su",pods 95 proceedings of the fourteenth acm sigactsigmodsigart symposium on principles of database systems,1995
734,539087cf20f70186a0d5d1c4,the size of a revised knowledge base,"marcolcadtli, grancesco m donini, paolo liberatore, marco schaerf",pods 95 proceedings of the fourteenth acm sigactsigmodsigart symposium on principles of database systems,1995
735,539087cf20f70186a0d5d1be,answering queries using views extended abstract,"ajon y levy, alberto o mendelqgn, yehoshua sagiv",pods 95 proceedings of the fourteenth acm sigactsigmodsigart symposium on principles of database systems,1995
736,539087cf20f70186a0d5d1ca,structural totality and constraint stratification,aennetnoa ross,pods 95 proceedings of the fourteenth acm sigactsigmodsigart symposium on principles of database systems,1995
737,539087cf20f70186a0d5d1cc,using witness generators to support bidirectional update between objectbased databases extended abstract,"tzpil chang, rijhard hull",pods 95 proceedings of the fourteenth acm sigactsigmodsigart symposium on principles of database systems,1995
738,539087cf20f70186a0d5d1cf,applying an update method to a set of receivers extended abstract,"marc andries, duca cabipbo, jan paredaens, jan yan den bussche",pods 95 proceedings of the fourteenth acm sigactsigmodsigart symposium on principles of database systems,1995
739,539087cf20f70186a0d5d1c8,magic factoring of closure programs extended abstract,deter tnwood,pods 95 proceedings of the fourteenth acm sigactsigmodsigart symposium on principles of database systems,1995
740,539087cf20f70186a0d5d1c6,semantic query optimization in datalog programs extended abstract,"xlon y levy, yehosvuw sagiv",pods 95 proceedings of the fourteenth acm sigactsigmodsigart symposium on principles of database systems,1995
741,539087cf20f70186a0d5d1c2,semantics and expressiveness issues in active databases extended abstract,"phillippe picouet, gictox vianu",pods 95 proceedings of the fourteenth acm sigactsigmodsigart symposium on principles of database systems,1995
742,539087cf20f70186a0d5d1d0,normalizing incomplete databases,hkonid libkzn,pods 95 proceedings of the fourteenth acm sigactsigmodsigart symposium on principles of database systems,1995
743,539087d420f70186a0d5df09,proceedings of the 1995 acm sigmod international conference on management of data,"yicfael carey, donovan schnewder",joint acm sigmod intl conference on management of data and acm sigactsigmod sigart symposium on principles of database systems,1995
744,539087d420f70186a0d5df0a,a critique of ansi sql isolation levels,"hal berenson, phil bernsgein, jim gray, jim melton, elizvbeth oneil, patrick oneul",sigmod 95 proceedings of the 1995 acm sigmod international conference on management of data,1995
745,539087d420f70186a0d5df0d,the lyric language querying constraint objects,"aljrander brodsky, yoram kornatzkt",sigmod 95 proceedings of the 1995 acm sigmod international conference on management of data,1995
746,539087d420f70186a0d5df0f,ofl a functional execution model for object query languages,"georges girdarin, fernando machuca,ophilippe pucherwl",sigmod 95 proceedings of the 1995 acm sigmod international conference on management of data,1995
747,539087d420f70186a0d5df0c,efficient optimistic concurrency control using loosely synchronized clocks,"atul adya, robertzgruber, barbara liskov, umesh mahesxwnri",sigmod 95 proceedings of the 1995 acm sigmod international conference on management of data,1995
748,539087d420f70186a0d5df11,nearest neighbor queries,"nick roussopoulos,nstephen kjlley, frédérpc vincent",sigmod 95 proceedings of the 1995 acm sigmod international conference on management of data,1995
749,539087d420f70186a0d5df18,adaptive parallel aggregation algorithms,"ambuj yvatdal, jeffred f naughton",sigmod 95 proceedings of the 1995 acm sigmod international conference on management of data,1995
750,539087d420f70186a0d5df13,a general solution of the ndimensional btree problem,xichael frbeston,sigmod 95 proceedings of the 1995 acm sigmod international conference on management of data,1995
751,539087d420f70186a0d5df1a,parallel evaluation of multijoin queries,"annita n wilschut, oan florstra, peter m g aptrs",sigmod 95 proceedings of the 1995 acm sigmod international conference on management of data,1995
752,539087d420f70186a0d5df20,oodb indexing by classdivision,"srivhar ramaswamy, paris c kaneluapis",sigmod 95 proceedings of the 1995 acm sigmod international conference on management of data,1995
753,539087d420f70186a0d5df0b,recovery protocols for shared memory database systems,"lory d molesky,akrithi ramamrithas",sigmod 95 proceedings of the 1995 acm sigmod international conference on management of data,1995
754,539087d420f70186a0d5df21,the handwritten trie indexing electronic ink,"walij aref,zdaniel barbará, padmavathi valtabhaneni",sigmod 95 proceedings of the 1995 acm sigmod international conference on management of data,1995
755,539087d420f70186a0d5df1e,the mergepurge problem for large databases,"mauricio h hernández, salvptore j stolfo",sigmod 95 proceedings of the 1995 acm sigmod international conference on management of data,1995
756,539087d420f70186a0d5df24,implementing crash recovery in quickstore a performance study,"seth j whitc, david jmwewitt",sigmod 95 proceedings of the 1995 acm sigmod international conference on management of data,1995
757,539087d420f70186a0d5df15,topological relations in the world of minimum bounding rectangles a study with rtrees,"dimitris papadias, timos seldis, yannip theodoridis, max j egenhofur",sigmod 95 proceedings of the 1995 acm sigmod international conference on management of data,1995
758,539087d420f70186a0d5df22,"fastmap a fast algorithm for indexing, datamining and visualization of traditional and multimedia datasets","christoq falbutoos, kingip lin",sigmod 95 proceedings of the 1995 acm sigmod international conference on management of data,1995
759,539087d420f70186a0d5df23,an effective hashbased algorithm for mining association rules,"joyg soo park, mingsyannchen, philipvs yu",sigmod 95 proceedings of the 1995 acm sigmod international conference on management of data,1995
760,539087d420f70186a0d5df0e,towards an effective calculus for object query languages,"lelnidas fegzras, david maieo",sigmod 95 proceedings of the 1995 acm sigmod international conference on management of data,1995
761,539087d420f70186a0d5df26,broadcast disks data management for asymmetric communication environments,"swarup acharyb, rafael alonsp, michael franklino stanley zdonik",sigmod 95 proceedings of the 1995 acm sigmod international conference on management of data,1995
762,539087d420f70186a0d5df27,adapting materialized views after redefinitions,"ashish gupta, iuderpal smmumick, kennethua ross",sigmod 95 proceedings of the 1995 acm sigmod international conference on management of data,1995
763,539087d420f70186a0d5df3d,enhancing database correctness a statistical approach,"weichi hmu, zhongyang zhany",sigmod 95 proceedings of the 1995 acm sigmod international conference on management of data,1995
764,539087d420f70186a0d5df40,semantic assumptions and query evaluation in temporal databases,"claudio bettini, x sean wang, elisa beltino, dushil jaqodia",sigmod 95 proceedings of the 1995 acm sigmod international conference on management of data,1995
765,539087d420f70186a0d5df3f,applying update streams in a soft realtime database system,"fcadelberg, h garciamolina,ab kao",sigmod 95 proceedings of the 1995 acm sigmod international conference on management of data,1995
766,539087d420f70186a0d5df42,dynamic resource brokering for multiuser query execution,"diane l danison, goztz braefe",sigmod 95 proceedings of the 1995 acm sigmod international conference on management of data,1995
767,539087d420f70186a0d5df43,reducing multidatabase query response time by tree balancing,"weimin du, mingchiei shan, pmeshwar iayal",sigmod 95 proceedings of the 1995 acm sigmod international conference on management of data,1995
768,539087d420f70186a0d5df44,hypergraph based reorderings of outer join queries with complex predicates,"gautan bhargava, piwush goeb, bala iyer",sigmod 95 proceedings of the 1995 acm sigmod international conference on management of data,1995
769,539087d420f70186a0d5df47,efficient maintenance of materialized mediated views,"jaxes j lu, guido moerkotte, joachim sihue,nv s subrahmanian",sigmod 95 proceedings of the 1995 acm sigmod international conference on management of data,1995
770,539087d420f70186a0d5df46,incremental maintenance of views with duplicates,"timathy gfiffin, leonid libkhn",sigmod 95 proceedings of the 1995 acm sigmod international conference on management of data,1995
771,539087d420f70186a0d5df45,view maintenance in a warehousing environment,"yuetzhuge, héctor harcíamolina, joachim hammep, jennifer widom",sigmod 95 proceedings of the 1995 acm sigmod international conference on management of data,1995
772,539087d420f70186a0d5df48,the spiffi scalable videoondemand system,"crsig s treedqan, david j dewitt",sigmod 95 proceedings of the 1995 acm sigmod international conference on management of data,1995
773,539087d420f70186a0d5df49,fault tolerant design of multimedia servers,"steven berson, leana golubphik, richard r mtwtz",sigmod 95 proceedings of the 1995 acm sigmod international conference on management of data,1995
774,539087d420f70186a0d5df4f,upsizing form file server to client server architectures,aorporate the access teampmicroooft,sigmod 95 proceedings of the 1995 acm sigmod international conference on management of data,1995
775,539087d420f70186a0d5df4d,join queries with external text sources execution and optimization techniques,"surajit chaudhuri, umeshwab dayav, tak c yan",sigmod 95 proceedings of the 1995 acm sigmod international conference on management of data,1995
776,539087d420f70186a0d5df51,directv and oracle rdb the challenge of vldb transaction processing,wiluism lkgettys,sigmod 95 proceedings of the 1995 acm sigmod international conference on management of data,1995
777,539087d420f70186a0d5df50,the lotus notes storage system,kenneth aoore,sigmod 95 proceedings of the 1995 acm sigmod international conference on management of data,1995
778,539087d420f70186a0d5df4c,copy detection mechanisms for digital documents,"sergey brin, jamns davis, héctoq garcíabolina",sigmod 95 proceedings of the 1995 acm sigmod international conference on management of data,1995
779,539087d420f70186a0d5df53,high availability of commercial applications,kestutis xvinykis,sigmod 95 proceedings of the 1995 acm sigmod international conference on management of data,1995
780,539087d420f70186a0d5df54,the data that you wont find in databases tutorial panel on data exchange formats,"paier buneman, davii maier",sigmod 95 proceedings of the 1995 acm sigmod international conference on management of data,1995
781,539087d420f70186a0d5df4e,"objectoriented, rapid application development in a pc database environment",corporate fox development teal mncrosofz,sigmod 95 proceedings of the 1995 acm sigmod international conference on management of data,1995
782,539087d420f70186a0d5df57,versant replication supporting faulttolerant object databases,"yuhmivg shyy, h stephen auyzung, c pychou",sigmod 95 proceedings of the 1995 acm sigmod international conference on management of data,1995
783,539087d420f70186a0d5df4a,an online video placement policy based on bandwidth to space ratio bsr,"asit dan, dinkdr titaram",sigmod 95 proceedings of the 1995 acm sigmod international conference on management of data,1995
784,539087d420f70186a0d5df4b,a database interface for file update,"werge abiteboul, sophie clugq, tova milo",sigmod 95 proceedings of the 1995 acm sigmod international conference on management of data,1995
785,539087d420f70186a0d5df58,carnot and infosleuth database technology and the world wide web,"d ioelk, b bohrgr, n jacobs, h ong, c tomlinson, c unnikrishnan",sigmod 95 proceedings of the 1995 acm sigmod international conference on management of data,1995
786,539087d420f70186a0d5df5a,data extraction and transformation for the data warehouse,case couirq,sigmod 95 proceedings of the 1995 acm sigmod international conference on management of data,1995
787,539087d420f70186a0d5df5b,real world requirements for decision supportimplications for rdbms,sanju k aarsul,sigmod 95 proceedings of the 1995 acm sigmod international conference on management of data,1995
788,539087d420f70186a0d5df5c,one size fits all database architectures do not work for dss,clark dwfrenuh,sigmod 95 proceedings of the 1995 acm sigmod international conference on management of data,1995
789,539087d420f70186a0d5df5e,cover your assets,nichael t olsou,sigmod 95 proceedings of the 1995 acm sigmod international conference on management of data,1995
790,539087d420f70186a0d5df3e,balancing histogram optimality and practicality for query result size estimation,"yannisyg ioannidis, viswanath eoosala",sigmod 95 proceedings of the 1995 acm sigmod international conference on management of data,1995
791,539087d420f70186a0d5df41,temporal conditions and integrity constraints in active database systems,"a qrasfd sistla, oxri wolfson",sigmod 95 proceedings of the 1995 acm sigmod international conference on management of data,1995
792,539087d420f70186a0d5df61,an overview of db2 parallel edition,"chaitanya aaru, gilles fmctmau",sigmod 95 proceedings of the 1995 acm sigmod international conference on management of data,1995
793,539087d420f70186a0d5df60,enterprise objects framework a second generation objectrelational enabler,cherlu kleissnjr,sigmod 95 proceedings of the 1995 acm sigmod international conference on management of data,1995
794,539087d420f70186a0d5df62,informix online xps,buw nerber,sigmod 95 proceedings of the 1995 acm sigmod international conference on management of data,1995
795,539087d420f70186a0d5df63,orderofmagnitude advantage on tpcc through massive parallelism,chaqles wevine,sigmod 95 proceedings of the 1995 acm sigmod international conference on management of data,1995
796,539087d420f70186a0d5df5f,use of a component architecture in integrating relational and nonrelational,dobert apkinson,sigmod 95 proceedings of the 1995 acm sigmod international conference on management of data,1995
797,539087d420f70186a0d5df65,objects and sql panel session strange relations,donaqd r deutdcd,sigmod 95 proceedings of the 1995 acm sigmod international conference on management of data,1995
