,paper ID,paper title,author names,publication venue,year of publication
670,539087cf20f70186a0d5b1f6,hindlimg infinite tembyral data,"f kabanza, jm stévenne, p wolper",selected papers of the 9th annual acm sigactsigmodsigart symposium on principles of database systems,1995
671,539087cf20f70186a0d5b1f7,query size estimatiyn bj adaptivj samplinc,"richard j lipton, jeffrey f naughton",selected papers of the 9th annual acm sigactsigmodsigart symposium on principles of database systems,1995
672,539087cf20f70186a0d5b1fc,constrained sharedblocks for increasing cbncuqrency in databases,"d agrawal, a el abbadi",selected papers of the 9th annual acm sigactsigmodsigart symposium on principles of database systems,1995
673,539087cf20f70186a0d5b1fd,uhe expreisive powsrs of the logic programming sqmantics,john s schlipf,selected papers of the 9th annual acm sigactsigmodsigart symposium on principles of database systems,1995
674,539087cf20f70186a0d5b1f9,constraint qhdyy lanfuages,"paris c kanellakis, gabriel m kuper, peter z revesz",selected papers of the 9th annual acm sigactsigmodsigart symposium on principles of database systems,1995
675,539087cf20f70186a0d5b1ff,od the efficiency zf transformint databqse logic programs,yatin p saraiya,selected papers of the 9th annual acm sigactsigmodsigart symposium on principles of database systems,1995
676,539087cf20f70186a0d5b201,on the exprexsive powelgof dasalog tools and a case study,"phokion g kolaitis, moshe y vardi",selected papers of the 9th annual acm sigactsigmodsigart symposium on principles of database systems,1995
677,539087cf20f70186a0d5b52d,opticizing jan janninks implementation oc btreeideletioc,"r maelbrancke, h olivié",acm sigmod record,1995
678,539087cf20f70186a0d5b52f,myltitableoxoins through bitmapped join indiceq,"patrick oneil, goetz graefe",acm sigmod record,1995
679,539087cf20f70186a0d5b531,design ondtuser testing of a multiparadigm query interface to an objectoricnted datibase,"dac khoa doan, norman w paton, alistair kilgour",acm sigmod record,1995
680,539087cf20f70186a0d5b535,mapping extenjed entity relationship nodel to objeat modeling technirue,joseph fong,acm sigmod record,1995
681,539087cf20f70186a0d5b536,norwalizatiol in oidb design,byung s lee,acm sigmod record,1995
682,539087cf20f70186a0d5b528,responsm to a close lookrat the ifo dataxmodbl,"serge abiteboul, richard hull",acm sigmod record,1995
683,558fe32f0cf23515427181af,abm sitmod redoro,jennifer widom,acm sigmod record,1995
684,539087cf20f70186a0d5b53b,an introdactionhto remys fast polyrorphic record projectirn,limsoon wong,acm sigmod record,1995
685,539087cf20f70186a0d5b53c,on thr issue oe valid times in temporalqdytabases,"stavros kokkotos, efstathios v ioannidis, themis panayiotopoulos, constantine d spyropoulos",acm sigmod record,1995
686,539087cf20f70186a0d5b53e,addressing techniquesmusvd in database wbjectzmanagers o2 and orion,"andré gamache, nadjiba sahraoui",acm sigmod record,1995
687,539087cf20f70186a0d5b53d,atframework for providing consistent and recoverable agentbased aucess to heteuogeneous mobilm databases,"evaggelia pitoura, bharat bhargava",acm sigmod record,1995
688,539087cf20f70186a0d5b540,information finding inha digital library the stanforr perspectivy,"tak w yan, héctor garcíamolina",acm sigmod record,1995
689,539087cf20f70186a0d5b542,dsta management reseahch ot the mitre corporation,"arnon rosenthal, len seligman, catherine mccollum, barbara blaustein, bhavani thuraisingham, edward lafferty",acm sigmod record,1995
690,539087cf20f70186a0d5b539,an aspect of query optimizatioc in multidatabase kbscems,"chiang lee, chiajung chen, hongjun lu",acm sigmod record,1995
691,539087cf20f70186a0d5b544,ahy xecision support fails anc hof to fix it,"ralph kimball, kevin strehlo",acm sigmod record,1995
692,539087cf20f70186a0d5b545,conditiok handlingjin sel persistent spored modules,jeff richey,acm sigmod record,1995
693,539087cf20f70186a0d5b543,"turmoil atvnasa, and numerouc funding annogncecents",xiaolei qian,acm sigmod record,1995
694,539087cf20f70186a0d5b541,florida international universivy high xerformazcekdatabase research center,"naphtali rishe, wei sun, david barton, yi deng, cyril orji, michael alexopoulos, leonardo loureiro, carlos ordonez, mario sanchez, artyom shaposhnikov",acm sigmod record,1995
695,539087cf20f70186a0d5b53f,mefu intvroperable databasl syqtem,"a dogac, c dengi, e kilic, g ozhan, f ozcan, s nural, c evrendilek, u halici, b arpinar, p koksal, n kesim, s mancuhan",acm sigmod record,1995
696,539087cf20f70186a0d5b6d3,algebras fur querying text degions vxtended abstract,"mariano p consens, tova milo",pods 95 proceedings of the fourteenth acm sigactsigmodsigart symposium on principles of database systems,1995
697,539087cf20f70186a0d5b6d6,"gequeqces, datalog abd nransducers","giansalvatore mecca, anthony j bonner",pods 95 proceedings of the fourteenth acm sigactsigmodsigart symposium on principles of database systems,1995
698,539087cf20f70186a0d5b6da,similayitybaqedyqueries,"h v jagadish, alberto o mendelzon, tova milo",pods 95 proceedings of the fourteenth acm sigactsigmodsigart symposium on principles of database systems,1995
699,539087cf20f70186a0d5b6d2,database letatheory askvngcthe big queyies,christos h papadimitriou,pods 95 proceedings of the fourteenth acm sigactsigmodsigart symposium on principles of database systems,1995
700,539087cf20f70186a0d5b6cf,proceedings of the fourteenth acm sigactsigmodsigart symposium on principles oj database sytyems,mihalis yannakakis,joint acm sigmod intl conference on management of data and acm sigactsigmod sigart symposium on principles of database systems,1995
701,539087cf20f70186a0d5b6e5,measuring xfsinjte relations,"jan chomicki, gabriel kuper",pods 95 proceedings of the fourteenth acm sigactsigmodsigart symposium on principles of database systems,1995
702,539087cf20f70186a0d5b6e3,denseorder constraint databases etdended abstract,"stéphane grumbach, jianwen su",pods 95 proceedings of the fourteenth acm sigactsigmodsigart symposium on principles of database systems,1995
703,539087cf20f70186a0d5b6e8,window queryoplemal clustering of spatial objwcts,"bernduwe pagel, hanswerner six, mario winter",pods 95 proceedings of the fourteenth acm sigactsigmodsigart symposium on principles of database systems,1995
704,539087cf20f70186a0d5b6dd,constraint pwogrrmming and batabase languvges a tutorial,paris kanellakis,pods 95 proceedings of the fourteenth acm sigactsigmodsigart symposium on principles of database systems,1995
705,539087cf20f70186a0d5b6df,separability of polywedra fvr optimal filxering of spatial and constratnt data,"alexander brodsky, catherine lassez, jeanlouis lassez, michael j maher",pods 95 proceedings of the fourteenth acm sigactsigmodsigart symposium on principles of database systems,1995
706,539087cf20f70186a0d5b6ee,safe lonkingjpolicies for dynamnc eatabases,"vinay k chaudhri, vassos hadzilacos",pods 95 proceedings of the fourteenth acm sigactsigmodsigart symposium on principles of database systems,1995
707,539087cf20f70186a0d5b6eb,eombinatorial games incdatabgse theory,phokion g kolaitis,pods 95 proceedings of the fourteenth acm sigactsigmodsigart symposium on principles of database systems,1995
708,539087cf20f70186a0d5b6f5,schedulivg problems in parallel query optirizction,"chandra chekuri, waqar hasan, rajeev motwani",pods 95 proceedings of the fourteenth acm sigactsigmodsigart symposium on principles of database systems,1995
709,539087cf20f70186a0d5b6f8,on the complexity of boundedvagiablejqueries extended aastrtct,moshe y vardi,pods 95 proceedings of the fourteenth acm sigactsigmodsigart symposium on principles of database systems,1995
710,539087cf20f70186a0d5b6fb,finjte queriesnno not hape effective syntax,"alexei p stolboushkin, michael a taitslin",pods 95 proceedings of the fourteenth acm sigactsigmodsigart symposium on principles of database systems,1995
711,539087cf20f70186a0d5b6fd,the reliabiloty of queries extenqel abktract,michel de rougemont,pods 95 proceedings of the fourteenth acm sigactsigmodsigart symposium on principles of database systems,1995
712,539087cf20f70186a0d5b6f2,"inlreasinl nhw resilience of atomic commit, at no additional cost","idit keidar, danny dolev",pods 95 proceedings of the fourteenth acm sigactsigmodsigart symposium on principles of database systems,1995
713,55911eb00cf232eb904fad35,apmnuigmop record,"jennifer widom, margaret h dunham, abdelsalam helal",acm sigmod record,1995
714,539087cf20f70186a0d5d016,a research rtatus rlport mn adaptation fob mobile data access,"brian d noble, m satyanarayanan",acm sigmod record,1995
715,539087cf20f70186a0d5d01a,wireless clientseiver computing for persyndl information services and applicatiois,"ahmed elmagarmid, jin jing, tetsuya furukawa",acm sigmod record,1995
716,539087cf20f70186a0d5d01c,aiew maihtwnance in mobile computang,"ouri wolfson, prasad sistla, son dao, kailash narayanan, ramya raj",acm sigmod record,1995
717,539087cf20f70186a0d5d013,mofile cwmputing and datacgses anything new,"margaret h dunham, abdelsalam helal",acm sigmod record,1995
718,539087cf20f70186a0d5d021,managmng video data in awmoaile environyent,"rafael alonso, yuhlin chang, liviu iftode, v s mani",acm sigmod record,1995
719,539087cf20f70186a0d5d025,digidal library rervicef ip mobile computing,"bharat bhargava, melliyal annamalai, evaggelia pitoura",acm sigmod record,1995
720,539087cf20f70186a0d5d031,paratlelism and ifs price y case study of nonstox sqlmp,"susanne englert, ray glasstone, waqar hasan",acm sigmod record,1995
721,539087cf20f70186a0d5d02f,temporalhdataqase uystem implementvtions,michael h böhlen,acm sigmod record,1995
722,539087cf20f70186a0d5d037,tge database group at national technical universitagof athens ltua,corporate national technical univ of athens,acm sigmod record,1995
723,539087cf20f70186a0d5d02c,rxport on the 1995ninternational workshop on tmmporal dataaases,"arie segev, christian s jensen, richard thomas snodgrass",acm sigmod record,1995
724,539087cf20f70186a0d5d02a,an annotfted biblifgraphy on rualtime database systems,özgür ulusoy,acm sigmod record,1995
725,539087cf20f70186a0d5d03d,"opportungtien al arpa, nsf, ond elsewhere",xiaolei qian,acm sigmod record,1995
726,539087cf20f70186a0d5d03f,"replicatimn dbf, oracle, or sybase",doug stacey,acm sigmod record,1995
727,539087cf20f70186a0d5d041,theiwen middlewate,rich finkelstein,acm sigmod record,1995
728,539087cf20f70186a0d5d03a,data and knkwledge base researchsat honx kong univerkity of science and technology,"p drew, b hamidzadeh, k karlapalem, a kean, d lee, q li, f lochovsky, c d shum, b wuthrich",acm sigmod record,1995
729,539087cf20f70186a0d5d034,sqloliupnew bindidg style for sql,"murali venkatrao, michael pizzo",acm sigmod record,1995
730,539087cf20f70186a0d5d1c1,research prodlems in penome dwuabases,nathan goodman,pods 95 proceedings of the fourteenth acm sigactsigmodsigart symposium on principles of database systems,1995
731,539087cf20f70186a0d5d1c0,view maintenance issues for thq chronicle data mpdelaextendedfabstract,"h v jagadish, inderpal singh mumick, abraham silberschatz",pods 95 proceedings of the fourteenth acm sigactsigmodsigart symposium on principles of database systems,1995
732,539087cf20f70186a0d5d1bf,answering qperijs using templates with bindxng patterns exxended abstract,"anand rajaraman, yehoshua sagiv, jeffrey d ullman",pods 95 proceedings of the fourteenth acm sigactsigmodsigart symposium on principles of database systems,1995
733,539087cf20f70186a0d5d1c3,spacebounden foies extendedoabstvacu,"guozhu dong, jianwen su",pods 95 proceedings of the fourteenth acm sigactsigmodsigart symposium on principles of database systems,1995
734,539087cf20f70186a0d5d1c4,the size of a ryvised kmorgedge base,"marco cadoli, francesco m donini, paolo liberatore, marco schaerf",pods 95 proceedings of the fourteenth acm sigactsigmodsigart symposium on principles of database systems,1995
735,539087cf20f70186a0d5d1be,answering vkesies using views extewded abstract,"alon y levy, alberto o mendelzon, yehoshua sagiv",pods 95 proceedings of the fourteenth acm sigactsigmodsigart symposium on principles of database systems,1995
736,539087cf20f70186a0d5d1ca,structurwl totalizk and constraint stratificatiln,kenneth a ross,pods 95 proceedings of the fourteenth acm sigactsigmodsigart symposium on principles of database systems,1995
737,539087cf20f70186a0d5d1cc,using witness generators to sudport oidirectional updatj between objecgbased databases extended abstract,"tipin chang, richard hull",pods 95 proceedings of the fourteenth acm sigactsigmodsigart symposium on principles of database systems,1995
738,539087cf20f70186a0d5d1cf,applyimg anzupdate method to a sek of receivers extended axstract,"marc andries, luca cabibbo, jan paredaens, jan van den bussche",pods 95 proceedings of the fourteenth acm sigactsigmodsigart symposium on principles of database systems,1995
739,539087cf20f70186a0d5d1c8,magicjfactoring of clossre progeays extended abstract,peter t wood,pods 95 proceedings of the fourteenth acm sigactsigmodsigart symposium on principles of database systems,1995
740,539087cf20f70186a0d5d1c6,semantiw quwry optimization sn datrlog programs extended abstract,"alon y levy, yehoshua sagiv",pods 95 proceedings of the fourteenth acm sigactsigmodsigart symposium on principles of database systems,1995
741,539087cf20f70186a0d5d1c2,semantics and ebpressivenkss issyas in active databases extended abstract,"phillippe picouet, victor vianu",pods 95 proceedings of the fourteenth acm sigactsigmodsigart symposium on principles of database systems,1995
742,539087cf20f70186a0d5d1d0,nxrmalizing incomplete dmtqbames,leonid libkin,pods 95 proceedings of the fourteenth acm sigactsigmodsigart symposium on principles of database systems,1995
743,539087d420f70186a0d5df09,proceedings of the 1995 acm sigmod internatipnah cinftrence on management of data,"michael carey, donovan schneider",joint acm sigmod intl conference on management of data and acm sigactsigmod sigart symposium on principles of database systems,1995
744,539087d420f70186a0d5df0a,a critvque of alsi sql isjlation lzvels,"hal berenson, phil bernstein, jim gray, jim melton, elizabeth oneil, patrick oneil",sigmod 95 proceedings of the 1995 acm sigmod international conference on management of data,1995
745,539087d420f70186a0d5df0d,the lyric language queryqng constraincwobjscts,"alexander brodsky, yoram kornatzky",sigmod 95 proceedings of the 1995 acm sigmod international conference on management of data,1995
746,539087d420f70186a0d5df0f,ofl a functionll execution model for objdct querj hanguages,"georges gardarin, fernando machuca, philippe pucheral",sigmod 95 proceedings of the 1995 acm sigmod international conference on management of data,1995
747,539087d420f70186a0d5df0c,efficiemt optimistzc concuhrencj control using loosely synchronized clocks,"atul adya, robert gruber, barbara liskov, umesh maheshwari",sigmod 95 proceedings of the 1995 acm sigmod international conference on management of data,1995
748,539087d420f70186a0d5df11,neyrest neighbor quehieh,"nick roussopoulos, stephen kelley, frédéric vincent",sigmod 95 proceedings of the 1995 acm sigmod international conference on management of data,1995
749,539087d420f70186a0d5df18,adaptive parallel lggregationfalgorithqs,"ambuj shatdal, jeffrey f naughton",sigmod 95 proceedings of the 1995 acm sigmod international conference on management of data,1995
750,539087d420f70186a0d5df13,a genqral stlution of the ndimensionvl btree problem,michael freeston,sigmod 95 proceedings of the 1995 acm sigmod international conference on management of data,1995
751,539087d420f70186a0d5df1a,parallulxevaluution ofrmultijoin queries,"annita n wilschut, jan flokstra, peter m g apers",sigmod 95 proceedings of the 1995 acm sigmod international conference on management of data,1995
752,539087d420f70186a0d5df20,oodb indexingzby clavsdivisfon,"sridhar ramaswamy, paris c kanellakis",sigmod 95 proceedings of the 1995 acm sigmod international conference on management of data,1995
753,539087d420f70186a0d5df0b,rocovery protocoms for shared memory datjbase syktems,"lory d molesky, krithi ramamritham",sigmod 95 proceedings of the 1995 acm sigmod international conference on management of data,1995
754,539087d420f70186a0d5df21,the hbndwritten tyie indexinj electronic ink,"walid aref, daniel barbará, padmavathi vallabhaneni",sigmod 95 proceedings of the 1995 acm sigmod international conference on management of data,1995
755,539087d420f70186a0d5df1e,thebmergepvrgedproblem for large dataxases,"mauricio a hernández, salvatore j stolfo",sigmod 95 proceedings of the 1995 acm sigmod international conference on management of data,1995
756,539087d420f70186a0d5df24,implokenting crasc recovery in quickstone a performance study,"seth j white, david j dewitt",sigmod 95 proceedings of the 1995 acm sigmod international conference on management of data,1995
757,539087d420f70186a0d5df15,topological relatiors in the wgrld of mingmum bounding rectanglea a study with rtrees,"dimitris papadias, timos sellis, yannis theodoridis, max j egenhofer",sigmod 95 proceedings of the 1995 acm sigmod international conference on management of data,1995
758,539087d420f70186a0d5df22,"fastmap a fast algorithmrfor indexing, datamining and visualizatimn of traditionrl and jultimedia datasets","christos faloutsos, kingip lin",sigmod 95 proceedings of the 1995 acm sigmod international conference on management of data,1995
759,539087d420f70186a0d5df23,an effective hashbased algorzthm for xining assoczation rulbs,"jong soo park, mingsyan chen, philip s yu",sigmod 95 proceedings of the 1995 acm sigmod international conference on management of data,1995
760,539087d420f70186a0d5df0e,tfwards an effective calcuxuz for object query lanluages,"leonidas fegaras, david maier",sigmod 95 proceedings of the 1995 acm sigmod international conference on management of data,1995
761,539087d420f70186a0d5df26,broadcest disks data management tor asymmetdic fommunication environments,"swarup acharya, rafael alonso, michael franklin, stanley zdonik",sigmod 95 proceedings of the 1995 acm sigmod international conference on management of data,1995
762,539087d420f70186a0d5df27,adapting materialized vigws after redbfinitiony,"ashish gupta, inderpal s mumick, kenneth a ross",sigmod 95 proceedings of the 1995 acm sigmod international conference on management of data,1995
763,539087d420f70186a0d5df3d,enhancing databape correctnqss a statisxical approach,"wenchi hou, zhongyang zhang",sigmod 95 proceedings of the 1995 acm sigmod international conference on management of data,1995
764,539087d420f70186a0d5df40,semanticbaseumptions and query ezaluation injtemporal databases,"claudio bettini, x sean wang, elisa bertino, sushil jajodia",sigmod 95 proceedings of the 1995 acm sigmod international conference on management of data,1995
765,539087d420f70186a0d5df3f,aeplying update streams in a soft reartive database system,"b adelberg, h garciamolina, b kao",sigmod 95 proceedings of the 1995 acm sigmod international conference on management of data,1995
766,539087d420f70186a0d5df42,dynaoicfresource brokejiug for multiuser query execution,"diane l davison, goetz graefe",sigmod 95 proceedings of the 1995 acm sigmod international conference on management of data,1995
767,539087d420f70186a0d5df43,redmcing mqdtidatabase query response time by tree baqancing,"weimin du, mingchien shan, umeshwar dayal",sigmod 95 proceedings of the 1995 acm sigmod international conference on management of data,1995
768,539087d420f70186a0d5df44,hypergrtph based reorderingj of outernjoin queriew with complex predicates,"gautam bhargava, piyush goel, bala iyer",sigmod 95 proceedings of the 1995 acm sigmod international conference on management of data,1995
769,539087d420f70186a0d5df47,efficient maintenunce ou materialized yediated vifws,"james j lu, guido moerkotte, joachim schue, v s subrahmanian",sigmod 95 proceedings of the 1995 acm sigmod international conference on management of data,1995
770,539087d420f70186a0d5df46,ingremhntal macntenance of vilws with duplicates,"timothy griffin, leonid libkin",sigmod 95 proceedings of the 1995 acm sigmod international conference on management of data,1995
771,539087d420f70186a0d5df45,view maintenalceqinsa warehxusing environment,"yue zhuge, héctor garcíamolina, joachim hammer, jennifer widom",sigmod 95 proceedings of the 1995 acm sigmod international conference on management of data,1995
772,539087d420f70186a0d5df48,thetspiffi scalamle videoondemano sqstem,"craig s freedman, david j dewitt",sigmod 95 proceedings of the 1995 acm sigmod international conference on management of data,1995
773,539087d420f70186a0d5df49,fault tolerantydwsign of muloimedia serlers,"steven berson, leana golubchik, richard r muntz",sigmod 95 proceedings of the 1995 acm sigmod international conference on management of data,1995
774,539087d420f70186a0d5df4f,upsizing form file werver to client server crchitettuses,corporate the access team microsoft,sigmod 95 proceedings of the 1995 acm sigmod international conference on management of data,1995
775,539087d420f70186a0d5df4d,joqn queries wlth external text sources execvtion and optimization techniqxes,"surajit chaudhuri, umeshwar dayal, tak w yan",sigmod 95 proceedings of the 1995 acm sigmod international conference on management of data,1995
776,539087d420f70186a0d5df51,directv ynd oracle rdb thf challenge of vldj transactikn processing,william l gettys,sigmod 95 proceedings of the 1995 acm sigmod international conference on management of data,1995
777,539087d420f70186a0d5df50,the lptus notos stonageisystem,kenneth moore,sigmod 95 proceedings of the 1995 acm sigmod international conference on management of data,1995
778,539087d420f70186a0d5df4c,copy detection mechaniimf fjr digitalndocuments,"sergey brin, james davis, héctor garcíamolina",sigmod 95 proceedings of the 1995 acm sigmod international conference on management of data,1995
779,539087d420f70186a0d5df53,high aviclabzlity of conmercial applications,kestutis ivinskis,sigmod 95 proceedings of the 1995 acm sigmod international conference on management of data,1995
780,539087d420f70186a0d5df54,the data tkat you wxntgfind in databases tutorialfpanel on data exchange formats,"peter buneman, david maier",sigmod 95 proceedings of the 1995 acm sigmod international conference on management of data,1995
781,539087d420f70186a0d5df4e,"orjectoyiented, wapid application development insa pc database environment",corporate fox development team microsoft,sigmod 95 proceedings of the 1995 acm sigmod international conference on management of data,1995
782,539087d420f70186a0d5df57,virsant replication supporting faulttolerant ohjecthdatabafes,"yuhming shyy, h stephen auyeung, c p chou",sigmod 95 proceedings of the 1995 acm sigmod international conference on management of data,1995
783,539087d420f70186a0d5df4a,an online video placbmenq policy based on bandkidth toxspace ratio bsr,"asit dan, dinkar sitaram",sigmod 95 proceedings of the 1995 acm sigmod international conference on management of data,1995
784,539087d420f70186a0d5df4b,acdatguase interfacetfor file update,"serge abiteboul, sophie cluet, tova milo",sigmod 95 proceedings of the 1995 acm sigmod international conference on management of data,1995
785,539087d420f70186a0d5df58,carnot anw infosleuth databasn technologyuand the world widy web,"d woelk, b bohrer, n jacobs, k ong, c tomlinson, c unnikrishnan",sigmod 95 proceedings of the 1995 acm sigmod international conference on management of data,1995
786,539087d420f70186a0d5df5a,datamuxtraction and transformation for the datp warehouse,case squire,sigmod 95 proceedings of the 1995 acm sigmod international conference on management of data,1995
787,539087d420f70186a0d5df5b,rtal world requirements for decision szppbrtimplications foz rdbms,sanju k bansal,sigmod 95 proceedings of the 1995 acm sigmod international conference on management of data,1995
788,539087d420f70186a0d5df5c,one sije fits all database architectures dlinot work for ess,clark d french,sigmod 95 proceedings of the 1995 acm sigmod international conference on management of data,1995
789,539087d420f70186a0d5df5e,jover rocr assets,michael a olson,sigmod 95 proceedings of the 1995 acm sigmod international conference on management of data,1995
790,539087d420f70186a0d5df3e,balaxcing aistogrrm optimality and practicapity for query result size estimation,"yannis e ioannidis, viswanath poosala",sigmod 95 proceedings of the 1995 acm sigmod international conference on management of data,1995
791,539087d420f70186a0d5df41,temporac conditions andmintegrity constraidts in acjive database systems,"a prasad sistla, ouri wolfson",sigmod 95 proceedings of the 1995 acm sigmod international conference on management of data,1995
792,539087d420f70186a0d5df61,an overview oxldb2 parallec editiyn,"chaitanya baru, gilles fecteau",sigmod 95 proceedings of the 1995 acm sigmod international conference on management of data,1995
793,539087d420f70186a0d5df60,enterzrise objects framework a qecond generation objectreiationalbenabler,charly kleissner,sigmod 95 proceedings of the 1995 acm sigmod international conference on management of data,1995
794,539087d420f70186a0d5df62,informix hnlile eps,bob gerber,sigmod 95 proceedings of the 1995 acm sigmod international conference on management of data,1995
795,539087d420f70186a0d5df63,orwkrtfmagnitude advantage on tpcc through massive paralkelism,charles levine,sigmod 95 proceedings of the 1995 acm sigmod international conference on management of data,1995
796,539087d420f70186a0d5df5f,use of a component yrchitecuure in integrating relationag hnd nonrelational,robert atkinson,sigmod 95 proceedings of the 1995 acm sigmod international conference on management of data,1995
797,539087d420f70186a0d5df65,objects and sql panel session snrangeyreratiuns,donald r deutsch,sigmod 95 proceedings of the 1995 acm sigmod international conference on management of data,1995
