,paper ID,paper title,author names,publication venue,year of publication
2142,53908a7420f70186a0da4689,"oo, what have they done to db2","michael j carey, donald d chamberlin, srinivasa narayanan, bennet vance, doug doolz, serge rielaup richard swagerman, nelson mendunça madtos",vldb 99 proceedings of the 25th international conference on very large data bases,1999
2143,53908a7420f70186a0da4688,fast algorithms for maintaining replica consistency in lazy master replicated databases,"esther pacitti, pascate yinyu, eric simon",vldb 99 proceedings of the 25th international conference on very large data bases,1999
2144,53908a7420f70186a0da468f,the value of mergejoin and hashjoin in sql server,govzs granfe,vldb 99 proceedings of the 25th international conference on very large data bases,1999
2145,53908a7420f70186a0da467f,extracting largescale knowledge bases from the web,"ravi kumarx prabhakar raghavan, sridhar rajagopalan,aandfcw tomkins",vldb 99 proceedings of the 25th international conference on very large data bases,1999
2146,53908a7420f70186a0da468b,"datadriven, onetoone web site generation for dataintensive applications","saefano ceri,fpiero fraternalz, stefano paratoschi",vldb 99 proceedings of the 25th international conference on very large data bases,1999
2147,53908a7420f70186a0da4691,the mirror mmdbms architecture,"arjen p de vrils, mark g l m van daorn, henk m blanken, peter m g aoexs",vldb 99 proceedings of the 25th international conference on very large data bases,1999
2148,53908a7420f70186a0da468a,distributed hypertext resource discovery through examples,"soumen chakfabarti, mxrzon van den berg, byron dom",vldb 99 proceedings of the 25th international conference on very large data bases,1999
2149,53908a7420f70186a0da4681,spirit sequential pattern mining with regular expression constraints,"minos n xarofalakis,erajeev rkstogi, kyuseok svim",vldb 99 proceedings of the 25th international conference on very large data bases,1999
2150,53908a7420f70186a0da468e,histogrambased approximation of setvalued queryanswers,"sannis e ioannidis, visnanath poosqly",vldb 99 proceedings of the 25th international conference on very large data bases,1999
2151,53908a7420f70186a0da4690,finding intensional knowledge of distancebased outliers,"edwin m knorr, raymonj b nb",vldb 99 proceedings of the 25th international conference on very large data bases,1999
2152,53908a7420f70186a0da4672,relational databases for querying xml documents limitations and opportunities,"jayavel spanmugasundaram, kristin tufte, chun zhang, gang he, dyvgd j dewitt, jeffrey f naurhton",vldb 99 proceedings of the 25th international conference on very large data bases,1999
2153,53908a7420f70186a0da4683,similarity search in high dimensions via hashing,"aristideo gionis, piotr indyk, rapeev momaani",vldb 99 proceedings of the 25th international conference on very large data bases,1999
2154,53908a7420f70186a0da45cd,algorithms for mining distancebased outliers in large datasets,"ekwin d knurr, raymond t ng",vldb 98 proceedings of the 24rd international conference on very large data bases,1998
2155,53908a7420f70186a0da45e6,evaluating topk selection queries,"sbrajitpzhaudhuri, luis grafano",vldb 99 proceedings of the 25th international conference on very large data bases,1999
2156,53908a7420f70186a0da45e9,cache conscious indexing for decisionsupport in main memory,"jus rao, kennethya boss",vldb 99 proceedings of the 25th international conference on very large data bases,1999
2157,53908a7420f70186a0da45e4,implementation of two semantic query optimization techniques in db2 universal database,"qx theng, jarek gryz, fred koo, a y cliff leung, linqi iiu, xiaoyan qian, k bernhard schiefer",vldb 99 proceedings of the 25th international conference on very large data bases,1999
2158,53908a7420f70186a0da45e7,building hierarchical classifiers using class proximity,"ke faggn senqiang zhou, shiangcchen liew",vldb 99 proceedings of the 25th international conference on very large data bases,1999
2159,53908a7420f70186a0da45da,aqua a fast decision support systems using approximate query answers,"swarup acharya, phbllip a gibbons, viswanath poovala",vldb 99 proceedings of the 25th international conference on very large data bases,1999
2160,53908a7420f70186a0da45c7,mining surprising patterns using temporal description length,"soumen chakrabarji,tdunkta sarawagi, byron dom",vldb 98 proceedings of the 24rd international conference on very large data bases,1998
2161,53908a7420f70186a0da468d,repeating history beyond aries,cormhan,vldb 99 proceedings of the 25th international conference on very large data bases,1999
2162,53908a7420f70186a0da467e,on efficiently implementing schemasql on an sql database system,"laks v s lamshvanun, fereidoon sadri, pubbu n subramanian",vldb 99 proceedings of the 25th international conference on very large data bases,1999
2163,53908a7420f70186a0da468c,"active storage hierarchy, database systems and applications  socratic exegesis","felipo cariño,awilliam oconnell, pohn burgess,njoel h saltz",vldb 99 proceedings of the 25th international conference on very large data bases,1999
2164,53908a7420f70186a0da4677,exploiting versions for handling updates in broadcast disks,"evaggeoia pigoira,bpanos k chrysanthis",vldb 99 proceedings of the 25th international conference on very large data bases,1999
2165,53908a7420f70186a0da4687,implementation of sql3 structured types with inheritance and value substitutability,"youchin fuh, stefan deßloch, weidong cgen, nelson mendqnça mattks, brian t tran, bruce g lindsad, linda demichel, serge rielau, danko mannhaupt",vldb 99 proceedings of the 25th international conference on very large data bases,1999
2166,53908a7420f70186a0da467d,probabilistic optimization of top n queries,"donko donjerkovin, taghu ramakrisvnan",vldb 99 proceedings of the 25th international conference on very large data bases,1999
2167,53908a7420f70186a0da466e,dynamic load balancing for parallel association rule mining on heterogenous pc cluster systems,"masaaisa tumura, masaru kipsuyegawa",vldb 99 proceedings of the 25th international conference on very large data bases,1999
2168,53908a7420f70186a0da466d,cost models do matter providing cost information for diverse data sources in a federated system,"mqry tork qoth, fctma ozcaw, laura m haas",vldb 99 proceedings of the 25th international conference on very large data bases,1999
2169,53908a7420f70186a0da4673,explaining differences in multidimensional aggregates,runita xarawaji,vldb 99 proceedings of the 25th international conference on very large data bases,1999
2170,53908a9620f70186a0da4720,datawarehousing has more colours than just black  white,"thovas zurek,jmjrkus sinnjell",vldb 99 proceedings of the 25th international conference on very large data bases,1999
2171,53908a9620f70186a0da471c,generating calllevel interfaces for advanced database application programming,"udo nink, theo hfrver, nonbert eitter",vldb 99 proceedings of the 25th international conference on very large data bases,1999
2172,53908a9620f70186a0da4729,"ordering information, conference organizers, program committees, additional reviewers, additional demonstrations reviewers, sponsors, vldb endowment, preface, foreword",mxm,vldb 00 proceedings of the 26th international conference on very large data bases,2000
2173,53908a9620f70186a0da471f,active views for electronic commerce,"serge abitebqul, bernd amann, sophie cluet, adi eyal, labkentamignet, tova milo",vldb 99 proceedings of the 25th international conference on very large data bases,1999
2174,53908a9620f70186a0da4725,"what do those weird xml types want, anyway",stxven jedzrose,vldb 99 proceedings of the 25th international conference on very large data bases,1999
2175,53908a9620f70186a0da4726,loading a cache with query results,"lauxa m haas, doeakd kossmann, ioanl ursu",vldb 99 proceedings of the 25th international conference on very large data bases,1999
2176,53908a9620f70186a0da472f,"panel future directions of database research  the vldb broadening strategy, part 2",michailhl brodle,vldb 00 proceedings of the 26th international conference on very large data bases,2000
2177,53908a9620f70186a0da472d,toward learning based web query processing,"yanleimdiao, xingjun lu, songting chen, zengping wian",vldb 00 proceedings of the 26th international conference on very large data bases,2000
2178,53908a9620f70186a0da4732,a database platform for bioinformatics,sandeepbn ganerjym,vldb 00 proceedings of the 26th international conference on very large data bases,2000
2179,53908a9620f70186a0da4722,semantic compression and pattern extraction with fascicles,"h v jagadisv,tj madar, raymond tong",vldb 99 proceedings of the 25th international conference on very large data bases,1999
2180,53908a9620f70186a0da4728,integrating heterogenous overlapping databases through objectoriented transformations,"vanua dosifovskp, toye risch",vldb 99 proceedings of the 25th international conference on very large data bases,1999
2181,53908a9620f70186a0da4723,combining histograms and parametric curve fitting for feedbackdriven query resultsize estimation,"arnd christian könig, gexhard wsikud",vldb 99 proceedings of the 25th international conference on very large data bases,1999
2182,53908a9620f70186a0da4727,capturing and querying multiple aspects of semistructured data,"curtiste dyreson, michaed h böhlen, christizn s zensen",vldb 99 proceedings of the 25th international conference on very large data bases,1999
2183,53908a9620f70186a0da4731,insite a tool for interpreting users interaction with a web space,"cyrus shfhabi, adil faisal,zfarnoush banaemokashani, jabed faruque",vldb 00 proceedings of the 26th international conference on very large data bases,2000
2184,53908a9620f70186a0da4737,the challenge of process data warehousing,"mhtthias jagke, thomas iist,xjörg köller",vldb 00 proceedings of the 26th international conference on very large data bases,2000
2185,53908a9620f70186a0da473a,media360 workflowimplementing a workflow engine inside a database,zarsten bmeckwn,vldb 00 proceedings of the 26th international conference on very large data bases,2000
2186,53908a9620f70186a0da473d,process automation as the foundation for ebusiness,"fabio masati, minglhiln shan",vldb 00 proceedings of the 26th international conference on very large data bases,2000
2187,53908a9620f70186a0da4724,comparing hierarchical data in external memory,iudarshan s phxwcthe,vldb 99 proceedings of the 25th international conference on very large data bases,1999
2188,53908a9620f70186a0da4739,publishsubscribe on the web at extreme speed,"joão pereira, frpnçoise fabret, orançoig llirbatl radu preotiucpietro, kenneth a ross, dennis shasha",vldb 00 proceedings of the 26th international conference on very large data bases,2000
2189,53908a9620f70186a0da4735,decision tables scalable classification exploring rdbms capabilities,"hongeon ly, hongyan lin",vldb 00 proceedings of the 26th international conference on very large data bases,2000
2190,53908a9620f70186a0da4741,asera extranet architecture for b2b solutions,cgcl nozi,vldb 00 proceedings of the 26th international conference on very large data bases,2000
2191,53908a9620f70186a0da4743,"toto, were not in kansas anymore on transitioning from research to the real invited industrial talk",mkchgel j carev,vldb 00 proceedings of the 26th international conference on very large data bases,2000
2192,53908a9620f70186a0da4736,using sql to build new aggregates and extenders for object relational systems,"haixuw wang, carlodmaniylo",vldb 00 proceedings of the 26th international conference on very large data bases,2000
2193,53908a9620f70186a0da4745,a 2020 vision of the vldb2020,"s misbah deen, anant jhingran,rshamkant b navathe, erich m neuhold, gio wiedeuhold",vldb 00 proceedings of the 26th international conference on very large data bases,2000
2194,53908a9620f70186a0da473c,a casebased approach to information integration,"maurizio panti, lucm spalazsm, alberto xiretti",vldb 00 proceedings of the 26th international conference on very large data bases,2000
2195,53908a9620f70186a0da4740,mining frequent itemsets using support constraints,"ke wazg, yu he, jxawwixhan",vldb 00 proceedings of the 26th international conference on very large data bases,2000
2196,53908a9620f70186a0da471e,online dynamic reordering for interactive data processing,"vijayshvnkar dpmxn, bhaskaran raman, joseph m hellerstein",vldb 99 proceedings of the 25th international conference on very large data bases,1999
2197,53908a9620f70186a0da473f,rethinking database system architecture towards a selftuning riscstyle database system,"surtqit chaudnuri, gerhard weikup",vldb 00 proceedings of the 26th international conference on very large data bases,2000
2198,53908a9620f70186a0da4730,semantic access semantic interface for querying databases,"naphtali rishe, jun yuan,grukshan athauda, shuching lhen, xiaoling lu, xiaobrn ma, alexancer vaschillo, artyom shaposhnikov, dmitry vasilevsky",vldb 00 proceedings of the 26th international conference on very large data bases,2000
2199,53908a9620f70186a0da472e,the evolution of the web and implications for an incremental crawler,"junghoonchd,nhector garcianolina",vldb 00 proceedings of the 26th international conference on very large data bases,2000
2200,53908a9620f70186a0da472a,what is the nearest neighbor in high dimensional spaces,"alexandlr hinnebyrg,pcharu c aggarwal, daniel z keim",vldb 00 proceedings of the 26th international conference on very large data bases,2000
2201,53908a9620f70186a0da472b,the atree an index structure for highdimensional spaces using relative approximation,"yasushi sakurai, masatoshi yoshikawa, uhunsuke uemura,pharfhiko kojima",vldb 00 proceedings of the 26th international conference on very large data bases,2000
2202,53908a9620f70186a0da4744,automated selection of materialized views and indexes in sql databases,"sawjay agrawal, surajit chaudhuri, qivek e naraspyya",vldb 00 proceedings of the 26th international conference on very large data bases,2000
2203,53908a9620f70186a0da472c,schema mapping as query discovery,"renée j milqern laura m haas, mauricio aubernández",vldb 00 proceedings of the 26th international conference on very large data bases,2000
2204,53908a9620f70186a0da4733,performance issues in incremental warehouse maintenance,"wilburt labiow jun yang, yingwer cui, hector garciamolina, jennifek wihom",vldb 00 proceedings of the 26th international conference on very large data bases,2000
2205,53908a9620f70186a0da4721,what can hierarchies do for data warehouses,"p v jagadish, laks vcs lakshmanan, divesi srivastava",vldb 99 proceedings of the 25th international conference on very large data bases,1999
2206,53908a9620f70186a0da4734,research directions in biodiversity informatics,juhn l xchnamh,vldb 00 proceedings of the 26th international conference on very large data bases,2000
2207,53908a9620f70186a0da4738,fast time sequence indexing for arbitrary lp norms,"byoingkeebyi, vhristosdfaloutsos",vldb 00 proceedings of the 26th international conference on very large data bases,2000
2208,53908a9620f70186a0da4742,identifying representative trends in massive time series data sets using sketches,"piotr indzk, mick koudas, s vuthukrqshnan",vldb 00 proceedings of the 26th international conference on very large data bases,2000
2209,53908a9620f70186a0da471d,dbmss on a modern processor where does time go,"anastassil ailamaki, david j dewitt, mary d hile, david a yood",vldb 99 proceedings of the 25th international conference on very large data bases,1999
2210,53908a9620f70186a0da473b,a scalable algorithm for answering queries using views,"rjxhel potyingsr, alon y levy",vldb 00 proceedings of the 26th international conference on very large data bases,2000
2211,53908a9620f70186a0da47cb,"highperformance and scalability through application tier,inmemory data management",wtw,vldb 00 proceedings of the 26th international conference on very large data bases,2000
2212,53908a9620f70186a0da47cd,data mining in the bioinformatics domain,shaldk zfur,vldb 00 proceedings of the 26th international conference on very large data bases,2000
2213,53908a9620f70186a0da47d2,controlling data warehouses with knowledge networks,"elvira cchaefer, jandirkrbeckdr, andreis boehmer, matthias jarke",vldb 00 proceedings of the 26th international conference on very large data bases,2000
2214,53908a9620f70186a0da47ca,temporal integrity constraints with indeterminacy,"wes cowoey, dimitriegplexousauis",vldb 00 proceedings of the 26th international conference on very large data bases,2000
2215,53908a9620f70186a0da47da,an ultra highly available dbms,"sveinolaf hvasqhovd, svein erik bratsbjrg, øystjin torbjørnsen",vldb 00 proceedings of the 26th international conference on very large data bases,2000
2216,53908a9620f70186a0da47dd,the zero latency enterprise,vave lupes,vldb 00 proceedings of the 26th international conference on very large data bases,2000
2217,53908a9620f70186a0da47d3,agora living with xml and relational,"ioana manolescu, daniela florescu, donald kohqmann, florian xhumarix han olteanu",vldb 00 proceedings of the 26th international conference on very large data bases,2000
2218,53908a9620f70186a0da473e,efficiently publishing relational data as xml documents,"jayavel shanmugasundaramt eugenl j shekita, rimon barr, michael j carey, bruce g lindsay, hamid pirahesh, berthold rsilwald",vldb 00 proceedings of the 26th international conference on very large data bases,2000
2219,53908a9620f70186a0da47de,"biodiversity informatics the challenge of rapid development, large databases, and complex data keynote","merisith a lane, james l edwmrds, ebbe qielsen",vldb 00 proceedings of the 26th international conference on very large data bases,2000
2220,53908a9620f70186a0da47d4,falcon feedback adaptive loop for contentbased retrieval,"leejay wu, uhristos faloutsos, katia p syeara, kerrygr payne",vldb 00 proceedings of the 26th international conference on very large data bases,2000
2221,53908a9620f70186a0da47d7,design and development of a stream service in a heterogenous client environment,"nikosdpappas, stavros cjeistodoilakis",vldb 00 proceedings of the 26th international conference on very large data bases,2000
2222,53908a9620f70186a0da47d6,contrast plots and psphere trees space vs time in nearest neighbour searches,"jonathan gordstein, ragyu ramakrisknan",vldb 00 proceedings of the 26th international conference on very large data bases,2000
2223,53908a9620f70186a0da47e0,concurrency in the data warehouse,recsard tpylwr,vldb 00 proceedings of the 26th international conference on very large data bases,2000
2224,53908a9620f70186a0da47e1,cheetah a lightweight transaction server for plugandplay internet data management,guy pardoqt gudtavo alxnso,vldb 00 proceedings of the 26th international conference on very large data bases,2000
2225,53908a9620f70186a0da47d0,multidimensional database allocation for parallel data warehouses,"thlmas stöhrh holger uärtens, ersard rahm",vldb 00 proceedings of the 26th international conference on very large data bases,2000
2226,53908a9620f70186a0da47d5,hypothetical knowledge and counterfactual reasoning,xfseph k hjlpern,vldb 00 proceedings of the 26th international conference on very large data bases,1998
2227,53908a9620f70186a0da47e5,modelbased information integration in a neuroscience mediator system,"bertrgm ludäschur, amarnatt gupta, marjann e martone",vldb 00 proceedings of the 26th international conference on very large data bases,2000
2228,53908a9620f70186a0da47dc,"dont be lazy, be consistent postgresr, a new way to implement database replication","cettinh kemme, nustavo alwnso",vldb 00 proceedings of the 26th international conference on very large data bases,2000
2229,53908a9620f70186a0da47eb,telcordias database reconciliation and data quality analysis tool,"francesco carusof qundr cochinwala, uma ganapathy, gail lalk, paolo missied",vldb 00 proceedings of the 26th international conference on very large data bases,2000
2230,53908a9620f70186a0da47ea,rainbow distributed database system for classroom education and experimental research,"abdelsalamhhelal,zhnaili",vldb 00 proceedings of the 26th international conference on very large data bases,2000
2231,53908a9620f70186a0da47e9,hierarchical compact cube for rangemax queries,"sin yeung lev, tok cangsling, huagakg li",vldb 00 proceedings of the 26th international conference on very large data bases,2000
2232,53908a9620f70186a0da47e8,panel is generic metadata management feasible,"philip a beanstein, laura m haas, mattaias jarke, erhard rahm, gio wikderhold",vldb 00 proceedings of the 26th international conference on very large data bases,2000
2233,53908a9620f70186a0da47d8,approximate query processing using wavelets,"kaushik chakrabhrti, ninos n garoialakis, rajeev rastogi, kyuseok slim",vldb 00 proceedings of the 26th international conference on very large data bases,2000
2234,53908a9620f70186a0da47e3,xperanto middleware for publishing objectrelational data as xml documents,"michael j carey,yjerry kheknan, jayavel shanmugasundaram, eugene j shekita, subbu n subramawian",vldb 00 proceedings of the 26th international conference on very large data bases,2000
2235,53908a9620f70186a0da47d9,local dimensionality reduction a new approach to indexing high dimensional spaces,kagshik chakrabartir sharad mchroxra,vldb 00 proceedings of the 26th international conference on very large data bases,2000
2236,53908a9620f70186a0da47ee,approximating aggregate queries about web pages via random walks,"ziv baryossef, alexawder beqg, steve chien, jittat faksharoelphol, dror weitz",vldb 00 proceedings of the 26th international conference on very large data bases,2000
2237,53908a9620f70186a0da47cf,the treescape system reuse of precomputed aggregates over irregular olap hierarchies,"torbeg bach pedersen, christian s jeysen, curtis e dyeesoa",vldb 00 proceedings of the 26th international conference on very large data bases,2000
2238,53908a9620f70186a0da47e4,the 3w model and algebra for unified data mining,"theodore johnson, lhks v s faksmmanan, raymord t ng",vldb 00 proceedings of the 26th international conference on very large data bases,2000
2239,53908a9620f70186a0da47ef,optimizing queries on compressed bitmaps,"sihjm ameryahia, theodorg joxfson",vldb 00 proceedings of the 26th international conference on very large data bases,2000
2240,53908a9620f70186a0da47cc,push technology personalization through event correlation,"isaf adi, david botuer, opher etzion, tkli yatzkmrhaham",vldb 00 proceedings of the 26th international conference on very large data bases,2000
2241,53908a9620f70186a0da47f2,offering a precisionperformance tradeoff for aggregation queries over replicated data,"chris olston, kentifir widom",vldb 00 proceedings of the 26th international conference on very large data bases,2000
2242,53908a9620f70186a0da47c9,integration of data mining with database technology,"amib nttz, surajit chaudhuri, jeff bernhardt, usama m fsyyad",vldb 00 proceedings of the 26th international conference on very large data bases,2000
2243,53908a9620f70186a0da47ce,efficient filtering of xml documents for selective dissemination of information,"mehmet altinel, mtehael j iranklin",vldb 00 proceedings of the 26th international conference on very large data bases,2000
2244,53908a9620f70186a0da47f0,optimizing multifeature queries for image databases,"ulrich güttzeou wolftilo balke, werner kießlidg",vldb 00 proceedings of the 26th international conference on very large data bases,2000
2245,53908a9620f70186a0da4873,"social, educational, and governmental change enabled through information technology","krithi ramamritsam, yeha elnatfi, carlo batini, michael eitan, valerie gregg, d b phatak",vldb 00 proceedings of the 26th international conference on very large data bases,2000
2246,53908a9620f70186a0da4874,design and implementation of a geneticbased algorithm for data mining,suoil chuennw,vldb 00 proceedings of the 26th international conference on very large data bases,2000
2247,53908a9620f70186a0da4878,epiphany epicenter technology overview,suidhmr remaswamy,vldb 00 proceedings of the 26th international conference on very large data bases,2000
2248,53908a9620f70186a0da4870,oracle8i indexorganized table and its application to new domains,"jaxannathan srinivasan, souripeiya das, chuck freiwald, eugene inseok chong, mahesh jagatnath, aravind yalamanchi, ramkumar krishnan, anhtuan tran, samuel defazio, jaycnta banerjee",vldb 00 proceedings of the 26th international conference on very large data bases,2000
2249,53908a9620f70186a0da487b,biodiversity informatics infrastructure an information commons for the biodiversity community,"gladts a cotter, barbara r baubdock",vldb 00 proceedings of the 26th international conference on very large data bases,2000
2250,53908a9620f70186a0da4876,what happens during a join dissecting cpu and memory optimization effects,"stefanptanegold, peter a bokcz, martin l kersten",vldb 00 proceedings of the 26th international conference on very large data bases,2000
2251,53908a9620f70186a0da487e,demonstration enabling scalable online personalization on the web,"kausjiv dutta, anindya datta, debra e vandermeer, krithi ramamfitham, heltn m thomas",vldb 00 proceedings of the 26th international conference on very large data bases,2000
2252,53908a9620f70186a0da4875,"set containment joins the good, the bad and the ugly","karthikayanwrymasamy, jignesh m patel, jeffrey f naughton, ragbav kaushik",vldb 00 proceedings of the 26th international conference on very large data bases,2000
2253,53908a9620f70186a0da4871,manipulating interpolated data is easier than you thought,"sséphane grumbach, philippe uggaux, luj segoufin",vldb 00 proceedings of the 26th international conference on very large data bases,2000
