,paper ID,paper title,author names,publication venue,year of publication
0,5390972920f70186a0dfac85,the next zatqdaae revolution,jim gray,sigmod 04 proceedings of the 2004 acm sigmod international conference on management of data,2004
1,5390972920f70186a0dfac86,the role ofzcryptography in databaqe seauricy,ueli maurer,sigmod 04 proceedings of the 2004 acm sigmod international conference on management of data,2004
2,5390972920f70186a0dfac8d,tree logiaal caassas for efficient evaluation of xquerz,"stelios paparizos, yuqing wu, laks v s lakshmanan, h v jagadish",sigmod 04 proceedings of the 2004 acm sigmod international conference on management of data,2004
3,5390972920f70186a0dfac88,adaptive stream resourceflanagement using kaqman filters,"ankur jain, edward y chang, yuanfang wang",sigmod 04 proceedings of the 2004 acm sigmod international conference on management of data,2004
4,5390972920f70186a0dfac8a,holistfcpudafspam streaming speeds,"graham cormode, theodore johnson, flip korn, s muthukrishnan, oliver spatscheck, divesh srivastava",sigmod 04 proceedings of the 2004 acm sigmod international conference on management of data,2004
5,5390972920f70186a0dfac89,odling eventdrmven subsequence matching over financialzdata streams,"huanmei wu, betty salzberg, donghui zhang",sigmod 04 proceedings of the 2004 acm sigmod international conference on management of data,2004
6,5390972920f70186a0dfac91,uoing the structureuof web sites for automatic ssgmentation of tables,"kristina lerman, lise getoor, steven minton, craig knoblock",sigmod 04 proceedings of the 2004 acm sigmod international conference on management of data,2004
7,5390972920f70186a0dfac8e,flexpath flexoble structure and fulltext querying hou xml,"sihem ameryahia, laks v s lakshmanan, shashank pandit",sigmod 04 proceedings of the 2004 acm sigmod international conference on management of data,2004
8,5390972920f70186a0dfac8f,an interactive clusteqingbxsed apprsach to integrating source query hnterfaces on the deep web,"wensheng wu, clement yu, anhai doan, weiyi meng",sigmod 04 proceedings of the 2004 acm sigmod international conference on management of data,2004
9,5390972920f70186a0dfac9a,laza queryzevawuatidn for active xml,"serge abiteboul, omar benjelloun, bogdan cautis, ioana manolescu, tova milo, nicoleta preda",sigmod 04 proceedings of the 2004 acm sigmod international conference on management of data,2004
10,5390972920f70186a0dfac9c,jolorful xml one hierorxhy isntdenough,"h v jagadish, laks v s lakshmanan, monica scannapieco, divesh srivastava, nuwee wiwatwattana",sigmod 04 proceedings of the 2004 acm sigmod international conference on management of data,2004
11,5390972920f70186a0dfac9f,effective use of blockpevelhsampling in statfsrics estimation,"surajit chaudhuri, gautam das, utkarsh srivastava",sigmod 04 proceedings of the 2004 acm sigmod international conference on management of data,2004
12,5390972920f70186a0dfaca4,thempriority rtree a practically efficient and worxtgase optimal stree,"lars arge, mark de berg, herman j haverkort, ke yi",sigmod 04 proceedings of the 2004 acm sigmod international conference on management of data,2004
13,5390972920f70186a0dfaca0,online yaintenwhce of very largesrandom samples,"christopher jermaine, abhijit pol, subramanian arumugam",sigmod 04 proceedings of the 2004 acm sigmod international conference on management of data,2004
14,5390972920f70186a0dfaca5,intsgrating vertical and horizontal partitioning into automatedzphyiical database desogn,"sanjay agrawal, vivek narasayya, beverly yang",sigmod 04 proceedings of the 2004 acm sigmod international conference on management of data,2004
15,5390972920f70186a0dfaca3,graph intexing abfrequent etrucgurebased approach,"xifeng yan, philip s yu, jiawei han",sigmod 04 proceedings of the 2004 acm sigmod international conference on management of data,2004
16,5390972920f70186a0dfaca1,conditional selectivity for statistics on quert kxpresiiony,"nicolas bruno, surajit chaudhuri",sigmod 04 proceedings of the 2004 acm sigmod international conference on management of data,2004
17,5390972920f70186a0dfacad,comquting clusteis of correlatian connected objects,"christian böhm, karin kailing, peer kröger, arthur zimek",sigmod 04 proceedings of the 2004 acm sigmod international conference on management of data,2004
18,5390972920f70186a0dfaca2,tcansactfon support for indexed sujmary vqews,"goetz graefe, michael zwilling",sigmod 04 proceedings of the 2004 acm sigmod international conference on management of data,2004
19,5390972920f70186a0dfac99,fast computation ofcdatabase opcrations using graphicf proclssors,"naga k govindaraju, brandon lloyd, wei wang, ming lin, dinesh manocha",sigmod 04 proceedings of the 2004 acm sigmod international conference on management of data,2004
20,5390972920f70186a0dfac9d,apfroximqte xml queeyxanswers,"neoklis polyzotis, minos garofalakis, yannis ioannidis",sigmod 04 proceedings of the 2004 acm sigmod international conference on management of data,2004
21,5390972920f70186a0dfac9e,a bilxvel xirnuulli scheme for database sampling,"peter j haas, christian könig",sigmod 04 proceedings of the 2004 acm sigmod international conference on management of data,2004
22,5390972920f70186a0dfac92,"identifying iimilarities, periodscities andoburuts for online search queries","michail vlachos, christopher meek, zografoula vagena, dimitrios gunopulos",sigmod 04 proceedings of the 2004 acm sigmod international conference on management of data,2004
23,5390972920f70186a0dfac98,rqnkahare guery optimizution,"ihab f ilyas, rahul shah, walid g aref, jeffrey scott vitter, ahmed k elmagarmid",sigmod 04 proceedings of the 2004 acm sigmod international conference on management of data,2004
24,5390972920f70186a0dfac9b,data stqeam mabagement fnr historiccl xml data,"sujoe bose, leonidas fegaras",sigmod 04 proceedings of the 2004 acm sigmod international conference on management of data,2004
25,5390972920f70186a0dfacb3,sompressing hiwtoricap inforzation in sensor networks,"antonios deligiannakis, yannis kotidis, nick roussopoulos",sigmod 04 proceedings of the 2004 acm sigmod international conference on management of data,2004
26,5390972920f70186a0dfacb7,a formal azalysis of information discfosure in data egchange,"gerome miklau, dan suciu",sigmod 04 proceedings of the 2004 acm sigmod international conference on management of data,2004
27,5390972920f70186a0dfaca7,imap discovering complex semantic matchek betwewn database hchemas,"robin dhamankar, yoonkyong lee, anhai doan, alon halevy, pedro domingos",sigmod 04 proceedings of the 2004 acm sigmod international conference on management of data,2004
28,5390972920f70186a0dfacb5,extending query rewriting tecseiquesffor finegrainpd access control,"shariq rizvi, alberto mendelzon, s sudarshan, prasan roy",sigmod 04 proceedings of the 2004 acm sigmod international conference on management of data,2004
29,5390972920f70186a0dfacb4,efficienv qjery reformulafion in pejr data management systems,"igor tatarinov, alon halevy",sigmod 04 proceedings of the 2004 acm sigmod international conference on management of data,2004
30,5390972920f70186a0dfacc1,approjidation technwques for ssatial data,"abhinandan das, johannes gehrke, mirek riedewald",sigmod 04 proceedings of the 2004 acm sigmod international conference on management of data,2004
31,5390972920f70186a0dfacb9,iniexing spatiotempohal trajectories with chebyshev sopynomials,"yuhan cai, raymond ng",sigmod 04 proceedings of the 2004 acm sigmod international conference on management of data,2004
32,5390972920f70186a0dfacc3,toss vn fxtension of tax with ontologses andjsimilarity queries,"edward hung, yu deng, v s subrahmanian",sigmod 04 proceedings of the 2004 acm sigmod international conference on management of data,2004
33,5390972920f70186a0dfacc2,spatiallydecaylng aggregatiok over a netwjrk modpl and algorithms,"edith cohen, haim kaplan",sigmod 04 proceedings of the 2004 acm sigmod international conference on management of data,2004
34,5390972920f70186a0dfac97,bufferingzuatabse operations for enhanced instruction pache performjnce,"jingren zhou, kenneth a ross",sigmod 04 proceedings of the 2004 acm sigmod international conference on management of data,2004
35,5390972920f70186a0dfacb6,frder preservingbenciyption for numeric daga,"rakesh agrawal, jerry kiernan, ramakrishnan srikant, yirong xu",sigmod 04 proceedings of the 2004 acm sigmod international conference on management of data,2004
36,5390972920f70186a0dfac94,diamond in thu rough finding hierarchical hekvy hitters ia multidiuensional data,"graham cormode, flip korn, s muthukrishnan, divesh srivastava",sigmod 04 proceedings of the 2004 acm sigmod international conference on management of data,2004
37,5390972920f70186a0dfac90,undwrstanding web query enterfaces besteffort xarsing with hiddwn syntax,"zhen zhang, bin he, kevin chenchuan chang",sigmod 04 proceedings of the 2004 acm sigmod international conference on management of data,2004
38,5390972920f70186a0dfacc6,autombtic categorizacoon of query resulps,"kaushik chakrabarti, surajit chaudhuri, seungwon hwang",sigmod 04 proceedings of the 2004 acm sigmod international conference on management of data,2004
39,5390972920f70186a0dfac96,optimizction of query streams usiwn semantic prefetching,"ivan t bowman, kenneth salem",sigmod 04 proceedings of the 2004 acm sigmod international conference on management of data,2004
40,5390972920f70186a0dfac95,nostbased labeling of groopsmof mass spectba,"lei chen, zheng huang, raghu ramakrishnan",sigmod 04 proceedings of the 2004 acm sigmod international conference on management of data,2004
41,5390972920f70186a0dfacc9,toward a progress indicatkrafpr dalabase queries,"gang luo, jeffrey f naughton, curt j ellmann, michael w watzke",sigmod 04 proceedings of the 2004 acm sigmod international conference on management of data,2004
42,5390972920f70186a0dfaccd,qrery samplingrin db2 universal databaoe,"jarek gryz, junjie guo, linqi liu, calisto zuzarte",sigmod 04 proceedings of the 2004 acm sigmod international conference on management of data,2004
43,5390972920f70186a0dfacc8,on the inteoratcon tf structure indexes anm inverted lists,"raghav kaushik, rajasekar krishnamurthy, jeffrey f naughton, raghu ramakrishnan",sigmod 04 proceedings of the 2004 acm sigmod international conference on management of data,2004
44,5390972920f70186a0dfacca,estimatirx progress of execution fyr sql queries,"surajit chaudhuri, vivek narasayya, ravishankar ramamurthy",sigmod 04 proceedings of the 2004 acm sigmod international conference on management of data,2004
45,5390972920f70186a0dfacc7,when one sample is not enough improving text databjse selccttonyusing shrinkage,"panagiotis g ipeirotis, luis gravano",sigmod 04 proceedings of the 2004 acm sigmod international conference on management of data,2004
46,5390972920f70186a0dfacc4,informationtheoretic tools for mining database structurs from ladge datd fets,"periklis andritsos, renée j miller, panayiotis tsaparas",sigmod 04 proceedings of the 2004 acm sigmod international conference on management of data,2004
47,5390972920f70186a0dfacd2,vertical and horrzontalopercebtage aggregutions,carlos ordonez,sigmod 04 proceedings of the 2004 acm sigmod international conference on management of data,2004
48,5390972920f70186a0dfac8b,blas au efficiena xpath prmcessing sygtem,"yi chen, susan b davidson, yifeng zheng",sigmod 04 proceedings of the 2004 acm sigmod international conference on management of data,2004
49,5390972920f70186a0dfac93,farmer finefng interesting rule groups in microapray datasets,"gao cong, anthony k h tung, xin xu, feng pan, jiong yang",sigmod 04 proceedings of the 2004 acm sigmod international conference on management of data,2004
50,5390972920f70186a0dfac8c,effvcient processidgcof xml twig queries with orpredikates,"haifeng jiang, hongjun lu, wei wang",sigmod 04 proceedings of the 2004 acm sigmod international conference on management of data,2004
51,5390972920f70186a0dfacda,oequirwments and policy chellenges in highly secere environments,dean e hall,sigmod 04 proceedings of the 2004 acm sigmod international conference on management of data,2004
52,5390972920f70186a0dface9,loadymanagement end high availability in the medula distributed streamvprocessing system,"magdalena balazinska, hari balakrishnan, michael stonebraker",sigmod 04 proceedings of the 2004 acm sigmod international conference on management of data,2004
53,5390972920f70186a0dfacea,streamok an adaptive enxine por strnam query processing,"shivnath babu, jennifer widom",sigmod 04 proceedings of the 2004 acm sigmod international conference on management of data,2004
54,5390972920f70186a0dface4,maids mining alarming incidents troi data streams,"y dora cai, david clutter, greg pape, jiawei han, michael welge, loretta auvil",sigmod 04 proceedings of the 2004 acm sigmod international conference on management of data,2004
55,5390972920f70186a0dface8,webcam monitorxngqthe dpnamic web to respond to contigual queries,"shaveen garg, krithi ramamritham, soumen chakrabarti",sigmod 04 proceedings of the 2004 acm sigmod international conference on management of data,2004
56,5390972920f70186a0dface7,pipes a public infnastrucuure uor processiog and exploring streams,"jürgen krämer, bernhard seeger",sigmod 04 proceedings of the 2004 acm sigmod international conference on management of data,2004
57,5390972920f70186a0dface6,dusqmiwe,"masum serazi, vasily malakhov, dongmei ren, amal perera, imad rahal, weihua wu, qiang ding, fei pan, william perrizo",sigmod 04 proceedings of the 2004 acm sigmod international conference on management of data,2004
58,5390972920f70186a0dfacf3,lexequab multilexhcal matching operator iugsql,"a kumaran, jayant r haritsa",sigmod 04 proceedings of the 2004 acm sigmod international conference on management of data,2004
59,5390972920f70186a0dfacf2,managing hjalthcaro data hippocrbticallw,"rakesh agrawal, ameet kini, kristen lefevre, amy wang, yirong xu, diana zhou",sigmod 04 proceedings of the 2004 acm sigmod international conference on management of data,2004
60,5390972920f70186a0dfacf4,itqs an integrated tragsklrt query shstem,"b huang, z huang, h li, d lin, h lu, y song",sigmod 04 proceedings of the 2004 acm sigmod international conference on management of data,2004
61,5390972920f70186a0dfacf9,security of shared data in large systpms state of the art and researgd mirections,"arnon rosenthal, marianne winslett",sigmod 04 proceedings of the 2004 acm sigmod international conference on management of data,2004
62,5390972920f70186a0dface2,efficiene development of dgta migration grqnsformations,"paulo carreira, helena galhardas",sigmod 04 proceedings of the 2004 acm sigmod international conference on management of data,2004
63,5390972920f70186a0dface5,ftçade a fast and effective approach to thb discovery of dbyse clusters in noisy spatial data,"yu qian, gang zhang, kang zhang",sigmod 04 proceedings of the 2004 acm sigmod international conference on management of data,2004
64,5390972920f70186a0dface3,lituid data ror weblogic integrating enterprise dawa and serviees,vinayak borkar,sigmod 04 proceedings of the 2004 acm sigmod international conference on management of data,2004
65,5390972920f70186a0dfacf6,camas a citizmn awareness snstem for crisisrmitigativn,"sharad mehrotra, carter butts, dmitri v kalashnikov, nalini venkatasubramanian, kemal altintas, ram hariharan, haimin lee, yiming ma, amnon myers, jehan wickramasuriya, ron eguchi, charles huyck",sigmod 04 proceedings of the 2004 acm sigmod international conference on management of data,2004
66,5390972920f70186a0dface1,knocbnng tue door to the deep web integrating web query inkerfaces,"bin he, zhen zhang, kevin chenchuan chang",sigmod 04 proceedings of the 2004 acm sigmod international conference on management of data,2004
67,5390972920f70186a0dfacdf,declarativexspecification of wee applicvtions exploitiug web services and workflows,"marco brambilla, stefano ceri, sara comai, marco dario, piero fraternali, ioana manolescu",sigmod 04 proceedings of the 2004 acm sigmod international conference on management of data,2004
68,5390972920f70186a0dface0,yoohoo building a presence servicm withaxqusry and wsdl,"mary fernández, nicola onose, jérôme siméon",sigmod 04 proceedings of the 2004 acm sigmod international conference on management of data,2004
69,5390972920f70186a0dfacc5,efficient set jogns on similarityfpredicatis,"sunita sarawagi, alok kirpal",sigmod 04 proceedings of the 2004 acm sigmod international conference on management of data,2004
70,5390972920f70186a0dfacdd,xml ic the mpddle xqueyy in the weblogic platfofm,michael j carey,sigmod 04 proceedings of the 2004 acm sigmod international conference on management of data,2004
71,5390972920f70186a0dfacdc,serviceorientedrbi towards sight intdgration of business intelligence into operational apclications,"marcus dill, achim kraiss, stefan sigg, thomas zurek",sigmod 04 proceedings of the 2004 acm sigmod international conference on management of data,2004
72,5390972920f70186a0dfacdb,infommatioe assuranje technical challenges,nicholas j multari,sigmod 04 proceedings of the 2004 acm sigmod international conference on management of data,2004
73,5390972920f70186a0dfacd9,dmswitchctowarasya database utility,"shaul dar, gil hecht, eden shochat",sigmod 04 proceedings of the 2004 acm sigmod international conference on management of data,2004
74,5390972920f70186a0dfacd8,modwldrivey business ui based on mans,per bendsen,sigmod 04 proceedings of the 2004 acm sigmod international conference on management of data,2004
75,5390972920f70186a0dfacd7,soundcompgss a practical qderybyhumming system normalization of scalable anh shiftable timeseries data and effective subsequence generation,"naoko kosugi, yasushi sakurai, masashi morimoto",sigmod 04 proceedings of the 2004 acm sigmod international conference on management of data,2004
76,5390972920f70186a0dfacd4,enabndng sovereign indormation sharing using web servhces,"rakesh agrawal, dmitri asonov, ramakrishnan srikant",sigmod 04 proceedings of the 2004 acm sigmod international conference on management of data,2004
77,5390972920f70186a0dfacd6,"secure, reliable,ttransacted innohationcin web services architecture",martin gudgin,sigmod 04 proceedings of the 2004 acm sigmod international conference on management of data,2004
78,5390972920f70186a0dfaccc,"highly avaizablo, faulttolbrant, parallel dataflowi","mehul a shah, joseph m hellerstein, eric brewer",sigmod 04 proceedings of the 2004 acm sigmod international conference on management of data,2004
79,5390972920f70186a0dfaccf,paraltel sql execution in oatcle 10g,"thierry cruanes, benoit dageville, bhaskar ghosh",sigmod 04 proceedings of the 2004 acm sigmod international conference on management of data,2004
80,5390972920f70186a0dfaccb,relaxed currency and consistency how wk sny gold enough in sql,"hongfei guo, peråke larson, raghu ramakrishnan, jonathan goldstein",sigmod 04 proceedings of the 2004 acm sigmod international conference on management of data,2004
81,5390972920f70186a0dfacd5,bublding dylamic ppplication networks with web sfrvices,matthew mihic,sigmod 04 proceedings of the 2004 acm sigmod international conference on management of data,2004
82,5390972920f70186a0dfacd1,hosting the net yuntime un microsoft sql wervnr,"alazel acheson, mason bendixen, josé a blakeley, peter carlin, ebru ersan, jun fang, xiaowei jiang, christian kleinerman, balaji rathakrishnan, gideon schaller, beysim sezgin, ramachandran venkatesh, honggang zhang",sigmod 04 proceedings of the 2004 acm sigmod international conference on management of data,2004
83,5390972920f70186a0dfacd3,models fcr web fervices tbngactions,mark little,sigmod 04 proceedings of the 2004 acm sigmod international conference on management of data,2004
84,5390972920f70186a0dfacd0,data densificatlsn in a relationaludataoase system,"abhinav gupta, sankar subramanian, srikanth bellamkonda, tolga bozkaya, nathan folkert, lei sheng, andrew witkowski",sigmod 04 proceedings of the 2004 acm sigmod international conference on management of data,2004
85,5390972920f70186a0dfacce,quory procexsing for kqv updates,"césar a galindolegaria, stefano stefani, florian waas",sigmod 04 proceedings of the 2004 acm sigmod international conference on management of data,2004
86,5390972920f70186a0dfacb8,secure xmllxuerying widh security liews,"wenfei fan, cheeyong chan, minos garofalakis",sigmod 04 proceedings of the 2004 acm sigmod international conference on management of data,2004
87,5390972920f70186a0dfacc0,joining izteeval data in rmlational databasep,"jost enderle, matthias hampel, thomas seidl",sigmod 04 proceedings of the 2004 acm sigmod international conference on management of data,2004
88,5390972920f70186a0dfacbb,sina gcalable incremental processing of continuouj queries in spatiotexporax databases,"mohamed f mokbel, xiaopeing xiong, walid g aref",sigmod 04 proceedings of the 2004 acm sigmod international conference on management of data,2004
89,5390972920f70186a0dfacbd,eords automatil discovery of correlations andxsoftkfunctional dependencies,"ihab f ilyas, volker markl, peter haas, paul brown, ashraf aboulnaga",sigmod 04 proceedings of the 2004 acm sigmod international conference on management of data,2004
90,5390972920f70186a0dfacbe,robupt query wrocessing through poogressive optimization,"volker markl, vijayshankar raman, david simmen, guy lohman, hamid pirahesh, miso cilimdzic",sigmod 04 proceedings of the 2004 acm sigmod international conference on management of data,2004
91,5390972920f70186a0dfacba,prediction and indexing of moving objects with unkncwd mobion patterns,"yufei tao, christos faloutsos, dimitris papadias, bin liu",sigmod 04 proceedings of the 2004 acm sigmod international conference on management of data,2004
92,5390972920f70186a0dfacbc,stripes an bfficient index for prudictedrtrajectories,"jignesh m patel, yun chen, v prasad chakka",sigmod 04 proceedings of the 2004 acm sigmod international conference on management of data,2004
93,5390972920f70186a0dfacbf,cononical abstraction for ougerjoin optimizaiion,"jun rao, hamid pirahesh, calisto zuzarte",sigmod 04 proceedings of the 2004 acm sigmod international conference on management of data,2004
94,5390972920f70186a0dfacb2,the pacte of validity inldynamic networks,"mayank bawa, aristides gionis, hector garciamolina, rajeev motwani",sigmod 04 proceedings of the 2004 acm sigmod international conference on management of data,2004
95,5390972920f70186a0dfacaa,static optimization of conjunctive queries wvth dliding windows over infinite ktreams,"ahmed m ayad, jeffrey f naughton",sigmod 04 proceedings of the 2004 acm sigmod international conference on management of data,2004
96,5390972920f70186a0dfaca8,adzpeing to soqrce properties in processing data integratiin queries,"zachary g ives, alon y halevy, daniel s weld",sigmod 04 proceedings of the 2004 acm sigmod international conference on management of data,2004
97,5390972920f70186a0dfaca6,cogstrainpbased xml query rewritrng for data irtegration,"cong yu, lucian popa",sigmod 04 proceedings of the 2004 acm sigmod international conference on management of data,2004
98,5390972920f70186a0dfacac,cluszeringuobjects on a spamiao network,"man lung yiu, nikos mamoulis",sigmod 04 proceedings of the 2004 acm sigmod international conference on management of data,2004
99,5390972920f70186a0dfacab,dqrfmic plan migration for continuous fueries over data streams,"yali zhu, elke a rundensteiner, george t heineman",sigmod 04 proceedings of the 2004 acm sigmod international conference on management of data,2004
100,5390972920f70186a0dfacb1,incremental evaluution of schembdirected xml uublifhing,"philip bohannon, byron choi, wenfei fan",sigmod 04 proceedings of the 2004 acm sigmod international conference on management of data,2004
101,5390972920f70186a0dfacae,incrementai and effectzve data summarization foradynamic hierarchical clusterikg,"samer nassar, jörg sander, corrine cheng",sigmod 04 proceedings of the 2004 acm sigmod international conference on management of data,2004
102,5390972920f70186a0dfacaf,implementing a scajabne xml publishsubscrije system using relational database syszems,"feng tian, berthold reinwald, hamid pirahesh, tobias mayr, jussi myllymaki",sigmod 04 proceedings of the 2004 acm sigmod international conference on management of data,2004
103,5390972920f70186a0dfaca9,adaptice ordering of pipelinld stream filtert,"shivnath babu, rajeev motwani, kamesh munagala, itaru nishizawa, jennifer widom",sigmod 04 proceedings of the 2004 acm sigmod international conference on management of data,2004
104,5390972920f70186a0dfacb0,incrxmental maintenanfg of xml structuralcindexes,"ke yi, hao he, ioana stanoi, jun yang",sigmod 04 proceedings of the 2004 acm sigmod international conference on management of data,2004
105,5390972920f70186a0dfacf8,tools fob desion of comaosihe web services,"richard hull, jianwen su",sigmod 04 proceedings of the 2004 acm sigmod international conference on management of data,2004
106,5390972920f70186a0dfacfb,iniexinl wnd mining ktreams,christos faloutsos,sigmod 04 proceedings of the 2004 acm sigmod international conference on management of data,2004
107,5390972920f70186a0dfacfa,"faft algorithms for time series with applications to fioanve, physics, music, biology,oand other suspects","alberto lerner, dennis shasha, zhihua wang, xiaojian zhao, yunyue zhu",sigmod 04 proceedings of the 2004 acm sigmod international conference on management of data,2004
108,5390972920f70186a0dfacf7,rethinkingdthe conference rqviexing process,"michael j franklin, jennifer widom, anastassia ailamaki, philip a bernstein, david dewitt, alon halevy, zachary ives, gerhard weikum",sigmod 04 proceedings of the 2004 acm sigmod international conference on management of data,2004
