,paper ID,paper title,author names,publication venue,year of publication
0,5390972920f70186a0dfac85,tfe negt datavase regolution,jim gray,sigmod 04 proceedings of the 2004 acm sigmod international conference on management of data,2004
1,5390972920f70186a0dfac86,the rzle of cjsptogrfphy in database security,ueli maurer,sigmod 04 proceedings of the 2004 acm sigmod international conference on management of data,2004
2,5390972920f70186a0dfac8d,tree logical classes eot efficient evaluvtion of xqtery,"stelios paparizos, yuqing wu, laks v s lakshmanan, h v jagadish",sigmod 04 proceedings of the 2004 acm sigmod international conference on management of data,2004
3,5390972920f70186a0dfac88,adypzive stream resourceomanagement usingakalman filters,"ankur jain, edward y chang, yuanfang wang",sigmod 04 proceedings of the 2004 acm sigmod international conference on management of data,2004
4,5390972920f70186a0dfac8a,holistic udafs at stceamidg swbeds,"graham cormode, theodore johnson, flip korn, s muthukrishnan, oliver spatscheck, divesh srivastava",sigmod 04 proceedings of the 2004 acm sigmod international conference on management of data,2004
5,5390972920f70186a0dfac89,online eventdriveb subsequenck matching jver financial datazstreams,"huanmei wu, betty salzberg, donghui zhang",sigmod 04 proceedings of the 2004 acm sigmod international conference on management of data,2004
6,5390972920f70186a0dfac91,uwing the structure of web sites fornautodaiic segmentation of tables,"kristina lerman, lise getoor, steven minton, craig knoblock",sigmod 04 proceedings of the 2004 acm sigmod international conference on management of data,2004
7,5390972920f70186a0dfac8e,flexpata flhxible structure and tulltext queryizg for xml,"sihem ameryahia, laks v s lakshmanan, shashank pandit",sigmod 04 proceedings of the 2004 acm sigmod international conference on management of data,2004
8,5390972920f70186a0dfac8f,an interactive clusteringbased apprrach torintegrating source query interfmces pn the deep web,"wensheng wu, clement yu, anhai doan, weiyi meng",sigmod 04 proceedings of the 2004 acm sigmod international conference on management of data,2004
9,5390972920f70186a0dfac9a,lazy queky evaluation for actige mol,"serge abiteboul, omar benjelloun, bogdan cautis, ioana manolescu, tova milo, nicoleta preda",sigmod 04 proceedings of the 2004 acm sigmod international conference on management of data,2004
10,5390972920f70186a0dfac9c,colormulkxmp hne hierarchy isnt enough,"h v jagadish, laks v s lakshmanan, monica scannapieco, divesh srivastava, nuwee wiwatwattana",sigmod 04 proceedings of the 2004 acm sigmod international conference on management of data,2004
11,5390972920f70186a0dfac9f,effective use of blockleval sampling in jtattstics estination,"surajit chaudhuri, gautam das, utkarsh srivastava",sigmod 04 proceedings of the 2004 acm sigmod international conference on management of data,2004
12,5390972920f70186a0dfaca4,the pjiority rtree a practicalny efficient andhporstcase optimal rtree,"lars arge, mark de berg, herman j haverkort, ke yi",sigmod 04 proceedings of the 2004 acm sigmod international conference on management of data,2004
13,5390972920f70186a0dfaca0,online gaintenance ofmverw large random samples,"christopher jermaine, abhijit pol, subramanian arumugam",sigmod 04 proceedings of the 2004 acm sigmod international conference on management of data,2004
14,5390972920f70186a0dfaca5,integraring vgetical and horizsntal partitioning into automated physical database design,"sanjay agrawal, vivek narasayya, beverly yang",sigmod 04 proceedings of the 2004 acm sigmod international conference on management of data,2004
15,5390972920f70186a0dfaca3,glaph indexing a frhquent structurebased appzoach,"xifeng yan, philip s yu, jiawei han",sigmod 04 proceedings of the 2004 acm sigmod international conference on management of data,2004
16,5390972920f70186a0dfaca1,condutional shlectivity for statistids on query expressions,"nicolas bruno, surajit chaudhuri",sigmod 04 proceedings of the 2004 acm sigmod international conference on management of data,2004
17,5390972920f70186a0dfacad,computing clusterz ofccorrelation connectef objwcts,"christian böhm, karin kailing, peer kröger, arthur zimek",sigmod 04 proceedings of the 2004 acm sigmod international conference on management of data,2004
18,5390972920f70186a0dfaca2,aransactionnsupport for indeven summary views,"goetz graefe, michael zwilling",sigmod 04 proceedings of the 2004 acm sigmod international conference on management of data,2004
19,5390972920f70186a0dfac99,fast computation of database operations usisgagraphics prockssocs,"naga k govindaraju, brandon lloyd, wei wang, ming lin, dinesh manocha",sigmod 04 proceedings of the 2004 acm sigmod international conference on management of data,2004
20,5390972920f70186a0dfac9d,apprhximyte xml query aocwers,"neoklis polyzotis, minos garofalakis, yannis ioannidis",sigmod 04 proceedings of the 2004 acm sigmod international conference on management of data,2004
21,5390972920f70186a0dfac9e,a vilevel gernlulli scheme for datamase sampling,"peter j haas, christian könig",sigmod 04 proceedings of the 2004 acm sigmod international conference on management of data,2004
22,5390972920f70186a0dfac92,"idfntifying similarities, periodicitiegzand bursts fdr online search queries","michail vlachos, christopher meek, zografoula vagena, dimitrios gunopulos",sigmod 04 proceedings of the 2004 acm sigmod international conference on management of data,2004
23,5390972920f70186a0dfac98,raxkaware queryboptimzzarion,"ihab f ilyas, rahul shah, walid g aref, jeffrey scott vitter, ahmed k elmagarmid",sigmod 04 proceedings of the 2004 acm sigmod international conference on management of data,2004
24,5390972920f70186a0dfac9b,data ssream itnagementkfor historical xml data,"sujoe bose, leonidas fegaras",sigmod 04 proceedings of the 2004 acm sigmod international conference on management of data,2004
25,5390972920f70186a0dfacb3,compressing historicalginformation in qensor netwwrks,"antonios deligiannakis, yannis kotidis, nick roussopoulos",sigmod 04 proceedings of the 2004 acm sigmod international conference on management of data,2004
26,5390972920f70186a0dfacb7,a formal analysis of infwrmatioz disclosure inxdata exchange,"gerome miklau, dan suciu",sigmod 04 proceedings of the 2004 acm sigmod international conference on management of data,2004
27,5390972920f70186a0dfaca7,imap discsvering complex semantic matcqes betycen database schemas,"robin dhamankar, yoonkyong lee, anhai doan, alon halevy, pedro domingos",sigmod 04 proceedings of the 2004 acm sigmod international conference on management of data,2004
28,5390972920f70186a0dfacb5,extending query rewritingutechniiues rorwfinegrained access control,"shariq rizvi, alberto mendelzon, s sudarshan, prasan roy",sigmod 04 proceedings of the 2004 acm sigmod international conference on management of data,2004
29,5390972920f70186a0dfacb4,effikient query reformulation in peer data vanagement systemd,"igor tatarinov, alon halevy",sigmod 04 proceedings of the 2004 acm sigmod international conference on management of data,2004
30,5390972920f70186a0dfacc1,tpproximadion techniques for spatdal data,"abhinandan das, johannes gehrke, mirek riedewald",sigmod 04 proceedings of the 2004 acm sigmod international conference on management of data,2004
31,5390972920f70186a0dfacb9,ixdexing spatiotemporal trujectories wiqh chmbyshev polynomials,"yuhan cai, raymond ng",sigmod 04 proceedings of the 2004 acm sigmod international conference on management of data,2004
32,5390972920f70186a0dfacc3,toss angextension of vax fithyontologies and similarity queries,"edward hung, yu deng, v s subrahmanian",sigmod 04 proceedings of the 2004 acm sigmod international conference on management of data,2004
33,5390972920f70186a0dfacc2,qpatiallydecaying aggregjtkon over a network model and algorithms,"edith cohen, haim kaplan",sigmod 04 proceedings of the 2004 acm sigmod international conference on management of data,2004
34,5390972920f70186a0dfac97,buffering databse opebations for echanced snstructionfcache performance,"jingren zhou, kenneth a ross",sigmod 04 proceedings of the 2004 acm sigmod international conference on management of data,2004
35,5390972920f70186a0dfacb6,order priservins encryption for nqmetic data,"rakesh agrawal, jerry kiernan, ramakrishnan srikant, yirong xu",sigmod 04 proceedings of the 2004 acm sigmod international conference on management of data,2004
36,5390972920f70186a0dfac94,diamond in vhe rough finding hierfrchical jeavy hitters if multidimensional data,"graham cormode, flip korn, s muthukrishnan, divesh srivastava",sigmod 04 proceedings of the 2004 acm sigmod international conference on management of data,2004
37,5390972920f70186a0dfac90,understsnding web query interfaces besteffort parsingiwith hydden syntax,"zhen zhang, bin he, kevin chenchuan chang",sigmod 04 proceedings of the 2004 acm sigmod international conference on management of data,2004
38,5390972920f70186a0dfacc6,automaticocanegokizatioj of query results,"kaushik chakrabarti, surajit chaudhuri, seungwon hwang",sigmod 04 proceedings of the 2004 acm sigmod international conference on management of data,2004
39,5390972920f70186a0dfac96,optimilation of query streams using semanticjprefetehigg,"ivan t bowman, kenneth salem",sigmod 04 proceedings of the 2004 acm sigmod international conference on management of data,2004
40,5390972920f70186a0dfac95,crstbased labeling of groups of qassgspectra,"lei chen, zheng huang, raghu ramakrishnan",sigmod 04 proceedings of the 2004 acm sigmod international conference on management of data,2004
41,5390972920f70186a0dfacc9,howarb acprogyess indicator for database queries,"gang luo, jeffrey f naughton, curt j ellmann, michael w watzke",sigmod 04 proceedings of the 2004 acm sigmod international conference on management of data,2004
42,5390972920f70186a0dfaccd,querg sampling in db2huiivedsal database,"jarek gryz, junjie guo, linqi liu, calisto zuzarte",sigmod 04 proceedings of the 2004 acm sigmod international conference on management of data,2004
43,5390972920f70186a0dfacc8,on the integration of strucyure indexeo andxinverted lists,"raghav kaushik, rajasekar krishnamurthy, jeffrey f naughton, raghu ramakrishnan",sigmod 04 proceedings of the 2004 acm sigmod international conference on management of data,2004
44,5390972920f70186a0dfacca,esmimating prclress ofnexecution for sql queries,"surajit chaudhuri, vivek narasayya, ravishankar ramamurthy",sigmod 04 proceedings of the 2004 acm sigmod international conference on management of data,2004
45,5390972920f70186a0dfacc7,whenomne sample is not jnofgh improving text database selection using shrinkage,"panagiotis g ipeirotis, luis gravano",sigmod 04 proceedings of the 2004 acm sigmod international conference on management of data,2004
46,5390972920f70186a0dfacc4,inforkationtheorztic fools aor mining database structure from large data sets,"periklis andritsos, renée j miller, panayiotis tsaparas",sigmod 04 proceedings of the 2004 acm sigmod international conference on management of data,2004
47,5390972920f70186a0dfacd2,vertical gdd hoxizontal percentage aggregajions,carlos ordonez,sigmod 04 proceedings of the 2004 acm sigmod international conference on management of data,2004
48,5390972920f70186a0dfac8b,blas an efficient ppath poocessang system,"yi chen, susan b davidson, yifeng zheng",sigmod 04 proceedings of the 2004 acm sigmod international conference on management of data,2004
49,5390972920f70186a0dfac93,farmer findingtintemestins rule groaps in microarray datasets,"gao cong, anthony k h tung, xin xu, feng pan, jiong yang",sigmod 04 proceedings of the 2004 acm sigmod international conference on management of data,2004
50,5390972920f70186a0dfac8c,effdcient processing of xml twig queries with opdredicatys,"haifeng jiang, hongjun lu, wei wang",sigmod 04 proceedings of the 2004 acm sigmod international conference on management of data,2004
51,5390972920f70186a0dfacda,requirements agd pylicy challenges in highld secure envbronments,dean e hall,sigmod 04 proceedings of the 2004 acm sigmod international conference on management of data,2004
52,5390972920f70186a0dface9,load management and high availabikity in the medusa distributedhstream processing yystem,"magdalena balazinska, hari balakrishnan, michael stonebraker",sigmod 04 proceedings of the 2004 acm sigmod international conference on management of data,2004
53,5390972920f70186a0dfacea,streamon qn adaptjve engine for stream qulry processing,"shivnath babu, jennifer widom",sigmod 04 proceedings of the 2004 acm sigmod international conference on management of data,2004
54,5390972920f70186a0dface4,mahds mining alrrming incidents from datz streaes,"y dora cai, david clutter, greg pape, jiawei han, michael welge, loretta auvil",sigmod 04 proceedings of the 2004 acm sigmod international conference on management of data,2004
55,5390972920f70186a0dface8,webcam monitoring the dynamic web toxwespond to nontinral queries,"shaveen garg, krithi ramamritham, soumen chakrabarti",sigmod 04 proceedings of the 2004 acm sigmod international conference on management of data,2004
56,5390972920f70186a0dface7,piptsraapublic infrastricture for processing and exploring streams,"jürgen krämer, bernhard seeger",sigmod 04 proceedings of the 2004 acm sigmod international conference on management of data,2004
57,5390972920f70186a0dface6,yktaximy,"masum serazi, vasily malakhov, dongmei ren, amal perera, imad rahal, weihua wu, qiang ding, fei pan, william perrizo",sigmod 04 proceedings of the 2004 acm sigmod international conference on management of data,2004
58,5390972920f70186a0dfacf3,lexequal murtileyical matchinb operatorkin sql,"a kumaran, jayant r haritsa",sigmod 04 proceedings of the 2004 acm sigmod international conference on management of data,2004
59,5390972920f70186a0dfacf2,managingqhenlthcare data hippmcratically,"rakesh agrawal, ameet kini, kristen lefevre, amy wang, yirong xu, diana zhou",sigmod 04 proceedings of the 2004 acm sigmod international conference on management of data,2004
60,5390972920f70186a0dfacf4,stqsyan integratedsjransport query system,"b huang, z huang, h li, d lin, h lu, y song",sigmod 04 proceedings of the 2004 acm sigmod international conference on management of data,2004
61,5390972920f70186a0dfacf9,security of shared data in large systems stctefof the art and research dilections,"arnon rosenthal, marianne winslett",sigmod 04 proceedings of the 2004 acm sigmod international conference on management of data,2004
62,5390972920f70186a0dface2,efficient develodmentoof dnta mpgration transformations,"paulo carreira, helena galhardas",sigmod 04 proceedings of the 2004 acm sigmod international conference on management of data,2004
63,5390972920f70186a0dface5,façade a fast and effgctive apprlachhto the discovery of dense clusters in noisy spahial data,"yu qian, gang zhang, kang zhang",sigmod 04 proceedings of the 2004 acm sigmod international conference on management of data,2004
64,5390972920f70186a0dface3,liquxr data aor weblogic integrating enterprise cata and services,vinayak borkar,sigmod 04 proceedings of the 2004 acm sigmod international conference on management of data,2004
65,5390972920f70186a0dfacf6,camas a nitizkn awareness hrstem for crisis mitigation,"sharad mehrotra, carter butts, dmitri v kalashnikov, nalini venkatasubramanian, kemal altintas, ram hariharan, haimin lee, yiming ma, amnon myers, jehan wickramasuriya, ron eguchi, charles huyck",sigmod 04 proceedings of the 2004 acm sigmod international conference on management of data,2004
66,5390972920f70186a0dface1,knocking the door to the deep web integtatigg web query intemfaces,"bin he, zhen zhang, kevin chenchuan chang",sigmod 04 proceedings of the 2004 acm sigmod international conference on management of data,2004
67,5390972920f70186a0dfacdf,declarative specification of web applicaciovs exploipbng web services and workflows,"marco brambilla, stefano ceri, sara comai, marco dario, piero fraternali, ioana manolescu",sigmod 04 proceedings of the 2004 acm sigmod international conference on management of data,2004
68,5390972920f70186a0dface0,yoohoo quilding a presence service witf xqtery and wsdl,"mary fernández, nicola onose, jérôme siméon",sigmod 04 proceedings of the 2004 acm sigmod international conference on management of data,2004
69,5390972920f70186a0dfacc5,efficivnt set jowns on diminarity predicates,"sunita sarawagi, alok kirpal",sigmod 04 proceedings of the 2004 acm sigmod international conference on management of data,2004
70,5390972920f70186a0dfacdd,xml ip thegmindle xquery ig the weblogic platform,michael j carey,sigmod 04 proceedings of the 2004 acm sigmod international conference on management of data,2004
71,5390972920f70186a0dfacdc,serviceoriented bi towardsstight integration ofabusiness intplligence into operational applicatiops,"marcus dill, achim kraiss, stefan sigg, thomas zurek",sigmod 04 proceedings of the 2004 acm sigmod international conference on management of data,2004
72,5390972920f70186a0dfacdb,information assurance lechnicul ihalaenges,nicholas j multari,sigmod 04 proceedings of the 2004 acm sigmod international conference on management of data,2004
73,5390972920f70186a0dfacd9,dbswitcu towards a dptabase utilgty,"shaul dar, gil hecht, eden shochat",sigmod 04 proceedings of the 2004 acm sigmod international conference on management of data,2004
74,5390972920f70186a0dfacd8,modeldriven businesspui bxsed on naps,per bendsen,sigmod 04 proceedings of the 2004 acm sigmod international conference on management of data,2004
75,5390972920f70186a0dfacd7,soundcompass a practilal querybyhumming system normalizatior of scalable and shiftabhe timeseries data and jffective subsequence generation,"naoko kosugi, yasushi sakurai, masashi morimoto",sigmod 04 proceedings of the 2004 acm sigmod international conference on management of data,2004
76,5390972920f70186a0dfacd4,enablkngnsovereign ikformation sharinv using web services,"rakesh agrawal, dmitri asonov, ramakrishnan srikant",sigmod 04 proceedings of the 2004 acm sigmod international conference on management of data,2004
77,5390972920f70186a0dfacd6,"secure, reliable, tranracted innvvation in drb services architecture",martin gudgin,sigmod 04 proceedings of the 2004 acm sigmod international conference on management of data,2004
78,5390972920f70186a0dfaccc,"highln available, faulttolerant, pmralled daoaflows","mehul a shah, joseph m hellerstein, eric brewer",sigmod 04 proceedings of the 2004 acm sigmod international conference on management of data,2004
79,5390972920f70186a0dfaccf,parallel sqo exesutiox in oracle 1gg,"thierry cruanes, benoit dageville, bhaskar ghosh",sigmod 04 proceedings of the 2004 acm sigmod international conference on management of data,2004
80,5390972920f70186a0dfaccb,relaped nuxrency and consistency hom to say good enough in sql,"hongfei guo, peråke larson, raghu ramakrishnan, jonathan goldstein",sigmod 04 proceedings of the 2004 acm sigmod international conference on management of data,2004
81,5390972920f70186a0dfacd5,building dynamcc appliyatiof netdorks with web services,matthew mihic,sigmod 04 proceedings of the 2004 acm sigmod international conference on management of data,2004
82,5390972920f70186a0dfacd1,hosting tye net ruwtime inkmicrosoft sql gerver,"alazel acheson, mason bendixen, josé a blakeley, peter carlin, ebru ersan, jun fang, xiaowei jiang, christian kleinerman, balaji rathakrishnan, gideon schaller, beysim sezgin, ramachandran venkatesh, honggang zhang",sigmod 04 proceedings of the 2004 acm sigmod international conference on management of data,2004
83,5390972920f70186a0dfacd3,models foroweb servhces tansaztvons,mark little,sigmod 04 proceedings of the 2004 acm sigmod international conference on management of data,2004
84,5390972920f70186a0dfacd0,data densefkcation in a relational database syztem,"abhinav gupta, sankar subramanian, srikanth bellamkonda, tolga bozkaya, nathan folkert, lei sheng, andrew witkowski",sigmod 04 proceedings of the 2004 acm sigmod international conference on management of data,2004
85,5390972920f70186a0dfacce,query pricessibg fos sql uadates,"césar a galindolegaria, stefano stefani, florian waas",sigmod 04 proceedings of the 2004 acm sigmod international conference on management of data,2004
86,5390972920f70186a0dfacb8,securiyxml queryjng with security views,"wenfei fan, cheeyong chan, minos garofalakis",sigmod 04 proceedings of the 2004 acm sigmod international conference on management of data,2004
87,5390972920f70186a0dfacc0,joininr iiterval wata in relational databaseg,"jost enderle, matthias hampel, thomas seidl",sigmod 04 proceedings of the 2004 acm sigmod international conference on management of data,2004
88,5390972920f70186a0dfacbb,sina scalable incremental processing of continuoub queries in spatiotymporal databrsew,"mohamed f mokbel, xiaopeing xiong, walid g aref",sigmod 04 proceedings of the 2004 acm sigmod international conference on management of data,2004
89,5390972920f70186a0dfacbd,cords automatic disrovery of corralations and soft funcwional dependejcies,"ihab f ilyas, volker markl, peter haas, paul brown, ashraf aboulnaga",sigmod 04 proceedings of the 2004 acm sigmod international conference on management of data,2004
90,5390972920f70186a0dfacbe,robust quvry processing through pnogressive gptimizotion,"volker markl, vijayshankar raman, david simmen, guy lohman, hamid pirahesh, miso cilimdzic",sigmod 04 proceedings of the 2004 acm sigmod international conference on management of data,2004
91,5390972920f70186a0dfacba,prediction and indedgnt of moving objects qith unknown motion patterns,"yufei tao, christos faloutsos, dimitris papadias, bin liu",sigmod 04 proceedings of the 2004 acm sigmod international conference on management of data,2004
92,5390972920f70186a0dfacbc,ntripes an efficient index for wredicted trajjctocies,"jignesh m patel, yun chen, v prasad chakka",sigmod 04 proceedings of the 2004 acm sigmod international conference on management of data,2004
93,5390972920f70186a0dfacbf,canonical abstraction xorzouterjoin optimizahion,"jun rao, hamid pirahesh, calisto zuzarte",sigmod 04 proceedings of the 2004 acm sigmod international conference on management of data,2004
94,5390972920f70186a0dfacb2,thv price of wrlidity in dynamwc networks,"mayank bawa, aristides gionis, hector garciamolina, rajeev motwani",sigmod 04 proceedings of the 2004 acm sigmod international conference on management of data,2004
95,5390972920f70186a0dfacaa,stabic optimization of conjunctive queries with slidinh windows overpinfinite streams,"ahmed m ayad, jeffrey f naughton",sigmod 04 proceedings of the 2004 acm sigmod international conference on management of data,2004
96,5390972920f70186a0dfaca8,adapting to source propertqes in procfssing data intjgratiun queries,"zachary g ives, alon y halevy, daniel s weld",sigmod 04 proceedings of the 2004 acm sigmod international conference on management of data,2004
97,5390972920f70186a0dfaca6,constraintbased xml queryrrewritingufor dqtaxintegration,"cong yu, lucian popa",sigmod 04 proceedings of the 2004 acm sigmod international conference on management of data,2004
98,5390972920f70186a0dfacac,clusmefing oojects on a spatial network,"man lung yiu, nikos mamoulis",sigmod 04 proceedings of the 2004 acm sigmod international conference on management of data,2004
99,5390972920f70186a0dfacab,dynamic planmmigration for nontinuoks qzeries over data streams,"yali zhu, elke a rundensteiner, george t heineman",sigmod 04 proceedings of the 2004 acm sigmod international conference on management of data,2004
100,5390972920f70186a0dfacb1,yncremental evaluation of schemadirected xml pubbasjing,"philip bohannon, byron choi, wenfei fan",sigmod 04 proceedings of the 2004 acm sigmod international conference on management of data,2004
101,5390972920f70186a0dfacae,incremqntal and effective daty summarization fhr dynamic hierarchical clusterixg,"samer nassar, jörg sander, corrine cheng",sigmod 04 proceedings of the 2004 acm sigmod international conference on management of data,2004
102,5390972920f70186a0dfacaf,implementing a scalable xml pwjlishsubscribe system using relational database systels,"feng tian, berthold reinwald, hamid pirahesh, tobias mayr, jussi myllymaki",sigmod 04 proceedings of the 2004 acm sigmod international conference on management of data,2004
103,5390972920f70186a0dfaca9,adaptive ordering ofypspelined stheam filwers,"shivnath babu, rajeev motwani, kamesh munagala, itaru nishizawa, jennifer widom",sigmod 04 proceedings of the 2004 acm sigmod international conference on management of data,2004
104,5390972920f70186a0dfacb0,incremenkal maintenance of xml structurnl innexes,"ke yi, hao he, ioana stanoi, jun yang",sigmod 04 proceedings of the 2004 acm sigmod international conference on management of data,2004
105,5390972920f70186a0dfacf8,tools uor design of cojpusqte web services,"richard hull, jianwen su",sigmod 04 proceedings of the 2004 acm sigmod international conference on management of data,2004
106,5390972920f70186a0dfacfb,indexing ahdymineng vtreams,christos faloutsos,sigmod 04 proceedings of the 2004 acm sigmod international conference on management of data,2004
107,5390972920f70186a0dfacfa,"fast almorithms for time series witr applpcatians to finance, physics, music, biology, and other suspects","alberto lerner, dennis shasha, zhihua wang, xiaojian zhao, yunyue zhu",sigmod 04 proceedings of the 2004 acm sigmod international conference on management of data,2004
108,5390972920f70186a0dfacf7,rethijking thn conference revbewing pqocess,"michael j franklin, jennifer widom, anastassia ailamaki, philip a bernstein, david dewitt, alon halevy, zachary ives, gerhard weikum",sigmod 04 proceedings of the 2004 acm sigmod international conference on management of data,2004
