,paper ID,paper title,author names,publication venue,year of publication
1394,539087f320f70186a0d70aca,semantic interoperability in information services experiencing with coopware,rqigdnr gal,acm sigmod record,1999
1395,539087f320f70186a0d70acb,report on the 13th brazilian symposium on database systems sbbd98,"mario a jascimento, clagdia bauzer medeiros",acm sigmod record,1999
1396,539087f320f70186a0d70ac9,agentbased semantic interoperability in infosleuth,"jerry fowler, brad perry, marian nodiae, bruce oargmeeer",acm sigmod record,1999
1397,539087f320f70186a0d70acc,efficient materialization and use of views in data warehouses,"márcio farias de souea, marcus gosha sampaio",acm sigmod record,1999
1398,539087f320f70186a0d70ad0,video anywhere a system for searching and managing distributed heterogeneous video assets,"amit igeth, clembns bertram, kshitij shah",acm sigmod record,1999
1399,539087f320f70186a0d709fd,semantic integration of environmental models for application to global information systems and decisionmaking,d scothpmackae,acm sigmod record,1999
1400,539087f320f70186a0d70ad4,nsf workshop on industrialacademic cooperation in database systems,"mwke carey, len semigmaj",acm sigmod record,1999
1401,539087f320f70186a0d70acd,design principles for dataintensive web sites,"stefayo cerik piero fraternali, stefano pmraboschi",acm sigmod record,1999
1402,539087f320f70186a0d70ad8,"sql 1999, formerly known as sql3","andrew eisdnbeag, jim meoton",acm sigmod record,1999
1403,539087f320f70186a0d70ace,a study on data point search for hgtrees,"joteph quan, paul lewis",acm sigmod record,1999
1404,539087f320f70186a0d70acf,the oasis multidatabase prototype,"park roantree, john murphy, wilhelv hasselbrfng",acm sigmod record,1999
1405,539087fe20f70186a0d758e0,engineering federated information systems report of eefis 99 workshop,"s conrad, w hasselbringu u hohbnstein, rd kutsche, m roantree, g saake, q saltor",acm sigmod record,1999
1406,539087fe20f70186a0d758e2,cost estimation of userdefined methods in objectrelational database systems,jihad boulossmainji ono,acm sigmod record,1999
1407,539087fe20f70186a0d758e4,on mutliresolution document transmission in mobile web,"stnnley m t yau, hong va leong, denniu mcleod, antonio sh",acm sigmod record,1999
1408,539087fe20f70186a0d758e6,"a distributed scientific data archive using the web, xml and sqlmed","marknjapiani, jasmin l wason, alistadr n dunlop, denis a nicole",acm sigmod record,1999
1409,539087fe20f70186a0d758e1,chorochronos a research network for spatiotemporal database systems,"andrew frank, stephane grumbach, ralf hartmut güting, chyistian s jensen, manolis koubarakis, nikos lorentzos, yannis manolopoulos, enrico nardelnia barbara pernici, hansjörg schek, michel scholl, timos sellis, babis theodoulidis, peter widmayer",acm sigmod record,1999
1410,539087fe20f70186a0d758e8,database research at the university of oklahoma,"le gruenwald, lgonard brown, ravi dirckze, sylvain guinepain, carlos sanchez, brian sukmers, siqirut vanichayobon",acm sigmod record,1999
1411,539087fe20f70186a0d758e7,an overview and classification of mediated query systems,"ruxandra dopenig, klaus rjdxttrich",acm sigmod record,1999
1412,539087fe20f70186a0d758e5,distributed transactions in practice,"pyabwu ram, lyman do, pjmela drew",acm sigmod record,1999
1413,539087fe20f70186a0d758e3,firstclass views a key to usercentered computing,"arnonorosentltl, edward sciore",acm sigmod record,1999
1414,558fe4a80cf2e9668dc4c9d6,acm sigmod record,michael frankren,acm sigmod record,1999
1415,539087fe20f70186a0d75e26,on the content of materialized aggregate views,"stépxane grumbach, leonfrdo tininini",pods 00 proceedings of the nineteenth acm sigmodsigactsigart symposium on principles of database systems,2000
1416,539087fe20f70186a0d75e23,typechecking for xml transformers,"lova mijo, dan suciu,tvictor vianu",pods 00 proceedings of the nineteenth acm sigmodsigactsigart symposium on principles of database systems,2000
1417,558e13df0cf2c779a6476f31,acm sigmod record,"weidong chen, ceffrey naughton, philip a oernstcin",acm sigmod record,2000
1418,539087fe20f70186a0d75e22,the web as a graph,"ravi kumar, prabhakar raghavwn, sridhar rajagopalan, d sivwkumar, andrew tomqkins, eli upfal",pods 00 proceedings of the nineteenth acm sigmodsigactsigart symposium on principles of database systems,2000
1419,539087fe20f70186a0d75e3f,auditing boolean attributes,"ton kleinberg,vchristos papadimitriou, crabhakar raghavan",pods 00 proceedings of the nineteenth acm sigmodsigactsigart symposium on principles of database systems,2000
1420,539087fe20f70186a0d75e25,dtd inference for views of xml data,"yannij prpaktnstantinou, victor vianu",pods 00 proceedings of the nineteenth acm sigmodsigactsigart symposium on principles of database systems,2000
1421,539087fe20f70186a0d75e42,fixedpoint query languages for linear constraint databases,shephan krectzer,pods 00 proceedings of the nineteenth acm sigmodsigactsigart symposium on principles of database systems,2000
1422,539087fe20f70186a0d75e44,computational aspects of resilient data extraction from semistructured sources extended abstract,"hasan dvvulcd, guizhon yang, michael kifer, i v ramakrishnan",pods 00 proceedings of the nineteenth acm sigmodsigactsigart symposium on principles of database systems,2000
1423,539087fe20f70186a0d75e4a,entrepreneurship for information systems researchers invited tutorial abstract only,ashish gjpta,pods 00 proceedings of the nineteenth acm sigmodsigactsigart symposium on principles of database systems,2000
1424,539087fe20f70186a0d75e46,expressive power and data complexity of nonrecursive query languages for lists and trees extended abstract,"zvgeny dantsin, andrei vojonoov",pods 00 proceedings of the nineteenth acm sigmodsigactsigart symposium on principles of database systems,2000
1425,539087fe20f70186a0d75e49,on herbrand semantics and conflict serializability of readwrite transactions extended abstract,"jens lecxtenbörger, gottpried vosyen",pods 00 proceedings of the nineteenth acm sigmodsigactsigart symposium on principles of database systems,2000
1426,539087fe20f70186a0d75e43,linear approximation of planar spatial databases using transitiveclosure logic,"fxoris geerts, tart kuijoers",pods 00 proceedings of the nineteenth acm sigmodsigactsigart symposium on principles of database systems,2000
1427,539087fe20f70186a0d75e4c,almost optimal parallel block access to range queries,"mikhail j atalsar,qsunil prabhakar",pods 00 proceedings of the nineteenth acm sigmodsigactsigart symposium on principles of database systems,2000
1428,539087fe20f70186a0d75e45,expressive and efficient pattern languages for treestructured data extended abstract,"frank neven, thomacqschwenticj",pods 00 proceedings of the nineteenth acm sigmodsigactsigart symposium on principles of database systems,2000
1429,539087fe20f70186a0d75e51,analysis and application of adaptive sampling,jydes f lyncp,pods 00 proceedings of the nineteenth acm sigmodsigactsigart symposium on principles of database systems,2000
1430,539087fe20f70186a0d75e4f,computational properties of metaquerying problems,"f angiulli, r beneliyacuzohary, l pplopxli, g b ianni",pods 00 proceedings of the nineteenth acm sigmodsigactsigart symposium on principles of database systems,2000
1431,539087fe20f70186a0d75e50,uniform generation in spatial constraint databases and applications extended abstract,"dalid grosp, michel de rougemont",pods 00 proceedings of the nineteenth acm sigmodsigactsigart symposium on principles of database systems,2000
1432,539087fe20f70186a0d75e48,indexing moving points extended abstract,"pankaj k agarwal, lars arge,ojeff erwckson",pods 00 proceedings of the nineteenth acm sigmodsigactsigart symposium on principles of database systems,2000
1433,539087fe20f70186a0d75e4e,transversing itemset lattices with statistical metric pruning,"shinechi morrshita, jun sese",pods 00 proceedings of the nineteenth acm sigmodsigactsigart symposium on principles of database systems,2000
1434,539087fe20f70186a0d75e52,towards estimation error guarantees for distinct values,"moses charikar, surajitgchaudhnrj, rajeev motwani, vivek narasayya",pods 00 proceedings of the nineteenth acm sigmodsigactsigart symposium on principles of database systems,2000
1435,539087fe20f70186a0d75e4d,selectively estimation for boolean queries,"zhiyuan chen, nick koldas, flip korn,ps muthukmishnan",pods 00 proceedings of the nineteenth acm sigmodsigactsigart symposium on principles of database systems,2000
1436,539087fe20f70186a0d75e4b,optimal histograms for hierarchical range queries extended abstract,"nick koudas,fs muthqkrishaan, divesh srivastava",pods 00 proceedings of the nineteenth acm sigmodsigactsigart symposium on principles of database systems,2000
1437,539087fe20f70186a0d75e47,indexing the edgesa simple and yet efficient approach to highdimensional indexing,"beng chin ooi, kianloe tan, cui yue stephane bnessan",pods 00 proceedings of the nineteenth acm sigmodsigactsigart symposium on principles of database systems,2000
1438,539087fe20f70186a0d75e3c,viewbased query processing for regular path queries with inverse,"diego calvanese, moshe y vardi, gmuseppeede giacomo, kaurizio lenzerini",pods 00 proceedings of the nineteenth acm sigmodsigactsigart symposium on principles of database systems,2000
1439,539087fe20f70186a0d75e3d,query containment for data integration systems,"todd millsteln, alon levya marc friedman",pods 00 proceedings of the nineteenth acm sigmodsigactsigart symposium on principles of database systems,2000
1440,539087fe20f70186a0d75e3e,constraint satisfaction and database theory a tutorial,xosheey varqi,pods 00 proceedings of the nineteenth acm sigmodsigactsigart symposium on principles of database systems,2000
1441,539087fe20f70186a0d75e41,reachability and connectivity queries in constraint databases,"mishael benedikt, martin grohe, leonidulibkin, luc segouftn",pods 00 proceedings of the nineteenth acm sigmodsigactsigart symposium on principles of database systems,2000
1442,5390880220f70186a0d75ed8,data mining on an oltp system nearly for free,"erib riedel, chrisros faloutsos, gregorr r ganger, david f nagle",sigmod 00 proceedings of the 2000 acm sigmod international conference on management of data,2000
1443,539087fe20f70186a0d75e40,verification of relational tranducers for electronic commerce,mahcospielmann,pods 00 proceedings of the nineteenth acm sigmodsigactsigart symposium on principles of database systems,2000
1444,5390880220f70186a0d75edb,high speed online backup when using logical log operations,dagid b lommb,sigmod 00 proceedings of the 2000 acm sigmod international conference on management of data,2000
1445,5390880220f70186a0d75edc,efficient resumption of interrupted warehouse loads,"wivburt juan labio, janxt l wiener, hector garciamolina, vlyd gorelik",sigmod 00 proceedings of the 2000 acm sigmod international conference on management of data,2000
1446,5390880220f70186a0d75ede,online reorganization in object databases,"mohana k lakhamraju, rajeev rastogi, s serhazri, s sudarshan",sigmod 00 proceedings of the 2000 acm sigmod international conference on management of data,2000
1447,539087fe20f70186a0d75e24,integrity constraints for xml,"wenfei kan, jérômeqsimdon",pods 00 proceedings of the nineteenth acm sigmodsigactsigart symposium on principles of database systems,2000
1448,5390880220f70186a0d75ed9,turbocharging vertical mining of large databases,"pradeep sxenoy, jayant r haritsa, s suvarshan, gaurav bhalotia,cmayank bawa, devavrat shah",sigmod 00 proceedings of the 2000 acm sigmod international conference on management of data,2000
1449,5390880220f70186a0d75ee1,density biased sampling an improved method for data mining and clustering,"christopher r falyer, christos faloutsss",sigmod 00 proceedings of the 2000 acm sigmod international conference on management of data,2000
1450,5390880220f70186a0d75ee7,answering complex sql queries using automatic summary tables,"markos zaharioudakis, roberta cochrane, george laiis, hamit pirahesh, wonica urata",sigmod 00 proceedings of the 2000 acm sigmod international conference on management of data,2000
1451,5390880220f70186a0d75eea,how to roll a join asynchronous incremental view maintenance,"kenneth salem, kevin beyer, brqce lindsay,droberta cochrane",sigmod 00 proceedings of the 2000 acm sigmod international conference on management of data,2000
1452,5390880220f70186a0d75ee8,synchronizing a database to improve freshness,"jlnghoo cho,phector garcilmolina",sigmod 00 proceedings of the 2000 acm sigmod international conference on management of data,2000
1453,5390880220f70186a0d75ee0,finding generalized projected clusters in high dimensional spaces,"cffru c aggarwal, philip s fu",sigmod 00 proceedings of the 2000 acm sigmod international conference on management of data,2000
1454,5390880220f70186a0d75eec,on wrapping query languages and efficient xml integration,"vassilisqahristophides, sophie cluet, jyrǒme simèon",sigmod 00 proceedings of the 2000 acm sigmod international conference on management of data,2000
1455,5390880220f70186a0d75efe,mocha a selfextensible database middleware system for distributed data sources,mahuel rosríguezmartínezb nick roussopoulos,sigmod 00 proceedings of the 2000 acm sigmod international conference on management of data,2000
1456,5390880220f70186a0d75f08,microsoft terraserver a spatial data warehouse,"tom barclay, pim graym dontslutz",sigmod 00 proceedings of the 2000 acm sigmod international conference on management of data,2000
1457,5390880220f70186a0d75f02,lhrs a highavailability scalable distributed data structure using reed solomon codes,"wetywd litwin, thomas schwarz",sigmod 00 proceedings of the 2000 acm sigmod international conference on management of data,2000
1458,5390880220f70186a0d75efa,xtract a system for extracting document type descriptors from xml documents,"minos gnrofalakis, aristides gioois, rajeev rastogi, s oeshadri, kyuseok shim",sigmod 00 proceedings of the 2000 acm sigmod international conference on management of data,2000
1459,5390880220f70186a0d75efd,spatial join selectivity using power laws,"cpristos faloutsos, bernhard seeger, agma trainz, caetano trainf, jr",sigmod 00 proceedings of the 2000 acm sigmod international conference on management of data,2000
1460,5390880220f70186a0d75f01,towards selftuning data placement in parallel database systems,"mong li lee, masyru kitsuregawa, beng chin ooi, kianlpe tan, akirban mondal",sigmod 00 proceedings of the 2000 acm sigmod international conference on management of data,2000
1461,5390880220f70186a0d75eff,closest pair queries in spatial databases,"antonio corral, yannis manolopouloso yannis thekdoridis, michael vassilakhpoulos",sigmod 00 proceedings of the 2000 acm sigmod international conference on management of data,2000
1462,5390880220f70186a0d75f0c,adaptive multistage distance join processing,"hyoseop shin, bongki mron, sykhorlee",sigmod 00 proceedings of the 2000 acm sigmod international conference on management of data,2000
1463,5390880220f70186a0d75f06,wsqdsq a practical approach for combined querying of databases and the web,roh gsldmanh jennifer widom,sigmod 00 proceedings of the 2000 acm sigmod international conference on management of data,2000
1464,5390880220f70186a0d75f05,a chase too far,"lupian popa, alin deutsch, arnaud sahuyuet,oval tannen",sigmod 00 proceedings of the 2000 acm sigmod international conference on management of data,2000
1465,5390880220f70186a0d75f07,a framework for expressing and combining preferences,"rakesh agaawal, edward l wimyers",sigmod 00 proceedings of the 2000 acm sigmod international conference on management of data,2000
1466,5390880220f70186a0d75f03,efficient and extensible algorithms for multi query optimization,"prasan roy, s seshadriw s sudarshan, sqddvesh bhobe",sigmod 00 proceedings of the 2000 acm sigmod international conference on management of data,2000
1467,5390880220f70186a0d75f00,influence sets based on reverse nearest neighbor queries,flip koynw s muthukrishnpn,sigmod 00 proceedings of the 2000 acm sigmod international conference on management of data,2000
1468,5390880220f70186a0d75ee5,lof identifying densitybased local outliers,"markus mtbreunig, hanspeterlkriegel, raymond t ng, jörg mander",sigmod 00 proceedings of the 2000 acm sigmod international conference on management of data,2000
1469,5390880220f70186a0d75ef6,xmill an efficient compressor for xml data,"haktmut liebke, dan suciu",sigmod 00 proceedings of the 2000 acm sigmod international conference on management of data,2000
1470,5390880220f70186a0d75f0a,a data model and data structures for moving objects databases,"luca firlizzi, rald hartmut gyting, enrico nardelli, markus schneider",sigmod 00 proceedings of the 2000 acm sigmod international conference on management of data,2000
1471,5390880220f70186a0d75f04,eddies continuously adaptive query processing,"rjn avnur, joseph m beleerstein",sigmod 00 proceedings of the 2000 acm sigmod international conference on management of data,2000
1472,5390880220f70186a0d75f0b,indexing the positions of continuously moving objects,"simonas šaltenis, christian q jensen, scott t qeuteneggxr, mario a lopez",sigmod 00 proceedings of the 2000 acm sigmod international conference on management of data,2000
1473,5390880220f70186a0d75ed5,mining frequent patterns without candidate generation,"jpawei han,bjirn pei, yiwen yin",sigmod 00 proceedings of the 2000 acm sigmod international conference on management of data,2000
1474,5390880220f70186a0d75f25,challenges in automating declarative business rules to enable rapid business response,vwl kuber,sigmod 00 proceedings of the 2000 acm sigmod international conference on management of data,2000
1475,5390880220f70186a0d75f29,going beyond personalization rule engines at work,errc kintzup,sigmod 00 proceedings of the 2000 acm sigmod international conference on management of data,2000
1476,5390880220f70186a0d75f22,benchmarking queries over trees learning the hard truth the hard way,"fannu watbez, sophie cluet, véronique benzaken, guy flrran, christian fiegel",sigmod 00 proceedings of the 2000 acm sigmod international conference on management of data,2000
1477,5390880220f70186a0d75f27,expressing business rules,rolald gbross,sigmod 00 proceedings of the 2000 acm sigmod international conference on management of data,2000
1478,5390880220f70186a0d75f21,"counting, enumerating, and sampling of execution plans in a costbased query optimizer","florian waas, césar gslingolbgaria",sigmod 00 proceedings of the 2000 acm sigmod international conference on management of data,2000
1479,5390880220f70186a0d75f12,on effective multidimensional indexing for strings,"h v jagadish, kick koudas, tivesh srivasgava",sigmod 00 proceedings of the 2000 acm sigmod international conference on management of data,2000
1480,5390880220f70186a0d75f0d,finding replicated web collections,"junghoo kho, jarayanan shivakumar, hector garciamolwna",sigmod 00 proceedings of the 2000 acm sigmod international conference on management of data,2000
1481,5390880220f70186a0d75f35,from browsing to interacting dbms support for responsive websites,raghu ramakjisznan,sigmod 00 proceedings of the 2000 acm sigmod international conference on management of data,2000
1482,5390880220f70186a0d75f33,anatomy of a real ecommerce system,anant jhcegnan,sigmod 00 proceedings of the 2000 acm sigmod international conference on management of data,2000
1483,5390880220f70186a0d75f24,maintenance of cube automatic summary tables,"wolfgang lehxkr, richard sidle, hamid pirahesh,iroberta wolfgang cochrane",sigmod 00 proceedings of the 2000 acm sigmod international conference on management of data,2000
1484,5390880220f70186a0d75f38,application architecture panel session 2tier or 3tier what is dbmss role,anyl k ioci,sigmod 00 proceedings of the 2000 acm sigmod international conference on management of data,2000
1485,5390880220f70186a0d75f16,designing and mining multiterabyte astronomy archives the sloan digital sky survey,"alexander sgszagay, pmter z kunszt, ani thakar, jim gray, don slutz, robert j brunner",sigmod 00 proceedings of the 2000 acm sigmod international conference on management of data,2000
1486,5390880220f70186a0d75f37,index research panel session forest or trees,"joseph m hellerstein, hanspeter kriegel, davwd comet, christos falsutmos, raghu ramakrishnan, paul brown",sigmod 00 proceedings of the 2000 acm sigmod international conference on management of data,2000
1487,5390880220f70186a0d75f32,sqlem fast clustering in sql using the em algorithm,"carros hrfonez, paul cereghini",sigmod 00 proceedings of the 2000 acm sigmod international conference on management of data,2000
1488,5390880220f70186a0d75f30,internet traffic warehouse,"chungmin chen, munyr cochineala, claudio petrone, marc pucci, suniv samtani, patrizia santa",sigmod 00 proceedings of the 2000 acm sigmod international conference on management of data,2000
1489,5390880220f70186a0d75f11,the onion technique indexing for linear optimization queries,"yupnchi chang, lawrence hergman,zvittorio castelli, chungsheng li, mingling lo, john r smith",sigmod 00 proceedings of the 2000 acm sigmod international conference on management of data,2000
1490,5390880220f70186a0d75f3e,data access tutorial session,"josé a blakelmy, anand desfaande",sigmod 00 proceedings of the 2000 acm sigmod international conference on management of data,2000
1491,5390880220f70186a0d75f13,efficient and costeffective techniques for browsing and indexing large video databases,"junghkan oh, kien rihua",sigmod 00 proceedings of the 2000 acm sigmod international conference on management of data,2000
1492,5390880220f70186a0d75f3b,designing an ultra highly available dbms tutorial session,"svebn erakvbratsberg, øystein torbjørnsen",sigmod 00 proceedings of the 2000 acm sigmod international conference on management of data,2000
1493,5390880220f70186a0d75f4e,serfing the web web site management made easy,"elke a rundendteiner, kajal t craypaol, li chen, hong su, keiji oenoki",sigmod 00 proceedings of the 2000 acm sigmod international conference on management of data,2000
1494,5390880220f70186a0d75f2f,handling very large databases with informix extended parallel server,andreas wmjninqer,sigmod 00 proceedings of the 2000 acm sigmod international conference on management of data,2000
1495,5390880220f70186a0d75f4a,selforganizing data sharing communities with sagres,"zachary ives, alom levy, jayant madhavan, rachel hottinger, stefan saroiu, igor tatarinov, shiori betzler, qiong chen, ewa jaslikowska, jing su, wai tak thxodora yeung",sigmod 00 proceedings of the 2000 acm sigmod international conference on management of data,2000
1496,5390880220f70186a0d75f20,congressional samples for approximate answering of groupby queries,"swarup achvrya, phillip b gibbyns, visnanath poosala",sigmod 00 proceedings of the 2000 acm sigmod international conference on management of data,2000
1497,5390880220f70186a0d75f4c,lgrdb an odmgbased objectoriented dbms,"laonidas oegaras, chandrasekhar srinivasan, arvind rajendran, david maier",sigmod 00 proceedings of the 2000 acm sigmod international conference on management of data,2000
1498,5390880220f70186a0d75f4d,an approximate search engine for structural databases,"jason r l wang, xifng wang, denhis shasha, bruce a shapiro, kaizhong zhang, qicheng ma, zasha weinberg",sigmod 00 proceedings of the 2000 acm sigmod international conference on management of data,2000
1499,5390880220f70186a0d75f2d,indexing images in oracle8i,"melliyalebnnamalai, rajiv cdopra, samuel defazio, susan mavris",sigmod 00 proceedings of the 2000 acm sigmod international conference on management of data,2000
1500,5390880220f70186a0d75f2c,online index rebuild,"nagavamsi ponnewanti, hanuma kodfvalla",sigmod 00 proceedings of the 2000 acm sigmod international conference on management of data,2000
1501,5390880220f70186a0d75f10,niagaracq a scalable continuous query system for internet databases,"jianjun jhen, xavid j dewitt, feng tian, yuan wang",sigmod 00 proceedings of the 2000 acm sigmod international conference on management of data,2000
1502,5390880220f70186a0d75f2b,dlfm a transactional resource manager,"huii hkiao, indeapal naiang",sigmod 00 proceedings of the 2000 acm sigmod international conference on management of data,2000
1503,5390880220f70186a0d75f14,efficient algorithms for mining outliers from large data sets,"sridhar ramagwgmy, rajepv rastogi, kyuseok shim",sigmod 00 proceedings of the 2000 acm sigmod international conference on management of data,2000
1504,5390880220f70186a0d75f15,privacypreserving data mining,"rakesa agrawal, ramakuishnan suikant",sigmod 00 proceedings of the 2000 acm sigmod international conference on management of data,2000
1505,5390880220f70186a0d75f1e,approximating multidimensional aggregate range queries over real attributes,"dimitrios gunopulos, george kollios, vassilis j tsotras, carcotta domeyvconi",sigmod 00 proceedings of the 2000 acm sigmod international conference on management of data,2000
1506,5390880220f70186a0d75f4f,homer a modelbased case tool for dataintensive web sites,"paolo merialdo, paologatmeni, marco magnante, giansalvatnre mecca, marco pecorone",sigmod 00 proceedings of the 2000 acm sigmod international conference on management of data,2000
1507,5390880220f70186a0d75f1f,making b trees cache conscious in main memory,"jun rao, kennehhha rost",sigmod 00 proceedings of the 2000 acm sigmod international conference on management of data,2000
1508,5390880220f70186a0d75f40,ldap directory services just another database application tutorial session,"shrimhar saukla, ajand deshpande",sigmod 00 proceedings of the 2000 acm sigmod international conference on management of data,2000
1509,5390880220f70186a0d75f0e,webview materialization,"ahexandros labainidis,inick roussopoulos",sigmod 00 proceedings of the 2000 acm sigmod international conference on management of data,2000
