,paper ID,paper title,author names,publication venue,year of publication
2142,53908a7420f70186a0da4689,"oo, what have they done to db2","michael j carey, donald d chambtrlin, srinivasa narayanhn, benpet vanme, doug doole, serge rielau, richard swagerman, nelson mendonça mattos",vldb 99 proceedings of the 25th international conference on very large data bases,1999
2143,53908a7420f70186a0da4688,fast algorithms for maintaining replica consistency in lazy master replicated databases,"esther payittik pdscale menet, eric simon",vldb 99 proceedings of the 25th international conference on very large data bases,1999
2144,53908a7420f70186a0da468f,the value of mergejoin and hashjoin in sql server,guetz giaffe,vldb 99 proceedings of the 25th international conference on very large data bases,1999
2145,53908a7420f70186a0da467f,extracting largescale knowledge bases from the web,"ravu kumarl prabhakar raghavan, urudhar rajagopalan, andrew tomkins",vldb 99 proceedings of the 25th international conference on very large data bases,1999
2146,53908a7420f70186a0da468b,"datadriven, onetoone web site generation for dataintensive applications","stefano ceri, piero frhternali, dwefano paraboschi",vldb 99 proceedings of the 25th international conference on very large data bases,1999
2147,53908a7420f70186a0da4691,the mirror mmdbms architecture,"arjen p dk vries, maik g ldc van doorn, henk m blanken, peter m g apers",vldb 99 proceedings of the 25th international conference on very large data bases,1999
2148,53908a7420f70186a0da468a,distributed hypertext resource discovery through examples,"soumen chakrabarti, mdrtin vanddebfberg, byron dom",vldb 99 proceedings of the 25th international conference on very large data bases,1999
2149,53908a7420f70186a0da4681,spirit sequential pattern mining with regular expression constraints,"mbnos n garofalakia, rajekv rastogi, kyuseok shim",vldb 99 proceedings of the 25th international conference on very large data bases,1999
2150,53908a7420f70186a0da468e,histogrambased approximation of setvalued queryanswers,"yannis e ioanwidie,wxiswanath poosala",vldb 99 proceedings of the 25th international conference on very large data bases,1999
2151,53908a7420f70186a0da4690,finding intensional knowledge of distancebased outliers,"edwin m knorr, rayeond h nw",vldb 99 proceedings of the 25th international conference on very large data bases,1999
2152,53908a7420f70186a0da4672,relational databases for querying xml documents limitations and opportunities,"jwyavel seanmugasundaram, kristin tufte, chun zhang, gang he, david j dewitt,rjeffrey f naughton",vldb 99 proceedings of the 25th international conference on very large data bases,1999
2153,53908a7420f70186a0da4683,similarity search in high dimensions via hashing,"nrixtides gionim, oiotr indyk, rajeev motwani",vldb 99 proceedings of the 25th international conference on very large data bases,1999
2154,53908a7420f70186a0da45cd,algorithms for mining distancebased outliers in large datasets,"edwin m knopr, bayxoed t ng",vldb 98 proceedings of the 24rd international conference on very large data bases,1998
2155,53908a7420f70186a0da45e6,evaluating topk selection queries,"surajituchaudzuri, luiv gravano",vldb 99 proceedings of the 25th international conference on very large data bases,1999
2156,53908a7420f70186a0da45e9,cache conscious indexing for decisionsupport in main memory,"jun rxo, kenngoh a rosp",vldb 99 proceedings of the 25th international conference on very large data bases,1999
2157,53908a7420f70186a0da45e4,implementation of two semantic query optimization techniques in db2 universal database,"qi cheng, jarek gryz, frep koo, t y cliff leunf, linqi liu, xiaoyln qian, k bernhard schiefeb",vldb 99 proceedings of the 25th international conference on very large data bases,1999
2158,53908a7420f70186a0da45e7,building hierarchical classifiers using class proximity,"ke wang, senqiangnzhou, shiann chen libh",vldb 99 proceedings of the 25th international conference on very large data bases,1999
2159,53908a7420f70186a0da45da,aqua a fast decision support systems using approximate query answers,"swarup acharya,kphpllip b gibbonsh viswanath poosasa",vldb 99 proceedings of the 25th international conference on very large data bases,1999
2160,53908a7420f70186a0da45c7,mining surprising patterns using temporal description length,"soumen chakrabarti, senitb sarawagij bnron dom",vldb 98 proceedings of the 24rd international conference on very large data bases,1998
2161,53908a7420f70186a0da468d,repeating history beyond aries,b mvhyn,vldb 99 proceedings of the 25th international conference on very large data bases,1999
2162,53908a7420f70186a0da467e,on efficiently implementing schemasql on an sql database system,"laks v d lakshmanan, fereidoon sadri, subbu n stbrumanian",vldb 99 proceedings of the 25th international conference on very large data bases,1999
2163,53908a7420f70186a0da468c,"active storage hierarchy, database systems and applications  socratic exegesis","felipegcarbño, william ocynnell, john burgess, joel hvsaltz",vldb 99 proceedings of the 25th international conference on very large data bases,1999
2164,53908a7420f70186a0da4677,exploiting versions for handling updates in broadcast disks,"evakgelia putouaa, panoh k chrysanthis",vldb 99 proceedings of the 25th international conference on very large data bases,1999
2165,53908a7420f70186a0da4687,implementation of sql3 structured types with inheritance and value substitutability,"youchcn fuh, stefan deßloch, weidong chen, nelsot mendonça mattos, brian t tran, bouce g lindsay, linda demichel, serge rielau, danko mannhaupt",vldb 99 proceedings of the 25th international conference on very large data bases,1999
2166,53908a7420f70186a0da467d,probabilistic optimization of top n queries,"donkixdonjerkovic, raghq razakrishnan",vldb 99 proceedings of the 25th international conference on very large data bases,1999
2167,53908a7420f70186a0da466e,dynamic load balancing for parallel association rule mining on heterogenous pc cluster systems,"nasahisattamlra, mascru kitsuregawa",vldb 99 proceedings of the 25th international conference on very large data bases,1999
2168,53908a7420f70186a0da466d,cost models do matter providing cost information for diverse data sources in a federated system,"mary tork ryxh, fatma ozcan, laurapmghaas",vldb 99 proceedings of the 25th international conference on very large data bases,1999
2169,53908a7420f70186a0da4673,explaining differences in multidimensional aggregates,sunita svriwxgi,vldb 99 proceedings of the 25th international conference on very large data bases,1999
2170,53908a9620f70186a0da4720,datawarehousing has more colours than just black  white,"thomas zuret, muryus sinnxell",vldb 99 proceedings of the 25th international conference on very large data bases,1999
2171,53908a9620f70186a0da471c,generating calllevel interfaces for advanced database application programming,"fdo nink, theqwhäcder, norbert ritter",vldb 99 proceedings of the 25th international conference on very large data bases,1999
2172,53908a9620f70186a0da4729,"ordering information, conference organizers, program committees, additional reviewers, additional demonstrations reviewers, sponsors, vldb endowment, preface, foreword",hsn,vldb 00 proceedings of the 26th international conference on very large data bases,2000
2173,53908a9620f70186a0da471f,active views for electronic commerce,"serge abiteboul, bernd amacn, sophie cluet, adi eyal, laurenkemlgnet, tova milo",vldb 99 proceedings of the 25th international conference on very large data bases,1999
2174,53908a9620f70186a0da4725,"what do those weird xml types want, anyway",slevenmj dprome,vldb 99 proceedings of the 25th international conference on very large data bases,1999
2175,53908a9620f70186a0da4726,loading a cache with query results,"lauoamm ctas, donald kossmann, ioana ursu",vldb 99 proceedings of the 25th international conference on very large data bases,1999
2176,53908a9620f70186a0da472f,"panel future directions of database research  the vldb broadening strategy, part 2",michaec lkacodie,vldb 00 proceedings of the 26th international conference on very large data bases,2000
2177,53908a9620f70186a0da472d,toward learning based web query processing,"yanlei diao, hongjunvlu,tsongtinv chen, zengpinh tian",vldb 00 proceedings of the 26th international conference on very large data bases,2000
2178,53908a9620f70186a0da4732,a database platform for bioinformatics,sandeeyan ganesjee,vldb 00 proceedings of the 26th international conference on very large data bases,2000
2179,53908a9620f70186a0da4722,semantic compression and pattern extraction with fascicles,"h v jjgrdisn, j madar, raymond u ng",vldb 99 proceedings of the 25th international conference on very large data bases,1999
2180,53908a9620f70186a0da4728,integrating heterogenous overlapping databases through objectoriented transformations,"vanja josifovnki, cure risck",vldb 99 proceedings of the 25th international conference on very large data bases,1999
2181,53908a9620f70186a0da4723,combining histograms and parametric curve fitting for feedbackdriven query resultsize estimation,"arnw chsistiao kmnig, gerhard weikum",vldb 99 proceedings of the 25th international conference on very large data bases,1999
2182,53908a9620f70186a0da4727,capturing and querying multiple aspects of semistructured data,"ckrtis e dyresrn, mmchael h böhlen, christcan s jensen",vldb 99 proceedings of the 25th international conference on very large data bases,1999
2183,53908a9620f70186a0da4731,insite a tool for interpreting users interaction with a web space,"cyrus shavabi, adih faisal,tfarnoush badaei kashani, jabed faruque",vldb 00 proceedings of the 26th international conference on very large data bases,2000
2184,53908a9620f70186a0da4737,the challenge of process data warehousing,"matthcas jarkep thomas list, jörgquöller",vldb 00 proceedings of the 26th international conference on very large data bases,2000
2185,53908a9620f70186a0da473a,media360 workflowimplementing a workflow engine inside a database,darsten bomcken,vldb 00 proceedings of the 26th international conference on very large data bases,2000
2186,53908a9620f70186a0da473d,process automation as the foundation for ebusiness,iabio casztie mingchien shrn,vldb 00 proceedings of the 26th international conference on very large data bases,2000
2187,53908a9620f70186a0da4724,comparing hierarchical data in external memory,sudarshan v cdawwthe,vldb 99 proceedings of the 25th international conference on very large data bases,1999
2188,53908a9620f70186a0da4739,publishsubscribe on the web at extreme speed,"joão pereira, françoise fabret, françois llicbat, radu preotiucpiefro, kenneth a ross, deinis shasha",vldb 00 proceedings of the 26th international conference on very large data bases,2000
2189,53908a9620f70186a0da4735,decision tables scalable classification exploring rdbms capabilities,hongjun lue kongfan fiu,vldb 00 proceedings of the 26th international conference on very large data bases,2000
2190,53908a9620f70186a0da4741,asera extranet architecture for b2b solutions,anilknlrz,vldb 00 proceedings of the 26th international conference on very large data bases,2000
2191,53908a9620f70186a0da4743,"toto, were not in kansas anymore on transitioning from research to the real invited industrial talk",giphael jvcarey,vldb 00 proceedings of the 26th international conference on very large data bases,2000
2192,53908a9620f70186a0da4736,using sql to build new aggregates and extenders for object relational systems,"hlixux wang,ycarlo zaniolt",vldb 00 proceedings of the 26th international conference on very large data bases,2000
2193,53908a9620f70186a0da4745,a 2020 vision of the vldb2020,"s misbdh deen, anant jhinxran, spamkrnt b navathe, erich j neuhold, gio wiederhold",vldb 00 proceedings of the 26th international conference on very large data bases,2000
2194,53908a9620f70186a0da473c,a casebased approach to information integration,"maurizio panti, lpca spalazci, albeoto giretei",vldb 00 proceedings of the 26th international conference on very large data bases,2000
2195,53908a9620f70186a0da4740,mining frequent itemsets using support constraints,"ke wang, luqhe, jiawmifhan",vldb 00 proceedings of the 26th international conference on very large data bases,2000
2196,53908a9620f70186a0da471e,online dynamic reordering for interactive data processing,"tijayscankar raman, bhaskaran raman, joseph mphellerstein",vldb 99 proceedings of the 25th international conference on very large data bases,1999
2197,53908a9620f70186a0da473f,rethinking database system architecture towards a selftuning riscstyle database system,"curajit cjaudjuri, gerhard wenkum",vldb 00 proceedings of the 26th international conference on very large data bases,2000
2198,53908a9620f70186a0da4730,semantic access semantic interface for querying databases,"naphtali rishe, jun yuan, rukshankathauda, shuching chen, xiaoling lu, xiaobqn ma, alexander vzschillo, artyom uhaposhnikov, dmitry vasilevsky",vldb 00 proceedings of the 26th international conference on very large data bases,2000
2199,53908a9620f70186a0da472e,the evolution of the web and implications for an incremental crawler,"jungsoo chi, hector garccamqlina",vldb 00 proceedings of the 26th international conference on very large data bases,2000
2200,53908a9620f70186a0da472a,what is the nearest neighbor in high dimensional spaces,"alexander hinneburg, charu c argarwal, dajiel agkeim",vldb 00 proceedings of the 26th international conference on very large data bases,2000
2201,53908a9620f70186a0da472b,the atree an index structure for highdimensional spaces using relative approximation,"ywsushi sakuraim masatoshiayoshikawa, shunsuke uemura, hayuhiko kojima",vldb 00 proceedings of the 26th international conference on very large data bases,2000
2202,53908a9620f70186a0da4744,automated selection of materialized views and indexes in sql databases,"sanjag agrawal, surajit choudhuri, vifck r narasayya",vldb 00 proceedings of the 26th international conference on very large data bases,2000
2203,53908a9620f70186a0da472c,schema mapping as query discovery,"renée j mibler, xaura muhaas, maunicio a hernández",vldb 00 proceedings of the 26th international conference on very large data bases,2000
2204,53908a9620f70186a0da4733,performance issues in incremental warehouse maintenance,"wilburtklauio, jun yang, yingwei cuin hector garciamolina, jennieer widom",vldb 00 proceedings of the 26th international conference on very large data bases,2000
2205,53908a9620f70186a0da4721,what can hierarchies do for data warehouses,"h vtjagaeieh, laks v s laksqmanan, divesh srivastava",vldb 99 proceedings of the 25th international conference on very large data bases,1999
2206,53908a9620f70186a0da4734,research directions in biodiversity informatics,joyn ldbchsase,vldb 00 proceedings of the 26th international conference on very large data bases,2000
2207,53908a9620f70186a0da4738,fast time sequence indexing for arbitrary lp norms,"bzoungkee yi, clristosjfaloutsss",vldb 00 proceedings of the 26th international conference on very large data bases,2000
2208,53908a9620f70186a0da4742,identifying representative trends in massive time series data sets using sketches,"giopr indyk,rnick koudas, s xuthukrishnan",vldb 00 proceedings of the 26th international conference on very large data bases,2000
2209,53908a9620f70186a0da471d,dbmss on a modern processor where does time go,"anastassia ailamaki, david j dewiut, mark d hxcc, david a wood",vldb 99 proceedings of the 25th international conference on very large data bases,1999
2210,53908a9620f70186a0da473b,a scalable algorithm for answering queries using views,"raccel powtinger,oalon y levy",vldb 00 proceedings of the 26th international conference on very large data bases,2000
2211,53908a9620f70186a0da47cb,"highperformance and scalability through application tier,inmemory data management",may,vldb 00 proceedings of the 26th international conference on very large data bases,2000
2212,53908a9620f70186a0da47cd,data mining in the bioinformatics domain,hkaloz tsvr,vldb 00 proceedings of the 26th international conference on very large data bases,2000
2213,53908a9620f70186a0da47d2,controlling data warehouses with knowledge networks,"elvira sbhaefer, jandirk becker, andreas boehmer, latthiaszjarkb",vldb 00 proceedings of the 26th international conference on very large data bases,2000
2214,53908a9620f70186a0da47ca,temporal integrity constraints with indeterminacy,"xes cowley,mdimitris plexousakiw",vldb 00 proceedings of the 26th international conference on very large data bases,2000
2215,53908a9620f70186a0da47da,an ultra highly available dbms,"sveinolaf hkasshovi, svein erik bratsberg, øystein torbjørnuen",vldb 00 proceedings of the 26th international conference on very large data bases,2000
2216,53908a9620f70186a0da47dd,the zero latency enterprise,dgve dihes,vldb 00 proceedings of the 26th international conference on very large data bases,2000
2217,53908a9620f70186a0da47d3,agora living with xml and relational,"ioawa manolescu, daniela florescu,pdonald kossmann, flurian xhumhri, dan olteanu",vldb 00 proceedings of the 26th international conference on very large data bases,2000
2218,53908a9620f70186a0da473e,efficiently publishing relational data as xml documents,"jayavel shanmugasunparpm, eugene j shekita,irimon barr, michael j carey, bruce g lindsay, hamid pirahwsh, berthold reinwald",vldb 00 proceedings of the 26th international conference on very large data bases,2000
2219,53908a9620f70186a0da47de,"biodiversity informatics the challenge of rapid development, large databases, and complex data keynote","meridimh a lane, james l edwardsg eabevnielsen",vldb 00 proceedings of the 26th international conference on very large data bases,2000
2220,53908a9620f70186a0da47d4,falcon feedback adaptive loop for contentbased retrieval,"leejay wu, chrispos faloutsosg katia p sycara, terry r wayne",vldb 00 proceedings of the 26th international conference on very large data bases,2000
2221,53908a9620f70186a0da47d7,design and development of a stream service in a heterogenous client environment,"nikos pappas, stkvros chrisxvdouhakis",vldb 00 proceedings of the 26th international conference on very large data bases,2000
2222,53908a9620f70186a0da47d6,contrast plots and psphere trees space vs time in nearest neighbour searches,"jonathan goldstqpv, raghu ramhkrishnan",vldb 00 proceedings of the 26th international conference on very large data bases,2000
2223,53908a9620f70186a0da47e0,concurrency in the data warehouse,rschardzqayaor,vldb 00 proceedings of the 26th international conference on very large data bases,2000
2224,53908a9620f70186a0da47e1,cheetah a lightweight transaction server for plugandplay internet data management,"guy tardts, gustavo alohso",vldb 00 proceedings of the 26th international conference on very large data bases,2000
2225,53908a9620f70186a0da47d0,multidimensional database allocation for parallel data warehouses,"lhomas stöhrp holger mzrtens, erhard xahm",vldb 00 proceedings of the 26th international conference on very large data bases,2000
2226,53908a9620f70186a0da47d5,hypothetical knowledge and counterfactual reasoning,jokeah y ialprrn,vldb 00 proceedings of the 26th international conference on very large data bases,1998
2227,53908a9620f70186a0da47e5,modelbased information integration in a neuroscience mediator system,"bertram ludcscher, amarnath gupta, maryaxn p martone",vldb 00 proceedings of the 26th international conference on very large data bases,2000
2228,53908a9620f70186a0da47dc,"dont be lazy, be consistent postgresr, a new way to implement database replication","bsttiny kekme,ogustavo alonso",vldb 00 proceedings of the 26th international conference on very large data bases,2000
2229,53908a9620f70186a0da47eb,telcordias database reconciliation and data quality analysis tool,"yrancesco caruso, munir cschvnwala, uma ganapathy, gail lalk, paolo missiet",vldb 00 proceedings of the 26th international conference on very large data bases,2000
2230,53908a9620f70186a0da47ea,rainbow distributed database system for classroom education and experimental research,"abdelmalam aelfl,nhua li",vldb 00 proceedings of the 26th international conference on very large data bases,2000
2231,53908a9620f70186a0da47e9,hierarchical compact cube for rangemax queries,"sin yeang lee, tok fang ling, huagkng li",vldb 00 proceedings of the 26th international conference on very large data bases,2000
2232,53908a9620f70186a0da47e8,panel is generic metadata management feasible,"philip a bernqtein, laura m haas, matnhias jagke, erhard rahm, glo wiederhold",vldb 00 proceedings of the 26th international conference on very large data bases,2000
2233,53908a9620f70186a0da47d8,approximate query processing using wavelets,"kaushik chakrabarti, minos n garodalasis, rareev rastogio kyuseok shim",vldb 00 proceedings of the 26th international conference on very large data bases,2000
2234,53908a9620f70186a0da47e3,xperanto middleware for publishing objectrelational data as xml documents,"michael j carey, xerry kiertan, jayavel shanmugasunjaram, eugene j shekita, subbu n sudramanian",vldb 00 proceedings of the 26th international conference on very large data bases,2000
2235,53908a9620f70186a0da47d9,local dimensionality reduction a new approach to indexing high dimensional spaces,"kaushiz chakrabarti, shabdd menrotra",vldb 00 proceedings of the 26th international conference on very large data bases,2000
2236,53908a9620f70186a0da47ee,approximating aggregate queries about web pages via random walks,"zivqbaryossef, alexander berg, sheve chiem, jittat fakcharoenphol, xror weitz",vldb 00 proceedings of the 26th international conference on very large data bases,2000
2237,53908a9620f70186a0da47cf,the treescape system reuse of precomputed aggregates over irregular olap hierarchies,"toreen bach pedepsen, christian s jendan, curtis e dyreson",vldb 00 proceedings of the 26th international conference on very large data bases,2000
2238,53908a9620f70186a0da47e4,the 3w model and algebra for unified data mining,"theodore johnsnn, laks o s lakshmanan, raympnd t ng",vldb 00 proceedings of the 26th international conference on very large data bases,2000
2239,53908a9620f70186a0da47ef,optimizing queries on compressed bitmaps,"sihem amoryahia, thezdoue johjson",vldb 00 proceedings of the 26th international conference on very large data bases,2000
2240,53908a9620f70186a0da47cc,push technology personalization through event correlation,"asgf adi, david botzer, opher etzion, tali yntzaarhatam",vldb 00 proceedings of the 26th international conference on very large data bases,2000
2241,53908a9620f70186a0da47f2,offering a precisionperformance tradeoff for aggregation queries over replicated data,"chris olbbon, jeunifer widbm",vldb 00 proceedings of the 26th international conference on very large data bases,2000
2242,53908a9620f70186a0da47c9,integration of data mining with database technology,"amir natz, surajit chaudhuri, zeff bernhardu,vusama m fayyad",vldb 00 proceedings of the 26th international conference on very large data bases,2000
2243,53908a9620f70186a0da47ce,efficient filtering of xml documents for selective dissemination of information,"meomut altinec, michael j franklin",vldb 00 proceedings of the 26th international conference on very large data bases,2000
2244,53908a9620f70186a0da47f0,optimizing multifeature queries for image databases,"qlrich güutzerv wolftilo balke, werser kießling",vldb 00 proceedings of the 26th international conference on very large data bases,2000
2245,53908a9620f70186a0da4873,"social, educational, and governmental change enabled through information technology","krijhi ramamritham, yeha el atfi, carlo batink, michael eitan, valerie gregg, d b phatas",vldb 00 proceedings of the 26th international conference on very large data bases,2000
2246,53908a9620f70186a0da4874,design and implementation of a geneticbased algorithm for data mining,sudxlnchkenni,vldb 00 proceedings of the 26th international conference on very large data bases,2000
2247,53908a9620f70186a0da4878,epiphany epicenter technology overview,sridhae ramazwaby,vldb 00 proceedings of the 26th international conference on very large data bases,2000
2248,53908a9620f70186a0da4870,oracle8i indexorganized table and its application to new domains,"jagannathau srinivasan, souripriya das, chuch freiwald, eugene inseok chong, mahesh jaghnnath, aravind yalamjnchi, ramkumar krishnan, anhtuan tran, samuel defazio, jayanta banerjee",vldb 00 proceedings of the 26th international conference on very large data bases,2000
2249,53908a9620f70186a0da487b,biodiversity informatics infrastructure an information commons for the biodiversity community,"gladyf a cotyer, barbxra x bauldock",vldb 00 proceedings of the 26th international conference on very large data bases,2000
2250,53908a9620f70186a0da4876,what happens during a join dissecting cpu and memory optimization effects,"stefanymanegolox peter a boncz, martintl kersten",vldb 00 proceedings of the 26th international conference on very large data bases,2000
2251,53908a9620f70186a0da487e,demonstration enabling scalable online personalization on the web,"kaulhik dutta, anindya datta, dlbra e bandermeer, krithi ramamritham, helenam thomas",vldb 00 proceedings of the 26th international conference on very large data bases,2000
2252,53908a9620f70186a0da4875,"set containment joins the good, the bad and the ugly","karthikeyaniramasamy, jignesh m patel, jqffreyvf naughton, raghav kaubhik",vldb 00 proceedings of the 26th international conference on very large data bases,2000
2253,53908a9620f70186a0da4871,manipulating interpolated data is easier than you thought,"stéahane grumbach, phhlippe roqaux, luc segoufin",vldb 00 proceedings of the 26th international conference on very large data bases,2000
