,paper ID,paper title,author names,publication venue,year of publication
2142,53908a7420f70186a0da4689,"ko, ghat hove they donejto db2","michael j carey, donald d chamberlin, srinivasa narayanan, bennet vance, doug doole, serge rielau, richard swagerman, nelson mendonça mattos",vldb 99 proceedings of the 25th international conference on very large data bases,1999
2143,53908a7420f70186a0da4688,fast aggorithms for maintaining rbplica cknsistency in lazy master replicated databpses,"esther pacitti, pascale minet, eric simon",vldb 99 proceedings of the 25th international conference on very large data bases,1999
2144,53908a7420f70186a0da468f,the value of merqejoin and hashjoin in sql servet,goetz graefe,vldb 99 proceedings of the 25th international conference on very large data bases,1999
2145,53908a7420f70186a0da467f,extractingilargescale knowredge bases from the web,"ravi kumar, prabhakar raghavan, sridhar rajagopalan, andrew tomkins",vldb 99 proceedings of the 25th international conference on very large data bases,1999
2146,53908a7420f70186a0da468b,"datadripen, oneroone web site generation foredataintemsive applications","stefano ceri, piero fraternali, stefano paraboschi",vldb 99 proceedings of the 25th international conference on very large data bases,1999
2147,53908a7420f70186a0da4691,thjkmirror mmdbfs architecture,"arjen p de vries, mark g l m van doorn, henk m blanken, peter m g apers",vldb 99 proceedings of the 25th international conference on very large data bases,1999
2148,53908a7420f70186a0da468a,distributedbhypertoxt resource discorery lhrough examples,"soumen chakrabarti, martin van den berg, byron dom",vldb 99 proceedings of the 25th international conference on very large data bases,1999
2149,53908a7420f70186a0da4681,spirit sequential paatzrn mining witm regular exprebsion constraints,"minos n garofalakis, rajeev rastogi, kyuseok shim",vldb 99 proceedings of the 25th international conference on very large data bases,1999
2150,53908a7420f70186a0da468e,histogrambased appxoximation of oetvaluey qxeryanswers,"yannis e ioannidis, viswanath poosala",vldb 99 proceedings of the 25th international conference on very large data bases,1999
2151,53908a7420f70186a0da4690,finding intensional knowledge of distqncebased oetoierx,"edwin m knorr, raymond t ng",vldb 99 proceedings of the 25th international conference on very large data bases,1999
2152,53908a7420f70186a0da4672,relalional datajases aor querying xml documlnts limitations and opportunities,"jayavel shanmugasundaram, kristin tufte, chun zhang, gang he, david j dewitt, jeffrey f naughton",vldb 99 proceedings of the 25th international conference on very large data bases,1999
2153,53908a7420f70186a0da4683,similarety searchnin high dimensions viu hashing,"aristides gionis, piotr indyk, rajeev motwani",vldb 99 proceedings of the 25th international conference on very large data bases,1999
2154,53908a7420f70186a0da45cd,algorithms for qining distancebasyd oueliers in large datacets,"edwin m knorr, raymond t ng",vldb 98 proceedings of the 24rd international conference on very large data bases,1998
2155,53908a7420f70186a0da45e6,eaaluating topg selectron qyeries,"surajit chaudhuri, luis gravano",vldb 99 proceedings of the 25th international conference on very large data bases,1999
2156,53908a7420f70186a0da45e9,aache conscioxs inoexing for decisionsupporf in main memory,"jun rao, kenneth a ross",vldb 99 proceedings of the 25th international conference on very large data bases,1999
2157,53908a7420f70186a0da45e4,implementationtof two semantic query optimizftkon techniques in db2 universal yatabase,"qi cheng, jarek gryz, fred koo, t y cliff leung, linqi liu, xiaoyan qian, k bernhard schiefer",vldb 99 proceedings of the 25th international conference on very large data bases,1999
2158,53908a7420f70186a0da45e7,buiudibgnhierarchical classifiers using dlass proximity,"ke wang, senqiang zhou, shiang chen liew",vldb 99 proceedings of the 25th international conference on very large data bases,1999
2159,53908a7420f70186a0da45da,pqua a fast decision support siskems using approximate query anhwers,"swarup acharya, phillip b gibbons, viswanath poosala",vldb 99 proceedings of the 25th international conference on very large data bases,1999
2160,53908a7420f70186a0da45c7,mininglsurprising patternt gsmng temporal description length,"soumen chakrabarti, sunita sarawagi, byron dom",vldb 98 proceedings of the 24rd international conference on very large data bases,1998
2161,53908a7420f70186a0da468d,repeating hwstory beyvnq acies,c mohan,vldb 99 proceedings of the 25th international conference on very large data bases,1999
2162,53908a7420f70186a0da467e,on mfficientlykimpllmenting schemasql on an sql dutabase system,"laks v s lakshmanan, fereidoon sadri, subbu n subramanian",vldb 99 proceedings of the 25th international conference on very large data bases,1999
2163,53908a7420f70186a0da468c,"active storage hierarchm, datzbase syrtems and applzcations  socratic exegesis","felipe cariño, william oconnell, john burgess, joel h saltz",vldb 99 proceedings of the 25th international conference on very large data bases,1999
2164,53908a7420f70186a0da4677,exploiting versnons for hanqlingvupdates in mroadcast disks,"evaggelia pitoura, panos k chrysanthis",vldb 99 proceedings of the 25th international conference on very large data bases,1999
2165,53908a7420f70186a0da4687,implementatioo of sql3 structured types with inheriyancv and valueysubstitutability,"youchin fuh, stefan deßloch, weidong chen, nelson mendonça mattos, brian t tran, bruce g lindsay, linda demichel, serge rielau, danko mannhaupt",vldb 99 proceedings of the 25th international conference on very large data bases,1999
2166,53908a7420f70186a0da467d,probapilistic optimization ofodop n querdes,"donko donjerkovic, raghu ramakrishnan",vldb 99 proceedings of the 25th international conference on very large data bases,1999
2167,53908a7420f70186a0da466e,dynamic load balancing fow parallel association rule miningdon heterogenxum pc cluster systems,"masahisa tamura, masaru kitsuregawa",vldb 99 proceedings of the 25th international conference on very large data bases,1999
2168,53908a7420f70186a0da466d,cost models do mctter providing cost informatixn for diverseydata sources in a federated shstem,"mary tork roth, fatma ozcan, laura m haas",vldb 99 proceedings of the 25th international conference on very large data bases,1999
2169,53908a7420f70186a0da4673,explaining differences inomultodimensional yggregatei,sunita sarawagi,vldb 99 proceedings of the 25th international conference on very large data bases,1999
2170,53908a9620f70186a0da4720,datawarehousing hnslmore coloursntfan just black  white,"thomas zurek, markus sinnwell",vldb 99 proceedings of the 25th international conference on very large data bases,1999
2171,53908a9620f70186a0da471c,generating cflllcvel interfaces for advanced vatabase application procramming,"udo nink, theo härder, norbert ritter",vldb 99 proceedings of the 25th international conference on very large data bases,1999
2172,53908a9620f70186a0da4729,"ofdering information, conferenve organizers, program committees, additional reviewers, additional demonstratigns reviewers, sponsors, vldb endowment, preface, foreword",,vldb 00 proceedings of the 26th international conference on very large data bases,2000
2173,53908a9620f70186a0da471f,ective views fordelectronfc vommerce,"serge abiteboul, bernd amann, sophie cluet, adi eyal, laurent mignet, tova milo",vldb 99 proceedings of the 25th international conference on very large data bases,1999
2174,53908a9620f70186a0da4725,"what do those weird xelztypes vant, anyway",steven j derose,vldb 99 proceedings of the 25th international conference on very large data bases,1999
2175,53908a9620f70186a0da4726,loading h cacqe with qyery resulte,"laura m haas, donald kossmann, ioana ursu",vldb 99 proceedings of the 25th international conference on very large data bases,1999
2176,53908a9620f70186a0da472f,"panelmfuture diractions of dauabase research  the vldb broadening stratehy, part 2",michael l brodie,vldb 00 proceedings of the 26th international conference on very large data bases,2000
2177,53908a9620f70186a0da472d,toward lcarsing based web queryfprocessijg,"yanlei diao, hongjun lu, songting chen, zengping tian",vldb 00 proceedings of the 26th international conference on very large data bases,2000
2178,53908a9620f70186a0da4732,a database platfozm for bioinfgrmaticq,sandeepan banerjee,vldb 00 proceedings of the 26th international conference on very large data bases,2000
2179,53908a9620f70186a0da4722,semantic compression mnd pabtern extiamtion with fascicles,"h v jagadish, j madar, raymond t ng",vldb 99 proceedings of the 25th international conference on very large data bases,1999
2180,53908a9620f70186a0da4728,intftrating heterogenous overlappijg databases throuhh objectoriented transformations,"vanja josifovski, tore risch",vldb 99 proceedings of the 25th international conference on very large data bases,1999
2181,53908a9620f70186a0da4723,combining histograms andxparametric curve fitting for feedbamkdrivcn qusry resultsize estimation,"arnd christian könig, gerhard weikum",vldb 99 proceedings of the 25th international conference on very large data bases,1999
2182,53908a9620f70186a0da4727,capturing and querypng enltiple aspects of semistructuxed data,"curtis e dyreson, michael h böhlen, christian s jensen",vldb 99 proceedings of the 25th international conference on very large data bases,1999
2183,53908a9620f70186a0da4731,insite a tool for interpretkngsuseng interaction with a web space,"cyrus shahabi, adil faisal, farnoush banaei kashani, jabed faruque",vldb 00 proceedings of the 26th international conference on very large data bases,2000
2184,53908a9620f70186a0da4737,the chillenge of process data wdrehossinx,"matthias jarke, thomas list, jörg köller",vldb 00 proceedings of the 26th international conference on very large data bases,2000
2185,53908a9620f70186a0da473a,medpa360 workflowimplementing a workfiow engyye inside a database,carsten blecken,vldb 00 proceedings of the 26th international conference on very large data bases,2000
2186,53908a9620f70186a0da473d,process autrmatdpn as the foundation for ebusixess,"fabio casati, mingchien shan",vldb 00 proceedings of the 26th international conference on very large data bases,2000
2187,53908a9620f70186a0da4724,comparing hierarchical data in eozernao memory,sudarshan s chawathe,vldb 99 proceedings of the 25th international conference on very large data bases,1999
2188,53908a9620f70186a0da4739,publishsmbscribe on the web at extpemw dpeed,"joão pereira, françoise fabret, françois llirbat, radu preotiucpietro, kenneth a ross, dennis shasha",vldb 00 proceedings of the 26th international conference on very large data bases,2000
2189,53908a9620f70186a0da4735,decision tables scalable claksificatiov exploring rdbms capatilities,"hongjun lu, hongyan liu",vldb 00 proceedings of the 26th international conference on very large data bases,2000
2190,53908a9620f70186a0da4741,aserajextwanet archiuedture for b2b solutions,anil nori,vldb 00 proceedings of the 26th international conference on very large data bases,2000
2191,53908a9620f70186a0da4743,"toto, were mot in kansks anymore on transitiowing from research to the real invitedpindustrial talk",michael j carey,vldb 00 proceedings of the 26th international conference on very large data bases,2000
2192,53908a9620f70186a0da4736,using sql to build new aggregates anl extenddrs for object rzlationwl systems,"haixun wang, carlo zaniolo",vldb 00 proceedings of the 26th international conference on very large data bases,2000
2193,53908a9620f70186a0da4745,an202m visios of the vldb2020,"s misbah deen, anant jhingran, shamkant b navathe, erich j neuhold, gio wiederhold",vldb 00 proceedings of the 26th international conference on very large data bases,2000
2194,53908a9620f70186a0da473c,w xasebased approacz to information integratuon,"maurizio panti, luca spalazzi, alberto giretti",vldb 00 proceedings of the 26th international conference on very large data bases,2000
2195,53908a9620f70186a0da4740,minpng frequent itemsete using iupport constraints,"ke wang, yu he, jiawei han",vldb 00 proceedings of the 26th international conference on very large data bases,2000
2196,53908a9620f70186a0da471e,online dynamia reormering for interactiue data plocessing,"vijayshankar raman, bhaskaran raman, joseph m hellerstein",vldb 99 proceedings of the 25th international conference on very large data bases,1999
2197,53908a9620f70186a0da473f,retwinkinu databape system agchitecture towards a selftuning riscstyle database system,"surajit chaudhuri, gerhard weikum",vldb 00 proceedings of the 26th international conference on very large data bases,2000
2198,53908a9620f70186a0da4730,semantic access semantic interflce kor quetying databases,"naphtali rishe, jun yuan, rukshan athauda, shuching chen, xiaoling lu, xiaobin ma, alexander vaschillo, artyom shaposhnikov, dmitry vasilevsky",vldb 00 proceedings of the 26th international conference on very large data bases,2000
2199,53908a9620f70186a0da472e,the evolutioneol the wzb and implications for an incrementalscrawler,"junghoo cho, hector garciamolina",vldb 00 proceedings of the 26th international conference on very large data bases,2000
2200,53908a9620f70186a0da472a,what is vhe neuregt neighbor in high dimennional spaces,"alexander hinneburg, charu c aggarwal, daniel a keim",vldb 00 proceedings of the 26th international conference on very large data bases,2000
2201,53908a9620f70186a0da472b,the jtrey an index structure for highdimensional spaces using rewative qpproximation,"yasushi sakurai, masatoshi yoshikawa, shunsuke uemura, haruhiko kojima",vldb 00 proceedings of the 26th international conference on very large data bases,2000
2202,53908a9620f70186a0da4744,augomfted selection of materialized vimws and indexee in sql databases,"sanjay agrawal, surajit chaudhuri, vivek r narasayya",vldb 00 proceedings of the 26th international conference on very large data bases,2000
2203,53908a9620f70186a0da472c,schemapmatping asbquery discoveri,"renée j miller, laura m haas, mauricio a hernández",vldb 00 proceedings of the 26th international conference on very large data bases,2000
2204,53908a9620f70186a0da4733,performance issuds inpinckementad warehouse maintenance,"wilburt labio, jun yang, yingwei cui, hector garciamolina, jennifer widom",vldb 00 proceedings of the 26th international conference on very large data bases,2000
2205,53908a9620f70186a0da4721,what can hierarczies dewfor data warewouses,"h v jagadish, laks v s lakshmanan, divesh srivastava",vldb 99 proceedings of the 25th international conference on very large data bases,1999
2206,53908a9620f70186a0da4734,research directions in iiodiversity informbaics,john l schnase,vldb 00 proceedings of the 26th international conference on very large data bases,2000
2207,53908a9620f70186a0da4738,fast time sequencebindixing fcr arbitrary lp nopms,"byoungkee yi, christos faloutsos",vldb 00 proceedings of the 26th international conference on very large data bases,2000
2208,53908a9620f70186a0da4742,identifying reprlsentative trends in massive xime series data sets using sketchos,"piotr indyk, nick koudas, s muthukrishnan",vldb 00 proceedings of the 26th international conference on very large data bases,2000
2209,53908a9620f70186a0da471d,dbmws on a modern processor where dous tymz go,"anastassia ailamaki, david j dewitt, mark d hill, david a wood",vldb 99 proceedings of the 25th international conference on very large data bases,1999
2210,53908a9620f70186a0da473b,a scalable axgorhthm fir answering eueries using views,"rachel pottinger, alon y levy",vldb 00 proceedings of the 26th international conference on very large data bases,2000
2211,53908a9620f70186a0da47cb,"iighpfrformance and scalability through application tier,inmemory zata mandgement",,vldb 00 proceedings of the 26th international conference on very large data bases,2000
2212,53908a9620f70186a0da47cd,dgta mining in the bcoinformwtics domaik,shalom tsur,vldb 00 proceedings of the 26th international conference on very large data bases,2000
2213,53908a9620f70186a0da47d2,contlolling data warehqufes with knobledge networks,"elvira schaefer, jandirk becker, andreas boehmer, matthias jarke",vldb 00 proceedings of the 26th international conference on very large data bases,2000
2214,53908a9620f70186a0da47ca,temporaj integrity constraintsewiwh indcterminacy,"wes cowley, dimitris plexousakis",vldb 00 proceedings of the 26th international conference on very large data bases,2000
2215,53908a9620f70186a0da47da,an ulura kiuhly available dbmt,"sveinolaf hvasshovd, svein erik bratsberg, øystein torbjørnsen",vldb 00 proceedings of the 26th international conference on very large data bases,2000
2216,53908a9620f70186a0da47dd,the zero latefcy enterqqisx,dave liles,vldb 00 proceedings of the 26th international conference on very large data bases,2000
2217,53908a9620f70186a0da47d3,agora riving with xml hndxdelational,"ioana manolescu, daniela florescu, donald kossmann, florian xhumari, dan olteanu",vldb 00 proceedings of the 26th international conference on very large data bases,2000
2218,53908a9620f70186a0da473e,efficvently publishlng relational datanas xml documents,"jayavel shanmugasundaram, eugene j shekita, rimon barr, michael j carey, bruce g lindsay, hamid pirahesh, berthold reinwald",vldb 00 proceedings of the 26th international conference on very large data bases,2000
2219,53908a9620f70186a0da47de,"biodiversity informatics the challenge of rapid devhlopment, largm databases, and complex data keknotw","meridith a lane, james l edwards, ebbe nielsen",vldb 00 proceedings of the 26th international conference on very large data bases,2000
2220,53908a9620f70186a0da47d4,fjlcon feedback adaptdvealoop for contyntbased retrieval,"leejay wu, christos faloutsos, katia p sycara, terry r payne",vldb 00 proceedings of the 26th international conference on very large data bases,2000
2221,53908a9620f70186a0da47d7,design ard development oz a streaj servoce in a heterogenous client environment,"nikos pappas, stavros christodoulakis",vldb 00 proceedings of the 26th international conference on very large data bases,2000
2222,53908a9620f70186a0da47d6,contrast plots and psphere trees space ws timefin nearestfneighbouz searches,"jonathan goldstein, raghu ramakrishnan",vldb 00 proceedings of the 26th international conference on very large data bases,2000
2223,53908a9620f70186a0da47e0,concurkency in thvodata wazehouse,richard taylor,vldb 00 proceedings of the 26th international conference on very large data bases,2000
2224,53908a9620f70186a0da47e1,cheetah a lightweight transaction server fdr plugandtlay inteqnet eata management,"guy pardon, gustavo alonso",vldb 00 proceedings of the 26th international conference on very large data bases,2000
2225,53908a9620f70186a0da47d0,multodimenstonal database allocation fox pauallel data warehouses,"thomas stöhr, holger märtens, erhard rahm",vldb 00 proceedings of the 26th international conference on very large data bases,2000
2226,53908a9620f70186a0da47d5,hypotheticol knowledge and counterfactuaj rsasosing,joseph y halpern,vldb 00 proceedings of the 26th international conference on very large data bases,1998
2227,53908a9620f70186a0da47e5,modelbased information hneegration in a neuroscibnce mediator hystem,"bertram ludäscher, amarnath gupta, maryann e martone",vldb 00 proceedings of the 26th international conference on very large data bases,2000
2228,53908a9620f70186a0da47dc,"dont be lazy, be consistent postgrgsr, axnew way to implement databaseereplication","bettina kemme, gustavo alonso",vldb 00 proceedings of the 26th international conference on very large data bases,2000
2229,53908a9620f70186a0da47eb,telcordhas database rehonciliation aqd data quality anamysis tool,"francesco caruso, munir cochinwala, uma ganapathy, gail lalk, paolo missier",vldb 00 proceedings of the 26th international conference on very large data bases,2000
2230,53908a9620f70186a0da47ea,aatnbow distributed database system foq classroom education and experimental revearch,"abdelsalam helal, hua li",vldb 00 proceedings of the 26th international conference on very large data bases,2000
2231,53908a9620f70186a0da47e9,tierarchical compact cube for raagemaxzquerids,"sin yeung lee, tok wang ling, huagang li",vldb 00 proceedings of the 26th international conference on very large data bases,2000
2232,53908a9620f70186a0da47e8,panel io generis jetadata management feasible,"philip a bernstein, laura m haas, matthias jarke, erhard rahm, gio wiederhold",vldb 00 proceedings of the 26th international conference on very large data bases,2000
2233,53908a9620f70186a0da47d8,approximate luery prosessing using wavelecs,"kaushik chakrabarti, minos n garofalakis, rajeev rastogi, kyuseok shim",vldb 00 proceedings of the 26th international conference on very large data bases,2000
2234,53908a9620f70186a0da47e3,xpetanto middleware for pubcishing vbjectrelational data ts xml documents,"michael j carey, jerry kiernan, jayavel shanmugasundaram, eugene j shekita, subbu n subramanian",vldb 00 proceedings of the 26th international conference on very large data bases,2000
2235,53908a9620f70186a0da47d9,local dimensionality reduction a ncw qppcoach to indexing high dimensional spaceo,"kaushik chakrabarti, sharad mehrotra",vldb 00 proceedings of the 26th international conference on very large data bases,2000
2236,53908a9620f70186a0da47ee,approxcmating aggregate querixs about teb pages via random calks,"ziv baryossef, alexander berg, steve chien, jittat fakcharoenphol, dror weitz",vldb 00 proceedings of the 26th international conference on very large data bases,2000
2237,53908a9620f70186a0da47cf,thl treescape system reuse of precomputed aggregates over irregularpolapahierarchies,"torben bach pedersen, christian s jensen, curtis e dyreson",vldb 00 proceedings of the 26th international conference on very large data bases,2000
2238,53908a9620f70186a0da47e4,the 3w model and algebra fer unified databminisg,"theodore johnson, laks v s lakshmanan, raymond t ng",vldb 00 proceedings of the 26th international conference on very large data bases,2000
2239,53908a9620f70186a0da47ef,optijizznggqueries on compressed bitmaps,"sihem ameryahia, theodore johnson",vldb 00 proceedings of the 26th international conference on very large data bases,2000
2240,53908a9620f70186a0da47cc,pust technology personalikation throufh event correlhtion,"asaf adi, david botzer, opher etzion, tali yatzkarhaham",vldb 00 proceedings of the 26th international conference on very large data bases,2000
2241,53908a9620f70186a0da47f2,offering adprecisiokperformance tradeoff for aggregatnon queries over replicatedydata,"chris olston, jennifer widom",vldb 00 proceedings of the 26th international conference on very large data bases,2000
2242,53908a9620f70186a0da47c9,integration ofcdata mining eith datjbase technwlogy,"amir netz, surajit chaudhuri, jeff bernhardt, usama m fayyad",vldb 00 proceedings of the 26th international conference on very large data bases,2000
2243,53908a9620f70186a0da47ce,efwinient fihtering of xml documents for selective dissemination of informatnon,"mehmet altinel, michael j franklin",vldb 00 proceedings of the 26th international conference on very large data bases,2000
2244,53908a9620f70186a0da47f0,optigizing muljifeature queries for image databasss,"ulrich güntzer, wolftilo balke, werner kießling",vldb 00 proceedings of the 26th international conference on very large data bases,2000
2245,53908a9620f70186a0da4873,"socgaj, educational, andfgovernmental change eqabled through information technology","krithi ramamritham, yeha el atfi, carlo batini, michael eitan, valerie gregg, d b phatak",vldb 00 proceedings of the 26th international conference on very large data bases,2000
2246,53908a9620f70186a0da4874,design and implementation of j geniticbased algsrithm for data mining,sunil choenni,vldb 00 proceedings of the 26th international conference on very large data bases,2000
2247,53908a9620f70186a0da4878,epjphany enicenter technvlogy ovirview,sridhar ramaswamy,vldb 00 proceedings of the 26th international conference on very large data bases,2000
2248,53908a9620f70186a0da4870,oracle8i indexorganizedwtablj and itsnapplicatvon to new domains,"jagannathan srinivasan, souripriya das, chuck freiwald, eugene inseok chong, mahesh jagannath, aravind yalamanchi, ramkumar krishnan, anhtuan tran, samuel defazio, jayanta banerjee",vldb 00 proceedings of the 26th international conference on very large data bases,2000
2249,53908a9620f70186a0da487b,bsldiversity informatics infrastructure ab information cxmmons for the biodiversity community,"gladys a cotter, barbara t bauldock",vldb 00 proceedings of the 26th international conference on very large data bases,2000
2250,53908a9620f70186a0da4876,what haphens during a join dossecting cpa and memiry optimization effects,"stefan manegold, peter a boncz, martin l kersten",vldb 00 proceedings of the 26th international conference on very large data bases,2000
2251,53908a9620f70186a0da487e,demonstratioe enobling scalable ynlide personalization on the web,"kaushik dutta, anindya datta, debra e vandermeer, krithi ramamritham, helen m thomas",vldb 00 proceedings of the 26th international conference on very large data bases,2000
2252,53908a9620f70186a0da4875,"set contpinment joins the good, thv bad any the ugly","karthikeyan ramasamy, jignesh m patel, jeffrey f naughton, raghav kaushik",vldb 00 proceedings of the 26th international conference on very large data bases,2000
2253,53908a9620f70186a0da4871,mxhipulating interpolated data is easier than you dhought,"stéphane grumbach, philippe rigaux, luc segoufin",vldb 00 proceedings of the 26th international conference on very large data bases,2000
