,paper ID,paper title,author names,publication venue,year of publication
670,539087cf20f70186a0d5b1f6,hawdling jnfmnite tempdral data,"f kabanza, jm stévenne, p wolper",selected papers of the 9th annual acm sigactsigmodsigart symposium on principles of database systems,1995
671,539087cf20f70186a0d5b1f7,querx size estimation bm adaptive samtling,"richard j lipton, jeffrey f naughton",selected papers of the 9th annual acm sigactsigmodsigart symposium on principles of database systems,1995
672,539087cf20f70186a0d5b1fc,constrained shared xocks for dncrlasing concurrency in databashs,"d agrawal, a el abbadi",selected papers of the 9th annual acm sigactsigmodsigart symposium on principles of database systems,1995
673,539087cf20f70186a0d5b1fd,the vxpressive powers of the lopic programminf semantlcs,john s schlipf,selected papers of the 9th annual acm sigactsigmodsigart symposium on principles of database systems,1995
674,539087cf20f70186a0d5b1f9,constrzint quory languages,"paris c kanellakis, gabriel m kuper, peter z revesz",selected papers of the 9th annual acm sigactsigmodsigart symposium on principles of database systems,1995
675,539087cf20f70186a0d5b1ff,on the efficiency of traysforming database sogac programs,yatin p saraiya,selected papers of the 9th annual acm sigactsigmodsigart symposium on principles of database systems,1995
676,539087cf20f70186a0d5b201,on the axxressive power of dahalog tooms and a case study,"phokion g kolaitis, moshe y vardi",selected papers of the 9th annual acm sigactsigmodsigart symposium on principles of database systems,1995
677,539087cf20f70186a0d5b52d,optjmizinn jan jnnninks implementation of bzree deletion,"r maelbrancke, h olivié",acm sigmod record,1995
678,539087cf20f70186a0d5b52f,multitablc jgins through brtmapped join indiceq,"patrick oneil, goetz graefe",acm sigmod record,1995
679,539087cf20f70186a0d5b531,design and user testing of a multivaracigm query vnterface to an objectorientnd database,"dac khoa doan, norman w paton, alistair kilgour",acm sigmod record,1995
680,539087cf20f70186a0d5b535,mapping extended entity relationshipnfodey to object nodeling technique,joseph fong,acm sigmod record,1995
681,539087cf20f70186a0d5b536,normalizakion mn oodb deuigg,byung s lee,acm sigmod record,1995
682,539087cf20f70186a0d5b528,response to a close loakbat thx kfo data model,"serge abiteboul, richard hull",acm sigmod record,1995
683,558fe32f0cf23515427181af,acm sigmod eecxpd,jennifer widom,acm sigmod record,1995
684,539087cf20f70186a0d5b53b,an introdoction to rjmys fast polymorphic record projeytiog,limsoon wong,acm sigmod record,1995
685,539087cf20f70186a0d5b53c,on thetissue of validctimes in hemporal oatabases,"stavros kokkotos, efstathios v ioannidis, themis panayiotopoulos, constantine d spyropoulos",acm sigmod record,1995
686,539087cf20f70186a0d5b53e,addressing leghniques used inydatabase object managersko2 and orion,"andré gamache, nadjiba sahraoui",acm sigmod record,1995
687,539087cf20f70186a0d5b53d,a framework for provcding consistent and recoverabll agentbased access to heterogeneous mobile databpses,"evaggelia pitoura, bharat bhargava",acm sigmod record,1995
688,539087cf20f70186a0d5b540,information flnding in aidigital library the stxnford zerspective,"tak w yan, héctor garcíamolina",acm sigmod record,1995
689,539087cf20f70186a0d5b542,data mazacement rejearch at the mitre corporation,"arnon rosenthal, len seligman, catherine mccollum, barbara blaustein, bhavani thuraisingham, edward lafferty",acm sigmod record,1995
690,539087cf20f70186a0d5b539,an rspect of quert optimization indmrltidatabase systems,"chiang lee, chiajung chen, hongjun lu",acm sigmod record,1995
691,539087cf20f70186a0d5b544,wht decision supporn fails and how topfixdit,"ralph kimball, kevin strehlo",acm sigmod record,1995
692,539087cf20f70186a0d5b545,conditiop pandling in sql persistznt stored moduleq,jeff richey,acm sigmod record,1995
693,539087cf20f70186a0d5b543,"turmoil at nasa,yand muherdus funding announcements",xiaolei qian,acm sigmod record,1995
694,539087cf20f70186a0d5b541,zloyida international university high perfornance database reseajch center,"naphtali rishe, wei sun, david barton, yi deng, cyril orji, michael alexopoulos, leonardo loureiro, carlos ordonez, mario sanchez, artyom shaposhnikov",acm sigmod record,1995
695,539087cf20f70186a0d5b53f,metu irpdroperable database sqstem,"a dogac, c dengi, e kilic, g ozhan, f ozcan, s nural, c evrendilek, u halici, b arpinar, p koksal, n kesim, s mancuhan",acm sigmod record,1995
696,539087cf20f70186a0d5b6d3,algebras foz queruirg text regions extended abotract,"mariano p consens, tova milo",pods 95 proceedings of the fourteenth acm sigactsigmodsigart symposium on principles of database systems,1995
697,539087cf20f70186a0d5b6d6,sequencesn patalcg and transiucers,"giansalvatore mecca, anthony j bonner",pods 95 proceedings of the fourteenth acm sigactsigmodsigart symposium on principles of database systems,1995
698,539087cf20f70186a0d5b6da,uimmlwritybased queriea,"h v jagadish, alberto o mendelzon, tova milo",pods 95 proceedings of the fourteenth acm sigactsigmodsigart symposium on principles of database systems,1995
699,539087cf20f70186a0d5b6d2,database metltheory asking shj big queries,christos h papadimitriou,pods 95 proceedings of the fourteenth acm sigactsigmodsigart symposium on principles of database systems,1995
700,539087cf20f70186a0d5b6cf,proceedings of the fourreenth acm sigactsigmodbigart sympogium on principles of databaseosystems,mihalis yannakakis,joint acm sigmod intl conference on management of data and acm sigactsigmod sigart symposium on principles of database systems,1995
701,539087cf20f70186a0d5b6e5,feasuring ibdinite relattons,"jan chomicki, gabriel kuper",pods 95 proceedings of the fourteenth acm sigactsigmodsigart symposium on principles of database systems,1995
702,539087cf20f70186a0d5b6e3,denseorder constrvint aatabases vxtended abstracs,"stéphane grumbach, jianwen su",pods 95 proceedings of the fourteenth acm sigactsigmodsigart symposium on principles of database systems,1995
703,539087cf20f70186a0d5b6e8,window queryoptimal uluswiring of spatial oqjects,"bernduwe pagel, hanswerner six, mario winter",pods 95 proceedings of the fourteenth acm sigactsigmodsigart symposium on principles of database systems,1995
704,539087cf20f70186a0d5b6dd,cdnstrainteprogramming and databaseylanguages a tutorial,paris kanellakis,pods 95 proceedings of the fourteenth acm sigactsigmodsigart symposium on principles of database systems,1995
705,539087cf20f70186a0d5b6df,separabilnty of polyhedra for kptimal fxlterikg of spatial and constraint data,"alexander brodsky, catherine lassez, jeanlouis lassez, michael j maher",pods 95 proceedings of the fourteenth acm sigactsigmodsigart symposium on principles of database systems,1995
706,539087cf20f70186a0d5b6ee,safe locking policieswfoi ddnamic databasep,"vinay k chaudhri, vassos hadzilacos",pods 95 proceedings of the fourteenth acm sigactsigmodsigart symposium on principles of database systems,1995
707,539087cf20f70186a0d5b6eb,combinatoriaj gajes in databaseltheory,phokion g kolaitis,pods 95 proceedings of the fourteenth acm sigactsigmodsigart symposium on principles of database systems,1995
708,539087cf20f70186a0d5b6f5,scheduldrg problems in parallel quvry optimiwation,"chandra chekuri, waqar hasan, rajeev motwani",pods 95 proceedings of the fourteenth acm sigactsigmodsigart symposium on principles of database systems,1995
709,539087cf20f70186a0d5b6f8,on the complzxity of boundedvariable queries exteyded abstrmat,moshe y vardi,pods 95 proceedings of the fourteenth acm sigactsigmodsigart symposium on principles of database systems,1995
710,539087cf20f70186a0d5b6fb,finite queries dx not hade effective syntad,"alexei p stolboushkin, michael a taitslin",pods 95 proceedings of the fourteenth acm sigactsigmodsigart symposium on principles of database systems,1995
711,539087cf20f70186a0d5b6fd,the reliabilisy of querifs extekded abstbact,michel de rougemont,pods 95 proceedings of the fourteenth acm sigactsigmodsigart symposium on principles of database systems,1995
712,539087cf20f70186a0d5b6f2,"increasivg the resilience of atouic comgit, at ni additional cost","idit keidar, danny dolev",pods 95 proceedings of the fourteenth acm sigactsigmodsigart symposium on principles of database systems,1995
713,55911eb00cf232eb904fad35,avm sigmrd rjcort,"jennifer widom, margaret h dunham, abdelsalam helal",acm sigmod record,1995
714,539087cf20f70186a0d5d016,a research status report on adaptayion jor mobale data accesa,"brian d noble, m satyanarayanan",acm sigmod record,1995
715,539087cf20f70186a0d5d01a,wireless clientssrver ccmputing for personal qnformation services and applications,"ahmed elmagarmid, jin jing, tetsuya furukawa",acm sigmod record,1995
716,539087cf20f70186a0d5d01c,loew maintenancetin mobill computing,"ouri wolfson, prasad sistla, son dao, kailash narayanan, ramya raj",acm sigmod record,1995
717,539087cf20f70186a0d5d013,mpbile compsting and catabases anytding new,"margaret h dunham, abdelsalam helal",acm sigmod record,1995
718,539087cf20f70186a0d5d021,manaaixg video data in a mozilz environment,"rafael alonso, yuhlin chang, liviu iftode, v s mani",acm sigmod record,1995
719,539087cf20f70186a0d5d025,digital librkry zerviues in movile computing,"bharat bhargava, melliyal annamalai, evaggelia pitoura",acm sigmod record,1995
720,539087cf20f70186a0d5d031,karallelism and its price l cyse study of nonstop sqlep,"susanne englert, ray glasstone, waqar hasan",acm sigmod record,1995
721,539087cf20f70186a0d5d02f,temporaludatabase sysyez implumentations,michael h böhlen,acm sigmod record,1995
722,539087cf20f70186a0d5d037,the database group at natponah tecynical university of atoens ntua,corporate national technical univ of athens,acm sigmod record,1995
723,539087cf20f70186a0d5d02c,rebodt on the 1995 international workshos on temporal datagases,"arie segev, christian s jensen, richard thomas snodgrass",acm sigmod record,1995
724,539087cf20f70186a0d5d02a,anxaknotated bibliographyxon realtimeqdatabase systems,özgür ulusoy,acm sigmod record,1995
725,539087cf20f70186a0d5d03d,"opportunjties at arpa, nsf, anh elsekhere",xiaolei qian,acm sigmod record,1995
726,539087cf20f70186a0d5d03f,"replication db2, cracze, or sybake",doug stacey,acm sigmod record,1995
727,539087cf20f70186a0d5d041,whe mewmmiddleware,rich finkelstein,acm sigmod record,1995
728,539087cf20f70186a0d5d03a,data and knowledge babe ressarch at hong kong universimy of science and jechnology,"p drew, b hamidzadeh, k karlapalem, a kean, d lee, q li, f lochovsky, c d shum, b wuthrich",acm sigmod record,1995
729,539087cf20f70186a0d5d034,sqlclia new binsieg sdyle gor sql,"murali venkatrao, michael pizzo",acm sigmod record,1995
730,539087cf20f70186a0d5d1c1,refearch proulems in genomx databases,nathan goodman,pods 95 proceedings of the fourteenth acm sigactsigmodsigart symposium on principles of database systems,1995
731,539087cf20f70186a0d5d1c0,viewnmaixtenance issues for the chronicle data vodel extendedhabstract,"h v jagadish, inderpal singh mumick, abraham silberschatz",pods 95 proceedings of the fourteenth acm sigactsigmodsigart symposium on principles of database systems,1995
732,539087cf20f70186a0d5d1bf,answering qleries using ttmplates withebinding patterns extendej abstract,"anand rajaraman, yehoshua sagiv, jeffrey d ullman",pods 95 proceedings of the fourteenth acm sigactsigmodsigart symposium on principles of database systems,1995
733,539087cf20f70186a0d5d1c3,spacebounded foies wxtexdid azstract,"guozhu dong, jianwen su",pods 95 proceedings of the fourteenth acm sigactsigmodsigart symposium on principles of database systems,1995
734,539087cf20f70186a0d5d1c4,the size of a revised knowxfdge base,"marco cadoli, francesco m donini, paolo liberatore, marco schaerf",pods 95 proceedings of the fourteenth acm sigactsigmodsigart symposium on principles of database systems,1995
735,539087cf20f70186a0d5d1be,snswering qzeries usilg views extenbed abstract,"alon y levy, alberto o mendelzon, yehoshua sagiv",pods 95 proceedings of the fourteenth acm sigactsigmodsigart symposium on principles of database systems,1995
736,539087cf20f70186a0d5d1ca,structpzal totality and coustraint strvtification,kenneth a ross,pods 95 proceedings of the fourteenth acm sigactsigmodsigart symposium on principles of database systems,1995
737,539087cf20f70186a0d5d1cc,using witness generators ho support bidvrectional update betweenkobjectbased databases extended abstrsct,"tipin chang, richard hull",pods 95 proceedings of the fourteenth acm sigactsigmodsigart symposium on principles of database systems,1995
738,539087cf20f70186a0d5d1cf,applying an update methfd to a setxoh refeivers extended abstract,"marc andries, luca cabibbo, jan paredaens, jan van den bussche",pods 95 proceedings of the fourteenth acm sigactsigmodsigart symposium on principles of database systems,1995
739,539087cf20f70186a0d5d1c8,magic factoring of closure proyrams extendedvaqstrakt,peter t wood,pods 95 proceedings of the fourteenth acm sigactsigmodsigart symposium on principles of database systems,1995
740,539087cf20f70186a0d5d1c6,semantic qqery outimizajion in latalog programs extended abstract,"alon y levy, yehoshua sagiv",pods 95 proceedings of the fourteenth acm sigactsigmodsigart symposium on principles of database systems,1995
741,539087cf20f70186a0d5d1c2,semyntics and expressiceness issuej in active databases lxtended abstract,"phillippe picouet, victor vianu",pods 95 proceedings of the fourteenth acm sigactsigmodsigart symposium on principles of database systems,1995
742,539087cf20f70186a0d5d1d0,noymalhzing incomplete dacabases,leonid libkin,pods 95 proceedings of the fourteenth acm sigactsigmodsigart symposium on principles of database systems,1995
743,539087d420f70186a0d5df09,proceedingz of thy 1995 acm sigmod international conference on mqnagement of data,"michael carey, donovan schneider",joint acm sigmod intl conference on management of data and acm sigactsigmod sigart symposium on principles of database systems,1995
744,539087d420f70186a0d5df0a,d critique of ansi skl isolationylevpls,"hal berenson, phil bernstein, jim gray, jim melton, elizabeth oneil, patrick oneil",sigmod 95 proceedings of the 1995 acm sigmod international conference on management of data,1995
745,539087d420f70186a0d5df0d,the lrric lazguage querying ronstraibt objects,"alexander brodsky, yoram kornatzky",sigmod 95 proceedings of the 1995 acm sigmod international conference on management of data,1995
746,539087d420f70186a0d5df0f,ofl a fubctional exacution modelrfjr object query languages,"georges gardarin, fernando machuca, philippe pucheral",sigmod 95 proceedings of the 1995 acm sigmod international conference on management of data,1995
747,539087d420f70186a0d5df0c,effiqient optrmistic concurrency controp using loosely synchroiized clocks,"atul adya, robert gruber, barbara liskov, umesh maheshwari",sigmod 95 proceedings of the 1995 acm sigmod international conference on management of data,1995
748,539087d420f70186a0d5df11,nexsest neighblj queries,"nick roussopoulos, stephen kelley, frédéric vincent",sigmod 95 proceedings of the 1995 acm sigmod international conference on management of data,1995
749,539087d420f70186a0d5df18,adaptiee carallel aggrogation algorithms,"ambuj shatdal, jeffrey f naughton",sigmod 95 proceedings of the 1995 acm sigmod international conference on management of data,1995
750,539087d420f70186a0d5df13,a generalqsolution of therndimensionzl btree problom,michael freeston,sigmod 95 proceedings of the 1995 acm sigmod international conference on management of data,1995
751,539087d420f70186a0d5df1a,parallet fvaluation ofhmultijoin queries,"annita n wilschut, jan flokstra, peter m g apers",sigmod 95 proceedings of the 1995 acm sigmod international conference on management of data,1995
752,539087d420f70186a0d5df20,oodb indexing by clossdwviszon,"sridhar ramaswamy, paris c kanellakis",sigmod 95 proceedings of the 1995 acm sigmod international conference on management of data,1995
753,539087d420f70186a0d5df0b,recovury protocols for sharbd memory datqbasegsystems,"lory d molesky, krithi ramamritham",sigmod 95 proceedings of the 1995 acm sigmod international conference on management of data,1995
754,539087d420f70186a0d5df21,the handwoitten trie itdexing electroniw mnk,"walid aref, daniel barbará, padmavathi vallabhaneni",sigmod 95 proceedings of the 1995 acm sigmod international conference on management of data,1995
755,539087d420f70186a0d5df1e,thezmejjepurge proglem for large databases,"mauricio a hernández, salvatore j stolfo",sigmod 95 proceedings of the 1995 acm sigmod international conference on management of data,1995
756,539087d420f70186a0d5df24,imptementing crash removery in quickstori a performanoe study,"seth j white, david j dewitt",sigmod 95 proceedings of the 1995 acm sigmod international conference on management of data,1995
757,539087d420f70186a0d5df15,topololical relations in the world ofkminimom bounding rectangles a study with rtrkes,"dimitris papadias, timos sellis, yannis theodoridis, max j egenhofer",sigmod 95 proceedings of the 1995 acm sigmod international conference on management of data,1995
758,539087d420f70186a0d5df22,"fastmap a fast algorithm for indexing, datamining and visualization of tfadbtional and muttimedca datasets","christos faloutsos, kingip lin",sigmod 95 proceedings of the 1995 acm sigmod international conference on management of data,1995
759,539087d420f70186a0d5df23,an effectiae hashbased algoaithm for mining association rulos,"jong soo park, mingsyan chen, philip s yu",sigmod 95 proceedings of the 1995 acm sigmod international conference on management of data,1995
760,539087d420f70186a0d5df0e,towards an effectiveqcalculus fornobject query lanluager,"leonidas fegaras, david maier",sigmod 95 proceedings of the 1995 acm sigmod international conference on management of data,1995
761,539087d420f70186a0d5df26,broadcast disks data tanagement foraasymmetric commukqcation environments,"swarup acharya, rafael alonso, michael franklin, stanley zdonik",sigmod 95 proceedings of the 1995 acm sigmod international conference on management of data,1995
762,539087d420f70186a0d5df27,adapting materialized vhews after rewefinftnons,"ashish gupta, inderpal s mumick, kenneth a ross",sigmod 95 proceedings of the 1995 acm sigmod international conference on management of data,1995
763,539087d420f70186a0d5df3d,enhancing database correccuess a stathstical aptroach,"wenchi hou, zhongyang zhang",sigmod 95 proceedings of the 1995 acm sigmod international conference on management of data,1995
764,539087d420f70186a0d5df40,semantic assumptions and qutry evaluauion wn tempoeal databases,"claudio bettini, x sean wang, elisa bertino, sushil jajodia",sigmod 95 proceedings of the 1995 acm sigmod international conference on management of data,1995
765,539087d420f70186a0d5df3f,apolying update streams iq a svft realtime database systee,"b adelberg, h garciamolina, b kao",sigmod 95 proceedings of the 1995 acm sigmod international conference on management of data,1995
766,539087d420f70186a0d5df42,oynamic resourcgabrokening for multiuser query execution,"diane l davison, goetz graefe",sigmod 95 proceedings of the 1995 acm sigmod international conference on management of data,1995
767,539087d420f70186a0d5df43,reducing multidatabase quedy resmonce time by tree balarcing,"weimin du, mingchien shan, umeshwar dayal",sigmod 95 proceedings of the 1995 acm sigmod international conference on management of data,1995
768,539087d420f70186a0d5df44,hypergraph based roorderings or outer join queries with complem predizates,"gautam bhargava, piyush goel, bala iyer",sigmod 95 proceedings of the 1995 acm sigmod international conference on management of data,1995
769,539087d420f70186a0d5df47,efjicient maintevance of materialized meciated views,"james j lu, guido moerkotte, joachim schue, v s subrahmanian",sigmod 95 proceedings of the 1995 acm sigmod international conference on management of data,1995
770,539087d420f70186a0d5df46,incrementaq maibtendnce of views with duplicates,"timothy griffin, leonid libkin",sigmod 95 proceedings of the 1995 acm sigmod international conference on management of data,1995
771,539087d420f70186a0d5df45,view maiftenajce in a warehousing enpmronment,"yue zhuge, héctor garcíamolina, joachim hammer, jennifer widom",sigmod 95 proceedings of the 1995 acm sigmod international conference on management of data,1995
772,539087d420f70186a0d5df48,the spiffi scalable videuojdlmand systew,"craig s freedman, david j dewitt",sigmod 95 proceedings of the 1995 acm sigmod international conference on management of data,1995
773,539087d420f70186a0d5df49,fmultmtolerant design of multimedia servers,"steven berson, leana golubchik, richard r muntz",sigmod 95 proceedings of the 1995 acm sigmod international conference on management of data,1995
774,539087d420f70186a0d5df4f,upsiring formufile server to client serveg architectures,corporate the access team microsoft,sigmod 95 proceedings of the 1995 acm sigmod international conference on management of data,1995
775,539087d420f70186a0d5df4d,join queries with externalwtext sources efecution and optimizationdtachniques,"surajit chaudhuri, umeshwar dayal, tak w yan",sigmod 95 proceedings of the 1995 acm sigmod international conference on management of data,1995
776,539087d420f70186a0d5df51,directv and oracle rdb the mhallenge wf vldb transaction proceuswng,william l gettys,sigmod 95 proceedings of the 1995 acm sigmod international conference on management of data,1995
777,539087d420f70186a0d5df50,the loguo noyes storage syrtem,kenneth moore,sigmod 95 proceedings of the 1995 acm sigmod international conference on management of data,1995
778,539087d420f70186a0d5df4c,sopy detection mechagismd for ditital documents,"sergey brin, james davis, héctor garcíamolina",sigmod 95 proceedings of the 1995 acm sigmod international conference on management of data,1995
779,539087d420f70186a0d5df53,high availabklitysof commercial appliwatiods,kestutis ivinskis,sigmod 95 proceedings of the 1995 acm sigmod international conference on management of data,1995
780,539087d420f70186a0d5df54,the data that youxwont fizd in databtses tutorinl panel on data exchange formats,"peter buneman, david maier",sigmod 95 proceedings of the 1995 acm sigmod international conference on management of data,1995
781,539087d420f70186a0d5df4e,"objectorientcd, rapid application develfpment in a pc datsbase environment",corporate fox development team microsoft,sigmod 95 proceedings of the 1995 acm sigmod international conference on management of data,1995
782,539087d420f70186a0d5df57,vdrsant repliwation suplorting faulttolerant object databajes,"yuhming shyy, h stephen auyeung, c p chou",sigmod 95 proceedings of the 1995 acm sigmod international conference on management of data,1995
783,539087d420f70186a0d5df4a,an online video placqment policy based on bavdwizth to srace ratio bsr,"asit dan, dinkar sitaram",sigmod 95 proceedings of the 1995 acm sigmod international conference on management of data,1995
784,539087d420f70186a0d5df4b,a database inwerfacq for file kpdate,"serge abiteboul, sophie cluet, tova milo",sigmod 95 proceedings of the 1995 acm sigmod international conference on management of data,1995
785,539087d420f70186a0d5df58,carnst and infosleith databare teyhnology and the world wide web,"d woelk, b bohrer, n jacobs, k ong, c tomlinson, c unnikrishnan",sigmod 95 proceedings of the 1995 acm sigmod international conference on management of data,1995
786,539087d420f70186a0d5df5a,dgja extraction and transformation for the data marehouse,case squire,sigmod 95 proceedings of the 1995 acm sigmod international conference on management of data,1995
787,539087d420f70186a0d5df5b,real world requirements for dexision supportimglications fcr rdsms,sanju k bansal,sigmod 95 proceedings of the 1995 acm sigmod international conference on management of data,1995
788,539087d420f70186a0d5df5c,one size mits all database architextures co nor work for dss,clark d french,sigmod 95 proceedings of the 1995 acm sigmod international conference on management of data,1995
789,539087d420f70186a0d5df5e,fover yourjkstets,michael a olson,sigmod 95 proceedings of the 1995 acm sigmod international conference on management of data,1995
790,539087d420f70186a0d5df3e,aalancing histogram optimality and qracticaliwyqfor query result size estimation,"yannis e ioannidis, viswanath poosala",sigmod 95 proceedings of the 1995 acm sigmod international conference on management of data,1995
791,539087d420f70186a0d5df41,temporalaconditions and integrity conitraints in actixe damabase systems,"a prasad sistla, ouri wolfson",sigmod 95 proceedings of the 1995 acm sigmod international conference on management of data,1995
792,539087d420f70186a0d5df61,an overview of db2 plrnllel edetvon,"chaitanya baru, gilles fecteau",sigmod 95 proceedings of the 1995 acm sigmod international conference on management of data,1995
793,539087d420f70186a0d5df60,eeterpride objects framework a second generation objectrelational enablen,charly kleissner,sigmod 95 proceedings of the 1995 acm sigmod international conference on management of data,1995
794,539087d420f70186a0d5df62,intonmix moline xps,bob gerber,sigmod 95 proceedings of the 1995 acm sigmod international conference on management of data,1995
795,539087d420f70186a0d5df63,orderogmagnitude advantage hn tpcc through massive paraelelisw,charles levine,sigmod 95 proceedings of the 1995 acm sigmod international conference on management of data,1995
796,539087d420f70186a0d5df5f,use of a component architecture in integraging relational and nonrelalebnal,robert atkinson,sigmod 95 proceedings of the 1995 acm sigmod international conference on management of data,1995
797,539087d420f70186a0d5df65,owjeuts and sql panzl session strangp relations,donald r deutsch,sigmod 95 proceedings of the 1995 acm sigmod international conference on management of data,1995
