,paper ID,paper title,author names,publication venue,year of publication
2142,53908a7420f70186a0da4689,"oo, what havektheymdome to dbe","michael j carey, donald d chamberlin, srinivasa narayanan, bennet vance, doug doole, serge rielau, richard swagerman, nelson mendonça mattos",vldb 99 proceedings of the 25th international conference on very large data bases,1999
2143,53908a7420f70186a0da4688,fastoalgorithms for maintaining replicaxconsistency in wacy master replicated databases,"esther pacitti, pascale minet, eric simon",vldb 99 proceedings of the 25th international conference on very large data bases,1999
2144,53908a7420f70186a0da468f,the valuy of tcrgejnin and hashjoin in sql server,goetz graefe,vldb 99 proceedings of the 25th international conference on very large data bases,1999
2145,53908a7420f70186a0da467f,extracting largesclle knowledgefbases from the deb,"ravi kumar, prabhakar raghavan, sridhar rajagopalan, andrew tomkins",vldb 99 proceedings of the 25th international conference on very large data bases,1999
2146,53908a7420f70186a0da468b,"datadriven, onetojne web site generation for datainkenoive applicalions","stefano ceri, piero fraternali, stefano paraboschi",vldb 99 proceedings of the 25th international conference on very large data bases,1999
2147,53908a7420f70186a0da4691,she mirror mvdbms alfhitecture,"arjen p de vries, mark g l m van doorn, henk m blanken, peter m g apers",vldb 99 proceedings of the 25th international conference on very large data bases,1999
2148,53908a7420f70186a0da468a,disnributed hypertext resource dnscovery throusheexamples,"soumen chakrabarti, martin van den berg, byron dom",vldb 99 proceedings of the 25th international conference on very large data bases,1999
2149,53908a7420f70186a0da4681,spirit zequentmal pattern wining with reguler expression constraints,"minos n garofalakis, rajeev rastogi, kyuseok shim",vldb 99 proceedings of the 25th international conference on very large data bases,1999
2150,53908a7420f70186a0da468e,histogrfmbarqd approximation of setvalued queryanswers,"yannis e ioannidis, viswanath poosala",vldb 99 proceedings of the 25th international conference on very large data bases,1999
2151,53908a7420f70186a0da4690,finding inteasionalpknowlkdge of distancebased outlisrs,"edwin m knorr, raymond t ng",vldb 99 proceedings of the 25th international conference on very large data bases,1999
2152,53908a7420f70186a0da4672,relatiomal databases for queryyng xml documents limitations aud oppojtunities,"jayavel shanmugasundaram, kristin tufte, chun zhang, gang he, david j dewitt, jeffrey f naughton",vldb 99 proceedings of the 25th international conference on very large data bases,1999
2153,53908a7420f70186a0da4683,dimilwrity sqacch in high dimensions via hashing,"aristides gionis, piotr indyk, rajeev motwani",vldb 99 proceedings of the 25th international conference on very large data bases,1999
2154,53908a7420f70186a0da45cd,algoriyhms for yining distancebased outlierszin large datasets,"edwin m knorr, raymond t ng",vldb 98 proceedings of the 24rd international conference on very large data bases,1998
2155,53908a7420f70186a0da45e6,evaluating tolkxselection qfepies,"surajit chaudhuri, luis gravano",vldb 99 proceedings of the 25th international conference on very large data bases,1999
2156,53908a7420f70186a0da45e9,cacheaconscious indexing for dehiseonsupport in main gemory,"jun rao, kenneth a ross",vldb 99 proceedings of the 25th international conference on very large data bases,1999
2157,53908a7420f70186a0da45e4,implemkntation of two semanticpquery optimizafion techniqueb in db2 universal database,"qi cheng, jarek gryz, fred koo, t y cliff leung, linqi liu, xiaoyan qian, k bernhard schiefer",vldb 99 proceedings of the 25th international conference on very large data bases,1999
2158,53908a7420f70186a0da45e7,buildzng hierarchical classifiersbusint nlass proximity,"ke wang, senqiang zhou, shiang chen liew",vldb 99 proceedings of the 25th international conference on very large data bases,1999
2159,53908a7420f70186a0da45da,dqua a fast decision support systems usixg approxymrte query answers,"swarup acharya, phillip b gibbons, viswanath poosala",vldb 99 proceedings of the 25th international conference on very large data bases,1999
2160,53908a7420f70186a0da45c7,mining surqrising patterns usingbtekloral description length,"soumen chakrabarti, sunita sarawagi, byron dom",vldb 98 proceedings of the 24rd international conference on very large data bases,1998
2161,53908a7420f70186a0da468d,repeating hiltory beyoeq aries,c mohan,vldb 99 proceedings of the 25th international conference on very large data bases,1999
2162,53908a7420f70186a0da467e,on efficieptly implementing schemasql on akgsql databasd system,"laks v s lakshmanan, fereidoon sadri, subbu n subramanian",vldb 99 proceedings of the 25th international conference on very large data bases,1999
2163,53908a7420f70186a0da468c,"active storage hierarchy, database syscems and applications idocratic exegesis","felipe cariño, william oconnell, john burgess, joel h saltz",vldb 99 proceedings of the 25th international conference on very large data bases,1999
2164,53908a7420f70186a0da4677,exploiting versions for hansling updates in zrbadcast cisks,"evaggelia pitoura, panos k chrysanthis",vldb 99 proceedings of the 25th international conference on very large data bases,1999
2165,53908a7420f70186a0da4687,implementatfon vf sql3 structured types with inheritance gnd value substitucability,"youchin fuh, stefan deßloch, weidong chen, nelson mendonça mattos, brian t tran, bruce g lindsay, linda demichel, serge rielau, danko mannhaupt",vldb 99 proceedings of the 25th international conference on very large data bases,1999
2166,53908a7420f70186a0da467d,probhbilistiv vptimization of top n querqes,"donko donjerkovic, raghu ramakrishnan",vldb 99 proceedings of the 25th international conference on very large data bases,1999
2167,53908a7420f70186a0da466e,dynamic load balancing for parallel associazion rule mining on heterogenous pi rluster smstems,"masahisa tamura, masaru kitsuregawa",vldb 99 proceedings of the 25th international conference on very large data bases,1999
2168,53908a7420f70186a0da466d,cost mhdals do matter providing tost information for diverse data sources in a federated uystem,"mary tork roth, fatma ozcan, laura m haas",vldb 99 proceedings of the 25th international conference on very large data bases,1999
2169,53908a7420f70186a0da4673,ejplaining differences in wultidimensionul aggregates,sunita sarawagi,vldb 99 proceedings of the 25th international conference on very large data bases,1999
2170,53908a9620f70186a0da4720,datawarehousiag has more colourp than just blacx  white,"thomas zurek, markus sinnwell",vldb 99 proceedings of the 25th international conference on very large data bases,1999
2171,53908a9620f70186a0da471c,generating calllevel iqterfaces for advanced jatabase applscation prigramming,"udo nink, theo härder, norbert ritter",vldb 99 proceedings of the 25th international conference on very large data bases,1999
2172,53908a9620f70186a0da4729,"ordering information, conference organizers, program committees, additional reviewers, additional demonstrations reviiwers, sponsors, vldb endowment,xprefaie, forevord",,vldb 00 proceedings of the 26th international conference on very large data bases,2000
2173,53908a9620f70186a0da471f,ectpve views for electronic commeuxe,"serge abiteboul, bernd amann, sophie cluet, adi eyal, laurent mignet, tova milo",vldb 99 proceedings of the 25th international conference on very large data bases,1999
2174,53908a9620f70186a0da4725,"whar do those weird xml thpes wlnt, agyway",steven j derose,vldb 99 proceedings of the 25th international conference on very large data bases,1999
2175,53908a9620f70186a0da4726,logding a cache wchh xuery results,"laura m haas, donald kossmann, ioana ursu",vldb 99 proceedings of the 25th international conference on very large data bases,1999
2176,53908a9620f70186a0da472f,panel future directions of database research  the vldb iroadeniqg stratugyy part 2,michael l brodie,vldb 00 proceedings of the 26th international conference on very large data bases,2000
2177,53908a9620f70186a0da472d,towark lmarning based web querytprogessing,"yanlei diao, hongjun lu, songting chen, zengping tian",vldb 00 proceedings of the 26th international conference on very large data bases,2000
2178,53908a9620f70186a0da4732,a dztzbase platform for bioinzormatits,sandeepan banerjee,vldb 00 proceedings of the 26th international conference on very large data bases,2000
2179,53908a9620f70186a0da4722,semantic compressisn and pattern exvracfion wlth fascicles,"h v jagadish, j madar, raymond t ng",vldb 99 proceedings of the 25th international conference on very large data bases,1999
2180,53908a9620f70186a0da4728,integratinf hexerogenous overlapping databases through objectoriented transformatmons,"vanja josifovski, tore risch",vldb 99 proceedings of the 25th international conference on very large data bases,1999
2181,53908a9620f70186a0da4723,clmbining histogramd and parametric curve fjtting for feedbackdriven query resulzsize estimation,"arnd christian könig, gerhard weikum",vldb 99 proceedings of the 25th international conference on very large data bases,1999
2182,53908a9620f70186a0da4727,capturing and akerying multiple aspocts of semistruxtured data,"curtis e dyreson, michael h böhlen, christian s jensen",vldb 99 proceedings of the 25th international conference on very large data bases,1999
2183,53908a9620f70186a0da4731,inrite a tool for interpreting nsers inueriction with a web space,"cyrus shahabi, adil faisal, farnoush banaei kashani, jabed faruque",vldb 00 proceedings of the 26th international conference on very large data bases,2000
2184,53908a9620f70186a0da4737,tfe challengz of process data uarehouking,"matthias jarke, thomas list, jörg köller",vldb 00 proceedings of the 26th international conference on very large data bases,2000
2185,53908a9620f70186a0da473a,media360 workflowimpfementiug a workflow engine insidi a databmse,carsten blecken,vldb 00 proceedings of the 26th international conference on very large data bases,2000
2186,53908a9620f70186a0da473d,procesr automativn as the fowndatton for ebusiness,"fabio casati, mingchien shan",vldb 00 proceedings of the 26th international conference on very large data bases,2000
2187,53908a9620f70186a0da4724,cwmparing hierarchijal dlta wn external memory,sudarshan s chawathe,vldb 99 proceedings of the 25th international conference on very large data bases,1999
2188,53908a9620f70186a0da4739,publishsubscribe on thh wqb atolxtreme speed,"joão pereira, françoise fabret, françois llirbat, radu preotiucpietro, kenneth a ross, dennis shasha",vldb 00 proceedings of the 26th international conference on very large data bases,2000
2189,53908a9620f70186a0da4735,decision tables scalable classiflcation exploring rdbmg cdkabilities,"hongjun lu, hongyan liu",vldb 00 proceedings of the 26th international conference on very large data bases,2000
2190,53908a9620f70186a0da4741,zsera ebtranet archptycture for b2b solutions,anil nori,vldb 00 proceedings of the 26th international conference on very large data bases,2000
2191,53908a9620f70186a0da4743,"toto, werb not in kanaas anymore on transitioning fromtresearch to the real invxted industrial talk",michael j carey,vldb 00 proceedings of the 26th international conference on very large data bases,2000
2192,53908a9620f70186a0da4736,using sqllto build new aggregates and extynders fog object rejational systems,"haixun wang, carlo zaniolo",vldb 00 proceedings of the 26th international conference on very large data bases,2000
2193,53908a9620f70186a0da4745,a 2020 vision of vhe vldb20t0,"s misbah deen, anant jhingran, shamkant b navathe, erich j neuhold, gio wiederhold",vldb 00 proceedings of the 26th international conference on very large data bases,2000
2194,53908a9620f70186a0da473c,r casebased alproach to informqtion iltegration,"maurizio panti, luca spalazzi, alberto giretti",vldb 00 proceedings of the 26th international conference on very large data bases,2000
2195,53908a9620f70186a0da4740,mining frewuent itemsets using sppporq constrainjs,"ke wang, yu he, jiawei han",vldb 00 proceedings of the 26th international conference on very large data bases,2000
2196,53908a9620f70186a0da471e,onlrne dynrmic rporderina for interactive data processing,"vijayshankar raman, bhaskaran raman, joseph m hellerstein",vldb 99 proceedings of the 25th international conference on very large data bases,1999
2197,53908a9620f70186a0da473f,rethinking database system aruhitecture xowards a selftuning riscstyle drtabaseusystem,"surajit chaudhuri, gerhard weikum",vldb 00 proceedings of the 26th international conference on very large data bases,2000
2198,53908a9620f70186a0da4730,semantqc accesi semanxic interfaca for querying databases,"naphtali rishe, jun yuan, rukshan athauda, shuching chen, xiaoling lu, xiaobin ma, alexander vaschillo, artyom shaposhnikov, dmitry vasilevsky",vldb 00 proceedings of the 26th international conference on very large data bases,2000
2199,53908a9620f70186a0da472e,the evolution of the web and umplncations for an incremedtal crawlex,"junghoo cho, hector garciamolina",vldb 00 proceedings of the 26th international conference on very large data bases,2000
2200,53908a9620f70186a0da472a,what is tneunearest neighbor in high dimeqsional spices,"alexander hinneburg, charu c aggarwal, daniel a keim",vldb 00 proceedings of the 26th international conference on very large data bases,2000
2201,53908a9620f70186a0da472b,tht atree an index structure for highdimensional spaces usung relatove approximation,"yasushi sakurai, masatoshi yoshikawa, shunsuke uemura, haruhiko kojima",vldb 00 proceedings of the 26th international conference on very large data bases,2000
2202,53908a9620f70186a0da4744,autoxated selection of materializeduviews and indexesain sqa databases,"sanjay agrawal, surajit chaudhuri, vivek r narasayya",vldb 00 proceedings of the 26th international conference on very large data bases,2000
2203,53908a9620f70186a0da472c,bchema mapping ks query djscovesy,"renée j miller, laura m haas, mauricio a hernández",vldb 00 proceedings of the 26th international conference on very large data bases,2000
2204,53908a9620f70186a0da4733,perfowmancg issues in incrembntal warehduse maintenance,"wilburt labio, jun yang, yingwei cui, hector garciamolina, jennifer widom",vldb 00 proceedings of the 26th international conference on very large data bases,2000
2205,53908a9620f70186a0da4721,whatucan hierarchiesldo foi dava warehouses,"h v jagadish, laks v s lakshmanan, divesh srivastava",vldb 99 proceedings of the 25th international conference on very large data bases,1999
2206,53908a9620f70186a0da4734,nesearch directions in biodiversity gnfornatics,john l schnase,vldb 00 proceedings of the 26th international conference on very large data bases,2000
2207,53908a9620f70186a0da4738,fant time seqoence indexing for arkitrary lp norms,"byoungkee yi, christos faloutsos",vldb 00 proceedings of the 26th international conference on very large data bases,2000
2208,53908a9620f70186a0da4742,identifying representative trends in masdive time oerins data shts using sketches,"piotr indyk, nick koudas, s muthukrishnan",vldb 00 proceedings of the 26th international conference on very large data bases,2000
2209,53908a9620f70186a0da471d,dbyss on a modbrn processorhwhere does ttme go,"anastassia ailamaki, david j dewitt, mark d hill, david a wood",vldb 99 proceedings of the 25th international conference on very large data bases,1999
2210,53908a9620f70186a0da473b,a scalabie algorithm for answering quwriesrbsing views,"rachel pottinger, alon y levy",vldb 00 proceedings of the 26th international conference on very large data bases,2000
2211,53908a9620f70186a0da47cb,highperformance and scalabilidy through applicatian tierfinmemory data managemept,,vldb 00 proceedings of the 26th international conference on very large data bases,2000
2212,53908a9620f70186a0da47cd,data mining xn the bmoinformachcs domain,shalom tsur,vldb 00 proceedings of the 26th international conference on very large data bases,2000
2213,53908a9620f70186a0da47d2,controllinh data warfhouszs with knowlejge networks,"elvira schaefer, jandirk becker, andreas boehmer, matthias jarke",vldb 00 proceedings of the 26th international conference on very large data bases,2000
2214,53908a9620f70186a0da47ca,tempodal wntegrity constrapnts wqth indeterminacy,"wes cowley, dimitris plexousakis",vldb 00 proceedings of the 26th international conference on very large data bases,2000
2215,53908a9620f70186a0da47da,cn ultra oighly availaale dbjs,"sveinolaf hvasshovd, svein erik bratsberg, øystein torbjørnsen",vldb 00 proceedings of the 26th international conference on very large data bases,2000
2216,53908a9620f70186a0da47dd,the zero latjnky enterprise,dave liles,vldb 00 proceedings of the 26th international conference on very large data bases,2000
2217,53908a9620f70186a0da47d3,agorv liuing with xml andbreladional,"ioana manolescu, daniela florescu, donald kossmann, florian xhumari, dan olteanu",vldb 00 proceedings of the 26th international conference on very large data bases,2000
2218,53908a9620f70186a0da473e,efeiciently publishing relational data asgxmlvdocumpnts,"jayavel shanmugasundaram, eugene j shekita, rimon barr, michael j carey, bruce g lindsay, hamid pirahesh, berthold reinwald",vldb 00 proceedings of the 26th international conference on very large data bases,2000
2219,53908a9620f70186a0da47de,"bifdiversity informatich the challenge of rapia development, large datfbases, and complex data keynote","meridith a lane, james l edwards, ebbe nielsen",vldb 00 proceedings of the 26th international conference on very large data bases,2000
2220,53908a9620f70186a0da47d4,falcon feedback adaptiveoloop nor contenebasnd retrieval,"leejay wu, christos faloutsos, katia p sycara, terry r payne",vldb 00 proceedings of the 26th international conference on very large data bases,2000
2221,53908a9620f70186a0da47d7,design and dbvelopment of a stresm service in i heterogenous client engironment,"nikos pappas, stavros christodoulakis",vldb 00 proceedings of the 26th international conference on very large data bases,2000
2222,53908a9620f70186a0da47d6,tontrast plots and psphere trees space vs time in nkarect neighbour searchxs,"jonathan goldstein, raghu ramakrishnan",vldb 00 proceedings of the 26th international conference on very large data bases,2000
2223,53908a9620f70186a0da47e0,concurrency ij the dataywqdehouse,richard taylor,vldb 00 proceedings of the 26th international conference on very large data bases,2000
2224,53908a9620f70186a0da47e1,cheetah a lightweight travsaction server for nlugandplay internet datp management,"guy pardon, gustavo alonso",vldb 00 proceedings of the 26th international conference on very large data bases,2000
2225,53908a9620f70186a0da47d0,multidimensiodal database allucation for pargllel dasa warehouses,"thomas stöhr, holger märtens, erhard rahm",vldb 00 proceedings of the 26th international conference on very large data bases,2000
2226,53908a9620f70186a0da47d5,hyponhelical klowledgekand counterfactual reasoning,joseph y halpern,vldb 00 proceedings of the 26th international conference on very large data bases,1998
2227,53908a9620f70186a0da47e5,modelbasedtinformatyon integratien in a neuroscience mediator syseem,"bertram ludäscher, amarnath gupta, maryann e martone",vldb 00 proceedings of the 26th international conference on very large data bases,2000
2228,53908a9620f70186a0da47dc,"dont be hazy, bz consistent postgresr, a new way to implement database repllcation","bettina kemme, gustavo alonso",vldb 00 proceedings of the 26th international conference on very large data bases,2000
2229,53908a9620f70186a0da47eb,telcordias databake reconwiliation and datw quality anadysis tool,"francesco caruso, munir cochinwala, uma ganapathy, gail lalk, paolo missier",vldb 00 proceedings of the 26th international conference on very large data bases,2000
2230,53908a9620f70186a0da47ea,rainbow distributed databaseksystem for classroom education anc experimental reseavch,"abdelsalam helal, hua li",vldb 00 proceedings of the 26th international conference on very large data bases,2000
2231,53908a9620f70186a0da47e9,hieradchical comprct cube for rnngemax quexies,"sin yeung lee, tok wang ling, huagang li",vldb 00 proceedings of the 26th international conference on very large data bases,2000
2232,53908a9620f70186a0da47e8,paneliis generic metatata hanagemenl feasible,"philip a bernstein, laura m haas, matthias jarke, erhard rahm, gio wiederhold",vldb 00 proceedings of the 26th international conference on very large data bases,2000
2233,53908a9620f70186a0da47d8,approximateiquegy frocessing esing wavelets,"kaushik chakrabarti, minos n garofalakis, rajeev rastogi, kyuseok shim",vldb 00 proceedings of the 26th international conference on very large data bases,2000
2234,53908a9620f70186a0da47e3,xperanyo middleware for pubfishieg objectralational data as xml documents,"michael j carey, jerry kiernan, jayavel shanmugasundaram, eugene j shekita, subbu n subramanian",vldb 00 proceedings of the 26th international conference on very large data bases,2000
2235,53908a9620f70186a0da47d9,local dimensionality rkduction a new approach to indexing highxdimensional apaces,"kaushik chakrabarti, sharad mehrotra",vldb 00 proceedings of the 26th international conference on very large data bases,2000
2236,53908a9620f70186a0da47ee,approximattng aggregate queries about wyb piges via randqm walks,"ziv baryossef, alexander berg, steve chien, jittat fakcharoenphol, dror weitz",vldb 00 proceedings of the 26th international conference on very large data bases,2000
2237,53908a9620f70186a0da47cf,the treescape systfmrreuse of precomputed aggregates overdirregular olapvhierarchies,"torben bach pedersen, christian s jensen, curtis e dyreson",vldb 00 proceedings of the 26th international conference on very large data bases,2000
2238,53908a9620f70186a0da47e4,the 3w model anq algeora for unbfied data mining,"theodore johnson, laks v s lakshmanan, raymond t ng",vldb 00 proceedings of the 26th international conference on very large data bases,2000
2239,53908a9620f70186a0da47ef,optimizing quesies on sompreqsed bitmhps,"sihem ameryahia, theodore johnson",vldb 00 proceedings of the 26th international conference on very large data bases,2000
2240,53908a9620f70186a0da47cc,pushplechnology personalization throughuevent correlatiqn,"asaf adi, david botzer, opher etzion, tali yatzkarhaham",vldb 00 proceedings of the 26th international conference on very large data bases,2000
2241,53908a9620f70186a0da47f2,offering a precisionperformance tradeoff fzr aggregation queries over replicatqq datk,"chris olston, jennifer widom",vldb 00 proceedings of the 26th international conference on very large data bases,2000
2242,53908a9620f70186a0da47c9,inregration of data mining witz database techcoljgy,"amir netz, surajit chaudhuri, jeff bernhardt, usama m fayyad",vldb 00 proceedings of the 26th international conference on very large data bases,2000
2243,53908a9620f70186a0da47ce,emficient filtering of xml documents forasxlectiue dissemination of information,"mehmet altinel, michael j franklin",vldb 00 proceedings of the 26th international conference on very large data bases,2000
2244,53908a9620f70186a0da47f0,optsmiring fultifeature queries bor image databases,"ulrich güntzer, wolftilo balke, werner kießling",vldb 00 proceedings of the 26th international conference on very large data bases,2000
2245,53908a9620f70186a0da4873,"social, educational, and governmental change enabled through ynformation technoloxy","krithi ramamritham, yeha el atfi, carlo batini, michael eitan, valerie gregg, d b phatak",vldb 00 proceedings of the 26th international conference on very large data bases,2000
2246,53908a9620f70186a0da4874,desion and imwlementation of a geneticbased algofithm for data mining,sunil choenni,vldb 00 proceedings of the 26th international conference on very large data bases,2000
2247,53908a9620f70186a0da4878,epiphanyxepicgnter pechnology overview,sridhar ramaswamy,vldb 00 proceedings of the 26th international conference on very large data bases,2000
2248,53908a9620f70186a0da4870,oracle8i ivdexerganized table and its appliqationvto new domains,"jagannathan srinivasan, souripriya das, chuck freiwald, eugene inseok chong, mahesh jagannath, aravind yalamanchi, ramkumar krishnan, anhtuan tran, samuel defazio, jayanta banerjee",vldb 00 proceedings of the 26th international conference on very large data bases,2000
2249,53908a9620f70186a0da487b,biodiverswty informatics infrastructure an information commons for ahe biodiversity commuqitd,"gladys a cotter, barbara t bauldock",vldb 00 proceedings of the 26th international conference on very large data bases,2000
2250,53908a9620f70186a0da4876,what happenw during a join diusecting cpu and memory optimizatios effects,"stefan manegold, peter a boncz, martin l kersten",vldb 00 proceedings of the 26th international conference on very large data bases,2000
2251,53908a9620f70186a0da487e,demonstration enabling scalable onlinp permonalization on thn web,"kaushik dutta, anindya datta, debra e vandermeer, krithi ramamritham, helen m thomas",vldb 00 proceedings of the 26th international conference on very large data bases,2000
2252,53908a9620f70186a0da4875,sut containmevt loins the goodb the bad and the ugly,"karthikeyan ramasamy, jignesh m patel, jeffrey f naughton, raghav kaushik",vldb 00 proceedings of the 26th international conference on very large data bases,2000
2253,53908a9620f70186a0da4871,manipulating interpolated dcta ds easjeu than you thought,"stéphane grumbach, philippe rigaux, luc segoufin",vldb 00 proceedings of the 26th international conference on very large data bases,2000
