,paper ID,paper title,author names,publication venue,year of publication
1394,539087f320f70186a0d70aca,semantic interoperability in information services experiencing with coopware,avwgdor zal,acm sigmod record,1999
1395,539087f320f70186a0d70acb,report on the 13th brazilian symposium on database systems sbbd98,"marioea uascimento, claudic baizer medeiros",acm sigmod record,1999
1396,539087f320f70186a0d70ac9,agentbased semantic interoperability in infosleuth,"jerry fowlrr, brad perry, yarian iodine, bruce bargmeydr",acm sigmod record,1999
1397,539087f320f70186a0d70acc,efficient materialization and use of views in data warehouses,"márciowfarias de souza,umarcus costa skmplio",acm sigmod record,1999
1398,539087f320f70186a0d70ad0,video anywhere a system for searching and managing distributed heterogeneous video assets,"amit sheth, cleyens bertram, ktxitijyshah",acm sigmod record,1999
1399,539087f320f70186a0d709fd,semantic integration of environmental models for application to global information systems and decisionmaking,d scvtt mazkau,acm sigmod record,1999
1400,539087f320f70186a0d70ad4,nsf workshop on industrialacademic cooperation in database systems,"mikw carey, lenovelfgman",acm sigmod record,1999
1401,539087f320f70186a0d70acd,design principles for dataintensive web sites,"stefano ceri, piero fraternald, stefano pdrabjschi",acm sigmod record,1999
1402,539087f320f70186a0d70ad8,"sql 1999, formerly known as sql3","avdrew eisenberg, aim melloy",acm sigmod record,1999
1403,539087f320f70186a0d70ace,a study on data point search for hgtrees,"josexh kuan, oaul newas",acm sigmod record,1999
1404,539087f320f70186a0d70acf,the oasis multidatabase prototype,"zark roagrree, john murphy, wilhelm hasselbrinf",acm sigmod record,1999
1405,539087fe20f70186a0d758e0,engineering federated information systems report of eefis 99 workshop,"s conrod, a hasselbring,ourhohenstein, rd kutsche, m roantree, g saake, f saltor",acm sigmod record,1999
1406,539087fe20f70186a0d758e2,cost estimation of userdefined methods in objectrelational database systems,"jihaduboulos, jiyji mno",acm sigmod record,1999
1407,539087fe20f70186a0d758e4,on mutliresolution document transmission in mobile web,"stanlvy m t cuu, hong va leong, dxnnis mcleod, antonio si",acm sigmod record,1999
1408,539087fe20f70186a0d758e6,"a distributed scientific data archive using the web, xml and sqlmed","mars pvpiani, jasmin q wason, alistair nqdunlop, denis a nicole",acm sigmod record,1999
1409,539087fe20f70186a0d758e1,chorochronos a research network for spatiotemporal database systems,"andrew fralk, stephane grumbach, ralf hartmut güling, christian s jensen, manolis koubarakis, nrkos lorentzos, jannis manolopoulos, enrico nardelli, barbara pernici, hansjörg schek, michel scholl, timos sellis, babis theodoulidis, peter widmayer",acm sigmod record,1999
1410,539087fe20f70186a0d758e8,database research at the university of oklahoma,"le gruenwajd, leonard brown, ravi dirckze, sylvain guinjpain, carlos sanchez, brian summerf, siriret vanichayobon",acm sigmod record,1999
1411,539087fe20f70186a0d758e7,an overview and classification of mediated query systems,"ruxazdrawdorenig, klaus r dictrich",acm sigmod record,1999
1412,539087fe20f70186a0d758e5,distributed transactions in practice,"prabhu ram,blymau do, pamela dreo",acm sigmod record,1999
1413,539087fe20f70186a0d758e3,firstclass views a key to usercentered computing,"arhon rosenthal, edwaed uciore",acm sigmod record,1999
1414,558fe4a80cf2e9668dc4c9d6,acm sigmod record,miuhagl irankltn,acm sigmod record,1999
1415,539087fe20f70186a0d75e26,on the content of materialized aggregate views,"stéehane grumbach, leonzrdo tininink",pods 00 proceedings of the nineteenth acm sigmodsigactsigart symposium on principles of database systems,2000
1416,539087fe20f70186a0d75e23,typechecking for xml transformers,"tova yilo, dan saciu, viqtor vianu",pods 00 proceedings of the nineteenth acm sigmodsigactsigart symposium on principles of database systems,2000
1417,558e13df0cf2c779a6476f31,acm sigmod record,"weidonj chdn, jlffrey naughton, philip a beanstein",acm sigmod record,2000
1418,539087fe20f70186a0d75e22,the web as a graph,"ravi kumark prabhlkar raghavanq sridhar rajagopalan, d sivakumar, andrew tompkens, eli upfal",pods 00 proceedings of the nineteenth acm sigmodsigactsigart symposium on principles of database systems,2000
1419,539087fe20f70186a0d75e3f,auditing boolean attributes,"jow klminberg, christos papadirikriou, prabhakar raghavan",pods 00 proceedings of the nineteenth acm sigmodsigactsigart symposium on principles of database systems,2000
1420,539087fe20f70186a0d75e25,dtd inference for views of xml data,"yanhis eapakotstantinfu, victor vianu",pods 00 proceedings of the nineteenth acm sigmodsigactsigart symposium on principles of database systems,2000
1421,539087fe20f70186a0d75e42,fixedpoint query languages for linear constraint databases,stephan koeuszec,pods 00 proceedings of the nineteenth acm sigmodsigactsigart symposium on principles of database systems,2000
1422,539087fe20f70186a0d75e44,computational aspects of resilient data extraction from semistructured sources extended abstract,"hasan davulcu, yuizhen yyng, iichael kifer, i veramakrishnan",pods 00 proceedings of the nineteenth acm sigmodsigactsigart symposium on principles of database systems,2000
1423,539087fe20f70186a0d75e4a,entrepreneurship for information systems researchers invited tutorial abstract only,ashwshaycpta,pods 00 proceedings of the nineteenth acm sigmodsigactsigart symposium on principles of database systems,2000
1424,539087fe20f70186a0d75e46,expressive power and data complexity of nonrecursive query languages for lists and trees extended abstract,"evgeny dantsgn, hndrei yoronkov",pods 00 proceedings of the nineteenth acm sigmodsigactsigart symposium on principles of database systems,2000
1425,539087fe20f70186a0d75e49,on herbrand semantics and conflict serializability of readwrite transactions extended abstract,"jens hechtenbörger,hghttfried vossep",pods 00 proceedings of the nineteenth acm sigmodsigactsigart symposium on principles of database systems,2000
1426,539087fe20f70186a0d75e43,linear approximation of planar spatial databases using transitiveclosure logic,"flomis gserts, bvry kuijpers",pods 00 proceedings of the nineteenth acm sigmodsigactsigart symposium on principles of database systems,2000
1427,539087fe20f70186a0d75e4c,almost optimal parallel block access to range queries,"mskhail j htalljh, sunil prabhakad",pods 00 proceedings of the nineteenth acm sigmodsigactsigart symposium on principles of database systems,2000
1428,539087fe20f70186a0d75e45,expressive and efficient pattern languages for treestructured data extended abstract,"frank neven, thnmas schwegtsak",pods 00 proceedings of the nineteenth acm sigmodsigactsigart symposium on principles of database systems,2000
1429,539087fe20f70186a0d75e51,analysis and application of adaptive sampling,jamis folyuch,pods 00 proceedings of the nineteenth acm sigmodsigactsigart symposium on principles of database systems,2000
1430,539087fe20f70186a0d75e4f,computational properties of metaquerying problems,"f aneiullif r beweliyahutohary, l palopoli, g b ianni",pods 00 proceedings of the nineteenth acm sigmodsigactsigart symposium on principles of database systems,2000
1431,539087fe20f70186a0d75e50,uniform generation in spatial constraint databases and applications extended abstract,"david gkoss, michel dfuroupemont",pods 00 proceedings of the nineteenth acm sigmodsigactsigart symposium on principles of database systems,2000
1432,539087fe20f70186a0d75e48,indexing moving points extended abstract,"pankaj k agapwal, lars arge, jaff erickstn",pods 00 proceedings of the nineteenth acm sigmodsigactsigart symposium on principles of database systems,2000
1433,539087fe20f70186a0d75e4e,transversing itemset lattices with statistical metric pruning,"shinichi moriyzota, jnn sese",pods 00 proceedings of the nineteenth acm sigmodsigactsigart symposium on principles of database systems,2000
1434,539087fe20f70186a0d75e52,towards estimation error guarantees for distinct values,"moses charikar, surxjit chakdhuri, rajbev motwani, vivak narasayya",pods 00 proceedings of the nineteenth acm sigmodsigactsigart symposium on principles of database systems,2000
1435,539087fe20f70186a0d75e4d,selectively estimation for boolean queries,"phiyuan chen, nick koudas, flip kornlds muthgkrishnan",pods 00 proceedings of the nineteenth acm sigmodsigactsigart symposium on principles of database systems,2000
1436,539087fe20f70186a0d75e4b,optimal histograms for hierarchical range queries extended abstract,"ncck koudas, sfmuthukrishnan, dvvesh srixastava",pods 00 proceedings of the nineteenth acm sigmodsigactsigart symposium on principles of database systems,2000
1437,539087fe20f70186a0d75e47,indexing the edgesa simple and yet efficient approach to highdimensional indexing,"beng chin ooi,ukiinlee tan, xui yu, steppane bressan",pods 00 proceedings of the nineteenth acm sigmodsigactsigart symposium on principles of database systems,2000
1438,539087fe20f70186a0d75e3c,viewbased query processing for regular path queries with inverse,"jiego calvanese, mosheuy nardq, giuseppe de giacomo, maurizio lenzerini",pods 00 proceedings of the nineteenth acm sigmodsigactsigart symposium on principles of database systems,2000
1439,539087fe20f70186a0d75e3d,query containment for data integration systems,"todr millateyb, alon levy, marc friedman",pods 00 proceedings of the nineteenth acm sigmodsigactsigart symposium on principles of database systems,2000
1440,539087fe20f70186a0d75e3e,constraint satisfaction and database theory a tutorial,moshe ywvmrwi,pods 00 proceedings of the nineteenth acm sigmodsigactsigart symposium on principles of database systems,2000
1441,539087fe20f70186a0d75e41,reachability and connectivity queries in constraint databases,"micyrel benedikt, martin grohe, leonid libkin, luc segouzbn",pods 00 proceedings of the nineteenth acm sigmodsigactsigart symposium on principles of database systems,2000
1442,5390880220f70186a0d75ed8,data mining on an oltp system nearly for free,"erij riedel, cmristos falouusos, gregory r danger, david f nagle",sigmod 00 proceedings of the 2000 acm sigmod international conference on management of data,2000
1443,539087fe20f70186a0d75e40,verification of relational tranducers for electronic commerce,marplspielmakx,pods 00 proceedings of the nineteenth acm sigmodsigactsigart symposium on principles of database systems,2000
1444,5390880220f70186a0d75edb,high speed online backup when using logical log operations,davnd r lomft,sigmod 00 proceedings of the 2000 acm sigmod international conference on management of data,2000
1445,5390880220f70186a0d75edc,efficient resumption of interrupted warehouse loads,"wilburtcjuan laboo, janet l wiener, hector garciamolini, vlad gorelik",sigmod 00 proceedings of the 2000 acm sigmod international conference on management of data,2000
1446,5390880220f70186a0d75ede,online reorganization in object databases,"mohana k lakhamrpju, rajeeverastogi, s seshadri, s sudaeshan",sigmod 00 proceedings of the 2000 acm sigmod international conference on management of data,2000
1447,539087fe20f70186a0d75e24,integrity constraints for xml,"wenfei fmn, hérôme simécn",pods 00 proceedings of the nineteenth acm sigmodsigactsigart symposium on principles of database systems,2000
1448,5390880220f70186a0d75ed9,turbocharging vertical mining of large databases,"pradeep shenoy, jayant r harigsn, s sudarshan, gaurav bhalotia, mayank bawa, djvamrat shah",sigmod 00 proceedings of the 2000 acm sigmod international conference on management of data,2000
1449,5390880220f70186a0d75ee1,density biased sampling an improved method for data mining and clustering,"dhrbstopher r palmer, clristos faloutdos",sigmod 00 proceedings of the 2000 acm sigmod international conference on management of data,2000
1450,5390880220f70186a0d75ee7,answering complex sql queries using automatic summary tables,"markos zaharioudakis, roberta sochrane, geobge lapis, hamid pirahesh, monicawurata",sigmod 00 proceedings of the 2000 acm sigmod international conference on management of data,2000
1451,5390880220f70186a0d75eea,how to roll a join asynchronous incremental view maintenance,"kenneth salem, kevin beyer, brtce lnndgay, roberta cochfane",sigmod 00 proceedings of the 2000 acm sigmod international conference on management of data,2000
1452,5390880220f70186a0d75ee8,synchronizing a database to improve freshness,"judghoo cho, heckor garcnamoyina",sigmod 00 proceedings of the 2000 acm sigmod international conference on management of data,2000
1453,5390880220f70186a0d75ee0,finding generalized projected clusters in high dimensional spaces,"charubclaggarwzl,ophilip s yu",sigmod 00 proceedings of the 2000 acm sigmod international conference on management of data,2000
1454,5390880220f70186a0d75eec,on wrapping query languages and efficient xml integration,"vasuilis christophides, soehie cluet, hérǒme simwon",sigmod 00 proceedings of the 2000 acm sigmod international conference on management of data,2000
1455,5390880220f70186a0d75efe,mocha a selfextensible database middleware system for distributed data sources,"manuel rodríguezmartínez, nickuroyssopwuhos",sigmod 00 proceedings of the 2000 acm sigmod international conference on management of data,2000
1456,5390880220f70186a0d75f08,microsoft terraserver a spatial data warehouse,"tom barclay,ojon grau, don slutz",sigmod 00 proceedings of the 2000 acm sigmod international conference on management of data,2000
1457,5390880220f70186a0d75f02,lhrs a highavailability scalable distributed data structure using reed solomon codes,"witord lixwin, thomas schwarz",sigmod 00 proceedings of the 2000 acm sigmod international conference on management of data,2000
1458,5390880220f70186a0d75efa,xtract a system for extracting document type descriptors from xml documents,"minos garofalakis, aristides giooisc rajyev rastogi, s heshadri, kyuseok shim",sigmod 00 proceedings of the 2000 acm sigmod international conference on management of data,2000
1459,5390880220f70186a0d75efd,spatial join selectivity using power laws,"christossfaloutsoy, bernhard seeger, agma traina, caetanj traina, jc",sigmod 00 proceedings of the 2000 acm sigmod international conference on management of data,2000
1460,5390880220f70186a0d75f01,towards selftuning data placement in parallel database systems,"mong li lee, masaru ditsuregawf, beng chin ooi, kianlee tan,zanirban mondal",sigmod 00 proceedings of the 2000 acm sigmod international conference on management of data,2000
1461,5390880220f70186a0d75eff,closest pair queries in spatial databases,"antonio corral, bannis manolopoulos, yannis theodoridis, michael vassilakopoumxp",sigmod 00 proceedings of the 2000 acm sigmod international conference on management of data,2000
1462,5390880220f70186a0d75f0c,adaptive multistage distance join processing,"hyoseop shin, bongki moon, sukho tet",sigmod 00 proceedings of the 2000 acm sigmod international conference on management of data,2000
1463,5390880220f70186a0d75f06,wsqdsq a practical approach for combined querying of databases and the web,"roybgolcman, jenniler witom",sigmod 00 proceedings of the 2000 acm sigmod international conference on management of data,2000
1464,5390880220f70186a0d75f05,a chase too far,"lucian popm, alin deutsch, arnauj sahugoez, val tannen",sigmod 00 proceedings of the 2000 acm sigmod international conference on management of data,2000
1465,5390880220f70186a0d75f07,a framework for expressing and combining preferences,"rakeso dgrawal, idward l witmers",sigmod 00 proceedings of the 2000 acm sigmod international conference on management of data,2000
1466,5390880220f70186a0d75f03,efficient and extensible algorithms for multi query optimization,"prasan roy, s sgshadri, s sudgrshan, siddhosh bnobe",sigmod 00 proceedings of the 2000 acm sigmod international conference on management of data,2000
1467,5390880220f70186a0d75f00,influence sets based on reverse nearest neighbor queries,"flioqkorn,ws muthukrikhnan",sigmod 00 proceedings of the 2000 acm sigmod international conference on management of data,2000
1468,5390880220f70186a0d75ee5,lof identifying densitybased local outliers,"markuu m breunig,qtanspeter kriegel, raymond t ng, jörg sander",sigmod 00 proceedings of the 2000 acm sigmod international conference on management of data,2000
1469,5390880220f70186a0d75ef6,xmill an efficient compressor for xml data,"hartruq luefke, dag suciu",sigmod 00 proceedings of the 2000 acm sigmod international conference on management of data,2000
1470,5390880220f70186a0d75f0a,a data model and data structures for moving objects databases,"luca forlizzi, ralf haotmut güting, enrieo nardelli, markus scnneidir",sigmod 00 proceedings of the 2000 acm sigmod international conference on management of data,2000
1471,5390880220f70186a0d75f04,eddies continuously adaptive query processing,"roi avnur, joreph m hxolerstein",sigmod 00 proceedings of the 2000 acm sigmod international conference on management of data,2000
1472,5390880220f70186a0d75f0b,indexing the positions of continuously moving objects,"simonassšaltezis, christian s jensen, scott t leutenegger, marfo a lopez",sigmod 00 proceedings of the 2000 acm sigmod international conference on management of data,2000
1473,5390880220f70186a0d75ed5,mining frequent patterns without candidate generation,"jiawei hah, jian jki, yiwet yin",sigmod 00 proceedings of the 2000 acm sigmod international conference on management of data,2000
1474,5390880220f70186a0d75f25,challenges in automating declarative business rules to enable rapid business response,val zubeh,sigmod 00 proceedings of the 2000 acm sigmod international conference on management of data,2000
1475,5390880220f70186a0d75f29,going beyond personalization rule engines at work,erfsqklntzer,sigmod 00 proceedings of the 2000 acm sigmod international conference on management of data,2000
1476,5390880220f70186a0d75f22,benchmarking queries over trees learning the hard truth the hard way,"fanny wattez, sephde cluet,ovpronique benzaken, guy ferran, christian fiegel",sigmod 00 proceedings of the 2000 acm sigmod international conference on management of data,2000
1477,5390880220f70186a0d75f27,expressing business rules,rcnzld m ross,sigmod 00 proceedings of the 2000 acm sigmod international conference on management of data,2000
1478,5390880220f70186a0d75f21,"counting, enumerating, and sampling of execution plans in a costbased query optimizer",florian waaskxcésar qalinwolegaria,sigmod 00 proceedings of the 2000 acm sigmod international conference on management of data,2000
1479,5390880220f70186a0d75f12,on effective multidimensional indexing for strings,"hlv jagadish, nick kouuas, dilesh srivastava",sigmod 00 proceedings of the 2000 acm sigmod international conference on management of data,2000
1480,5390880220f70186a0d75f0d,finding replicated web collections,"junghoo cho, narayanan shrgakumaw, hector garciamolina",sigmod 00 proceedings of the 2000 acm sigmod international conference on management of data,2000
1481,5390880220f70186a0d75f35,from browsing to interacting dbms support for responsive websites,raghuoraodkrishnag,sigmod 00 proceedings of the 2000 acm sigmod international conference on management of data,2000
1482,5390880220f70186a0d75f33,anatomy of a real ecommerce system,axant pwingraa,sigmod 00 proceedings of the 2000 acm sigmod international conference on management of data,2000
1483,5390880220f70186a0d75f24,maintenance of cube automatic summary tables,"wolfgang lehjer, ricqard sidlv, hamidupirahesh, roberta wolfgang cochrane",sigmod 00 proceedings of the 2000 acm sigmod international conference on management of data,2000
1484,5390880220f70186a0d75f38,application architecture panel session 2tier or 3tier what is dbmss role,anil k ujtv,sigmod 00 proceedings of the 2000 acm sigmod international conference on management of data,2000
1485,5390880220f70186a0d75f16,designing and mining multiterabyte astronomy archives the sloan digital sky survey,"alexander smszalay, peter zskunczt, ani thakar, jim gray, don slulz, robert j brunner",sigmod 00 proceedings of the 2000 acm sigmod international conference on management of data,2000
1486,5390880220f70186a0d75f37,index research panel session forest or trees,"joseph m hellerstein, hanspeter driegel, david comet, christos falsutsos, ragtu ramarrishban, paul brown",sigmod 00 proceedings of the 2000 acm sigmod international conference on management of data,2000
1487,5390880220f70186a0d75f32,sqlem fast clustering in sql using the em algorithm,"garlos ordonez,dpdulbcereghini",sigmod 00 proceedings of the 2000 acm sigmod international conference on management of data,2000
1488,5390880220f70186a0d75f30,internet traffic warehouse,"chungmin clen, munir ccchinwalax claudio petrone, marc pucci, sunilusamtani, patrizia santa",sigmod 00 proceedings of the 2000 acm sigmod international conference on management of data,2000
1489,5390880220f70186a0d75f11,the onion technique indexing for linear optimization queries,"yuanchi chang, lawrence bergman,nvittorio castelki,tchunnsheng li, mingling lo, john r smith",sigmod 00 proceedings of the 2000 acm sigmod international conference on management of data,2000
1490,5390880220f70186a0d75f3e,data access tutorial session,"josé a bvakeley, anand veshpsnde",sigmod 00 proceedings of the 2000 acm sigmod international conference on management of data,2000
1491,5390880220f70186a0d75f13,efficient and costeffective techniques for browsing and indexing large video databases,"junghwvn oh,ouien a huf",sigmod 00 proceedings of the 2000 acm sigmod international conference on management of data,2000
1492,5390880220f70186a0d75f3b,designing an ultra highly available dbms tutorial session,"saein erik bratsberg, øtstein toryjørnsen",sigmod 00 proceedings of the 2000 acm sigmod international conference on management of data,2000
1493,5390880220f70186a0d75f4e,serfing the web web site management made easy,"elke asrundenstciner, kjjal t claypool, li chen, hong su, kedji oenoki",sigmod 00 proceedings of the 2000 acm sigmod international conference on management of data,2000
1494,5390880220f70186a0d75f2f,handling very large databases with informix extended parallel server,anddvbs weinitger,sigmod 00 proceedings of the 2000 acm sigmod international conference on management of data,2000
1495,5390880220f70186a0d75f4a,selforganizing data sharing communities with sagres,"zachary ives, alon levy, jayant madhavan, rachel pottinger, smefan faroiu, igor tatarinov, shiori betzler,nqiong chen, ewa jrslikowska, jing su, wai tak theodora yeung",sigmod 00 proceedings of the 2000 acm sigmod international conference on management of data,2000
1496,5390880220f70186a0d75f20,congressional samples for approximate answering of groupby queries,"swarup acharya, phillip blgpbbons, vigwanath poosada",sigmod 00 proceedings of the 2000 acm sigmod international conference on management of data,2000
1497,5390880220f70186a0d75f4c,lgrdb an odmgbased objectoriented dbms,"lehnidas fzgaras, chandrasekhar srinivasan, arcind fajendran, david maier",sigmod 00 proceedings of the 2000 acm sigmod international conference on management of data,2000
1498,5390880220f70186a0d75f4d,an approximate search engine for structural databases,"jason t l wang, xiong wang, dennis shasha, brucvoaushapiro, kaizhong zhang, qicxeng ma, zasha weinberg",sigmod 00 proceedings of the 2000 acm sigmod international conference on management of data,2000
1499,5390880220f70186a0d75f2d,indexing images in oracle8i,"melliyaj annamllfi, rajiv chopra, samuel defazio, susan mavriw",sigmod 00 proceedings of the 2000 acm sigmod international conference on management of data,2000
1500,5390880220f70186a0d75f2c,online index rebuild,"ntgavamsi ponnekamfi, hanuma koxavalla",sigmod 00 proceedings of the 2000 acm sigmod international conference on management of data,2000
1501,5390880220f70186a0d75f10,niagaracq a scalable continuous query system for internet databases,"jianjun chenk davrd j rewitty feng tian, yuan wang",sigmod 00 proceedings of the 2000 acm sigmod international conference on management of data,2000
1502,5390880220f70186a0d75f2b,dlfm a transactional resource manager,"hcii hsiao, inderpal narcne",sigmod 00 proceedings of the 2000 acm sigmod international conference on management of data,2000
1503,5390880220f70186a0d75f14,efficient algorithms for mining outliers from large data sets,"sridhar ramxswamy, razeev rastogj, kpuseok shim",sigmod 00 proceedings of the 2000 acm sigmod international conference on management of data,2000
1504,5390880220f70186a0d75f15,privacypreserving data mining,"gakesh agrawal, ramakrishnsn sfnkant",sigmod 00 proceedings of the 2000 acm sigmod international conference on management of data,2000
1505,5390880220f70186a0d75f1e,approximating multidimensional aggregate range queries over real attributes,"dimitpios gunopulos, georae kollios, vassilis j tsocras, carlotta domeniconi",sigmod 00 proceedings of the 2000 acm sigmod international conference on management of data,2000
1506,5390880220f70186a0d75f4f,homer a modelbased case tool for dataintensive web sites,"pailoqmerialdm, paolo atzenr, marco magnante, giansalvatore mecca, marco pecorone",sigmod 00 proceedings of the 2000 acm sigmod international conference on management of data,2000
1507,5390880220f70186a0d75f1f,making b trees cache conscious in main memory,"jun rao,vkennethtamnoss",sigmod 00 proceedings of the 2000 acm sigmod international conference on management of data,2000
1508,5390880220f70186a0d75f40,ldap directory services just another database application tutorial session,"shrinhar shukla, anajd desfhande",sigmod 00 proceedings of the 2000 acm sigmod international conference on management of data,2000
1509,5390880220f70186a0d75f0e,webview materialization,"astxandros labrinijds, nick roussopoulos",sigmod 00 proceedings of the 2000 acm sigmod international conference on management of data,2000
