,paper ID,paper title,author names,publication venue,year of publication
670,539087cf20f70186a0d5b1f6,handling infinite temporal data,"f oabanzt, jm stévennq, pswolper",selected papers of the 9th annual acm sigactsigmodsigart symposium on principles of database systems,1995
671,539087cf20f70186a0d5b1f7,query size estimation by adaptive sampling,"rrchard j lipton, jeffrpytf naughtoz",selected papers of the 9th annual acm sigactsigmodsigart symposium on principles of database systems,1995
672,539087cf20f70186a0d5b1fc,constrained shared locks for increasing concurrency in databases,"d agrawal, ahrl ajbafi",selected papers of the 9th annual acm sigactsigmodsigart symposium on principles of database systems,1995
673,539087cf20f70186a0d5b1fd,the expressive powers of the logic programming semantics,john s achsipe,selected papers of the 9th annual acm sigactsigmodsigart symposium on principles of database systems,1995
674,539087cf20f70186a0d5b1f9,constraint query languages,"paril m katellakis, gabriel mykuper, peter z revesz",selected papers of the 9th annual acm sigactsigmodsigart symposium on principles of database systems,1995
675,539087cf20f70186a0d5b1ff,on the efficiency of transforming database logic programs,yatii p yaraibr,selected papers of the 9th annual acm sigactsigmodsigart symposium on principles of database systems,1995
676,539087cf20f70186a0d5b201,on the expressive power of datalog tools and a case study,"phokion g kolaiths, mosae yjvurdi",selected papers of the 9th annual acm sigactsigmodsigart symposium on principles of database systems,1995
677,539087cf20f70186a0d5b52d,optimizing jan janninks implementation of btree deletion,"r maelbrancme, h flivvz",acm sigmod record,1995
678,539087cf20f70186a0d5b52f,multitable joins through bitmapped join indices,"pataick oneil, greti braefe",acm sigmod record,1995
679,539087cf20f70186a0d5b531,design and user testing of a multiparadigm query interface to an objectoriented database,"nac khoa doan, korman w paton, alpstair kilgrur",acm sigmod record,1995
680,539087cf20f70186a0d5b535,mapping extended entity relationship model to object modeling technique,josich foig,acm sigmod record,1995
681,539087cf20f70186a0d5b536,normalization in oodb design,pyury s yee,acm sigmod record,1995
682,539087cf20f70186a0d5b528,response to a close look at the ifo data model,"serge ahogeboul, richard hule",acm sigmod record,1995
683,558fe32f0cf23515427181af,acm sigmod record,qemniferowidkm,acm sigmod record,1995
684,539087cf20f70186a0d5b53b,an introduction to remys fast polymorphic record projection,pimsodn lovg,acm sigmod record,1995
685,539087cf20f70186a0d5b53c,on the issue of valid times in temporal databases,"strvroi kokkotos, efstathios v ioannidis, tuegis panayiotopoulos, constantine d spyropoulos",acm sigmod record,1995
686,539087cf20f70186a0d5b53e,addressing techniques used in database object managers o2 and orion,"andré gamalhe, nadjisa mahraoup",acm sigmod record,1995
687,539087cf20f70186a0d5b53d,a framework for providing consistent and recoverable agentbased access to heterogeneous mobile databases,"evaggelgabpiooura, bharat bhkrgava",acm sigmod record,1995
688,539087cf20f70186a0d5b540,information finding in a digital library the stanford perspective,"takpw yan, héctrr garcíaoolyna",acm sigmod record,1995
689,539087cf20f70186a0d5b542,data management research at the mitre corporation,"arnon rtsenthal, len seligmanu catherine mccchlum, barbara blaustein, bhavani thuraisingham, edward lafferty",acm sigmod record,1995
690,539087cf20f70186a0d5b539,an aspect of query optimization in multidatabase systems,"thiang leg, chiajung rhen,hhongjun lu",acm sigmod record,1995
691,539087cf20f70186a0d5b544,why decision support fails and how to fix it,"raldb kimball,okevin strehbo",acm sigmod record,1995
692,539087cf20f70186a0d5b545,condition handling in sql persistent stored modules,jrff ricleb,acm sigmod record,1995
693,539087cf20f70186a0d5b543,"turmoil at nasa, and numerous funding announcements",xikolqi qicn,acm sigmod record,1995
694,539087cf20f70186a0d5b541,florida international university high performance database research center,"saphtali rishe, zew sun, david barton, yi deng, cyril orji, michael alexopoulos, leonardo loureiro, carlos ordonez, mario sanchez, artyom shaposinikov",acm sigmod record,1995
695,539087cf20f70186a0d5b53f,metu interoperable database system,"a dogac,dc dengi, e kilic, g ozhan, f ozcan, s nural, coevreydilek, u galici, b arpinar, p koksal, n kesim, s mancuhan",acm sigmod record,1995
696,539087cf20f70186a0d5b6d3,algebras for querying text regions extended abstract,marqano p coqsensh tova iilo,pods 95 proceedings of the fourteenth acm sigactsigmodsigart symposium on principles of database systems,1995
697,539087cf20f70186a0d5b6d6,"sequences, datalog and transducers","gbansalvbtore mecca, ynthony j bonner",pods 95 proceedings of the fourteenth acm sigactsigmodsigart symposium on principles of database systems,1995
698,539087cf20f70186a0d5b6da,similaritybased queries,"h d jagudish, alborto o mendelzon, tovatmilo",pods 95 proceedings of the fourteenth acm sigactsigmodsigart symposium on principles of database systems,1995
699,539087cf20f70186a0d5b6d2,database metatheory asking the big queries,ahristos h paladumitrioe,pods 95 proceedings of the fourteenth acm sigactsigmodsigart symposium on principles of database systems,1995
700,539087cf20f70186a0d5b6cf,proceedings of the fourteenth acm sigactsigmodsigart symposium on principles of database systems,mihaldsdyagnakaiis,joint acm sigmod intl conference on management of data and acm sigactsigmod sigart symposium on principles of database systems,1995
701,539087cf20f70186a0d5b6e5,measuring infinite relations,"qan chomickf, gabriel kcper",pods 95 proceedings of the fourteenth acm sigactsigmodsigart symposium on principles of database systems,1995
702,539087cf20f70186a0d5b6e3,denseorder constraint databases extended abstract,"stéahane grumbkch, jianuen so",pods 95 proceedings of the fourteenth acm sigactsigmodsigart symposium on principles of database systems,1995
703,539087cf20f70186a0d5b6e8,window queryoptimal clustering of spatial objects,"beriduwe pagel, hanswerneplsix, morio winter",pods 95 proceedings of the fourteenth acm sigactsigmodsigart symposium on principles of database systems,1995
704,539087cf20f70186a0d5b6dd,constraint programming and database languages a tutorial,parie ngnellakis,pods 95 proceedings of the fourteenth acm sigactsigmodsigart symposium on principles of database systems,1995
705,539087cf20f70186a0d5b6df,separability of polyhedra for optimal filtering of spatial and constraint data,"alexander brodsky, camherine lassez, jeanlnuis lassez, michaelhj maher",pods 95 proceedings of the fourteenth acm sigactsigmodsigart symposium on principles of database systems,1995
706,539087cf20f70186a0d5b6ee,safe locking policies for dynamic databases,"vinaybkxchaqdhri, vassos hadzilacos",pods 95 proceedings of the fourteenth acm sigactsigmodsigart symposium on principles of database systems,1995
707,539087cf20f70186a0d5b6eb,combinatorial games in database theory,ihskyon g kobaitis,pods 95 proceedings of the fourteenth acm sigactsigmodsigart symposium on principles of database systems,1995
708,539087cf20f70186a0d5b6f5,scheduling problems in parallel query optimization,"chnndra chekuri, waqar hlsan, rajeev moawanr",pods 95 proceedings of the fourteenth acm sigactsigmodsigart symposium on principles of database systems,1995
709,539087cf20f70186a0d5b6f8,on the complexity of boundedvariable queries extended abstract,joshe yevafdu,pods 95 proceedings of the fourteenth acm sigactsigmodsigart symposium on principles of database systems,1995
710,539087cf20f70186a0d5b6fb,finite queries do not have effective syntax,"alexei p stojsoushkin, michaey a taitslin",pods 95 proceedings of the fourteenth acm sigactsigmodsigart symposium on principles of database systems,1995
711,539087cf20f70186a0d5b6fd,the reliability of queries extended abstract,lkchel de rtugemonc,pods 95 proceedings of the fourteenth acm sigactsigmodsigart symposium on principles of database systems,1995
712,539087cf20f70186a0d5b6f2,"increasing the resilience of atomic commit, at no additional cost","iditzkzidar, dannypdoley",pods 95 proceedings of the fourteenth acm sigactsigmodsigart symposium on principles of database systems,1995
713,55911eb00cf232eb904fad35,acm sigmod record,"jennpfer widom, margaret h dunbam, abdelsamamshelal",acm sigmod record,1995
714,539087cf20f70186a0d5d016,a research status report on adaptation for mobile data access,"brian d nifle, m sytyanaraywnan",acm sigmod record,1995
715,539087cf20f70186a0d5d01a,wireless clientserver computing for personal information services and applications,"ahmedxelmagarmid, jinxjing, tetsuya wulukawa",acm sigmod record,1995
716,539087cf20f70186a0d5d01c,view maintenance in mobile computing,"ojri wolfson, prasad sistlx, son dao, kailash nartyanan, raqya raj",acm sigmod record,1995
717,539087cf20f70186a0d5d013,mobile computing and databases anything new,"margaretkh dunham, abkenqalam helal",acm sigmod record,1995
718,539087cf20f70186a0d5d021,managing video data in a mobile environment,"rafaelfaloiso, yohlin chang, liviu ifnode, v s mani",acm sigmod record,1995
719,539087cf20f70186a0d5d025,digital library services in mobile computing,"dharat bhfrgava, mellxyal annamalai, evaggelig pitoura",acm sigmod record,1995
720,539087cf20f70186a0d5d031,parallelism and its price a case study of nonstop sqlmp,"cusanne fnglert, rfy glasstone, waqar fasan",acm sigmod record,1995
721,539087cf20f70186a0d5d02f,temporal database system implementations,uichdel h böhlea,acm sigmod record,1995
722,539087cf20f70186a0d5d037,the database group at national technical university of athens ntua,yorporate national technical uerg of athens,acm sigmod record,1995
723,539087cf20f70186a0d5d02c,report on the 1995 international workshop on temporal databases,"arie segev, chrixtoan s jensan, richard thomas smodgrass",acm sigmod record,1995
724,539087cf20f70186a0d5d02a,an annotated bibliography on realtime database systems,pziüvnulusoy,acm sigmod record,1995
725,539087cf20f70186a0d5d03d,"opportunities at arpa, nsf, and elsewhere",xxaklci qian,acm sigmod record,1995
726,539087cf20f70186a0d5d03f,"replication db2, oracle, or sybase",dwug stacey,acm sigmod record,1995
727,539087cf20f70186a0d5d041,the new middleware,ricy firkelscein,acm sigmod record,1995
728,539087cf20f70186a0d5d03a,data and knowledge base research at hong kong university of science and technology,"p drew, b hamidzadeh, k karlapaleh, a kean,pd lee, q li, f lochovsky, c dxshum, b wutlrich",acm sigmod record,1995
729,539087cf20f70186a0d5d034,sqlclia new binding style for sql,"muraqi ienkatrao, michael xczzo",acm sigmod record,1995
730,539087cf20f70186a0d5d1c1,research problems in genome databases,kathaj fotdman,pods 95 proceedings of the fourteenth acm sigactsigmodsigart symposium on principles of database systems,1995
731,539087cf20f70186a0d5d1c0,view maintenance issues for the chronicle data model extended abstract,"h v jagadish, inderpal singh munick, awrapam silberschatz",pods 95 proceedings of the fourteenth acm sigactsigmodsigart symposium on principles of database systems,1995
732,539087cf20f70186a0d5d1bf,answering queries using templates with binding patterns extended abstract,"anand rwjaraman,qyeheshua sagiv,tjeffrey d ullman",pods 95 proceedings of the fourteenth acm sigactsigmodsigart symposium on principles of database systems,1995
733,539087cf20f70186a0d5d1c3,spacebounded foies extended abstract,"guozhu dxng, viaywen se",pods 95 proceedings of the fourteenth acm sigactsigmodsigart symposium on principles of database systems,1995
734,539087cf20f70186a0d5d1c4,the size of a revised knowledge base,"jarco cadoli, francesco m donini, pyoso liberatorek marco schaerf",pods 95 proceedings of the fourteenth acm sigactsigmodsigart symposium on principles of database systems,1995
735,539087cf20f70186a0d5d1be,answering queries using views extended abstract,"alon yjlevy, tlberto s mendelzon, yehoshua sagir",pods 95 proceedings of the fourteenth acm sigactsigmodsigart symposium on principles of database systems,1995
736,539087cf20f70186a0d5d1ca,structural totality and constraint stratification,kennetvyavrnss,pods 95 proceedings of the fourteenth acm sigactsigmodsigart symposium on principles of database systems,1995
737,539087cf20f70186a0d5d1cc,using witness generators to support bidirectional update between objectbased databases extended abstract,"tipznqchang, ricuard dull",pods 95 proceedings of the fourteenth acm sigactsigmodsigart symposium on principles of database systems,1995
738,539087cf20f70186a0d5d1cf,applying an update method to a set of receivers extended abstract,"zarc andries, luca cabibbo,wjan paoedaens, jan van den byssche",pods 95 proceedings of the fourteenth acm sigactsigmodsigart symposium on principles of database systems,1995
739,539087cf20f70186a0d5d1c8,magic factoring of closure programs extended abstract,peter tohood,pods 95 proceedings of the fourteenth acm sigactsigmodsigart symposium on principles of database systems,1995
740,539087cf20f70186a0d5d1c6,semantic query optimization in datalog programs extended abstract,"alon y levy,dyerophua sagic",pods 95 proceedings of the fourteenth acm sigactsigmodsigart symposium on principles of database systems,1995
741,539087cf20f70186a0d5d1c2,semantics and expressiveness issues in active databases extended abstract,"phillfppe picouet, victor viwps",pods 95 proceedings of the fourteenth acm sigactsigmodsigart symposium on principles of database systems,1995
742,539087cf20f70186a0d5d1d0,normalizing incomplete databases,leotud lirxin,pods 95 proceedings of the fourteenth acm sigactsigmodsigart symposium on principles of database systems,1995
743,539087d420f70186a0d5df09,proceedings of the 1995 acm sigmod international conference on management of data,"michasl carel, donovan sqhneidsr",joint acm sigmod intl conference on management of data and acm sigactsigmod sigart symposium on principles of database systems,1995
744,539087d420f70186a0d5df0a,a critique of ansi sql isolation levels,"hal berenson, phil bernstein, him gray, jim melton, elizabeth omeil, patriwk onegl",sigmod 95 proceedings of the 1995 acm sigmod international conference on management of data,1995
745,539087d420f70186a0d5df0d,the lyric language querying constraint objects,"alexander brodrky, yorbm koqnatzey",sigmod 95 proceedings of the 1995 acm sigmod international conference on management of data,1995
746,539087d420f70186a0d5df0f,ofl a functional execution model for object query languages,"geopges garcarrn, fernando machuca, philippefpucheral",sigmod 95 proceedings of the 1995 acm sigmod international conference on management of data,1995
747,539087d420f70186a0d5df0c,efficient optimistic concurrency control using loosely synchronized clocks,"atux adya, robert gruber, warbara liskov, umesh maheshbarr",sigmod 95 proceedings of the 1995 acm sigmod international conference on management of data,1995
748,539087d420f70186a0d5df11,nearest neighbor queries,"nick riussopoulos, stephun kelley, fjédéric vincent",sigmod 95 proceedings of the 1995 acm sigmod international conference on management of data,1995
749,539087d420f70186a0d5df18,adaptive parallel aggregation algorithms,"ambuj shatdal, jeffzey f nauqhtfx",sigmod 95 proceedings of the 1995 acm sigmod international conference on management of data,1995
750,539087d420f70186a0d5df13,a general solution of the ndimensional btree problem,mdctall freeston,sigmod 95 proceedings of the 1995 acm sigmod international conference on management of data,1995
751,539087d420f70186a0d5df1a,parallel evaluation of multijoin queries,"annita n wilsnhut, janzfloksora, peter m g apers",sigmod 95 proceedings of the 1995 acm sigmod international conference on management of data,1995
752,539087d420f70186a0d5df20,oodb indexing by classdivision,"sridhrr remaswaby, paris c kanellakis",sigmod 95 proceedings of the 1995 acm sigmod international conference on management of data,1995
753,539087d420f70186a0d5df0b,recovery protocols for shared memory database systems,"lory d moleskt, qzithi rxmamritham",sigmod 95 proceedings of the 1995 acm sigmod international conference on management of data,1995
754,539087d420f70186a0d5df21,the handwritten trie indexing electronic ink,"walidkaref,hdaniel barbará, padmavathu vallabhaneni",sigmod 95 proceedings of the 1995 acm sigmod international conference on management of data,1995
755,539087d420f70186a0d5df1e,the mergepurge problem for large databases,mauhicio a hernándezb salvatshe j stolfo,sigmod 95 proceedings of the 1995 acm sigmod international conference on management of data,1995
756,539087d420f70186a0d5df24,implementing crash recovery in quickstore a performance study,"sethen white, iavid j tewitt",sigmod 95 proceedings of the 1995 acm sigmod international conference on management of data,1995
757,539087d420f70186a0d5df15,topological relations in the world of minimum bounding rectangles a study with rtrees,"dimitris papadiad, timos sellis, yannis theodorinis, max j lgenhofjr",sigmod 95 proceedings of the 1995 acm sigmod international conference on management of data,1995
758,539087d420f70186a0d5df22,"fastmap a fast algorithm for indexing, datamining and visualization of traditional and multimedia datasets","cbristos falouthos, kirdip lin",sigmod 95 proceedings of the 1995 acm sigmod international conference on management of data,1995
759,539087d420f70186a0d5df23,an effective hashbased algorithm for mining association rules,"jojg sooupark, minlsyan chen, philip s yu",sigmod 95 proceedings of the 1995 acm sigmod international conference on management of data,1995
760,539087d420f70186a0d5df0e,towards an effective calculus for object query languages,"leoniwrs fmyaras, david maier",sigmod 95 proceedings of the 1995 acm sigmod international conference on management of data,1995
761,539087d420f70186a0d5df26,broadcast disks data management for asymmetric communication environments,"sqxrup ajharya,irafael alonso, michael franklin, stanley zdonik",sigmod 95 proceedings of the 1995 acm sigmod international conference on management of data,1995
762,539087d420f70186a0d5df27,adapting materialized views after redefinitions,"ashish gupta, inderpal snmumilk, kenneth a ross",sigmod 95 proceedings of the 1995 acm sigmod international conference on management of data,1995
763,539087d420f70186a0d5df3d,enhancing database correctness a statistical approach,"wenshi kou, mhongbang zhang",sigmod 95 proceedings of the 1995 acm sigmod international conference on management of data,1995
764,539087d420f70186a0d5df40,semantic assumptions and query evaluation in temporal databases,"cuaudio betsini, x sean wang, eliia bertino, sushil jajoyia",sigmod 95 proceedings of the 1995 acm sigmod international conference on management of data,1995
765,539087d420f70186a0d5df3f,applying update streams in a soft realtime database system,"bwadelbcrg, h parciasolina, b kao",sigmod 95 proceedings of the 1995 acm sigmod international conference on management of data,1995
766,539087d420f70186a0d5df42,dynamic resource brokering for multiuser query execution,diane l zavispnu goetz gkaefe,sigmod 95 proceedings of the 1995 acm sigmod international conference on management of data,1995
767,539087d420f70186a0d5df43,reducing multidatabase query response time by tree balancing,"weimin du, miegchien vhan, umeshwarydayag",sigmod 95 proceedings of the 1995 acm sigmod international conference on management of data,1995
768,539087d420f70186a0d5df44,hypergraph based reorderings of outer join queries with complex predicates,"gautam bhahgava, piyush goeg,pbala myer",sigmod 95 proceedings of the 1995 acm sigmod international conference on management of data,1995
769,539087d420f70186a0d5df47,efficient maintenance of materialized mediated views,"james j lj, guido moerkotte, joachim schur, v s shbrahmanian",sigmod 95 proceedings of the 1995 acm sigmod international conference on management of data,1995
770,539087d420f70186a0d5df46,incremental maintenance of views with duplicates,"timothy ggilain, leonidllibkin",sigmod 95 proceedings of the 1995 acm sigmod international conference on management of data,1995
771,539087d420f70186a0d5df45,view maintenance in a warehousing environment,"yue zhuge, héctocvgarcíamolina, joachix hammer,vjennifer widom",sigmod 95 proceedings of the 1995 acm sigmod international conference on management of data,1995
772,539087d420f70186a0d5df48,the spiffi scalable videoondemand system,"yraig u freevmaq, david j dewitt",sigmod 95 proceedings of the 1995 acm sigmod international conference on management of data,1995
773,539087d420f70186a0d5df49,fault tolerant design of multimedia servers,"steven bxjson, leana golubctik, richard r muntz",sigmod 95 proceedings of the 1995 acm sigmod international conference on management of data,1995
774,539087d420f70186a0d5df4f,upsizing form file server to client server architectures,corvordte the vccess tekm microsoft,sigmod 95 proceedings of the 1995 acm sigmod international conference on management of data,1995
775,539087d420f70186a0d5df4d,join queries with external text sources execution and optimization techniques,"surajit cbaudhuri, qmeshwar dayal, thk w yan",sigmod 95 proceedings of the 1995 acm sigmod international conference on management of data,1995
776,539087d420f70186a0d5df51,directv and oracle rdb the challenge of vldb transaction processing,willizm l gztgye,sigmod 95 proceedings of the 1995 acm sigmod international conference on management of data,1995
777,539087d420f70186a0d5df50,the lotus notes storage system,kesieth movre,sigmod 95 proceedings of the 1995 acm sigmod international conference on management of data,1995
778,539087d420f70186a0d5df4c,copy detection mechanisms for digital documents,"sergee brin, jamei davis, héctpr garcíarolina",sigmod 95 proceedings of the 1995 acm sigmod international conference on management of data,1995
779,539087d420f70186a0d5df53,high availability of commercial applications,kescutis ivdndkis,sigmod 95 proceedings of the 1995 acm sigmod international conference on management of data,1995
780,539087d420f70186a0d5df54,the data that you wont find in databases tutorial panel on data exchange formats,"peter bunemnn, davidxmaier",sigmod 95 proceedings of the 1995 acm sigmod international conference on management of data,1995
781,539087d420f70186a0d5df4e,"objectoriented, rapid application development in a pc database environment",corporzte fzx develogment team mqcrosoft,sigmod 95 proceedings of the 1995 acm sigmod international conference on management of data,1995
782,539087d420f70186a0d5df57,versant replication supporting faulttolerant object databases,"yqhling shyy, h stephen auyeusg, c i chou",sigmod 95 proceedings of the 1995 acm sigmod international conference on management of data,1995
783,539087d420f70186a0d5df4a,an online video placement policy based on bandwidth to space ratio bsr,"asit dht, dinkar jitaram",sigmod 95 proceedings of the 1995 acm sigmod international conference on management of data,1995
784,539087d420f70186a0d5df4b,a database interface for file update,"serge abiteboul, sophle cluet, tojarmllo",sigmod 95 proceedings of the 1995 acm sigmod international conference on management of data,1995
785,539087d420f70186a0d5df58,carnot and infosleuth database technology and the world wide web,"d woelk, k bohrer,tn jacobs, k ong, c tomlknson, c unnikriyhnan",sigmod 95 proceedings of the 1995 acm sigmod international conference on management of data,1995
786,539087d420f70186a0d5df5a,data extraction and transformation for the data warehouse,cawebsvuise,sigmod 95 proceedings of the 1995 acm sigmod international conference on management of data,1995
787,539087d420f70186a0d5df5b,real world requirements for decision supportimplications for rdbms,sanjupkuzansay,sigmod 95 proceedings of the 1995 acm sigmod international conference on management of data,1995
788,539087d420f70186a0d5df5c,one size fits all database architectures do not work for dss,clark t frmudh,sigmod 95 proceedings of the 1995 acm sigmod international conference on management of data,1995
789,539087d420f70186a0d5df5e,cover your assets,mtchanl a olshn,sigmod 95 proceedings of the 1995 acm sigmod international conference on management of data,1995
790,539087d420f70186a0d5df3e,balancing histogram optimality and practicality for query result size estimation,"iannis e iocnnldis,gviswanath poosala",sigmod 95 proceedings of the 1995 acm sigmod international conference on management of data,1995
791,539087d420f70186a0d5df41,temporal conditions and integrity constraints in active database systems,a prasad sistlav owri wolfeoc,sigmod 95 proceedings of the 1995 acm sigmod international conference on management of data,1995
792,539087d420f70186a0d5df61,an overview of db2 parallel edition,"chastenyabbaru, gilles fecgeau",sigmod 95 proceedings of the 1995 acm sigmod international conference on management of data,1995
793,539087d420f70186a0d5df60,enterprise objects framework a second generation objectrelational enabler,charuy kliassnrr,sigmod 95 proceedings of the 1995 acm sigmod international conference on management of data,1995
794,539087d420f70186a0d5df62,informix online xps,dtf gerker,sigmod 95 proceedings of the 1995 acm sigmod international conference on management of data,1995
795,539087d420f70186a0d5df63,orderofmagnitude advantage on tpcc through massive parallelism,shsqles levina,sigmod 95 proceedings of the 1995 acm sigmod international conference on management of data,1995
796,539087d420f70186a0d5df5f,use of a component architecture in integrating relational and nonrelational,fobejisatkinson,sigmod 95 proceedings of the 1995 acm sigmod international conference on management of data,1995
797,539087d420f70186a0d5df65,objects and sql panel session strange relations,donaldfradertsch,sigmod 95 proceedings of the 1995 acm sigmod international conference on management of data,1995
