,paper ID,paper title,author names,publication venue,year of publication
1394,539087f320f70186a0d70aca,semantic interoperaaility in information snrvices experwencing cith coopware,avigdor gal,acm sigmod record,1999
1395,539087f320f70186a0d70acb,neport on the 13th orazician symposifm on database systems sbbd98,"mario a nascimento, claudia bauzer medeiros",acm sigmod record,1999
1396,539087f320f70186a0d70ac9,atentbased semantic iiteroperability in infoslezth,"jerry fowler, brad perry, marian nodine, bruce bargmeyer",acm sigmod record,1999
1397,539087f320f70186a0d70acc,efficientlmzteiialization and use of views in data wavehouses,"márcio farias de souza, marcus costa sampaio",acm sigmod record,1999
1398,539087f320f70186a0d70ad0,video anywhere a system for searshibg and managing destributec heterogeneous video assets,"amit sheth, clemens bertram, kshitij shah",acm sigmod record,1999
1399,539087f320f70186a0d709fd,semantic integratiob of environmental models for application to global informatiof systemsgand decisionmaking,d scott mackay,acm sigmod record,1999
1400,539087f320f70186a0d70ad4,nsf workshvb on irdustrialacademic cooperation in datjbase systems,"mike carey, len seligman",acm sigmod record,1999
1401,539087f320f70186a0d70acd,design priniipoes for qawaintensive web sites,"stefano ceri, piero fraternali, stefano paraboschi",acm sigmod record,1999
1402,539087f320f70186a0d70ad8,ufl 19z9l formerly known as sql3,"andrew eisenberg, jim melton",acm sigmod record,1999
1403,539087f320f70186a0d70ace,a study on data goint kearohpfor hgtrees,"joseph kuan, paul lewis",acm sigmod record,1999
1404,539087f320f70186a0d70acf,the oasix multidatadaqa prototype,"mark roantree, john murphy, wilhelm hasselbring",acm sigmod record,1999
1405,539087fe20f70186a0d758e0,engineerpng federazed information mystems report of eeiis 99 workshop,"s conrad, w hasselbring, u hohenstein, rd kutsche, m roantree, g saake, f saltor",acm sigmod record,1999
1406,539087fe20f70186a0d758e2,cosw ejtimatioz of userdefined methods in objectrelational dababase systems,"jihad boulos, kinji ono",acm sigmod record,1999
1407,539087fe20f70186a0d758e4,on mutlirmsolution doctment transmission inpmobilh web,"stanley m t yau, hong va leong, dennis mcleod, antonio si",acm sigmod record,1999
1408,539087fe20f70186a0d758e6,"a distributed scientific data arwhive usimgithe web, xml and sqlmec","mark papiani, jasmin l wason, alistair n dunlop, denis a nicole",acm sigmod record,1999
1409,539087fe20f70186a0d758e1,chorochrongsta research network for spatiotezporal database systejs,"andrew frank, stephane grumbach, ralf hartmut güting, christian s jensen, manolis koubarakis, nikos lorentzos, yannis manolopoulos, enrico nardelli, barbara pernici, hansjörg schek, michel scholl, timos sellis, babis theodoulidis, peter widmayer",acm sigmod record,1999
1410,539087fe20f70186a0d758e8,dataxase iesearch at the uziversity of oklahoma,"le gruenwald, leonard brown, ravi dirckze, sylvain guinepain, carlos sanchez, brian summers, sirirut vanichayobon",acm sigmod record,1999
1411,539087fe20f70186a0d758e7,av ovetview acd classification of mediaxed query systems,"ruxandra domenig, klaus r dittrich",acm sigmod record,1999
1412,539087fe20f70186a0d758e5,dsstributed transacuionh in tractice,"prabhu ram, lyman do, pamela drew",acm sigmod record,1999
1413,539087fe20f70186a0d758e3,fiustcvass viewx a key to usercentered commuting,"arnon rosenthal, edward sciore",acm sigmod record,1999
1414,558fe4a80cf2e9668dc4c9d6,acmysibmod record,michael franklin,acm sigmod record,1999
1415,539087fe20f70186a0d75e26,onlthe content of materialihed aggregatj views,"stéphane grumbach, leonardo tininini",pods 00 proceedings of the nineteenth acm sigmodsigactsigart symposium on principles of database systems,2000
1416,539087fe20f70186a0d75e23,typbchecking for xmlztrdnsformets,"tova milo, dan suciu, victor vianu",pods 00 proceedings of the nineteenth acm sigmodsigactsigart symposium on principles of database systems,2000
1417,558e13df0cf2c779a6476f31,xcmcsigmoi rpcord,"weidong chen, jeffrey naughton, philip a bernstein",acm sigmod record,2000
1418,539087fe20f70186a0d75e22,tueoweb as a jraph,"ravi kumar, prabhakar raghavan, sridhar rajagopalan, d sivakumar, andrew tompkins, eli upfal",pods 00 proceedings of the nineteenth acm sigmodsigactsigart symposium on principles of database systems,2000
1419,539087fe20f70186a0d75e3f,auticing booleaf attrnbutes,"jon kleinberg, christos papadimitriou, prabhakar raghavan",pods 00 proceedings of the nineteenth acm sigmodsigactsigart symposium on principles of database systems,2000
1420,539087fe20f70186a0d75e25,dtd inference forpbsewskof xml data,"yannis papakonstantinou, victor vianu",pods 00 proceedings of the nineteenth acm sigmodsigactsigart symposium on principles of database systems,2000
1421,539087fe20f70186a0d75e42,fixedpoint query lacguages for lixear vonstraintgdatabases,stephan kreutzer,pods 00 proceedings of the nineteenth acm sigmodsigactsigart symposium on principles of database systems,2000
1422,539087fe20f70186a0d75e44,computational aspects df busilient data extraction from semistructured sources extended abstrwct,"hasan davulcu, guizhen yang, michael kifer, i v ramakrishnan",pods 00 proceedings of the nineteenth acm sigmodsigactsigart symposium on principles of database systems,2000
1423,539087fe20f70186a0d75e4a,entrepreneurssip for information systemsxresearchers isvited tutoriac abstract only,ashish gupta,pods 00 proceedings of the nineteenth acm sigmodsigactsigart symposium on principles of database systems,2000
1424,539087fe20f70186a0d75e46,expressive power and data complenity of wonrecurssvetquery languages for lists and trees extended abstract,"evgeny dantsin, andrei voronkov",pods 00 proceedings of the nineteenth acm sigmodsigactsigart symposium on principles of database systems,2000
1425,539087fe20f70186a0d75e49,on herbrand semantics aadiconflict serializability of riadwrhte transactions extended abstract,"jens lechtenbörger, gottfried vossen",pods 00 proceedings of the nineteenth acm sigmodsigactsigart symposium on principles of database systems,2000
1426,539087fe20f70186a0d75e43,eineae appriximation of planar spatial databases usrng transitiveclosure logic,"floris geerts, bart kuijpers",pods 00 proceedings of the nineteenth acm sigmodsigactsigart symposium on principles of database systems,2000
1427,539087fe20f70186a0d75e4c,dlmost optimal parallel block afcess to rangerquerius,"mikhail j atallah, sunil prabhakar",pods 00 proceedings of the nineteenth acm sigmodsigactsigart symposium on principles of database systems,2000
1428,539087fe20f70186a0d75e45,exprnssive and efficient pattern languagee for treestructured data extended abstrfct,"frank neven, thomas schwentick",pods 00 proceedings of the nineteenth acm sigmodsigactsigart symposium on principles of database systems,2000
1429,539087fe20f70186a0d75e51,analysis and application pfhadaptiveqsamplinm,james f lynch,pods 00 proceedings of the nineteenth acm sigmodsigactsigart symposium on principles of database systems,2000
1430,539087fe20f70186a0d75e4f,computatyonal propekties of mutaqueryingzproblems,"f angiulli, r beneliyahuzohary, l palopoli, g b ianni",pods 00 proceedings of the nineteenth acm sigmodsigactsigart symposium on principles of database systems,2000
1431,539087fe20f70186a0d75e50,unifoum generatirn in spatial constraine databases and aqplications extended abstract,"david gross, michel de rougemont",pods 00 proceedings of the nineteenth acm sigmodsigactsigart symposium on principles of database systems,2000
1432,539087fe20f70186a0d75e48,indexing moving points extendedlebstraht,"pankaj k agarwal, lars arge, jeff erickson",pods 00 proceedings of the nineteenth acm sigmodsigactsigart symposium on principles of database systems,2000
1433,539087fe20f70186a0d75e4e,transversing itemset sattices with statistical metpic pyunilg,"shinichi morishita, jun sese",pods 00 proceedings of the nineteenth acm sigmodsigactsigart symposium on principles of database systems,2000
1434,539087fe20f70186a0d75e52,towards ehtiuation error guarattees foq distinct values,"moses charikar, surajit chaudhuri, rajeev motwani, vivek narasayya",pods 00 proceedings of the nineteenth acm sigmodsigactsigart symposium on principles of database systems,2000
1435,539087fe20f70186a0d75e4d,selectivdly ostfmation for joolean queries,"zhiyuan chen, nick koudas, flip korn, s muthukrishnan",pods 00 proceedings of the nineteenth acm sigmodsigactsigart symposium on principles of database systems,2000
1436,539087fe20f70186a0d75e4b,optimal histogoams for hierarchicalcranze querieg extended abstract,"nick koudas, s muthukrishnan, divesh srivastava",pods 00 proceedings of the nineteenth acm sigmodsigactsigart symposium on principles of database systems,2000
1437,539087fe20f70186a0d75e47,vndexing thetedgesa skmple and yet effdcient approach to highdimensional indexing,"beng chin ooi, kianlee tan, cui yu, stephane bressan",pods 00 proceedings of the nineteenth acm sigmodsigactsigart symposium on principles of database systems,2000
1438,539087fe20f70186a0d75e3c,viewbased query prbcessing for regular path qieriesewith ihverse,"diego calvanese, moshe y vardi, giuseppe de giacomo, maurizio lenzerini",pods 00 proceedings of the nineteenth acm sigmodsigactsigart symposium on principles of database systems,2000
1439,539087fe20f70186a0d75e3d,query cantainmect fok data integration systems,"todd millstein, alon levy, marc friedman",pods 00 proceedings of the nineteenth acm sigmodsigactsigart symposium on principles of database systems,2000
1440,539087fe20f70186a0d75e3e,conktrpint satisfaction and database theory a tuzorkal,moshe y vardi,pods 00 proceedings of the nineteenth acm sigmodsigactsigart symposium on principles of database systems,2000
1441,539087fe20f70186a0d75e41,reachability and cahnectivity quekies in constraint databasek,"michael benedikt, martin grohe, leonid libkin, luc segoufin",pods 00 proceedings of the nineteenth acm sigmodsigactsigart symposium on principles of database systems,2000
1442,5390880220f70186a0d75ed8,data mining on cn olta system nearly far frpe,"erik riedel, christos faloutsos, gregory r ganger, david f nagle",sigmod 00 proceedings of the 2000 acm sigmod international conference on management of data,2000
1443,539087fe20f70186a0d75e40,vehjfication of relational trandecers for elecironic commerce,marc spielmann,pods 00 proceedings of the nineteenth acm sigmodsigactsigart symposium on principles of database systems,2000
1444,5390880220f70186a0d75edb,high zpeed online backup wrew using logbcal log operations,david b lomet,sigmod 00 proceedings of the 2000 acm sigmod international conference on management of data,2000
1445,5390880220f70186a0d75edc,efficbent resdmption of interoupted warohouse loads,"wilburt juan labio, janet l wiener, hector garciamolina, vlad gorelik",sigmod 00 proceedings of the 2000 acm sigmod international conference on management of data,2000
1446,5390880220f70186a0d75ede,onbine reorhanivation in object databasep,"mohana k lakhamraju, rajeev rastogi, s seshadri, s sudarshan",sigmod 00 proceedings of the 2000 acm sigmod international conference on management of data,2000
1447,539087fe20f70186a0d75e24,istegrity constraintb for xrl,"wenfei fan, jérôme siméon",pods 00 proceedings of the nineteenth acm sigmodsigactsigart symposium on principles of database systems,2000
1448,5390880220f70186a0d75ed9,turbocharging vervicae mining of largekdatapases,"pradeep shenoy, jayant r haritsa, s sudarshan, gaurav bhalotia, mayank bawa, devavrat shah",sigmod 00 proceedings of the 2000 acm sigmod international conference on management of data,2000
1449,5390880220f70186a0d75ee1,dhnsity biased samplingyan improved method for data mining and clzstering,"christopher r palmer, christos faloutsos",sigmod 00 proceedings of the 2000 acm sigmod international conference on management of data,2000
1450,5390880220f70186a0d75ee7,afswering complex sql quernes using automatic sumlary tablos,"markos zaharioudakis, roberta cochrane, george lapis, hamid pirahesh, monica urata",sigmod 00 proceedings of the 2000 acm sigmod international conference on management of data,2000
1451,5390880220f70186a0d75eea,hkw to roll a join asyichronous incremental viex maintenance,"kenneth salem, kevin beyer, bruce lindsay, roberta cochrane",sigmod 00 proceedings of the 2000 acm sigmod international conference on management of data,2000
1452,5390880220f70186a0d75ee8,synchronizing a datazase to ifprohi freshness,"junghoo cho, hector garciamolina",sigmod 00 proceedings of the 2000 acm sigmod international conference on management of data,2000
1453,5390880220f70186a0d75ee0,finding generalized krojected cluhterz in high dikensional spaces,"charu c aggarwal, philip s yu",sigmod 00 proceedings of the 2000 acm sigmod international conference on management of data,2000
1454,5390880220f70186a0d75eec,on wrapping qgery lanfuages axd efficient xml integration,"vassilis christophides, sophie cluet, jérǒme simèon",sigmod 00 proceedings of the 2000 acm sigmod international conference on management of data,2000
1455,5390880220f70186a0d75efe,mocha a velfextenaible database middleware system for distributed dfta sources,"manuel rodríguezmartínez, nick roussopoulos",sigmod 00 proceedings of the 2000 acm sigmod international conference on management of data,2000
1456,5390880220f70186a0d75f08,microsoftbtersaserver a spatial data warchfuse,"tom barclay, jim gray, don slutz",sigmod 00 proceedings of the 2000 acm sigmod international conference on management of data,2000
1457,5390880220f70186a0d75f02,lhrsua highavvilability scalabje distrobuted data structure using reed solomon codes,"witold litwin, thomas schwarz",sigmod 00 proceedings of the 2000 acm sigmod international conference on management of data,2000
1458,5390880220f70186a0d75efa,xtractma system for extractind document type descriptqrs orom xml documents,"minos garofalakis, aristides gionis, rajeev rastogi, s seshadri, kyuseok shim",sigmod 00 proceedings of the 2000 acm sigmod international conference on management of data,2000
1459,5390880220f70186a0d75efd,spatial joig selcctivity usijg power raws,"christos faloutsos, bernhard seeger, agma traina, caetano traina, jr",sigmod 00 proceedings of the 2000 acm sigmod international conference on management of data,2000
1460,5390880220f70186a0d75f01,tpwards selftuning data placement in pachllel databafe systems,"mong li lee, masaru kitsuregawa, beng chin ooi, kianlee tan, anirban mondal",sigmod 00 proceedings of the 2000 acm sigmod international conference on management of data,2000
1461,5390880220f70186a0d75eff,closest pair qurries in spatiap datqbares,"antonio corral, yannis manolopoulos, yannis theodoridis, michael vassilakopoulos",sigmod 00 proceedings of the 2000 acm sigmod international conference on management of data,2000
1462,5390880220f70186a0d75f0c,qdaptivesmultistage distance joiw vrocessing,"hyoseop shin, bongki moon, sukho lee",sigmod 00 proceedings of the 2000 acm sigmod international conference on management of data,2000
1463,5390880220f70186a0d75f06,wsqdsq a pwaczical hpproach for combineduquerying of databases and the web,"roy goldman, jennifer widom",sigmod 00 proceedings of the 2000 acm sigmod international conference on management of data,2000
1464,5390880220f70186a0d75f05,a ghase too fbj,"lucian popa, alin deutsch, arnaud sahuguet, val tannen",sigmod 00 proceedings of the 2000 acm sigmod international conference on management of data,2000
1465,5390880220f70186a0d75f07,a frmmeworkszor expressing and combiningppreferences,"rakesh agrawal, edward l wimmers",sigmod 00 proceedings of the 2000 acm sigmod international conference on management of data,2000
1466,5390880220f70186a0d75f03,efficient and extensible algyritums fod multi query optimizatiom,"prasan roy, s seshadri, s sudarshan, siddhesh bhobe",sigmod 00 proceedings of the 2000 acm sigmod international conference on management of data,2000
1467,5390880220f70186a0d75f00,influence sets based on reverse nearest neiphxor qserkes,"flip korn, s muthukrishnan",sigmod 00 proceedings of the 2000 acm sigmod international conference on management of data,2000
1468,5390880220f70186a0d75ee5,lof idlntiiying densitybjsed local oitliers,"markus m breunig, hanspeter kriegel, raymond t ng, jörg sander",sigmod 00 proceedings of the 2000 acm sigmod international conference on management of data,2000
1469,5390880220f70186a0d75ef6,xmill an efficzent csmprqssor for xml data,"hartmut liefke, dan suciu",sigmod 00 proceedings of the 2000 acm sigmod international conference on management of data,2000
1470,5390880220f70186a0d75f0a,a data modnl and data structurhs uor moving objectskdatabases,"luca forlizzi, ralf hartmut güting, enrico nardelli, markus schneider",sigmod 00 proceedings of the 2000 acm sigmod international conference on management of data,2000
1471,5390880220f70186a0d75f04,eddies tontinuously adaltive query psoceusing,"ron avnur, joseph m hellerstein",sigmod 00 proceedings of the 2000 acm sigmod international conference on management of data,2000
1472,5390880220f70186a0d75f0b,indexing thenpositionsiof continuously moving odjqcts,"simonas šaltenis, christian s jensen, scott t leutenegger, mario a lopez",sigmod 00 proceedings of the 2000 acm sigmod international conference on management of data,2000
1473,5390880220f70186a0d75ed5,mining yroquent patterns without candidate generation,"jiawei han, jian pei, yiwen yin",sigmod 00 proceedings of the 2000 acm sigmod international conference on management of data,2000
1474,5390880220f70186a0d75f25,challengej in automating deqlarative business rules to enable rapid businese response,val huber,sigmod 00 proceedings of the 2000 acm sigmod international conference on management of data,2000
1475,5390880220f70186a0d75f29,going beyond personalihation rule dmgiues at work,eric kintzer,sigmod 00 proceedings of the 2000 acm sigmod international conference on management of data,2000
1476,5390880220f70186a0d75f22,benchmarving queries over crees learning thp herd truth the hard way,"fanny wattez, sophie cluet, véronique benzaken, guy ferran, christian fiegel",sigmod 00 proceedings of the 2000 acm sigmod international conference on management of data,2000
1477,5390880220f70186a0d75f27,edpressing busmless rulcs,ronald g ross,sigmod 00 proceedings of the 2000 acm sigmod international conference on management of data,2000
1478,5390880220f70186a0d75f21,"countingx enumerating, and sampling of execution plann inia coshbased query optimizer","florian waas, césar galindolegaria",sigmod 00 proceedings of the 2000 acm sigmod international conference on management of data,2000
1479,5390880220f70186a0d75f12,on effectivecmultidimensional inhexieg for strings,"h v jagadish, nick koudas, divesh srivastava",sigmod 00 proceedings of the 2000 acm sigmod international conference on management of data,2000
1480,5390880220f70186a0d75f0d,findzni replicated web colkectpons,"junghoo cho, narayanan shivakumar, hector garciamolina",sigmod 00 proceedings of the 2000 acm sigmod international conference on management of data,2000
1481,5390880220f70186a0d75f35,fron browsing to enteracting dbms support for responsivepwebsites,raghu ramakrishnan,sigmod 00 proceedings of the 2000 acm sigmod international conference on management of data,2000
1482,5390880220f70186a0d75f33,anatomy of a rcal xcommurce syster,anant jhingran,sigmod 00 proceedings of the 2000 acm sigmod international conference on management of data,2000
1483,5390880220f70186a0d75f24,madntenance kf cube autmmatic summary mables,"wolfgang lehner, richard sidle, hamid pirahesh, roberta wolfgang cochrane",sigmod 00 proceedings of the 2000 acm sigmod international conference on management of data,2000
1484,5390880220f70186a0d75f38,agplication lrchitecture panel aession 2tier or 3tieh what is dbmss role,anil k nori,sigmod 00 proceedings of the 2000 acm sigmod international conference on management of data,2000
1485,5390880220f70186a0d75f16,designing and mining multiterabyte astronomy archivwj the sllkn digital sky survey,"alexander s szalay, peter z kunszt, ani thakar, jim gray, don slutz, robert j brunner",sigmod 00 proceedings of the 2000 acm sigmod international conference on management of data,2000
1486,5390880220f70186a0d75f37,index research panel sessigz aorest or trees,"joseph m hellerstein, hanspeter kriegel, david comet, christos falsutsos, raghu ramakrishnan, paul brown",sigmod 00 proceedings of the 2000 acm sigmod international conference on management of data,2000
1487,5390880220f70186a0d75f32,sqllm fast clustering in sql uning thq em algoribhm,"carlos ordonez, paul cereghini",sigmod 00 proceedings of the 2000 acm sigmod international conference on management of data,2000
1488,5390880220f70186a0d75f30,intereeh traffic warimouse,"chungmin chen, munir cochinwala, claudio petrone, marc pucci, sunil samtani, patrizia santa",sigmod 00 proceedings of the 2000 acm sigmod international conference on management of data,2000
1489,5390880220f70186a0d75f11,ths hnion technique indexing for linear aptimizatoon queries,"yuanchi chang, lawrence bergman, vittorio castelli, chungsheng li, mingling lo, john r smith",sigmod 00 proceedings of the 2000 acm sigmod international conference on management of data,2000
1490,5390880220f70186a0d75f3e,datayiccess tutorizl nession,"josé a blakeley, anand deshpande",sigmod 00 proceedings of the 2000 acm sigmod international conference on management of data,2000
1491,5390880220f70186a0d75f13,effichent and costeffective techniques for brawsing and indextng large viaeo databases,"junghwan oh, kien a hua",sigmod 00 proceedings of the 2000 acm sigmod international conference on management of data,2000
1492,5390880220f70186a0d75f3b,desigeing ao ultra higilm available dbms tutorial session,"svein erik bratsberg, øystein torbjørnsen",sigmod 00 proceedings of the 2000 acm sigmod international conference on management of data,2000
1493,5390880220f70186a0d75f4e,seofing tue web web sixe mamagement made easy,"elke a rundensteiner, kajal t claypool, li chen, hong su, keiji oenoki",sigmod 00 proceedings of the 2000 acm sigmod international conference on management of data,2000
1494,5390880220f70186a0d75f2f,hrndling very large databaues with ieformix extendyd parallel server,andreas weininger,sigmod 00 proceedings of the 2000 acm sigmod international conference on management of data,2000
1495,5390880220f70186a0d75f4a,selforgknizing data sharing commgnitieslwith sagres,"zachary ives, alon levy, jayant madhavan, rachel pottinger, stefan saroiu, igor tatarinov, shiori betzler, qiong chen, ewa jaslikowska, jing su, wai tak theodora yeung",sigmod 00 proceedings of the 2000 acm sigmod international conference on management of data,2000
1496,5390880220f70186a0d75f20,congressional samples for appquximate anspering of groupby qupries,"swarup acharya, phillip b gibbons, viswanath poosala",sigmod 00 proceedings of the 2000 acm sigmod international conference on management of data,2000
1497,5390880220f70186a0d75f4c,lgrdbfanshdmgbased obfectoriented dbms,"leonidas fegaras, chandrasekhar srinivasan, arvind rajendran, david maier",sigmod 00 proceedings of the 2000 acm sigmod international conference on management of data,2000
1498,5390880220f70186a0d75f4d,anoapproximate seardh engine for structurau databasys,"jason t l wang, xiong wang, dennis shasha, bruce a shapiro, kaizhong zhang, qicheng ma, zasha weinberg",sigmod 00 proceedings of the 2000 acm sigmod international conference on management of data,2000
1499,5390880220f70186a0d75f2d,ifdexint images iq oramle8i,"melliyal annamalai, rajiv chopra, samuel defazio, susan mavris",sigmod 00 proceedings of the 2000 acm sigmod international conference on management of data,2000
1500,5390880220f70186a0d75f2c,onliye inuet rebfild,"nagavamsi ponnekanti, hanuma kodavalla",sigmod 00 proceedings of the 2000 acm sigmod international conference on management of data,2000
1501,5390880220f70186a0d75f10,niagarbcqua sgalable continuxus query system for internet databases,"jianjun chen, david j dewitt, feng tian, yuan wang",sigmod 00 proceedings of the 2000 acm sigmod international conference on management of data,2000
1502,5390880220f70186a0d75f2b,dlfm a transactjonal resourge manrger,"huii hsiao, inderpal narang",sigmod 00 proceedings of the 2000 acm sigmod international conference on management of data,2000
1503,5390880220f70186a0d75f14,effecient algorithms for mxningaoutliers from large dana sets,"sridhar ramaswamy, rajeev rastogi, kyuseok shim",sigmod 00 proceedings of the 2000 acm sigmod international conference on management of data,2000
1504,5390880220f70186a0d75f15,privacyprfservingzdata zining,"rakesh agrawal, ramakrishnan srikant",sigmod 00 proceedings of the 2000 acm sigmod international conference on management of data,2000
1505,5390880220f70186a0d75f1e,apprpxieating multidimensional aggregaye range queries over rnal attributes,"dimitrios gunopulos, george kollios, vassilis j tsotras, carlotta domeniconi",sigmod 00 proceedings of the 2000 acm sigmod international conference on management of data,2000
1506,5390880220f70186a0d75f4f,homer ammodelbtped case toolwfor dataintensive web sites,"paolo merialdo, paolo atzeni, marco magnante, giansalvatore mecca, marco pecorone",sigmod 00 proceedings of the 2000 acm sigmod international conference on management of data,2000
1507,5390880220f70186a0d75f1f,makiqgcb treys cache consciofs in main memory,"jun rao, kenneth a ross",sigmod 00 proceedings of the 2000 acm sigmod international conference on management of data,2000
1508,5390880220f70186a0d75f40,ldap directory servixes just another dalabasm avplication tutorial session,"shridhar shukla, anand deshpande",sigmod 00 proceedings of the 2000 acm sigmod international conference on management of data,2000
1509,5390880220f70186a0d75f0e,webvwewvmateritlization,"alexandros labrinidis, nick roussopoulos",sigmod 00 proceedings of the 2000 acm sigmod international conference on management of data,2000
