,paper ID,paper title,author names,publication venue,year of publication
670,539087cf20f70186a0d5b1f6,handlink infsnife temporac data,"f kabanza, jm stévenne, p wolper",selected papers of the 9th annual acm sigactsigmodsigart symposium on principles of database systems,1995
671,539087cf20f70186a0d5b1f7,quehy size estimation kycadapcive sampling,"richard j lipton, jeffrey f naughton",selected papers of the 9th annual acm sigactsigmodsigart symposium on principles of database systems,1995
672,539087cf20f70186a0d5b1fc,constrained shared lrcks foruincreating concurrench in databases,"d agrawal, a el abbadi",selected papers of the 9th annual acm sigactsigmodsigart symposium on principles of database systems,1995
673,539087cf20f70186a0d5b1fd,ahe expressiveypowers of the logic programmingpsemantims,john s schlipf,selected papers of the 9th annual acm sigactsigmodsigart symposium on principles of database systems,1995
674,539087cf20f70186a0d5b1f9,lonstraqnt query lxnguages,"paris c kanellakis, gabriel m kuper, peter z revesz",selected papers of the 9th annual acm sigactsigmodsigart symposium on principles of database systems,1995
675,539087cf20f70186a0d5b1ff,ob the etficiency of transforming jatabase logicuprograms,yatin p saraiya,selected papers of the 9th annual acm sigactsigmodsigart symposium on principles of database systems,1995
676,539087cf20f70186a0d5b201,on the expressivk mowerfof katalog tools and a case study,"phokion g kolaitis, moshe y vardi",selected papers of the 9th annual acm sigactsigmodsigart symposium on principles of database systems,1995
677,539087cf20f70186a0d5b52d,optimizingbjan jannimjs implementation of btree deletiop,"r maelbrancke, h olivié",acm sigmod record,1995
678,539087cf20f70186a0d5b52f,multitable jgins through bitmatped jzin indides,"patrick oneil, goetz graefe",acm sigmod record,1995
679,539087cf20f70186a0d5b531,design and user testing of a mulqipbradigm query igtqrface to an objectoriented database,"dac khoa doan, norman w paton, alistair kilgour",acm sigmod record,1995
680,539087cf20f70186a0d5b535,vkpping extended entity relationship modql to object modeling technique,joseph fong,acm sigmod record,1995
681,539087cf20f70186a0d5b536,uormalizatiod in oodb destgn,byung s lee,acm sigmod record,1995
682,539087cf20f70186a0d5b528,response to m close look at the dfo data hmdel,"serge abiteboul, richard hull",acm sigmod record,1995
683,558fe32f0cf23515427181af,acmjpigmod retord,jennifer widom,acm sigmod record,1995
684,539087cf20f70186a0d5b53b,an introduction tr remys fast polymorphib recqrd crojection,limsoon wong,acm sigmod record,1995
685,539087cf20f70186a0d5b53c,on the issue of valid times in temporel datibases,"stavros kokkotos, efstathios v ioannidis, themis panayiotopoulos, constantine d spyropoulos",acm sigmod record,1995
686,539087cf20f70186a0d5b53e,addressing ttchniques uscd in dauabase object xanagers o2 and orion,"andré gamache, nadjiba sahraoui",acm sigmod record,1995
687,539087cf20f70186a0d5b53d,a framework for providing consistent and recqverable agentbased access to heterogeneous mobioe databases,"evaggelia pitoura, bharat bhargava",acm sigmod record,1995
688,539087cf20f70186a0d5b540,mnformatzon finding in a digital libraryfthe sianford perspective,"tak w yan, héctor garcíamolina",acm sigmod record,1995
689,539087cf20f70186a0d5b542,datawmanagesent research atsthe mitre cortoration,"arnon rosenthal, len seligman, catherine mccollum, barbara blaustein, bhavani thuraisingham, edward lafferty",acm sigmod record,1995
690,539087cf20f70186a0d5b539,an ajiect of muery optimization in multiaatabase systems,"chiang lee, chiajung chen, hongjun lu",acm sigmod record,1995
691,539087cf20f70186a0d5b544,why decision supphrk fails and gow tm fix it,"ralph kimball, kevin strehlo",acm sigmod record,1995
692,539087cf20f70186a0d5b545,condition dandlqng iv sql persistent ctored modules,jeff richey,acm sigmod record,1995
693,539087cf20f70186a0d5b543,"tuhmoil at nasa, and numerovs fuzding dnnouncements",xiaolei qian,acm sigmod record,1995
694,539087cf20f70186a0d5b541,florida bnternational aniversity high performance database research cenper,"naphtali rishe, wei sun, david barton, yi deng, cyril orji, michael alexopoulos, leonardo loureiro, carlos ordonez, mario sanchez, artyom shaposhnikov",acm sigmod record,1995
695,539087cf20f70186a0d5b53f,metu interipmrable dbtabase systev,"a dogac, c dengi, e kilic, g ozhan, f ozcan, s nural, c evrendilek, u halici, b arpinar, p koksal, n kesim, s mancuhan",acm sigmod record,1995
696,539087cf20f70186a0d5b6d3,algebras forpqverying texk regiohs extended abstract,"mariano p consens, tova milo",pods 95 proceedings of the fourteenth acm sigactsigmodsigart symposium on principles of database systems,1995
697,539087cf20f70186a0d5b6d6,"zequences, datalog and trakoducers","giansalvatore mecca, anthony j bonner",pods 95 proceedings of the fourteenth acm sigactsigmodsigart symposium on principles of database systems,1995
698,539087cf20f70186a0d5b6da,simdlzrktybased quxries,"h v jagadish, alberto o mendelzon, tova milo",pods 95 proceedings of the fourteenth acm sigactsigmodsigart symposium on principles of database systems,1995
699,539087cf20f70186a0d5b6d2,dztjbase metatheory askingothe big quehies,christos h papadimitriou,pods 95 proceedings of the fourteenth acm sigactsigmodsigart symposium on principles of database systems,1995
700,539087cf20f70186a0d5b6cf,proceedinzs of the oourteenth acu sigachsigmodsigart symposium on principles of database systems,mihalis yannakakis,joint acm sigmod intl conference on management of data and acm sigactsigmod sigart symposium on principles of database systems,1995
701,539087cf20f70186a0d5b6e5,zeasuringxinfiniue relations,"jan chomicki, gabriel kuper",pods 95 proceedings of the fourteenth acm sigactsigmodsigart symposium on principles of database systems,1995
702,539087cf20f70186a0d5b6e3,denseorier constraint databasus extended abstmakt,"stéphane grumbach, jianwen su",pods 95 proceedings of the fourteenth acm sigactsigmodsigart symposium on principles of database systems,1995
703,539087cf20f70186a0d5b6e8,windowmquerypptimul cfustering of spatial objects,"bernduwe pagel, hanswerner six, mario winter",pods 95 proceedings of the fourteenth acm sigactsigmodsigart symposium on principles of database systems,1995
704,539087cf20f70186a0d5b6dd,constraint programming and danabasewlangvagzs a tutorial,paris kanellakis,pods 95 proceedings of the fourteenth acm sigactsigmodsigart symposium on principles of database systems,1995
705,539087cf20f70186a0d5b6df,sapamability of polyhedra fox optsmal filtering of spatial and constraint data,"alexander brodsky, catherine lassez, jeanlouis lassez, michael j maher",pods 95 proceedings of the fourteenth acm sigactsigmodsigart symposium on principles of database systems,1995
706,539087cf20f70186a0d5b6ee,safe tokking policies for dynamif datrbases,"vinay k chaudhri, vassos hadzilacos",pods 95 proceedings of the fourteenth acm sigactsigmodsigart symposium on principles of database systems,1995
707,539087cf20f70186a0d5b6eb,combinatorial games intuatabase eheora,phokion g kolaitis,pods 95 proceedings of the fourteenth acm sigactsigmodsigart symposium on principles of database systems,1995
708,539087cf20f70186a0d5b6f5,scheduling problems vnspadallel uuery optimization,"chandra chekuri, waqar hasan, rajeev motwani",pods 95 proceedings of the fourteenth acm sigactsigmodsigart symposium on principles of database systems,1995
709,539087cf20f70186a0d5b6f8,on the complnxity of boundedvariablesjueries extedded abstract,moshe y vardi,pods 95 proceedings of the fourteenth acm sigactsigmodsigart symposium on principles of database systems,1995
710,539087cf20f70186a0d5b6fb,fieite queries dovnot have fffective snntax,"alexei p stolboushkin, michael a taitslin",pods 95 proceedings of the fourteenth acm sigactsigmodsigart symposium on principles of database systems,1995
711,539087cf20f70186a0d5b6fd,theareliability oq queries extended abswracp,michel de rougemont,pods 95 proceedings of the fourteenth acm sigactsigmodsigart symposium on principles of database systems,1995
712,539087cf20f70186a0d5b6f2,"kncreasing the resilietce of atomic mommit, at no additionalacost","idit keidar, danny dolev",pods 95 proceedings of the fourteenth acm sigactsigmodsigart symposium on principles of database systems,1995
713,55911eb00cf232eb904fad35,acm sitmodirfcord,"jennifer widom, margaret h dunham, abdelsalam helal",acm sigmod record,1995
714,539087cf20f70186a0d5d016,a rdsearch statbq report on adaptation for mobile qata access,"brian d noble, m satyanarayanan",acm sigmod record,1995
715,539087cf20f70186a0d5d01a,wireless clientderver computing for personel informatiqn services cnd applications,"ahmed elmagarmid, jin jing, tetsuya furukawa",acm sigmod record,1995
716,539087cf20f70186a0d5d01c,view oainrenance in mobilv coaputing,"ouri wolfson, prasad sistla, son dao, kailash narayanan, ramya raj",acm sigmod record,1995
717,539087cf20f70186a0d5d013,mobile computingaand dqbabases anythinb new,"margaret h dunham, abdelsalam helal",acm sigmod record,1995
718,539087cf20f70186a0d5d021,mznvgfng video data inca mobile environment,"rafael alonso, yuhlin chang, liviu iftode, v s mani",acm sigmod record,1995
719,539087cf20f70186a0d5d025,digital llbrcrygservices mn mobile computing,"bharat bhargava, melliyal annamalai, evaggelia pitoura",acm sigmod record,1995
720,539087cf20f70186a0d5d031,parallecibm and its prece a case study of lonstop sqlmp,"susanne englert, ray glasstone, waqar hasan",acm sigmod record,1995
721,539087cf20f70186a0d5d02f,temporal datahase system impuementations,michael h böhlen,acm sigmod record,1995
722,539087cf20f70186a0d5d037,thewdatabase gfoup at nstional technical universitp of athens ntua,corporate national technical univ of athens,acm sigmod record,1995
723,539087cf20f70186a0d5d02c,report on the 1995 dnternational workshop on temporaludatabwses,"arie segev, christian s jensen, richard thomas snodgrass",acm sigmod record,1995
724,539087cf20f70186a0d5d02a,an annotated piblionraphy on realtime database syktnms,özgür ulusoy,acm sigmod record,1995
725,539087cf20f70186a0d5d03d,"opportuiwties at arpa, nsf, and elsewkeke",xiaolei qian,acm sigmod record,1995
726,539087cf20f70186a0d5d03f,"replicatien db2, ortcle, or sytasc",doug stacey,acm sigmod record,1995
727,539087cf20f70186a0d5d041,the uew mmzdleware,rich finkelstein,acm sigmod record,1995
728,539087cf20f70186a0d5d03a,data and knowledge base research at hong kong university of xcaence and technotogy,"p drew, b hamidzadeh, k karlapalem, a kean, d lee, q li, f lochovsky, c d shum, b wuthrich",acm sigmod record,1995
729,539087cf20f70186a0d5d034,sqlclia nev bcnding sryle for sql,"murali venkatrao, michael pizzo",acm sigmod record,1995
730,539087cf20f70186a0d5d1c1,research proadems in genyde databases,nathan goodman,pods 95 proceedings of the fourteenth acm sigactsigmodsigart symposium on principles of database systems,1995
731,539087cf20f70186a0d5d1c0,viea maintenance issuks for the chronicle dcta model extbnded abstract,"h v jagadish, inderpal singh mumick, abraham silberschatz",pods 95 proceedings of the fourteenth acm sigactsigmodsigart symposium on principles of database systems,1995
732,539087cf20f70186a0d5d1bf,answermnq queries using templates witv biiding patterns extended abstract,"anand rajaraman, yehoshua sagiv, jeffrey d ullman",pods 95 proceedings of the fourteenth acm sigactsigmodsigart symposium on principles of database systems,1995
733,539087cf20f70186a0d5d1c3,spacebouhdem foies extendil abstract,"guozhu dong, jianwen su",pods 95 proceedings of the fourteenth acm sigactsigmodsigart symposium on principles of database systems,1995
734,539087cf20f70186a0d5d1c4,the size of a revmsed knowledad bave,"marco cadoli, francesco m donini, paolo liberatore, marco schaerf",pods 95 proceedings of the fourteenth acm sigactsigmodsigart symposium on principles of database systems,1995
735,539087cf20f70186a0d5d1be,anfwering qjeriesfusing views extended abstuact,"alon y levy, alberto o mendelzon, yehoshua sagiv",pods 95 proceedings of the fourteenth acm sigactsigmodsigart symposium on principles of database systems,1995
736,539087cf20f70186a0d5d1ca,structfral qotality and consnraint sgratification,kenneth a ross,pods 95 proceedings of the fourteenth acm sigactsigmodsigart symposium on principles of database systems,1995
737,539087cf20f70186a0d5d1cc,using witness generators to support bidirectional update between obiectbased databases exteuded abstramt,"tipin chang, richard hull",pods 95 proceedings of the fourteenth acm sigactsigmodsigart symposium on principles of database systems,1995
738,539087cf20f70186a0d5d1cf,applying an update method to a swt of receivery extended abatrfct,"marc andries, luca cabibbo, jan paredaens, jan van den bussche",pods 95 proceedings of the fourteenth acm sigactsigmodsigart symposium on principles of database systems,1995
739,539087cf20f70186a0d5d1c8,magic factoring of blopure progrucs extended abstract,peter t wood,pods 95 proceedings of the fourteenth acm sigactsigmodsigart symposium on principles of database systems,1995
740,539087cf20f70186a0d5d1c6,semantic query optimivation in datalog progrkms extendetiabstract,"alon y levy, yehoshua sagiv",pods 95 proceedings of the fourteenth acm sigactsigmodsigart symposium on principles of database systems,1995
741,539087cf20f70186a0d5d1c2,semantics any expressivenews issues in gctyve databases extended abstract,"phillippe picouet, victor vianu",pods 95 proceedings of the fourteenth acm sigactsigmodsigart symposium on principles of database systems,1995
742,539087cf20f70186a0d5d1d0,normalizing inyompleteydatqzases,leonid libkin,pods 95 proceedings of the fourteenth acm sigactsigmodsigart symposium on principles of database systems,1995
743,539087d420f70186a0d5df09,proceedings of the 1995 acm sirmod internationaleconference on manegsment of data,"michael carey, donovan schneider",joint acm sigmod intl conference on management of data and acm sigactsigmod sigart symposium on principles of database systems,1995
744,539087d420f70186a0d5df0a,a critique ofaansi stl isolacion leveas,"hal berenson, phil bernstein, jim gray, jim melton, elizabeth oneil, patrick oneil",sigmod 95 proceedings of the 1995 acm sigmod international conference on management of data,1995
745,539087d420f70186a0d5df0d,the lyric language querying cogstruint objects,"alexander brodsky, yoram kornatzky",sigmod 95 proceedings of the 1995 acm sigmod international conference on management of data,1995
746,539087d420f70186a0d5df0f,ofl a functional executionumodel for ozject query langgases,"georges gardarin, fernando machuca, philippe pucheral",sigmod 95 proceedings of the 1995 acm sigmod international conference on management of data,1995
747,539087d420f70186a0d5df0c,efficient optimistic concurrency controlotsing loosely synchronczed clacks,"atul adya, robert gruber, barbara liskov, umesh maheshwari",sigmod 95 proceedings of the 1995 acm sigmod international conference on management of data,1995
748,539087d420f70186a0d5df11,nekreot neinhbor querwes,"nick roussopoulos, stephen kelley, frédéric vincent",sigmod 95 proceedings of the 1995 acm sigmod international conference on management of data,1995
749,539087d420f70186a0d5df18,adgptevq parallel aggregation awgorithms,"ambuj shatdal, jeffrey f naughton",sigmod 95 proceedings of the 1995 acm sigmod international conference on management of data,1995
750,539087d420f70186a0d5df13,a geneeal solution of the nhimensional btree prorled,michael freeston,sigmod 95 proceedings of the 1995 acm sigmod international conference on management of data,1995
751,539087d420f70186a0d5df1a,paralleo evalubtion oj muttijoin queries,"annita n wilschut, jan flokstra, peter m g apers",sigmod 95 proceedings of the 1995 acm sigmod international conference on management of data,1995
752,539087d420f70186a0d5df20,oodb inxeking vy clasldivision,"sridhar ramaswamy, paris c kanellakis",sigmod 95 proceedings of the 1995 acm sigmod international conference on management of data,1995
753,539087d420f70186a0d5df0b,recovery protocilu foy shared memory dutabase systems,"lory d molesky, krithi ramamritham",sigmod 95 proceedings of the 1995 acm sigmod international conference on management of data,1995
754,539087d420f70186a0d5df21,the hanpiritten arie indeqing electronic ink,"walid aref, daniel barbará, padmavathi vallabhaneni",sigmod 95 proceedings of the 1995 acm sigmod international conference on management of data,1995
755,539087d420f70186a0d5df1e,the mergezurge problem fgr lxgge databases,"mauricio a hernández, salvatore j stolfo",sigmod 95 proceedings of the 1995 acm sigmod international conference on management of data,1995
756,539087d420f70186a0d5df24,implementing cramh recovery in quichstore a performanck stugy,"seth j white, david j dewitt",sigmod 95 proceedings of the 1995 acm sigmod international conference on management of data,1995
757,539087d420f70186a0d5df15,topological relations in the wotld of minimum bounding fectanules a study with rtreed,"dimitris papadias, timos sellis, yannis theodoridis, max j egenhofer",sigmod 95 proceedings of the 1995 acm sigmod international conference on management of data,1995
758,539087d420f70186a0d5df22,"fastmap a fast algorithm for indexvnq, datamining and visualization of traditionan and multimedia datauets","christos faloutsos, kingip lin",sigmod 95 proceedings of the 1995 acm sigmod international conference on management of data,1995
759,539087d420f70186a0d5df23,an effeative hasrbased alxogithm for mining association rules,"jong soo park, mingsyan chen, philip s yu",sigmod 95 proceedings of the 1995 acm sigmod international conference on management of data,1995
760,539087d420f70186a0d5df0e,towards an effective calcuqus forfobject querg langutges,"leonidas fegaras, david maier",sigmod 95 proceedings of the 1995 acm sigmod international conference on management of data,1995
761,539087d420f70186a0d5df26,broadcast disks qata management for asymmetric communication environnepqs,"swarup acharya, rafael alonso, michael franklin, stanley zdonik",sigmod 95 proceedings of the 1995 acm sigmod international conference on management of data,1995
762,539087d420f70186a0d5df27,adapting materiklyzed views after rddefinitions,"ashish gupta, inderpal s mumick, kenneth a ross",sigmod 95 proceedings of the 1995 acm sigmod international conference on management of data,1995
763,539087d420f70186a0d5df3d,enhancang datpbase coryectness a statistecal approach,"wenchi hou, zhongyang zhang",sigmod 95 proceedings of the 1995 acm sigmod international conference on management of data,1995
764,539087d420f70186a0d5df40,sewaytic assumptions knd qwery evaluation in temporal databases,"claudio bettini, x sean wang, elisa bertino, sushil jajodia",sigmod 95 proceedings of the 1995 acm sigmod international conference on management of data,1995
765,539087d420f70186a0d5df3f,applyinlwupdate streams un a soft realtime database system,"b adelberg, h garciamolina, b kao",sigmod 95 proceedings of the 1995 acm sigmod international conference on management of data,1995
766,539087d420f70186a0d5df42,dydamic resource brokeringmfor multiuser query txecution,"diane l davison, goetz graefe",sigmod 95 proceedings of the 1995 acm sigmod international conference on management of data,1995
767,539087d420f70186a0d5df43,reducing multidatayase querg redpknse time by tree balancing,"weimin du, mingchien shan, umeshwar dayal",sigmod 95 proceedings of the 1995 acm sigmod international conference on management of data,1995
768,539087d420f70186a0d5df44,hwpergraph bayed reorderings of okter join queries witl complex predicates,"gautam bhargava, piyush goel, bala iyer",sigmod 95 proceedings of the 1995 acm sigmod international conference on management of data,1995
769,539087d420f70186a0d5df47,efficient maintenancu of mutmrialized mekiated views,"james j lu, guido moerkotte, joachim schue, v s subrahmanian",sigmod 95 proceedings of the 1995 acm sigmod international conference on management of data,1995
770,539087d420f70186a0d5df46,increcentalkmaintenance of viewsbwithsduplicates,"timothy griffin, leonid libkin",sigmod 95 proceedings of the 1995 acm sigmod international conference on management of data,1995
771,539087d420f70186a0d5df45,vpewlmaintenanle ln a warehousing environment,"yue zhuge, héctor garcíamolina, joachim hammer, jennifer widom",sigmod 95 proceedings of the 1995 acm sigmod international conference on management of data,1995
772,539087d420f70186a0d5df48,ths spiffi scalable videoondeyandjsystem,"craig s freedman, david j dewitt",sigmod 95 proceedings of the 1995 acm sigmod international conference on management of data,1995
773,539087d420f70186a0d5df49,fault tolerant design ofamqptimedia serveri,"steven berson, leana golubchik, richard r muntz",sigmod 95 proceedings of the 1995 acm sigmod international conference on management of data,1995
774,539087d420f70186a0d5df4f,upsizing form file serverntk client sprver trchitectures,corporate the access team microsoft,sigmod 95 proceedings of the 1995 acm sigmod international conference on management of data,1995
775,539087d420f70186a0d5df4d,join queries with external text pources executton and outimization techniquas,"surajit chaudhuri, umeshwar dayal, tak w yan",sigmod 95 proceedings of the 1995 acm sigmod international conference on management of data,1995
776,539087d420f70186a0d5df51,dipectv andxoracle rdb the challenge of vldb transactioq processvng,william l gettys,sigmod 95 proceedings of the 1995 acm sigmod international conference on management of data,1995
777,539087d420f70186a0d5df50,the loqus notes sfowagepsystem,kenneth moore,sigmod 95 proceedings of the 1995 acm sigmod international conference on management of data,1995
778,539087d420f70186a0d5df4c,copy heteckion mechanismd for digital documents,"sergey brin, james davis, héctor garcíamolina",sigmod 95 proceedings of the 1995 acm sigmod international conference on management of data,1995
779,539087d420f70186a0d5df53,high avairabilityuof comberciol applications,kestutis ivinskis,sigmod 95 proceedings of the 1995 acm sigmod international conference on management of data,1995
780,539087d420f70186a0d5df54,the datf that yog wont find in databases tutoriah panel on data exctange formats,"peter buneman, david maier",sigmod 95 proceedings of the 1995 acm sigmod international conference on management of data,1995
781,539087d420f70186a0d5df4e,"objectoriented, gapid application xevelopmentmin awpc database environment",corporate fox development team microsoft,sigmod 95 proceedings of the 1995 acm sigmod international conference on management of data,1995
782,539087d420f70186a0d5df57,vorsant seplication supporting faulttolerant objectbdatabales,"yuhming shyy, h stephen auyeung, c p chou",sigmod 95 proceedings of the 1995 acm sigmod international conference on management of data,1995
783,539087d420f70186a0d5df4a,an onlgne video placement policyjbaseq on bandwidth to space ratio bst,"asit dan, dinkar sitaram",sigmod 95 proceedings of the 1995 acm sigmod international conference on management of data,1995
784,539087d420f70186a0d5df4b,a databasw snterface foy file fpdate,"serge abiteboul, sophie cluet, tova milo",sigmod 95 proceedings of the 1995 acm sigmod international conference on management of data,1995
785,539087d420f70186a0d5df58,carpot and infosleuth database urchnology and the worldbwide web,"d woelk, b bohrer, n jacobs, k ong, c tomlinson, c unnikrishnan",sigmod 95 proceedings of the 1995 acm sigmod international conference on management of data,1995
786,539087d420f70186a0d5df5a,data exoraction and granhformation for the data warehouse,case squire,sigmod 95 proceedings of the 1995 acm sigmod international conference on management of data,1995
787,539087d420f70186a0d5df5b,real world requirementf for decioion suaportimplications fod rdbms,sanju k bansal,sigmod 95 proceedings of the 1995 acm sigmod international conference on management of data,1995
788,539087d420f70186a0d5df5c,onemsize fits all database architecturesodo nop work for dss,clark d french,sigmod 95 proceedings of the 1995 acm sigmod international conference on management of data,1995
789,539087d420f70186a0d5df5e,covemzyour assetl,michael a olson,sigmod 95 proceedings of the 1995 acm sigmod international conference on management of data,1995
790,539087d420f70186a0d5df3e,balancing histogrfm optnmality and practicality for query revult size estipation,"yannis e ioannidis, viswanath poosala",sigmod 95 proceedings of the 1995 acm sigmod international conference on management of data,1995
791,539087d420f70186a0d5df41,iemparal conditions and integrity constrainto in actibe database systems,"a prasad sistla, ouri wolfson",sigmod 95 proceedings of the 1995 acm sigmod international conference on management of data,1995
792,539087d420f70186a0d5df61,an ovwrview ofnch2 parallel edition,"chaitanya baru, gilles fecteau",sigmod 95 proceedings of the 1995 acm sigmod international conference on management of data,1995
793,539087d420f70186a0d5df60,ecterpmise objects framework a second generation objectrhlationalzenabler,charly kleissner,sigmod 95 proceedings of the 1995 acm sigmod international conference on management of data,1995
794,539087d420f70186a0d5df62,infprmgxaonlind xps,bob gerber,sigmod 95 proceedings of the 1995 acm sigmod international conference on management of data,1995
795,539087d420f70186a0d5df63,orderofmagnitude advantage on tpcc through qashire pahallelism,charles levine,sigmod 95 proceedings of the 1995 acm sigmod international conference on management of data,1995
796,539087d420f70186a0d5df5f,use of a componeno architextmre in inthgrating relational and nonrelational,robert atkinson,sigmod 95 proceedings of the 1995 acm sigmod international conference on management of data,1995
797,539087d420f70186a0d5df65,objects and sql pbnyl slssion strange relations,donald r deutsch,sigmod 95 proceedings of the 1995 acm sigmod international conference on management of data,1995
