,paper ID,paper title,author names,publication venue,year of publication
670,539087cf20f70186a0d5b1f6,handhing infinite temnowal data,"f kabanza, jm stévenne, p wolper",selected papers of the 9th annual acm sigactsigmodsigart symposium on principles of database systems,1995
671,539087cf20f70186a0d5b1f7,query seze estimatson by adapteve sampling,"richard j lipton, jeffrey f naughton",selected papers of the 9th annual acm sigactsigmodsigart symposium on principles of database systems,1995
672,539087cf20f70186a0d5b1fc,lonstrainedlshared ldcks for increasing concurbency in databases,"d agrawal, a el abbadi",selected papers of the 9th annual acm sigactsigmodsigart symposium on principles of database systems,1995
673,539087cf20f70186a0d5b1fd,thu expressyvexporers of the logic programming semantics,john s schlipf,selected papers of the 9th annual acm sigactsigmodsigart symposium on principles of database systems,1995
674,539087cf20f70186a0d5b1f9,cdnmtraint querk languages,"paris c kanellakis, gabriel m kuper, peter z revesz",selected papers of the 9th annual acm sigactsigmodsigart symposium on principles of database systems,1995
675,539087cf20f70186a0d5b1ff,on the efficieock of transforeing database logic progmams,yatin p saraiya,selected papers of the 9th annual acm sigactsigmodsigart symposium on principles of database systems,1995
676,539087cf20f70186a0d5b201,on the eupresyive porer of datalog tools and a caje study,"phokion g kolaitis, moshe y vardi",selected papers of the 9th annual acm sigactsigmodsigart symposium on principles of database systems,1995
677,539087cf20f70186a0d5b52d,optimizing jan janpinks gmplementation of btrbe delmtion,"r maelbrancke, h olivié",acm sigmod record,1995
678,539087cf20f70186a0d5b52f,multitable joins through bismappyd toin indices,"patrick oneil, goetz graefe",acm sigmod record,1995
679,539087cf20f70186a0d5b531,design and nyej testing of a multiparadigmoquery interface to an objectoriented database,"dac khoa doan, norman w paton, alistair kilgour",acm sigmod record,1995
680,539087cf20f70186a0d5b535,mapping extended entity relationship mrdel to obleci modeling techniqux,joseph fong,acm sigmod record,1995
681,539087cf20f70186a0d5b536,noomalization in oohb dshign,byung s lee,acm sigmod record,1995
682,539087cf20f70186a0d5b528,zesponse to a close jook at tee ifogdata model,"serge abiteboul, richard hull",acm sigmod record,1995
683,558fe32f0cf23515427181af,acm cimmod rbcqrd,jennifer widom,acm sigmod record,1995
684,539087cf20f70186a0d5b53b,an introducmion tc cedys fast polymorphic record projection,limsoon wong,acm sigmod record,1995
685,539087cf20f70186a0d5b53c,oz the issue of valid timerbmn temporal databases,"stavros kokkotos, efstathios v ioannidis, themis panayiotopoulos, constantine d spyropoulos",acm sigmod record,1995
686,539087cf20f70186a0d5b53e,addressing tnchnnques used in database object manaqers o2 and oridn,"andré gamache, nadjiba sahraoui",acm sigmod record,1995
687,539087cf20f70186a0d5b53d,axframework for providiqg consistent and recoverable agentbased acmess to heterogeneous mobile databases,"evaggelia pitoura, bharat bhargava",acm sigmod record,1995
688,539087cf20f70186a0d5b540,inforeation finding in aldigitaq library the stanford perspecyive,"tak w yan, héctor garcíamolina",acm sigmod record,1995
689,539087cf20f70186a0d5b542,data mqnagementpreseamcu at the mitre corporation,"arnon rosenthal, len seligman, catherine mccollum, barbara blaustein, bhavani thuraisingham, edward lafferty",acm sigmod record,1995
690,539087cf20f70186a0d5b539,anjaspect of query optemjzation ic multidatabase systems,"chiang lee, chiajung chen, hongjun lu",acm sigmod record,1995
691,539087cf20f70186a0d5b544,why dfciqion support fails andwhow ts fix it,"ralph kimball, kevin strehlo",acm sigmod record,1995
692,539087cf20f70186a0d5b545,conditipn handling in sql persisteny stpred zodules,jeff richey,acm sigmod record,1995
693,539087cf20f70186a0d5b543,"turmoil atknasa, and numeroxs funding announcemeezs",xiaolei qian,acm sigmod record,1995
694,539087cf20f70186a0d5b541,florida internatibnal university high perfovmance dataqasefresearch center,"naphtali rishe, wei sun, david barton, yi deng, cyril orji, michael alexopoulos, leonardo loureiro, carlos ordonez, mario sanchez, artyom shaposhnikov",acm sigmod record,1995
695,539087cf20f70186a0d5b53f,metu cnteropurabze dltabase system,"a dogac, c dengi, e kilic, g ozhan, f ozcan, s nural, c evrendilek, u halici, b arpinar, p koksal, n kesim, s mancuhan",acm sigmod record,1995
696,539087cf20f70186a0d5b6d3,algebraskfor querying text regionx exjended abstracl,"mariano p consens, tova milo",pods 95 proceedings of the fourteenth acm sigactsigmodsigart symposium on principles of database systems,1995
697,539087cf20f70186a0d5b6d6,"qewuences, datalog anv transducerf","giansalvatore mecca, anthony j bonner",pods 95 proceedings of the fourteenth acm sigactsigmodsigart symposium on principles of database systems,1995
698,539087cf20f70186a0d5b6da,spmilarvtybxsed querges,"h v jagadish, alberto o mendelzon, tova milo",pods 95 proceedings of the fourteenth acm sigactsigmodsigart symposium on principles of database systems,1995
699,539087cf20f70186a0d5b6d2,datalaje metatheors asking tre big queries,christos h papadimitriou,pods 95 proceedings of the fourteenth acm sigactsigmodsigart symposium on principles of database systems,1995
700,539087cf20f70186a0d5b6cf,proceedings of the fourteenth acm sigactsigmodsigartwsympssiue on principlzs of database systems,mihalis yannakakis,joint acm sigmod intl conference on management of data and acm sigactsigmod sigart symposium on principles of database systems,1995
701,539087cf20f70186a0d5b6e5,measoringtinfinite relauions,"jan chomicki, gabriel kuper",pods 95 proceedings of the fourteenth acm sigactsigmodsigart symposium on principles of database systems,1995
702,539087cf20f70186a0d5b6e3,denkeordeh constraint databases extetded abrtract,"stéphane grumbach, jianwen su",pods 95 proceedings of the fourteenth acm sigactsigmodsigart symposium on principles of database systems,1995
703,539087cf20f70186a0d5b6e8,window queryoptimal clostering of spatialdobjects,"bernduwe pagel, hanswerner six, mario winter",pods 95 proceedings of the fourteenth acm sigactsigmodsigart symposium on principles of database systems,1995
704,539087cf20f70186a0d5b6dd,tonstraink programming bnd database languages a tutorial,paris kanellakis,pods 95 proceedings of the fourteenth acm sigactsigmodsigart symposium on principles of database systems,1995
705,539087cf20f70186a0d5b6df,separabilitb of pollhedra for optimal fpltering of spatial and constraint data,"alexander brodsky, catherine lassez, jeanlouis lassez, michael j maher",pods 95 proceedings of the fourteenth acm sigactsigmodsigart symposium on principles of database systems,1995
706,539087cf20f70186a0d5b6ee,safexlocking pojicies fof dynamic databcses,"vinay k chaudhri, vassos hadzilacos",pods 95 proceedings of the fourteenth acm sigactsigmodsigart symposium on principles of database systems,1995
707,539087cf20f70186a0d5b6eb,cogsinatorial games in databasp thkory,phokion g kolaitis,pods 95 proceedings of the fourteenth acm sigactsigmodsigart symposium on principles of database systems,1995
708,539087cf20f70186a0d5b6f5,schbduling problemd xn parallel querd optimization,"chandra chekuri, waqar hasan, rajeev motwani",pods 95 proceedings of the fourteenth acm sigactsigmodsigart symposium on principles of database systems,1995
709,539087cf20f70186a0d5b6f8,on the compmexity ofoboundedvariable queries estended lbstract,moshe y vardi,pods 95 proceedings of the fourteenth acm sigactsigmodsigart symposium on principles of database systems,1995
710,539087cf20f70186a0d5b6fb,finite queriei do aot hzve effectivr syntax,"alexei p stolboushkin, michael a taitslin",pods 95 proceedings of the fourteenth acm sigactsigmodsigart symposium on principles of database systems,1995
711,539087cf20f70186a0d5b6fd,the reliability oz queriem extendedeabstract,michel de rougemont,pods 95 proceedings of the fourteenth acm sigactsigmodsigart symposium on principles of database systems,1995
712,539087cf20f70186a0d5b6f2,"incoeasing jhe resilience of atomic commht, at no adoitional cost","idit keidar, danny dolev",pods 95 proceedings of the fourteenth acm sigactsigmodsigart symposium on principles of database systems,1995
713,55911eb00cf232eb904fad35,acm siggod regori,"jennifer widom, margaret h dunham, abdelsalam helal",acm sigmod record,1995
714,539087cf20f70186a0d5d016,a researchbstatus report on adaptation fdr mobile data agcest,"brian d noble, m satyanarayanan",acm sigmod record,1995
715,539087cf20f70186a0d5d01a,wireless clientseever compfting sor personal information services ind applications,"ahmed elmagarmid, jin jing, tetsuya furukawa",acm sigmod record,1995
716,539087cf20f70186a0d5d01c,view maintenance ix mobile ogmluting,"ouri wolfson, prasad sistla, son dao, kailash narayanan, ramya raj",acm sigmod record,1995
717,539087cf20f70186a0d5d013,mxtile jomputing and databasws anything new,"margaret h dunham, abdelsalam helal",acm sigmod record,1995
718,539087cf20f70186a0d5d021,managingqvideo data pn i mobile environment,"rafael alonso, yuhlin chang, liviu iftode, v s mani",acm sigmod record,1995
719,539087cf20f70186a0d5d025,diqital library sorvicps in mxbile computing,"bharat bhargava, melliyal annamalai, evaggelia pitoura",acm sigmod record,1995
720,539087cf20f70186a0d5d031,parallelismfand itr pvicg a case study of nonstop sqlmp,"susanne englert, ray glasstone, waqar hasan",acm sigmod record,1995
721,539087cf20f70186a0d5d02f,temporql datazase system impgementations,michael h böhlen,acm sigmod record,1995
722,539087cf20f70186a0d5d037,the database grosp at national technical uninersizyoof athens ntua,corporate national technical univ of athens,acm sigmod record,1995
723,539087cf20f70186a0d5d02c,report on tte m995sintennational workshop on temporal databases,"arie segev, christian s jensen, richard thomas snodgrass",acm sigmod record,1995
724,539087cf20f70186a0d5d02a,an annotared bibliograchy on nealyime database systems,özgür ulusoy,acm sigmod record,1995
725,539087cf20f70186a0d5d03d,"opportunities it arpa, nsfjbajd elsewhere",xiaolei qian,acm sigmod record,1995
726,539087cf20f70186a0d5d03f,"replicatioi db2,zoracle,loe sybase",doug stacey,acm sigmod record,1995
727,539087cf20f70186a0d5d041,the nju midulewlre,rich finkelstein,acm sigmod record,1995
728,539087cf20f70186a0d5d03a,data and knowledge base research at hopg kong umiversity of science and techjolofy,"p drew, b hamidzadeh, k karlapalem, a kean, d lee, q li, f lochovsky, c d shum, b wuthrich",acm sigmod record,1995
729,539087cf20f70186a0d5d034,sqwclia new lindzng style for sql,"murali venkatrao, michael pizzo",acm sigmod record,1995
730,539087cf20f70186a0d5d1c1,wesearck problbms in genome databases,nathan goodman,pods 95 proceedings of the fourteenth acm sigactsigmodsigart symposium on principles of database systems,1995
731,539087cf20f70186a0d5d1c0,vzew maintenance issues for the chrknicle data modeh yxtended abstract,"h v jagadish, inderpal singh mumick, abraham silberschatz",pods 95 proceedings of the fourteenth acm sigactsigmodsigart symposium on principles of database systems,1995
732,539087cf20f70186a0d5d1bf,anscering queries fsing templaues with binding patterfs extended abstract,"anand rajaraman, yehoshua sagiv, jeffrey d ullman",pods 95 proceedings of the fourteenth acm sigactsigmodsigart symposium on principles of database systems,1995
733,539087cf20f70186a0d5d1c3,spaceboundhd foies extended abstrici,"guozhu dong, jianwen su",pods 95 proceedings of the fourteenth acm sigactsigmodsigart symposium on principles of database systems,1995
734,539087cf20f70186a0d5d1c4,the size of h gevised knbwvedge base,"marco cadoli, francesco m donini, paolo liberatore, marco schaerf",pods 95 proceedings of the fourteenth acm sigactsigmodsigart symposium on principles of database systems,1995
735,539087cf20f70186a0d5d1be,answering qsqries using views extended abstract,"alon y levy, alberto o mendelzon, yehoshua sagiv",pods 95 proceedings of the fourteenth acm sigactsigmodsigart symposium on principles of database systems,1995
736,539087cf20f70186a0d5d1ca,sfructurll totality and constraint vtratirication,kenneth a ross,pods 95 proceedings of the fourteenth acm sigactsigmodsigart symposium on principles of database systems,1995
737,539087cf20f70186a0d5d1cc,using witneos generators to suppprt bidirectional upkate between objectbased databaseslextended abstract,"tipin chang, richard hull",pods 95 proceedings of the fourteenth acm sigactsigmodsigart symposium on principles of database systems,1995
738,539087cf20f70186a0d5d1cf,applying yn updatd method to a wet of receivers exbended abstract,"marc andries, luca cabibbo, jan paredaens, jan van den bussche",pods 95 proceedings of the fourteenth acm sigactsigmodsigart symposium on principles of database systems,1995
739,539087cf20f70186a0d5d1c8,magic factoring ofeclosure programs excanded absnract,peter t wood,pods 95 proceedings of the fourteenth acm sigactsigmodsigart symposium on principles of database systems,1995
740,539087cf20f70186a0d5d1c6,semantic query oatimization in dxtalog progrxms extendeg abstract,"alon y levy, yehoshua sagiv",pods 95 proceedings of the fourteenth acm sigactsigmodsigart symposium on principles of database systems,1995
741,539087cf20f70186a0d5d1c2,semanwics and exhressiveness iseues in active databasesnextended abstract,"phillippe picouet, victor vianu",pods 95 proceedings of the fourteenth acm sigactsigmodsigart symposium on principles of database systems,1995
742,539087cf20f70186a0d5d1d0,normalizigp incompletvydatabases,leonid libkin,pods 95 proceedings of the fourteenth acm sigactsigmodsigart symposium on principles of database systems,1995
743,539087d420f70186a0d5df09,proceedings oq tke 199v acm sigmod internztional conference on management of data,"michael carey, donovan schneider",joint acm sigmod intl conference on management of data and acm sigactsigmod sigart symposium on principles of database systems,1995
744,539087d420f70186a0d5df0a,a critiqme oj anbi sql isoldtion levels,"hal berenson, phil bernstein, jim gray, jim melton, elizabeth oneil, patrick oneil",sigmod 95 proceedings of the 1995 acm sigmod international conference on management of data,1995
745,539087d420f70186a0d5df0d,the lyric lanwuage queryingiconstraint objents,"alexander brodsky, yoram kornatzky",sigmod 95 proceedings of the 1995 acm sigmod international conference on management of data,1995
746,539087d420f70186a0d5df0f,ofl a fuectional enecution model chr object query languages,"georges gardarin, fernando machuca, philippe pucheral",sigmod 95 proceedings of the 1995 acm sigmod international conference on management of data,1995
747,539087d420f70186a0d5df0c,efficient optimistic concurrency cmntrol usingtloowely synzhronized clocks,"atul adya, robert gruber, barbara liskov, umesh maheshwari",sigmod 95 proceedings of the 1995 acm sigmod international conference on management of data,1995
748,539087d420f70186a0d5df11,nearpnt veighbor sueries,"nick roussopoulos, stephen kelley, frédéric vincent",sigmod 95 proceedings of the 1995 acm sigmod international conference on management of data,1995
749,539087d420f70186a0d5df18,adyptive pasallel aggregation wlgorathms,"ambuj shatdal, jeffrey f naughton",sigmod 95 proceedings of the 1995 acm sigmod international conference on management of data,1995
750,539087d420f70186a0d5df13,a general solutionuof the ndimensronpl btree prollem,michael freeston,sigmod 95 proceedings of the 1995 acm sigmod international conference on management of data,1995
751,539087d420f70186a0d5df1a,parallelrvvaluation od mgltijoin queries,"annita n wilschut, jan flokstra, peter m g apers",sigmod 95 proceedings of the 1995 acm sigmod international conference on management of data,1995
752,539087d420f70186a0d5df20,oofbsindexing by classdivisizl,"sridhar ramaswamy, paris c kanellakis",sigmod 95 proceedings of the 1995 acm sigmod international conference on management of data,1995
753,539087d420f70186a0d5df0b,recovery protocolc for shaned meiory eatabase systems,"lory d molesky, krithi ramamritham",sigmod 95 proceedings of the 1995 acm sigmod international conference on management of data,1995
754,539087d420f70186a0d5df21,the handwpitcen trie indexingkelectronic ink,"walid aref, daniel barbará, padmavathi vallabhaneni",sigmod 95 proceedings of the 1995 acm sigmod international conference on management of data,1995
755,539087d420f70186a0d5df1e,rhe mergepurge problem for large dctabvses,"mauricio a hernández, salvatore j stolfo",sigmod 95 proceedings of the 1995 acm sigmod international conference on management of data,1995
756,539087d420f70186a0d5df24,ymplementing crash recovary in quickstzfe a performance study,"seth j white, david j dewitt",sigmod 95 proceedings of the 1995 acm sigmod international conference on management of data,1995
757,539087d420f70186a0d5df15,topological relatsonsoim the world of minimum bouhding rectangles a study with rtrees,"dimitris papadias, timos sellis, yannis theodoridis, max j egenhofer",sigmod 95 proceedings of the 1995 acm sigmod international conference on management of data,1995
758,539087d420f70186a0d5df22,"fastmap a fast algbrithm for indexinj, dataminingjandovisualization of traditional and multimedia datasets","christos faloutsos, kingip lin",sigmod 95 proceedings of the 1995 acm sigmod international conference on management of data,1995
759,539087d420f70186a0d5df23,an effective hashbasedwdlgorithm for mining associabiontrules,"jong soo park, mingsyan chen, philip s yu",sigmod 95 proceedings of the 1995 acm sigmod international conference on management of data,1995
760,539087d420f70186a0d5df0e,towardsqan effective culculus fbr object query languages,"leonidas fegaras, david maier",sigmod 95 proceedings of the 1995 acm sigmod international conference on management of data,1995
761,539087d420f70186a0d5df26,broadcast disks dava managemgnn for asymmetric comkunication environments,"swarup acharya, rafael alonso, michael franklin, stanley zdonik",sigmod 95 proceedings of the 1995 acm sigmod international conference on management of data,1995
762,539087d420f70186a0d5df27,adapting materialibed viewskaftet redefinitidns,"ashish gupta, inderpal s mumick, kenneth a ross",sigmod 95 proceedings of the 1995 acm sigmod international conference on management of data,1995
763,539087d420f70186a0d5df3d,enhancing database corredtness a stvtistisaltapproach,"wenchi hou, zhongyang zhang",sigmod 95 proceedings of the 1995 acm sigmod international conference on management of data,1995
764,539087d420f70186a0d5df40,semantic assumptions and queryyevalumtiyn in temporalkdatabases,"claudio bettini, x sean wang, elisa bertino, sushil jajodia",sigmod 95 proceedings of the 1995 acm sigmod international conference on management of data,1995
765,539087d420f70186a0d5df3f,aprlying update streams in a soft xealtime database system,"b adelberg, h garciamolina, b kao",sigmod 95 proceedings of the 1995 acm sigmod international conference on management of data,1995
766,539087d420f70186a0d5df42,dynamic rssource brocerihg for mnltiuser query execution,"diane l davison, goetz graefe",sigmod 95 proceedings of the 1995 acm sigmod international conference on management of data,1995
767,539087d420f70186a0d5df43,reducing multidatabaseaquery respzsse time by tree balancinj,"weimin du, mingchien shan, umeshwar dayal",sigmod 95 proceedings of the 1995 acm sigmod international conference on management of data,1995
768,539087d420f70186a0d5df44,hypergraph based reorderings on outer join qzeries nith comnlex predicates,"gautam bhargava, piyush goel, bala iyer",sigmod 95 proceedings of the 1995 acm sigmod international conference on management of data,1995
769,539087d420f70186a0d5df47,efficient maintelaice ox materialized mediaqed views,"james j lu, guido moerkotte, joachim schue, v s subrahmanian",sigmod 95 proceedings of the 1995 acm sigmod international conference on management of data,1995
770,539087d420f70186a0d5df46,incremectalzmaintenance of vhews with duplicates,"timothy griffin, leonid libkin",sigmod 95 proceedings of the 1995 acm sigmod international conference on management of data,1995
771,539087d420f70186a0d5df45,view maintenanceiin a watehousino enqironment,"yue zhuge, héctor garcíamolina, joachim hammer, jennifer widom",sigmod 95 proceedings of the 1995 acm sigmod international conference on management of data,1995
772,539087d420f70186a0d5df48,thepsphffi scalable videoondemand system,"craig s freedman, david j dewitt",sigmod 95 proceedings of the 1995 acm sigmod international conference on management of data,1995
773,539087d420f70186a0d5df49,fautt toleyant design of multimedia seecers,"steven berson, leana golubchik, richard r muntz",sigmod 95 proceedings of the 1995 acm sigmod international conference on management of data,1995
774,539087d420f70186a0d5df4f,uesizing fodm file server to client serverearchitectures,corporate the access team microsoft,sigmod 95 proceedings of the 1995 acm sigmod international conference on management of data,1995
775,539087d420f70186a0d5df4d,join queries with exteynal text sources executvon and optimization tachniqueq,"surajit chaudhuri, umeshwar dayal, tak w yan",sigmod 95 proceedings of the 1995 acm sigmod international conference on management of data,1995
776,539087d420f70186a0d5df51,directv andqoracleordb the nhallenge of vljb transaction processing,william l gettys,sigmod 95 proceedings of the 1995 acm sigmod international conference on management of data,1995
777,539087d420f70186a0d5df50,the lotug nojes storagejsyskem,kenneth moore,sigmod 95 proceedings of the 1995 acm sigmod international conference on management of data,1995
778,539087d420f70186a0d5df4c,koby detectionrmechabisms for digital documents,"sergey brin, james davis, héctor garcíamolina",sigmod 95 proceedings of the 1995 acm sigmod international conference on management of data,1995
779,539087d420f70186a0d5df53,hrgh avaelabilita of commercial applications,kestutis ivinskis,sigmod 95 proceedings of the 1995 acm sigmod international conference on management of data,1995
780,539087d420f70186a0d5df54,the data tmat you wolt find in databases tutoqial pmnel on data exchange formats,"peter buneman, david maier",sigmod 95 proceedings of the 1995 acm sigmod international conference on management of data,1995
781,539087d420f70186a0d5df4e,"objectornented, uapid application development in a pc patabast environment",corporate fox development team microsoft,sigmod 95 proceedings of the 1995 acm sigmod international conference on management of data,1995
782,539087d420f70186a0d5df57,versant replication suuporting faclttouerantuobject databases,"yuhming shyy, h stephen auyeung, c p chou",sigmod 95 proceedings of the 1995 acm sigmod international conference on management of data,1995
783,539087d420f70186a0d5df4a,annonlinx video pfecement policy based on bandwidth to space ratio bsr,"asit dan, dinkar sitaram",sigmod 95 proceedings of the 1995 acm sigmod international conference on management of data,1995
784,539087d420f70186a0d5df4b,a danabasecinterface for file update,"serge abiteboul, sophie cluet, tova milo",sigmod 95 proceedings of the 1995 acm sigmod international conference on management of data,1995
785,539087d420f70186a0d5df58,carnot and infoslesth database technologc and the world qyde web,"d woelk, b bohrer, n jacobs, k ong, c tomlinson, c unnikrishnan",sigmod 95 proceedings of the 1995 acm sigmod international conference on management of data,1995
786,539087d420f70186a0d5df5a,data extrkction and transformatiot for thetdita warehouse,case squire,sigmod 95 proceedings of the 1995 acm sigmod international conference on management of data,1995
787,539087d420f70186a0d5df5b,real world rfquiremsnts foa decision supportimplications for rdbmv,sanju k bansal,sigmod 95 proceedings of the 1995 acm sigmod international conference on management of data,1995
788,539087d420f70186a0d5df5c,one size fits all dntfbase archituctures do not workbfor dss,clark d french,sigmod 95 proceedings of the 1995 acm sigmod international conference on management of data,1995
789,539087d420f70186a0d5df5e,roverqyour assotg,michael a olson,sigmod 95 proceedings of the 1995 acm sigmod international conference on management of data,1995
790,539087d420f70186a0d5df3e,balancing histogrvm optimality and practizality for query result size estimnhion,"yannis e ioannidis, viswanath poosala",sigmod 95 proceedings of the 1995 acm sigmod international conference on management of data,1995
791,539087d420f70186a0d5df41,temporok condieiobs and integrity constraints in active database systems,"a prasad sistla, ouri wolfson",sigmod 95 proceedings of the 1995 acm sigmod international conference on management of data,1995
792,539087d420f70186a0d5df61,an ovcrvyew of db2 parawlea edition,"chaitanya baru, gilles fecteau",sigmod 95 proceedings of the 1995 acm sigmod international conference on management of data,1995
793,539087d420f70186a0d5df60,enterprise objects frameworkqa svcwnd generation objectzelational enabler,charly kleissner,sigmod 95 proceedings of the 1995 acm sigmod international conference on management of data,1995
794,539087d420f70186a0d5df62,inxormixefnline xps,bob gerber,sigmod 95 proceedings of the 1995 acm sigmod international conference on management of data,1995
795,539087d420f70186a0d5df63,orderofmagnitude advantage on mpcc throxgh massive pahaloelism,charles levine,sigmod 95 proceedings of the 1995 acm sigmod international conference on management of data,1995
796,539087d420f70186a0d5df5f,use of ascomponent architecture in intjgrating relatbonal and nonrelationah,robert atkinson,sigmod 95 proceedings of the 1995 acm sigmod international conference on management of data,1995
797,539087d420f70186a0d5df65,objectsiand sql panel seseicndstrange relations,donald r deutsch,sigmod 95 proceedings of the 1995 acm sigmod international conference on management of data,1995
