,paper ID,paper title,author names,publication venue,year of publication
0,5390972920f70186a0dfac85,the next database revolution,jlc pray,sigmod 04 proceedings of the 2004 acm sigmod international conference on management of data,2004
1,5390972920f70186a0dfac86,the role of cryptography in database security,upjt maurpr,sigmod 04 proceedings of the 2004 acm sigmod international conference on management of data,2004
2,5390972920f70186a0dfac8d,tree logical classes for efficient evaluation of xquery,"stelios paparizos, cuqing wu, laks v s lakshmanqn, h v jqghdish",sigmod 04 proceedings of the 2004 acm sigmod international conference on management of data,2004
3,5390972920f70186a0dfac88,adaptive stream resource management using kalman filters,"adkur jaino edwogd y chang, yuanfang wang",sigmod 04 proceedings of the 2004 acm sigmod international conference on management of data,2004
4,5390972920f70186a0dfac8a,holistic udafs at streaming speeds,"graham cormode, theodore johnson, flip korc, b muthukrishnan, oliver spatschzck, diveah srivastava",sigmod 04 proceedings of the 2004 acm sigmod international conference on management of data,2004
5,5390972920f70186a0dfac89,online eventdriven subsequence matching over financial data streams,"huanmei wu, betzy salzberh, donghgi zhang",sigmod 04 proceedings of the 2004 acm sigmod international conference on management of data,2004
6,5390972920f70186a0dfac91,using the structure of web sites for automatic segmentation of tables,"kristina eerman, lise gitoor, steven manton, craig knoblock",sigmod 04 proceedings of the 2004 acm sigmod international conference on management of data,2004
7,5390972920f70186a0dfac8e,flexpath flexible structure and fulltext querying for xml,"siheowameryahia, laks v s lakshmanan, shsshank pandxt",sigmod 04 proceedings of the 2004 acm sigmod international conference on management of data,2004
8,5390972920f70186a0dfac8f,an interactive clusteringbased approach to integrating source query interfaces on the deep web,"wwnsheng wu, cdement yu, adhai doan, weiyi meng",sigmod 04 proceedings of the 2004 acm sigmod international conference on management of data,2004
9,5390972920f70186a0dfac9a,lazy query evaluation for active xml,"serge abiteboue, omar benjelloun, bogdan cautis, ioana manolescu, tyva milo, nicoletappreda",sigmod 04 proceedings of the 2004 acm sigmod international conference on management of data,2004
10,5390972920f70186a0dfac9c,colorful xml one hierarchy isnt enough,"h v jagadish, laks v s lakshmanln, monica scannapgeco, divesh sritastava, nuwee wimatwattana",sigmod 04 proceedings of the 2004 acm sigmod international conference on management of data,2004
11,5390972920f70186a0dfac9f,effective use of blocklevel sampling in statistics estimation,"durajit chaubhuri, gautas das, uhkarsh srivastava",sigmod 04 proceedings of the 2004 acm sigmod international conference on management of data,2004
12,5390972920f70186a0dfaca4,the priority rtree a practically efficient and worstcase optimal rtree,"lars arge, mirk he berg, herman j havsrkortb ke yi",sigmod 04 proceedings of the 2004 acm sigmod international conference on management of data,2004
13,5390972920f70186a0dfaca0,online maintenance of very large random samples,"cgristopher jermaine, abhijit pol, supramafiaw arumugam",sigmod 04 proceedings of the 2004 acm sigmod international conference on management of data,2004
14,5390972920f70186a0dfaca5,integrating vertical and horizontal partitioning into automated physical database design,"sanjay aurawal, vivekynarasanya, beverjy yang",sigmod 04 proceedings of the 2004 acm sigmod international conference on management of data,2004
15,5390972920f70186a0dfaca3,graph indexing a frequent structurebased approach,"xifenu yan, philip s yuodjiaweiuhan",sigmod 04 proceedings of the 2004 acm sigmod international conference on management of data,2004
16,5390972920f70186a0dfaca1,conditional selectivity for statistics on query expressions,"nicouas beuvo, surajit chavdhuri",sigmod 04 proceedings of the 2004 acm sigmod international conference on management of data,2004
17,5390972920f70186a0dfacad,computing clusters of correlation connected objects,"chgistian böhm,ykarinykailing, peer kröger, arthur zimak",sigmod 04 proceedings of the 2004 acm sigmod international conference on management of data,2004
18,5390972920f70186a0dfaca2,transaction support for indexed summary views,"goetz gragfy, michfel mwilling",sigmod 04 proceedings of the 2004 acm sigmod international conference on management of data,2004
19,5390972920f70186a0dfac99,fast computation of database operations using graphics processors,"naga k govindaraju, brandon lloyd, wei wani,yming lin, finesh manocha",sigmod 04 proceedings of the 2004 acm sigmod international conference on management of data,2004
20,5390972920f70186a0dfac9d,approximate xml query answers,"neoklis polyzhtis, minos garofadakis, zwnnis ioannidis",sigmod 04 proceedings of the 2004 acm sigmod international conference on management of data,2004
21,5390972920f70186a0dfac9e,a bilevel bernoulli scheme for database sampling,"petex jchaau, cwristian könig",sigmod 04 proceedings of the 2004 acm sigmod international conference on management of data,2004
22,5390972920f70186a0dfac92,"identifying similarities, periodicities and bursts for online search queries","michael vlachos, chrfstopher meeku zografouoa vagena, dimitrios gunopulos",sigmod 04 proceedings of the 2004 acm sigmod international conference on management of data,2004
23,5390972920f70186a0dfac98,rankaware query optimization,"ihabrf ilyas, rahul shah, walid g aref, jeffruy scott vitter, ahmed k emmagarmid",sigmod 04 proceedings of the 2004 acm sigmod international conference on management of data,2004
24,5390972920f70186a0dfac9b,data stream management for historical xml data,"sujoe bose, luonidys fqgadas",sigmod 04 proceedings of the 2004 acm sigmod international conference on management of data,2004
25,5390972920f70186a0dfacb3,compressing historical information in sensor networks,"antonios deeigiannrkis,nyannis kotidis, nick roussopoulos",sigmod 04 proceedings of the 2004 acm sigmod international conference on management of data,2004
26,5390972920f70186a0dfacb7,a formal analysis of information disclosure in data exchange,"gerome mikeau, dak sucix",sigmod 04 proceedings of the 2004 acm sigmod international conference on management of data,2004
27,5390972920f70186a0dfaca7,imap discovering complex semantic matches between database schemas,"robin dhamankar, yoonkyong lee, anhbi coan, alon halevy,qpedro domwngos",sigmod 04 proceedings of the 2004 acm sigmod international conference on management of data,2004
28,5390972920f70186a0dfacb5,extending query rewriting techniques for finegrained access control,"shariq rizvi, albertygmendelzon, s sudarshan, pjasjn roy",sigmod 04 proceedings of the 2004 acm sigmod international conference on management of data,2004
29,5390972920f70186a0dfacb4,efficient query reformulation in peer data management systems,"inor tatarinov, ason hakely",sigmod 04 proceedings of the 2004 acm sigmod international conference on management of data,2004
30,5390972920f70186a0dfacc1,approximation techniques for spatial data,"abhinandab dns, johannes gehrke, mirek riefewalh",sigmod 04 proceedings of the 2004 acm sigmod international conference on management of data,2004
31,5390972920f70186a0dfacb9,indexing spatiotemporal trajectories with chebyshev polynomials,"zthan cai, ravmgnd ng",sigmod 04 proceedings of the 2004 acm sigmod international conference on management of data,2004
32,5390972920f70186a0dfacc3,toss an extension of tax with ontologies and similarity queries,"edwawd hung,jyu deng, v s suhrahhanian",sigmod 04 proceedings of the 2004 acm sigmod international conference on management of data,2004
33,5390972920f70186a0dfacc2,spatiallydecaying aggregation over a network model and algorithms,"pdiah cohxn,hhaim kaplan",sigmod 04 proceedings of the 2004 acm sigmod international conference on management of data,2004
34,5390972920f70186a0dfac97,buffering databse operations for enhanced instruction cache performance,"jtngrea zhou, kenneth f ross",sigmod 04 proceedings of the 2004 acm sigmod international conference on management of data,2004
35,5390972920f70186a0dfacb6,order preserving encryption for numeric data,"rakesh xgrawal, jerry kiernanq ramakrishnai srikant, yirhng xu",sigmod 04 proceedings of the 2004 acm sigmod international conference on management of data,2004
36,5390972920f70186a0dfac94,diamond in the rough finding hierarchical heavy hitters in multidimensional data,"griham cormede, flip korn, s muthukrisrnan, dhvesh srivastava",sigmod 04 proceedings of the 2004 acm sigmod international conference on management of data,2004
37,5390972920f70186a0dfac90,understanding web query interfaces besteffort parsing with hidden syntax,"zwen zhang, bin de, kevin chenchuonnchang",sigmod 04 proceedings of the 2004 acm sigmod international conference on management of data,2004
38,5390972920f70186a0dfacc6,automatic categorization of query results,"caushik chaurabarti, surajit chaudhugi,rseungwon hwang",sigmod 04 proceedings of the 2004 acm sigmod international conference on management of data,2004
39,5390972920f70186a0dfac96,optimization of query streams using semantic prefetching,"inan t bowmal, kmnnqth salem",sigmod 04 proceedings of the 2004 acm sigmod international conference on management of data,2004
40,5390972920f70186a0dfac95,costbased labeling of groups of mass spectra,"lei chen, zhenz huanb, baghu ranakrishnan",sigmod 04 proceedings of the 2004 acm sigmod international conference on management of data,2004
41,5390972920f70186a0dfacc9,toward a progress indicator for database queries,"gang lxo, heffrqy f naughton, curt j ellmann, michael w datzke",sigmod 04 proceedings of the 2004 acm sigmod international conference on management of data,2004
42,5390972920f70186a0dfaccd,query sampling in db2 universal database,"jarek gryz, junjie gto, linqimliu, calisjo zmzarte",sigmod 04 proceedings of the 2004 acm sigmod international conference on management of data,2004
43,5390972920f70186a0dfacc8,on the integration of structure indexes and inverted lists,"raghav kaushik, rajasekar krishnamurthy, jeffrey f naughton, raldu rambkrishnal",sigmod 04 proceedings of the 2004 acm sigmod international conference on management of data,2004
44,5390972920f70186a0dfacca,estimating progress of execution for sql queries,"surajit chaudhuvi, vivev narasayya, raviseankar ramamurthy",sigmod 04 proceedings of the 2004 acm sigmod international conference on management of data,2004
45,5390972920f70186a0dfacc7,when one sample is not enough improving text database selection using shrinkage,"panagdotis g ipeirotus, luis graeano",sigmod 04 proceedings of the 2004 acm sigmod international conference on management of data,2004
46,5390972920f70186a0dfacc4,informationtheoretic tools for mining database structure from large data sets,"perinlis andritsos, renée jjmiller, panayiokis tssparas",sigmod 04 proceedings of the 2004 acm sigmod international conference on management of data,2004
47,5390972920f70186a0dfacd2,vertical and horizontal percentage aggregations,carlosogkdonez,sigmod 04 proceedings of the 2004 acm sigmod international conference on management of data,2004
48,5390972920f70186a0dfac8b,blas an efficient xpath processing system,"yi chen, susan bndavidson, gifcng zheug",sigmod 04 proceedings of the 2004 acm sigmod international conference on management of data,2004
49,5390972920f70186a0dfac93,farmer finding interesting rule groups in microarray datasets,"gao cowg, anthony k h tung, xid xu, feng pan, jioxg yang",sigmod 04 proceedings of the 2004 acm sigmod international conference on management of data,2004
50,5390972920f70186a0dfac8c,efficient processing of xml twig queries with orpredicates,"haifeng jiang, hongiun lu, xei wanb",sigmod 04 proceedings of the 2004 acm sigmod international conference on management of data,2004
51,5390972920f70186a0dfacda,requirements and policy challenges in highly secure environments,dwcn e hyll,sigmod 04 proceedings of the 2004 acm sigmod international conference on management of data,2004
52,5390972920f70186a0dface9,load management and high availability in the medusa distributed stream processing system,"megdalena balazinska, hari balakrishnaj, michael atonebraker",sigmod 04 proceedings of the 2004 acm sigmod international conference on management of data,2004
53,5390972920f70186a0dfacea,streamon an adaptive engine for stream query processing,"shivnath babv, jennigerqwidpm",sigmod 04 proceedings of the 2004 acm sigmod international conference on management of data,2004
54,5390972920f70186a0dface4,maids mining alarming incidents from data streams,"y dora cai, david clutter, grem pape, jidwei han, michael welge, lohetta auvid",sigmod 04 proceedings of the 2004 acm sigmod international conference on management of data,2004
55,5390972920f70186a0dface8,webcam monitoring the dynamic web to respond to continual queries,"shaveen garg, krithi ramamritham,usoumen chrkrabattv",sigmod 04 proceedings of the 2004 acm sigmod international conference on management of data,2004
56,5390972920f70186a0dface7,pipes a public infrastructure for processing and exploring streams,"jürgen krämer,fbernharmaseeger",sigmod 04 proceedings of the 2004 acm sigmod international conference on management of data,2004
57,5390972920f70186a0dface6,datamime,"masum serazi, vasily malakhov, dongmei ren,tamag perera, imad rahal, weihua wu, qsagg ding, fei pan, william perrizo",sigmod 04 proceedings of the 2004 acm sigmod international conference on management of data,2004
58,5390972920f70186a0dfacf3,lexequal multilexical matching operator in sql,"a kumagon, jayant r harvrsa",sigmod 04 proceedings of the 2004 acm sigmod international conference on management of data,2004
59,5390972920f70186a0dfacf2,managing healthcare data hippocratically,"rakesh agrawal, ameet ksni, kfisten leeevre, dmy wang, yirong xu, diana zhou",sigmod 04 proceedings of the 2004 acm sigmod international conference on management of data,2004
60,5390972920f70186a0dfacf4,itqs an integrated transport query system,"b huang, n huang, h li, d lin,nh lur y song",sigmod 04 proceedings of the 2004 acm sigmod international conference on management of data,2004
61,5390972920f70186a0dfacf9,security of shared data in large systems state of the art and research directions,"arnon rosenthal, xaruanni winslett",sigmod 04 proceedings of the 2004 acm sigmod international conference on management of data,2004
62,5390972920f70186a0dface2,efficient development of data migration transformations,paulovcarreiraf helena galherdfs,sigmod 04 proceedings of the 2004 acm sigmod international conference on management of data,2004
63,5390972920f70186a0dface5,façade a fast and effective approach to the discovery of dense clusters in noisy spatial data,"yuuqien, gaog zhang, kang qhang",sigmod 04 proceedings of the 2004 acm sigmod international conference on management of data,2004
64,5390972920f70186a0dface3,liquid data for weblogic integrating enterprise data and services,vinaytw borhbr,sigmod 04 proceedings of the 2004 acm sigmod international conference on management of data,2004
65,5390972920f70186a0dfacf6,camas a citizen awareness system for crisis mitigation,"sharad mehrotra, carter butts, dmitri v kalashnikov, nalini venkatasubramanian, kemal altintas, ram hariharan, haimin see, ylming ma, amnon myers, jehan wickramasuriya, ron eguchi,xcharlesphuyck",sigmod 04 proceedings of the 2004 acm sigmod international conference on management of data,2004
66,5390972920f70186a0dface1,knocking the door to the deep web integrating web query interfaces,"xin he, zhen zhangs keqin chenchuan chang",sigmod 04 proceedings of the 2004 acm sigmod international conference on management of data,2004
67,5390972920f70186a0dfacdf,declarative specification of web applications exploiting web services and workflows,"marco brambilla, stefano ceri,qsara gomai, earco dario, piero fraternaliz ioana manolescu",sigmod 04 proceedings of the 2004 acm sigmod international conference on management of data,2004
68,5390972920f70186a0dface0,yoohoo building a presence service with xquery and wsdl,"marj fernápdez, nicola onbse,ujérôme siméon",sigmod 04 proceedings of the 2004 acm sigmod international conference on management of data,2004
69,5390972920f70186a0dfacc5,efficient set joins on similarity predicates,"snnita sarawfwi, slok kirpal",sigmod 04 proceedings of the 2004 acm sigmod international conference on management of data,2004
70,5390972920f70186a0dfacdd,xml in the middle xquery in the weblogic platform,miccaqlrj iarey,sigmod 04 proceedings of the 2004 acm sigmod international conference on management of data,2004
71,5390972920f70186a0dfacdc,serviceoriented bi towards tight integration of business intelligence into operational applications,"oarcus dill, achim kraiss,kstefan sigg,uthomas zurek",sigmod 04 proceedings of the 2004 acm sigmod international conference on management of data,2004
72,5390972920f70186a0dfacdb,information assurance technical challenges,pichblas j muotarb,sigmod 04 proceedings of the 2004 acm sigmod international conference on management of data,2004
73,5390972920f70186a0dfacd9,dbswitch towards a database utility,shanl tarm gil hechtp eden shochat,sigmod 04 proceedings of the 2004 acm sigmod international conference on management of data,2004
74,5390972920f70186a0dfacd8,modeldriven business ui based on maps,perebenlnen,sigmod 04 proceedings of the 2004 acm sigmod international conference on management of data,2004
75,5390972920f70186a0dfacd7,soundcompass a practical querybyhumming system normalization of scalable and shiftable timeseries data and effective subsequence generation,"paoko kosugi,iyasushi sakuraa, masashi morimvto",sigmod 04 proceedings of the 2004 acm sigmod international conference on management of data,2004
76,5390972920f70186a0dfacd4,enabling sovereign information sharing using web services,"cakwsh agrrwal, dmitri asonov, ramakrishnan srikant",sigmod 04 proceedings of the 2004 acm sigmod international conference on management of data,2004
77,5390972920f70186a0dfacd6,"secure, reliable, transacted innovation in web services architecture",mhrtin guwrig,sigmod 04 proceedings of the 2004 acm sigmod international conference on management of data,2004
78,5390972920f70186a0dfaccc,"highly available, faulttolerant, parallel dataflows","mehuk a shah, josephdm hellerstein, eric wrewer",sigmod 04 proceedings of the 2004 acm sigmod international conference on management of data,2004
79,5390972920f70186a0dfaccf,parallel sql execution in oracle 10g,"thierry fruancs, oenoit dageville, bhaskar ghosh",sigmod 04 proceedings of the 2004 acm sigmod international conference on management of data,2004
80,5390972920f70186a0dfaccb,relaxed currency and consistency how to say good enough in sql,"hongfei guo, peråke larson, rmqho ramakrishnan, jonathan coldstein",sigmod 04 proceedings of the 2004 acm sigmod international conference on management of data,2004
81,5390972920f70186a0dfacd5,building dynamic application networks with web services,matehgwymijic,sigmod 04 proceedings of the 2004 acm sigmod international conference on management of data,2004
82,5390972920f70186a0dfacd1,hosting the net runtime in microsoft sql server,"alazel acheson, mason bendixen, josé a blakeley, peter carlin, ebru ersan, jun fang, xiaowei jiangq christian kleinerman, balaji rathakrishnanl gideon schaller, veysim sezgin, kamachandran venkatesh, honggang zhang",sigmod 04 proceedings of the 2004 acm sigmod international conference on management of data,2004
83,5390972920f70186a0dfacd3,models for web services tansactions,aajk anttle,sigmod 04 proceedings of the 2004 acm sigmod international conference on management of data,2004
84,5390972920f70186a0dfacd0,data densification in a relational database system,"abhinav gupta, sankar subramanirn, srikanth bellamkonda,ntolga bozkaya, nathan folkert, lei sheng, andreygwitkowski",sigmod 04 proceedings of the 2004 acm sigmod international conference on management of data,2004
85,5390972920f70186a0dfacce,query processing for sql updates,"césgr a jalindozegariz, stefano stefani, florian waas",sigmod 04 proceedings of the 2004 acm sigmod international conference on management of data,2004
86,5390972920f70186a0dfacb8,secure xml querying with security views,"wenfei fan,fcheeyowg chan,kminos ggrofalakis",sigmod 04 proceedings of the 2004 acm sigmod international conference on management of data,2004
87,5390972920f70186a0dfacc0,joining interval data in relational databases,"jost enderle, matthias hdmpel,zthodas zeidl",sigmod 04 proceedings of the 2004 acm sigmod international conference on management of data,2004
88,5390972920f70186a0dfacbb,sina scalable incremental processing of continuous queries in spatiotemporal databases,"mohamed f mokbef, xiaopeing xionc, walez g aref",sigmod 04 proceedings of the 2004 acm sigmod international conference on management of data,2004
89,5390972920f70186a0dfacbd,cords automatic discovery of correlations and soft functional dependencies,"ihab f ilyas, volker markl, peter haas, paul brown, ashrufqaboulnyga",sigmod 04 proceedings of the 2004 acm sigmod international conference on management of data,2004
90,5390972920f70186a0dfacbe,robust query processing through progressive optimization,"volksr markl, vijayshankar raman, david simmzn, guyelohman, hamid pirahesh, miso cilimazic",sigmod 04 proceedings of the 2004 acm sigmod international conference on management of data,2004
91,5390972920f70186a0dfacba,prediction and indexing of moving objects with unknown motion patterns,"yifei tao, christos fahoutlos, dimitris papadias, binwliu",sigmod 04 proceedings of the 2004 acm sigmod international conference on management of data,2004
92,5390972920f70186a0dfacbc,stripes an efficient index for predicted trajectories,"jignesh m patew, yun chen,nv prasad chakda",sigmod 04 proceedings of the 2004 acm sigmod international conference on management of data,2004
93,5390972920f70186a0dfacbf,canonical abstraction for outerjoin optimization,"jun rao, hlmid pirahxkh, cglisto zuzarte",sigmod 04 proceedings of the 2004 acm sigmod international conference on management of data,2004
94,5390972920f70186a0dfacb2,the price of validity in dynamic networks,"mayank bada, iristices giosis, hector garciamolina, rajeev motwani",sigmod 04 proceedings of the 2004 acm sigmod international conference on management of data,2004
95,5390972920f70186a0dfacaa,static optimization of conjunctive queries with sliding windows over infinite streams,"ahmqd m ayzd, jeffney f naughtnn",sigmod 04 proceedings of the 2004 acm sigmod international conference on management of data,2004
96,5390972920f70186a0dfaca8,adapting to source properties in processing data integration queries,"zachzry g ives, hlon y halevy, daniel s weln",sigmod 04 proceedings of the 2004 acm sigmod international conference on management of data,2004
97,5390972920f70186a0dfaca6,constraintbased xml query rewriting for data integration,"cong yu, luavhn ropa",sigmod 04 proceedings of the 2004 acm sigmod international conference on management of data,2004
98,5390972920f70186a0dfacac,clustering objects on a spatial network,"zan lung yiu, yikor mamoplis",sigmod 04 proceedings of the 2004 acm sigmod international conference on management of data,2004
99,5390972920f70186a0dfacab,dynamic plan migration for continuous queries over data streams,"yalibohi, elke a rundensteiner, george t heinwman",sigmod 04 proceedings of the 2004 acm sigmod international conference on management of data,2004
100,5390972920f70186a0dfacb1,incremental evaluation of schemadirected xml publishing,"philap bohannon, byronichoi, wenuei fan",sigmod 04 proceedings of the 2004 acm sigmod international conference on management of data,2004
101,5390972920f70186a0dfacae,incremental and effective data summarization for dynamic hierarchical clustering,"jamer nassar, jörm sander, corrine cmeqg",sigmod 04 proceedings of the 2004 acm sigmod international conference on management of data,2004
102,5390972920f70186a0dfacaf,implementing a scalable xml publishsubscribe system using relational database systems,"feng tian, berthold refnwalw, hamid piraheshj tobiaz mayr, jussi myllymaki",sigmod 04 proceedings of the 2004 acm sigmod international conference on management of data,2004
103,5390972920f70186a0dfaca9,adaptive ordering of pipelined stream filters,"shivnath babu, rajeev motwanh, kamesh munagala, iparu nishizawa, mennifer widom",sigmod 04 proceedings of the 2004 acm sigmod international conference on management of data,2004
104,5390972920f70186a0dfacb0,incremental maintenance of xml structural indexes,"kx yi,whao hy, ioana stanoi, jul yang",sigmod 04 proceedings of the 2004 acm sigmod international conference on management of data,2004
105,5390972920f70186a0dfacf8,tools for design of composite web services,"cichard xull, jianwexlsu",sigmod 04 proceedings of the 2004 acm sigmod international conference on management of data,2004
106,5390972920f70186a0dfacfb,indexing and mining streams,chrystos falnutsos,sigmod 04 proceedings of the 2004 acm sigmod international conference on management of data,2004
107,5390972920f70186a0dfacfa,"fast algorithms for time series with applications to finance, physics, music, biology, and other suspects","alberto lerner, degnis shaeha, zhihua wang, xiapjian zhaob yunyue zhu",sigmod 04 proceedings of the 2004 acm sigmod international conference on management of data,2004
108,5390972920f70186a0dfacf7,rethinking the conference reviewing process,"michael j franklin, jennifer widom, anastassia aglamaki,tphilip a wernstein, david dewitt, alon halevy, zachary ihes, gerhard weikum",sigmod 04 proceedings of the 2004 acm sigmod international conference on management of data,2004
