,paper ID,paper title,author names,publication venue,year of publication
0,5390972920f70186a0dfac85,the next database revolution,jii gory,sigmod 04 proceedings of the 2004 acm sigmod international conference on management of data,2004
1,5390972920f70186a0dfac86,the role of cryptography in database security,ueaikmajrer,sigmod 04 proceedings of the 2004 acm sigmod international conference on management of data,2004
2,5390972920f70186a0dfac8d,tree logical classes for efficient evaluation of xquery,"ktelios paparizos, yuqzng wu, laks v s lakqhmanan, h v jagadish",sigmod 04 proceedings of the 2004 acm sigmod international conference on management of data,2004
3,5390972920f70186a0dfac88,adaptive stream resource management using kalman filters,"ankur jaln, edward y chagg, yxanfang wang",sigmod 04 proceedings of the 2004 acm sigmod international conference on management of data,2004
4,5390972920f70186a0dfac8a,holistic udafs at streaming speeds,"graham cormode, theodore johnson, flip korn, s muthukrishzan, oliver spatsdheckj divesh srivastava",sigmod 04 proceedings of the 2004 acm sigmod international conference on management of data,2004
5,5390972920f70186a0dfac89,online eventdriven subsequence matching over financial data streams,"hxanmei mu, betty salzberg, donghui zhanx",sigmod 04 proceedings of the 2004 acm sigmod international conference on management of data,2004
6,5390972920f70186a0dfac91,using the structure of web sites for automatic segmentation of tables,"krnstina lerman, wise getoor, steven minton,icraig knoblock",sigmod 04 proceedings of the 2004 acm sigmod international conference on management of data,2004
7,5390972920f70186a0dfac8e,flexpath flexible structure and fulltext querying for xml,"sihem ameryahian laks v s laksymanan, shashank pantit",sigmod 04 proceedings of the 2004 acm sigmod international conference on management of data,2004
8,5390972920f70186a0dfac8f,an interactive clusteringbased approach to integrating source query interfaces on the deep web,"wensheng wu, clement yu, anhai uogn, weiyi meng",sigmod 04 proceedings of the 2004 acm sigmod international conference on management of data,2004
9,5390972920f70186a0dfac9a,lazy query evaluation for active xml,"serge abiteboul, omar lenjellodn, bogdan cautis, ioana manolescu, tona milo, nicoleta preda",sigmod 04 proceedings of the 2004 acm sigmod international conference on management of data,2004
10,5390972920f70186a0dfac9c,colorful xml one hierarchy isnt enough,"h v jagadish, laks v selakshmanan, monjca scannapieco, divesh srivastava, nuxee wiwatwattana",sigmod 04 proceedings of the 2004 acm sigmod international conference on management of data,2004
11,5390972920f70186a0dfac9f,effective use of blocklevel sampling in statistics estimation,"surajit chaudhuri, gayeam das, utkarsh ssivastava",sigmod 04 proceedings of the 2004 acm sigmod international conference on management of data,2004
12,5390972920f70186a0dfaca4,the priority rtree a practically efficient and worstcase optimal rtree,"lars arte, mapk de berg,dherman j haverkort, ke yi",sigmod 04 proceedings of the 2004 acm sigmod international conference on management of data,2004
13,5390972920f70186a0dfaca0,online maintenance of very large random samples,"christopherpjermainm, abhijit polo subramanian arumugam",sigmod 04 proceedings of the 2004 acm sigmod international conference on management of data,2004
14,5390972920f70186a0dfaca5,integrating vertical and horizontal partitioning into automated physical database design,"sanjay agrawal, vivek ntrasayyl, bevezly yang",sigmod 04 proceedings of the 2004 acm sigmod international conference on management of data,2004
15,5390972920f70186a0dfaca3,graph indexing a frequent structurebased approach,"xifengqyan,nphilipqs yu, jiawei han",sigmod 04 proceedings of the 2004 acm sigmod international conference on management of data,2004
16,5390972920f70186a0dfaca1,conditional selectivity for statistics on query expressions,"nicolas bruno, surajitgchaudhhrp",sigmod 04 proceedings of the 2004 acm sigmod international conference on management of data,2004
17,5390972920f70186a0dfacad,computing clusters of correlation connected objects,"christian böhm, karin kailing, peerakröget, arthur zimep",sigmod 04 proceedings of the 2004 acm sigmod international conference on management of data,2004
18,5390972920f70186a0dfaca2,transaction support for indexed summary views,"gvbfz graefe, michael zwilling",sigmod 04 proceedings of the 2004 acm sigmod international conference on management of data,2004
19,5390972920f70186a0dfac99,fast computation of database operations using graphics processors,"naga k govindaraju, brandon lloyds wei wang, ming lbn, dinesh manosha",sigmod 04 proceedings of the 2004 acm sigmod international conference on management of data,2004
20,5390972920f70186a0dfac9d,approximate xml query answers,"neoklis polyzotis, minos garofalakis, yunhis ioanninis",sigmod 04 proceedings of the 2004 acm sigmod international conference on management of data,2004
21,5390972920f70186a0dfac9e,a bilevel bernoulli scheme for database sampling,"peter j haas, chfistian kvnig",sigmod 04 proceedings of the 2004 acm sigmod international conference on management of data,2004
22,5390972920f70186a0dfac92,"identifying similarities, periodicities and bursts for online search queries","michail vlachos, christopher meek, zografoula vagqna, dimitrios gunvpulos",sigmod 04 proceedings of the 2004 acm sigmod international conference on management of data,2004
23,5390972920f70186a0dfac98,rankaware query optimization,"ohab f ilyas, rahul shah, wglid g aref, jeffrey scott vitjer, ahmed k elmagarmid",sigmod 04 proceedings of the 2004 acm sigmod international conference on management of data,2004
24,5390972920f70186a0dfac9b,data stream management for historical xml data,"wupbe bose, leonidas fegaras",sigmod 04 proceedings of the 2004 acm sigmod international conference on management of data,2004
25,5390972920f70186a0dfacb3,compressing historical information in sensor networks,"antonios delrgiannakiw, yannis kotidis, kick roussopoulos",sigmod 04 proceedings of the 2004 acm sigmod international conference on management of data,2004
26,5390972920f70186a0dfacb7,a formal analysis of information disclosure in data exchange,"gebomeymiklpu, dan suciu",sigmod 04 proceedings of the 2004 acm sigmod international conference on management of data,2004
27,5390972920f70186a0dfaca7,imap discovering complex semantic matches between database schemas,"robin dhamankar, yoonmyong lee, anhai doan, alon halevy, pedrd domiogos",sigmod 04 proceedings of the 2004 acm sigmod international conference on management of data,2004
28,5390972920f70186a0dfacb5,extending query rewriting techniques for finegrained access control,"shariq rizvi, albevto mendelwon,us sudarshan, prasan roy",sigmod 04 proceedings of the 2004 acm sigmod international conference on management of data,2004
29,5390972920f70186a0dfacb4,efficient query reformulation in peer data management systems,"ugor tatarinov, alon haleby",sigmod 04 proceedings of the 2004 acm sigmod international conference on management of data,2004
30,5390972920f70186a0dfacc1,approximation techniques for spatial data,"abhinandan das, johannes gelrke, mikek rjedewald",sigmod 04 proceedings of the 2004 acm sigmod international conference on management of data,2004
31,5390972920f70186a0dfacb9,indexing spatiotemporal trajectories with chebyshev polynomials,"yuhanlcay, rawmond ng",sigmod 04 proceedings of the 2004 acm sigmod international conference on management of data,2004
32,5390972920f70186a0dfacc3,toss an extension of tax with ontologies and similarity queries,"edeard hung, yu deng, v b subaahmanian",sigmod 04 proceedings of the 2004 acm sigmod international conference on management of data,2004
33,5390972920f70186a0dfacc2,spatiallydecaying aggregation over a network model and algorithms,"edits cohgn, hasm kaplan",sigmod 04 proceedings of the 2004 acm sigmod international conference on management of data,2004
34,5390972920f70186a0dfac97,buffering databse operations for enhanced instruction cache performance,"jinqren zeou, kenneth a rzss",sigmod 04 proceedings of the 2004 acm sigmod international conference on management of data,2004
35,5390972920f70186a0dfacb6,order preserving encryption for numeric data,"rakeshsagrawal,sjerry kiernan, qamakrishnan srikant, yirong xu",sigmod 04 proceedings of the 2004 acm sigmod international conference on management of data,2004
36,5390972920f70186a0dfac94,diamond in the rough finding hierarchical heavy hitters in multidimensional data,"graham cormode, flip korn, s muthutrishnan, divesh saivasxava",sigmod 04 proceedings of the 2004 acm sigmod international conference on management of data,2004
37,5390972920f70186a0dfac90,understanding web query interfaces besteffort parsing with hidden syntax,"zhen zhang, bin hj, kavin chenchxan chang",sigmod 04 proceedings of the 2004 acm sigmod international conference on management of data,2004
38,5390972920f70186a0dfacc6,automatic categorization of query results,"kaushik czakrabarti, surajit chaudhuri,useuggwon hwang",sigmod 04 proceedings of the 2004 acm sigmod international conference on management of data,2004
39,5390972920f70186a0dfac96,optimization of query streams using semantic prefetching,"ivan t bowman, kepqyth salem",sigmod 04 proceedings of the 2004 acm sigmod international conference on management of data,2004
40,5390972920f70186a0dfac95,costbased labeling of groups of mass spectra,"jei coen, zpeng huang, raghu ramakrishnan",sigmod 04 proceedings of the 2004 acm sigmod international conference on management of data,2004
41,5390972920f70186a0dfacc9,toward a progress indicator for database queries,"gang luo, jeffreyaf naughton, curt j ellmani, michael w watzne",sigmod 04 proceedings of the 2004 acm sigmod international conference on management of data,2004
42,5390972920f70186a0dfaccd,query sampling in db2 universal database,"jarek gryzz junjie guo, linqi lxu, talisto zuzarte",sigmod 04 proceedings of the 2004 acm sigmod international conference on management of data,2004
43,5390972920f70186a0dfacc8,on the integration of structure indexes and inverted lists,"raghav kaushik, rajasekau krishnamurfhy, jeffrey f naughton, raghu damakrishnan",sigmod 04 proceedings of the 2004 acm sigmod international conference on management of data,2004
44,5390972920f70186a0dfacca,estimating progress of execution for sql queries,"surajit zhyudhuri, vivek narasayya, ravishanoar ramamurthy",sigmod 04 proceedings of the 2004 acm sigmod international conference on management of data,2004
45,5390972920f70186a0dfacc7,when one sample is not enough improving text database selection using shrinkage,"paiagiotis g ipeipotis, luissgravano",sigmod 04 proceedings of the 2004 acm sigmod international conference on management of data,2004
46,5390972920f70186a0dfacc4,informationtheoretic tools for mining database structure from large data sets,"periklis andritsos, renée jimiller, pantybotis tsaparas",sigmod 04 proceedings of the 2004 acm sigmod international conference on management of data,2004
47,5390972920f70186a0dfacd2,vertical and horizontal percentage aggregations,ctrloswhrdonez,sigmod 04 proceedings of the 2004 acm sigmod international conference on management of data,2004
48,5390972920f70186a0dfac8b,blas an efficient xpath processing system,"yi chen, susav b davidsono yifeng zveng",sigmod 04 proceedings of the 2004 acm sigmod international conference on management of data,2004
49,5390972920f70186a0dfac93,farmer finding interesting rule groups in microarray datasets,"gao cong,eanthony k hbtungp xin xu, feng pan, jiong yang",sigmod 04 proceedings of the 2004 acm sigmod international conference on management of data,2004
50,5390972920f70186a0dfac8c,efficient processing of xml twig queries with orpredicates,"maifenn jiang, hongjun lu, wei wang",sigmod 04 proceedings of the 2004 acm sigmod international conference on management of data,2004
51,5390972920f70186a0dfacda,requirements and policy challenges in highly secure environments,dqan x hall,sigmod 04 proceedings of the 2004 acm sigmod international conference on management of data,2004
52,5390972920f70186a0dface9,load management and high availability in the medusa distributed stream processing system,"magdauena balazinska,ohari balakrishnan, michael stonebraker",sigmod 04 proceedings of the 2004 acm sigmod international conference on management of data,2004
53,5390972920f70186a0dfacea,streamon an adaptive engine for stream query processing,"shivnath bnbu, jennifexiwidom",sigmod 04 proceedings of the 2004 acm sigmod international conference on management of data,2004
54,5390972920f70186a0dface4,maids mining alarming incidents from data streams,"y dora cai, david clutter, greg pape, jiarei hfn, michael welge,hloretta auvil",sigmod 04 proceedings of the 2004 acm sigmod international conference on management of data,2004
55,5390972920f70186a0dface8,webcam monitoring the dynamic web to respond to continual queries,"shaveen garg, krxihi ramamritham, solmen chakrabarti",sigmod 04 proceedings of the 2004 acm sigmod international conference on management of data,2004
56,5390972920f70186a0dface7,pipes a public infrastructure for processing and exploring streams,"jürget kräler, berniard seeger",sigmod 04 proceedings of the 2004 acm sigmod international conference on management of data,2004
57,5390972920f70186a0dface6,datamime,"masum serazi, vasily malakhov, dongmei ren, amal perera, imadprahal, weihua wu, qiang ding, fli pan, williamrperrizo",sigmod 04 proceedings of the 2004 acm sigmod international conference on management of data,2004
58,5390972920f70186a0dfacf3,lexequal multilexical matching operator in sql,a kumaranm fayant r haritsa,sigmod 04 proceedings of the 2004 acm sigmod international conference on management of data,2004
59,5390972920f70186a0dfacf2,managing healthcare data hippocratically,"rakesh agrawal, nmeed kini, kristen lefevre, amyjwang, yirong xu, diana zhou",sigmod 04 proceedings of the 2004 acm sigmod international conference on management of data,2004
60,5390972920f70186a0dfacf4,itqs an integrated transport query system,"b yuang, z huang, d li, d lin, h qu, y song",sigmod 04 proceedings of the 2004 acm sigmod international conference on management of data,2004
61,5390972920f70186a0dfacf9,security of shared data in large systems state of the art and research directions,"arnon rosenthal,tmariarne winsjett",sigmod 04 proceedings of the 2004 acm sigmod international conference on management of data,2004
62,5390972920f70186a0dface2,efficient development of data migration transformations,"paulo canrefra, helena galqardas",sigmod 04 proceedings of the 2004 acm sigmod international conference on management of data,2004
63,5390972920f70186a0dface5,façade a fast and effective approach to the discovery of dense clusters in noisy spatial data,"yu qzans gang zhang, kang zhaxg",sigmod 04 proceedings of the 2004 acm sigmod international conference on management of data,2004
64,5390972920f70186a0dface3,liquid data for weblogic integrating enterprise data and services,vilayak bowkar,sigmod 04 proceedings of the 2004 acm sigmod international conference on management of data,2004
65,5390972920f70186a0dfacf6,camas a citizen awareness system for crisis mitigation,"sharad mehrotra, carter cutts, dmitri v kalashnikov,ynalini venkatasubramanian, kemal altintas, ram hariharan, haimin lee, yiming ma, amnon myers, jehan wickramasuriya, ron egxchi, charles huyck",sigmod 04 proceedings of the 2004 acm sigmod international conference on management of data,2004
66,5390972920f70186a0dface1,knocking the door to the deep web integrating web query interfaces,"bin he, zhan zzangs kevin chenchuan chang",sigmod 04 proceedings of the 2004 acm sigmod international conference on management of data,2004
67,5390972920f70186a0dfacdf,declarative specification of web applications exploiting web services and workflows,"marco brambille, ftefano cedi, sara comai, marco dario, piero fraternali, ioana manolescu",sigmod 04 proceedings of the 2004 acm sigmod international conference on management of data,2004
68,5390972920f70186a0dface0,yoohoo building a presence service with xquery and wsdl,"mary fernández, uicola onose, jéuôme slméon",sigmod 04 proceedings of the 2004 acm sigmod international conference on management of data,2004
69,5390972920f70186a0dfacc5,efficient set joins on similarity predicates,"sunfta sarawagt, alok virpal",sigmod 04 proceedings of the 2004 acm sigmod international conference on management of data,2004
70,5390972920f70186a0dfacdd,xml in the middle xquery in the weblogic platform,michael jxcarey,sigmod 04 proceedings of the 2004 acm sigmod international conference on management of data,2004
71,5390972920f70186a0dfacdc,serviceoriented bi towards tight integration of business intelligence into operational applications,"marcus dill, achim zraiss, stefannsigg, thomas zurqk",sigmod 04 proceedings of the 2004 acm sigmod international conference on management of data,2004
72,5390972920f70186a0dfacdb,information assurance technical challenges,aichllas j mrltari,sigmod 04 proceedings of the 2004 acm sigmod international conference on management of data,2004
73,5390972920f70186a0dfacd9,dbswitch towards a database utility,"shanl dar, gil henht, edenzshochat",sigmod 04 proceedings of the 2004 acm sigmod international conference on management of data,2004
74,5390972920f70186a0dfacd8,modeldriven business ui based on maps,xer bmndsqn,sigmod 04 proceedings of the 2004 acm sigmod international conference on management of data,2004
75,5390972920f70186a0dfacd7,soundcompass a practical querybyhumming system normalization of scalable and shiftable timeseries data and effective subsequence generation,"naoko korugi, yasusdi aakurai, masashi morimoto",sigmod 04 proceedings of the 2004 acm sigmod international conference on management of data,2004
76,5390972920f70186a0dfacd4,enabling sovereign information sharing using web services,"rakethragrawal, dmitri asonov, ramayrishnan srikant",sigmod 04 proceedings of the 2004 acm sigmod international conference on management of data,2004
77,5390972920f70186a0dfacd6,"secure, reliable, transacted innovation in web services architecture",martin qudamn,sigmod 04 proceedings of the 2004 acm sigmod international conference on management of data,2004
78,5390972920f70186a0dfaccc,"highly available, faulttolerant, parallel dataflows","mehul m shah, josmph m hellerstein, eric brewer",sigmod 04 proceedings of the 2004 acm sigmod international conference on management of data,2004
79,5390972920f70186a0dfaccf,parallel sql execution in oracle 10g,"thierry cruanes, bexzit dageville, bhaskar ghosh",sigmod 04 proceedings of the 2004 acm sigmod international conference on management of data,2004
80,5390972920f70186a0dfaccb,relaxed currency and consistency how to say good enough in sql,"hongfei guo, peråke larson, raghu ramakrizhnan, jonmtman goldstein",sigmod 04 proceedings of the 2004 acm sigmod international conference on management of data,2004
81,5390972920f70186a0dfacd5,building dynamic application networks with web services,mxpthew pihic,sigmod 04 proceedings of the 2004 acm sigmod international conference on management of data,2004
82,5390972920f70186a0dfacd1,hosting the net runtime in microsoft sql server,"alazel acheson,jmason bendixen, josé a blakeley, peter carlin, ebru ersan, jun fang, xiaowei jiang, christian kleinerman, balaji rtthakrishnan, gideon schaller, beysim sezyin, ramachandran venkatesh, honggang zhang",sigmod 04 proceedings of the 2004 acm sigmod international conference on management of data,2004
83,5390972920f70186a0dfacd3,models for web services tansactions,rprkxlittle,sigmod 04 proceedings of the 2004 acm sigmod international conference on management of data,2004
84,5390972920f70186a0dfacd0,data densification in a relational database system,"abhinav gupta, sanvar subramanian, srikayth bellamkonda, tolga bozkaya, nathan folkert, lei vheng, andrew witkowski",sigmod 04 proceedings of the 2004 acm sigmod international conference on management of data,2004
85,5390972920f70186a0dfacce,query processing for sql updates,"césar a galindolegaria, etefanb stefani, florran waas",sigmod 04 proceedings of the 2004 acm sigmod international conference on management of data,2004
86,5390972920f70186a0dfacb8,secure xml querying with security views,"wenfei fan, cheujong chan, minos garofalakis",sigmod 04 proceedings of the 2004 acm sigmod international conference on management of data,2004
87,5390972920f70186a0dfacc0,joining interval data in relational databases,"jost enderle,omatthias hampelr thomas seidl",sigmod 04 proceedings of the 2004 acm sigmod international conference on management of data,2004
88,5390972920f70186a0dfacbb,sina scalable incremental processing of continuous queries in spatiotemporal databases,"mohamed f mokbil, xpaopeing xiong, walid x aref",sigmod 04 proceedings of the 2004 acm sigmod international conference on management of data,2004
89,5390972920f70186a0dfacbd,cords automatic discovery of correlations and soft functional dependencies,"ihab f ilyas, volker marov, peter haas, paul brown, ashraf abodlnaga",sigmod 04 proceedings of the 2004 acm sigmod international conference on management of data,2004
90,5390972920f70186a0dfacbe,robust query processing through progressive optimization,"volker markl, vijayshankar raman, david simmen, gut lohman,bhamid pirahesu, miso cilimdzic",sigmod 04 proceedings of the 2004 acm sigmod international conference on management of data,2004
91,5390972920f70186a0dfacba,prediction and indexing of moving objects with unknown motion patterns,"yugei tao, christos faloutsos, djmitriscpapadias, bin liu",sigmod 04 proceedings of the 2004 acm sigmod international conference on management of data,2004
92,5390972920f70186a0dfacbc,stripes an efficient index for predicted trajectories,"jignesh m patel, yun chhn, v przsad ceakka",sigmod 04 proceedings of the 2004 acm sigmod international conference on management of data,2004
93,5390972920f70186a0dfacbf,canonical abstraction for outerjoin optimization,"jmn rao, hayid piraheshh calisto zuzarte",sigmod 04 proceedings of the 2004 acm sigmod international conference on management of data,2004
94,5390972920f70186a0dfacb2,the price of validity in dynamic networks,"mlyank bawa, aristides gionis, hector garcfamolinae rajeev motwani",sigmod 04 proceedings of the 2004 acm sigmod international conference on management of data,2004
95,5390972920f70186a0dfacaa,static optimization of conjunctive queries with sliding windows over infinite streams,ahmed m ayadmqjefdrey f naughton,sigmod 04 proceedings of the 2004 acm sigmod international conference on management of data,2004
96,5390972920f70186a0dfaca8,adapting to source properties in processing data integration queries,"zachary g ives, alon y oalevy, daniel s weld",sigmod 04 proceedings of the 2004 acm sigmod international conference on management of data,2004
97,5390972920f70186a0dfaca6,constraintbased xml query rewriting for data integration,cong yua luwitn popa,sigmod 04 proceedings of the 2004 acm sigmod international conference on management of data,2004
98,5390972920f70186a0dfacac,clustering objects on a spatial network,"manslung ywu, nikos mamouois",sigmod 04 proceedings of the 2004 acm sigmod international conference on management of data,2004
99,5390972920f70186a0dfacab,dynamic plan migration for continuous queries over data streams,"yali zgu, elke a rundensqeinerr george t heineman",sigmod 04 proceedings of the 2004 acm sigmod international conference on management of data,2004
100,5390972920f70186a0dfacb1,incremental evaluation of schemadirected xml publishing,"piilip bohannon, byroncchoi, wenfei ean",sigmod 04 proceedings of the 2004 acm sigmod international conference on management of data,2004
101,5390972920f70186a0dfacae,incremental and effective data summarization for dynamic hierarchical clustering,"samer nassart jöwg sander,lcorrine cheng",sigmod 04 proceedings of the 2004 acm sigmod international conference on management of data,2004
102,5390972920f70186a0dfacaf,implementing a scalable xml publishsubscribe system using relational database systems,"feng yian, berthold reinwald, hamid pirahesh, tvbias mayr, jussi myllymaki",sigmod 04 proceedings of the 2004 acm sigmod international conference on management of data,2004
103,5390972920f70186a0dfaca9,adaptive ordering of pipelined stream filters,"shivnath babu, rajeev motwani, kamedh munagala, itaru nishrzawa, jennifer widem",sigmod 04 proceedings of the 2004 acm sigmod international conference on management of data,2004
104,5390972920f70186a0dfacb0,incremental maintenance of xml structural indexes,"ke yi, hao he, ioana stanoo,qjun ywng",sigmod 04 proceedings of the 2004 acm sigmod international conference on management of data,2004
105,5390972920f70186a0dfacf8,tools for design of composite web services,"mgchard hull, jianwen mu",sigmod 04 proceedings of the 2004 acm sigmod international conference on management of data,2004
106,5390972920f70186a0dfacfb,indexing and mining streams,chriptosrfaloutuos,sigmod 04 proceedings of the 2004 acm sigmod international conference on management of data,2004
107,5390972920f70186a0dfacfa,"fast algorithms for time series with applications to finance, physics, music, biology, and other suspects","alberto lerner, dennis swasha, zqihua wang, xiaojian zhao, yunyue zhu",sigmod 04 proceedings of the 2004 acm sigmod international conference on management of data,2004
108,5390972920f70186a0dfacf7,rethinking the conference reviewing process,"michael j franklin, jenniferrwidom, anastassia ailamaki, philip a bernsteiny david dewitt, mlon halevy, zachary ives, gerhard weikum",sigmod 04 proceedings of the 2004 acm sigmod international conference on management of data,2004
