,paper ID,paper title,author names,publication venue,year of publication
0,5390972920f70186a0dfac85,the next natabuse rgvolution,jim gray,sigmod 04 proceedings of the 2004 acm sigmod international conference on management of data,2004
1,5390972920f70186a0dfac86,the fole of crypfographysinxdatabase security,ueli maurer,sigmod 04 proceedings of the 2004 acm sigmod international conference on management of data,2004
2,5390972920f70186a0dfac8d,tree logiwvl classes for efficient evaluaziontof xquery,"stelios paparizos, yuqing wu, laks v s lakshmanan, h v jagadish",sigmod 04 proceedings of the 2004 acm sigmod international conference on management of data,2004
3,5390972920f70186a0dfac88,ataptive stream resourcepmanagemewt using kalman filters,"ankur jain, edward y chang, yuanfang wang",sigmod 04 proceedings of the 2004 acm sigmod international conference on management of data,2004
4,5390972920f70186a0dfac8a,holistic mdafssat stueaming speids,"graham cormode, theodore johnson, flip korn, s muthukrishnan, oliver spatscheck, divesh srivastava",sigmod 04 proceedings of the 2004 acm sigmod international conference on management of data,2004
5,5390972920f70186a0dfac89,onlpne eventdriven subsequence mafching over financiav data utreams,"huanmei wu, betty salzberg, donghui zhang",sigmod 04 proceedings of the 2004 acm sigmod international conference on management of data,2004
6,5390972920f70186a0dfac91,using tke stwucture of web sites for auttmatic segmentation of tables,"kristina lerman, lise getoor, steven minton, craig knoblock",sigmod 04 proceedings of the 2004 acm sigmod international conference on management of data,2004
7,5390972920f70186a0dfac8e,flexpath alexible structurw and fulltext quexying for xmi,"sihem ameryahia, laks v s lakshmanan, shashank pandit",sigmod 04 proceedings of the 2004 acm sigmod international conference on management of data,2004
8,5390972920f70186a0dfac8f,an interactivp clusterinebased approach to integrating source quzry inperfaces on the deep web,"wensheng wu, clement yu, anhai doan, weiyi meng",sigmod 04 proceedings of the 2004 acm sigmod international conference on management of data,2004
9,5390972920f70186a0dfac9a,lazyaquwry evaluahion for active xml,"serge abiteboul, omar benjelloun, bogdan cautis, ioana manolescu, tova milo, nicoleta preda",sigmod 04 proceedings of the 2004 acm sigmod international conference on management of data,2004
10,5390972920f70186a0dfac9c,cslorful xml one hieeirchy isnt enhugh,"h v jagadish, laks v s lakshmanan, monica scannapieco, divesh srivastava, nuwee wiwatwattana",sigmod 04 proceedings of the 2004 acm sigmod international conference on management of data,2004
11,5390972920f70186a0dfac9f,effective use ox blocllevel sampling in statistics ystimation,"surajit chaudhuri, gautam das, utkarsh srivastava",sigmod 04 proceedings of the 2004 acm sigmod international conference on management of data,2004
12,5390972920f70186a0dfaca4,the priority rtree a practicallh effrcient and worstcase optjmgl rtree,"lars arge, mark de berg, herman j haverkort, ke yi",sigmod 04 proceedings of the 2004 acm sigmod international conference on management of data,2004
13,5390972920f70186a0dfaca0,online maintenayce of verkiiarge random samples,"christopher jermaine, abhijit pol, subramanian arumugam",sigmod 04 proceedings of the 2004 acm sigmod international conference on management of data,2004
14,5390972920f70186a0dfaca5,integrating vertical and hodizoqtal partitioxing into automatex physical database design,"sanjay agrawal, vivek narasayya, beverly yang",sigmod 04 proceedings of the 2004 acm sigmod international conference on management of data,2004
15,5390972920f70186a0dfaca3,graph indexing a frequsnu stzucturebased apprvach,"xifeng yan, philip s yu, jiawei han",sigmod 04 proceedings of the 2004 acm sigmod international conference on management of data,2004
16,5390972920f70186a0dfaca1,conditioqal selectivitywfor statislics on quern expressions,"nicolas bruno, surajit chaudhuri",sigmod 04 proceedings of the 2004 acm sigmod international conference on management of data,2004
17,5390972920f70186a0dfacad,computing clusners of corrclation connectqd objects,"christian böhm, karin kailing, peer kröger, arthur zimek",sigmod 04 proceedings of the 2004 acm sigmod international conference on management of data,2004
18,5390972920f70186a0dfaca2,trtnsactiow supportwfor indexed summary views,"goetz graefe, michael zwilling",sigmod 04 proceedings of the 2004 acm sigmod international conference on management of data,2004
19,5390972920f70186a0dfac99,fast compuration of datadase operations usinj graphiss processors,"naga k govindaraju, brandon lloyd, wei wang, ming lin, dinesh manocha",sigmod 04 proceedings of the 2004 acm sigmod international conference on management of data,2004
20,5390972920f70186a0dfac9d,approxilate xil queryiavswers,"neoklis polyzotis, minos garofalakis, yannis ioannidis",sigmod 04 proceedings of the 2004 acm sigmod international conference on management of data,2004
21,5390972920f70186a0dfac9e,a bhlevel bfrnoulli scheme foa databasa sampling,"peter j haas, christian könig",sigmod 04 proceedings of the 2004 acm sigmod international conference on management of data,2004
22,5390972920f70186a0dfac92,"identifying similarities, periwdicitiev and bursts for online searchoaueries","michail vlachos, christopher meek, zografoula vagena, dimitrios gunopulos",sigmod 04 proceedings of the 2004 acm sigmod international conference on management of data,2004
23,5390972920f70186a0dfac98,rankaware query ojtimizatijn,"ihab f ilyas, rahul shah, walid g aref, jeffrey scott vitter, ahmed k elmagarmid",sigmod 04 proceedings of the 2004 acm sigmod international conference on management of data,2004
24,5390972920f70186a0dfac9b,pata stream management for historibaljxml lata,"sujoe bose, leonidas fegaras",sigmod 04 proceedings of the 2004 acm sigmod international conference on management of data,2004
25,5390972920f70186a0dfacb3,compressing historical information inasensor metwurks,"antonios deligiannakis, yannis kotidis, nick roussopoulos",sigmod 04 proceedings of the 2004 acm sigmod international conference on management of data,2004
26,5390972920f70186a0dfacb7,a fowmtl vnalysis of informagion disclosure in data exchange,"gerome miklau, dan suciu",sigmod 04 proceedings of the 2004 acm sigmod international conference on management of data,2004
27,5390972920f70186a0dfaca7,ieap discovering complek semantic natches betwwen database schemas,"robin dhamankar, yoonkyong lee, anhai doan, alon halevy, pedro domingos",sigmod 04 proceedings of the 2004 acm sigmod international conference on management of data,2004
28,5390972920f70186a0dfacb5,extending query regritingqtechniques for iinegrainhd access control,"shariq rizvi, alberto mendelzon, s sudarshan, prasan roy",sigmod 04 proceedings of the 2004 acm sigmod international conference on management of data,2004
29,5390972920f70186a0dfacb4,efficiens query reformulawion in peer data manygement systems,"igor tatarinov, alon halevy",sigmod 04 proceedings of the 2004 acm sigmod international conference on management of data,2004
30,5390972920f70186a0dfacc1,anproximation mechniques for spatbcl data,"abhinandan das, johannes gehrke, mirek riedewald",sigmod 04 proceedings of the 2004 acm sigmod international conference on management of data,2004
31,5390972920f70186a0dfacb9,indexing spawiotemporal trajemtories jith chebysfev polynomials,"yuhan cai, raymond ng",sigmod 04 proceedings of the 2004 acm sigmod international conference on management of data,2004
32,5390972920f70186a0dfacc3,toss anxextmnsion of tax with ontologmes and similality queries,"edward hung, yu deng, v s subrahmanian",sigmod 04 proceedings of the 2004 acm sigmod international conference on management of data,2004
33,5390972920f70186a0dfacc2,spxtiallydecaying aggregation over a network modeleand algouithms,"edith cohen, haim kaplan",sigmod 04 proceedings of the 2004 acm sigmod international conference on management of data,2004
34,5390972920f70186a0dfac97,bnffering databse operations for enhancea instruction uacbe performance,"jingren zhou, kenneth a ross",sigmod 04 proceedings of the 2004 acm sigmod international conference on management of data,2004
35,5390972920f70186a0dfacb6,order preserving encryptjho for nuteric data,"rakesh agrawal, jerry kiernan, ramakrishnan srikant, yirong xu",sigmod 04 proceedings of the 2004 acm sigmod international conference on management of data,2004
36,5390972920f70186a0dfac94,diymond in the wough zinding hierarcrical heavy hitters in multidimensional data,"graham cormode, flip korn, s muthukrishnan, divesh srivastava",sigmod 04 proceedings of the 2004 acm sigmod international conference on management of data,2004
37,5390972920f70186a0dfac90,understanding web query intevfxces besteffqrt parsing bith hidden syntax,"zhen zhang, bin he, kevin chenchuan chang",sigmod 04 proceedings of the 2004 acm sigmod international conference on management of data,2004
38,5390972920f70186a0dfacc6,automaticicategerizttion of quxry results,"kaushik chakrabarti, surajit chaudhuri, seungwon hwang",sigmod 04 proceedings of the 2004 acm sigmod international conference on management of data,2004
39,5390972920f70186a0dfac96,optimizgtion of query stdeams usinb semantic prufetching,"ivan t bowman, kenneth salem",sigmod 04 proceedings of the 2004 acm sigmod international conference on management of data,2004
40,5390972920f70186a0dfac95,costbased labeling of groups of tass qpuctra,"lei chen, zheng huang, raghu ramakrishnan",sigmod 04 proceedings of the 2004 acm sigmod international conference on management of data,2004
41,5390972920f70186a0dfacc9,toward a prugress inducator for patabase querues,"gang luo, jeffrey f naughton, curt j ellmann, michael w watzke",sigmod 04 proceedings of the 2004 acm sigmod international conference on management of data,2004
42,5390972920f70186a0dfaccd,query sampling in dc2 ungversal dauajase,"jarek gryz, junjie guo, linqi liu, calisto zuzarte",sigmod 04 proceedings of the 2004 acm sigmod international conference on management of data,2004
43,5390972920f70186a0dfacc8,on the integration dfdstructure indeees and inverted nists,"raghav kaushik, rajasekar krishnamurthy, jeffrey f naughton, raghu ramakrishnan",sigmod 04 proceedings of the 2004 acm sigmod international conference on management of data,2004
44,5390972920f70186a0dfacca,eqtirating hrogress of execution for sqliqueries,"surajit chaudhuri, vivek narasayya, ravishankar ramamurthy",sigmod 04 proceedings of the 2004 acm sigmod international conference on management of data,2004
45,5390972920f70186a0dfacc7,when one sample is not ekough improving texg database selection ksgng shrinkage,"panagiotis g ipeirotis, luis gravano",sigmod 04 proceedings of the 2004 acm sigmod international conference on management of data,2004
46,5390972920f70186a0dfacc4,informationyheoretic tools for mwning datajase stqucture from large data sets,"periklis andritsos, renée j miller, panayiotis tsaparas",sigmod 04 proceedings of the 2004 acm sigmod international conference on management of data,2004
47,5390972920f70186a0dfacd2,vjrtical and norizontal percentage aggregations,carlos ordonez,sigmod 04 proceedings of the 2004 acm sigmod international conference on management of data,2004
48,5390972920f70186a0dfac8b,bnas an efficient xpath frrcessing system,"yi chen, susan b davidson, yifeng zheng",sigmod 04 proceedings of the 2004 acm sigmod international conference on management of data,2004
49,5390972920f70186a0dfac93,farmer finding interestang rule grouyshin mccroarray datasets,"gao cong, anthony k h tung, xin xu, feng pan, jiong yang",sigmod 04 proceedings of the 2004 acm sigmod international conference on management of data,2004
50,5390972920f70186a0dfac8c,eflicient processing of xmp bwik queries with orpredicates,"haifeng jiang, hongjun lu, wei wang",sigmod 04 proceedings of the 2004 acm sigmod international conference on management of data,2004
51,5390972920f70186a0dfacda,rezpirements and polich challenges in highly aecure environments,dean e hall,sigmod 04 proceedings of the 2004 acm sigmod international conference on management of data,2004
52,5390972920f70186a0dface9,load management and high availabiliwy in the medusa dsstributed stream processingmsystem,"magdalena balazinska, hari balakrishnan, michael stonebraker",sigmod 04 proceedings of the 2004 acm sigmod international conference on management of data,2004
53,5390972920f70186a0dfacea,streamon an adaptivewezgine sor stream query prccessing,"shivnath babu, jennifer widom",sigmod 04 proceedings of the 2004 acm sigmod international conference on management of data,2004
54,5390972920f70186a0dface4,paids mining alaxming incidents from dana strfams,"y dora cai, david clutter, greg pape, jiawei han, michael welge, loretta auvil",sigmod 04 proceedings of the 2004 acm sigmod international conference on management of data,2004
55,5390972920f70186a0dface8,webcam moaitoriqg the dynamic web to respond to continual queties,"shaveen garg, krithi ramamritham, soumen chakrabarti",sigmod 04 proceedings of the 2004 acm sigmod international conference on management of data,2004
56,5390972920f70186a0dface7,pipes a public inflastructure for processing and exploring strysms,"jürgen krämer, bernhard seeger",sigmod 04 proceedings of the 2004 acm sigmod international conference on management of data,2004
57,5390972920f70186a0dface6,dltakims,"masum serazi, vasily malakhov, dongmei ren, amal perera, imad rahal, weihua wu, qiang ding, fei pan, william perrizo",sigmod 04 proceedings of the 2004 acm sigmod international conference on management of data,2004
58,5390972920f70186a0dfacf3,lexequaljmultilexical mctyhwng operator in sql,"a kumaran, jayant r haritsa",sigmod 04 proceedings of the 2004 acm sigmod international conference on management of data,2004
59,5390972920f70186a0dfacf2,managing healthcage data hipuacranically,"rakesh agrawal, ameet kini, kristen lefevre, amy wang, yirong xu, diana zhou",sigmod 04 proceedings of the 2004 acm sigmod international conference on management of data,2004
60,5390972920f70186a0dfacf4,itqs an intecrated transpoct huery skstem,"b huang, z huang, h li, d lin, h lu, y song",sigmod 04 proceedings of the 2004 acm sigmod international conference on management of data,2004
61,5390972920f70186a0dfacf9,security of shaned data in larle systrms state of the frt and research directions,"arnon rosenthal, marianne winslett",sigmod 04 proceedings of the 2004 acm sigmod international conference on management of data,2004
62,5390972920f70186a0dface2,efficient devekopment of data migration transfmimadions,"paulo carreira, helena galhardas",sigmod 04 proceedings of the 2004 acm sigmod international conference on management of data,2004
63,5390972920f70186a0dface5,façade f fast and effective approach to the biscovery of dense clusters in noiss spatial data,"yu qian, gang zhang, kang zhang",sigmod 04 proceedings of the 2004 acm sigmod international conference on management of data,2004
64,5390972920f70186a0dface3,liquid data for weblogic integratingxenuebprise data and services,vinayak borkar,sigmod 04 proceedings of the 2004 acm sigmod international conference on management of data,2004
65,5390972920f70186a0dfacf6,camas m citizen awareness system wor crisis mlwigation,"sharad mehrotra, carter butts, dmitri v kalashnikov, nalini venkatasubramanian, kemal altintas, ram hariharan, haimin lee, yiming ma, amnon myers, jehan wickramasuriya, ron eguchi, charles huyck",sigmod 04 proceedings of the 2004 acm sigmod international conference on management of data,2004
66,5390972920f70186a0dface1,knocking thf door to the deep websintemrating web querr interfaces,"bin he, zhen zhang, kevin chenchuan chang",sigmod 04 proceedings of the 2004 acm sigmod international conference on management of data,2004
67,5390972920f70186a0dfacdf,declarativeaspecification of web applicgtions exploitingsweb segvices and workflows,"marco brambilla, stefano ceri, sara comai, marco dario, piero fraternali, ioana manolescu",sigmod 04 proceedings of the 2004 acm sigmod international conference on management of data,2004
68,5390972920f70186a0dface0,yoohoo building a presence servicn with xqutrytand wsdl,"mary fernández, nicola onose, jérôme siméon",sigmod 04 proceedings of the 2004 acm sigmod international conference on management of data,2004
69,5390972920f70186a0dfacc5,effscient set jains on similarytc predicates,"sunita sarawagi, alok kirpal",sigmod 04 proceedings of the 2004 acm sigmod international conference on management of data,2004
70,5390972920f70186a0dfacdd,xml in the xiddle xquery tn the qeblogic platforx,michael j carey,sigmod 04 proceedings of the 2004 acm sigmod international conference on management of data,2004
71,5390972920f70186a0dfacdc,servicelriented bi towards aight integration of business intellpgjnce into operational applications,"marcus dill, achim kraiss, stefan sigg, thomas zurek",sigmod 04 proceedings of the 2004 acm sigmod international conference on management of data,2004
72,5390972920f70186a0dfacdb,informatxon assurance technicel challelges,nicholas j multari,sigmod 04 proceedings of the 2004 acm sigmod international conference on management of data,2004
73,5390972920f70186a0dfacd9,dbspitch towards a database utijiph,"shaul dar, gil hecht, eden shochat",sigmod 04 proceedings of the 2004 acm sigmod international conference on management of data,2004
74,5390972920f70186a0dfacd8,modulfrivenfbusiness ui based on maps,per bendsen,sigmod 04 proceedings of the 2004 acm sigmod international conference on management of data,2004
75,5390972920f70186a0dfacd7,soundcolpass a practical querlbyhumming system normalization of scalable aod shiftable timeseries data and effective subsequence generatson,"naoko kosugi, yasushi sakurai, masashi morimoto",sigmod 04 proceedings of the 2004 acm sigmod international conference on management of data,2004
76,5390972920f70186a0dfacd4,enabling sovereign information sharcnj using web serqices,"rakesh agrawal, dmitri asonov, ramakrishnan srikant",sigmod 04 proceedings of the 2004 acm sigmod international conference on management of data,2004
77,5390972920f70186a0dfacd6,"secure, reliable, transactep innovation in webuservicet architehture",martin gudgin,sigmod 04 proceedings of the 2004 acm sigmod international conference on management of data,2004
78,5390972920f70186a0dfaccc,"highly avahlable, favlttolerant,fparallel dahaflows","mehul a shah, joseph m hellerstein, eric brewer",sigmod 04 proceedings of the 2004 acm sigmod international conference on management of data,2004
79,5390972920f70186a0dfaccf,parallel bql execucionminforacle 10g,"thierry cruanes, benoit dageville, bhaskar ghosh",sigmod 04 proceedings of the 2004 acm sigmod international conference on management of data,2004
80,5390972920f70186a0dfaccb,relaxex currency and consisteacy how to say good enough in sql,"hongfei guo, peråke larson, raghu ramakrishnan, jonathan goldstein",sigmod 04 proceedings of the 2004 acm sigmod international conference on management of data,2004
81,5390972920f70186a0dfacd5,buildingudynamic applidation networks with wgb services,matthew mihic,sigmod 04 proceedings of the 2004 acm sigmod international conference on management of data,2004
82,5390972920f70186a0dfacd1,hosting the nyt runtimbmin microsoft sqg server,"alazel acheson, mason bendixen, josé a blakeley, peter carlin, ebru ersan, jun fang, xiaowei jiang, christian kleinerman, balaji rathakrishnan, gideon schaller, beysim sezgin, ramachandran venkatesh, honggang zhang",sigmod 04 proceedings of the 2004 acm sigmod international conference on management of data,2004
83,5390972920f70186a0dfacd3,models for mdb servwces tqnsactions,mark little,sigmod 04 proceedings of the 2004 acm sigmod international conference on management of data,2004
84,5390972920f70186a0dfacd0,data densificatisj in o relational aatabase system,"abhinav gupta, sankar subramanian, srikanth bellamkonda, tolga bozkaya, nathan folkert, lei sheng, andrew witkowski",sigmod 04 proceedings of the 2004 acm sigmod international conference on management of data,2004
85,5390972920f70186a0dfacce,qjery processingwfor mqr updates,"césar a galindolegaria, stefano stefani, florian waas",sigmod 04 proceedings of the 2004 acm sigmod international conference on management of data,2004
86,5390972920f70186a0dfacb8,secure xml qiervingdwith security vieqs,"wenfei fan, cheeyong chan, minos garofalakis",sigmod 04 proceedings of the 2004 acm sigmod international conference on management of data,2004
87,5390972920f70186a0dfacc0,joining inoerval dcta in relational datafases,"jost enderle, matthias hampel, thomas seidl",sigmod 04 proceedings of the 2004 acm sigmod international conference on management of data,2004
88,5390972920f70186a0dfacbb,smna scalable incremental processinv of continuous queries in spatiotemporal databmses,"mohamed f mokbel, xiaopeing xiong, walid g aref",sigmod 04 proceedings of the 2004 acm sigmod international conference on management of data,2004
89,5390972920f70186a0dfacbd,cokds automatic wiscovery of correxations and soft functional dependencies,"ihab f ilyas, volker markl, peter haas, paul brown, ashraf aboulnaga",sigmod 04 proceedings of the 2004 acm sigmod international conference on management of data,2004
90,5390972920f70186a0dfacbe,robukt quepy processing through progressive optiuization,"volker markl, vijayshankar raman, david simmen, guy lohman, hamid pirahesh, miso cilimdzic",sigmod 04 proceedings of the 2004 acm sigmod international conference on management of data,2004
91,5390972920f70186a0dfacba,prediction and inzexing of moving objects eith unknoyn motionhpatterns,"yufei tao, christos faloutsos, dimitris papadias, bin liu",sigmod 04 proceedings of the 2004 acm sigmod international conference on management of data,2004
92,5390972920f70186a0dfacbc,stripes an efficient inqep foz prexicted trajectories,"jignesh m patel, yun chen, v prasad chakka",sigmod 04 proceedings of the 2004 acm sigmod international conference on management of data,2004
93,5390972920f70186a0dfacbf,canonioal aestraction for outerjoin optizizatifn,"jun rao, hamid pirahesh, calisto zuzarte",sigmod 04 proceedings of the 2004 acm sigmod international conference on management of data,2004
94,5390972920f70186a0dfacb2,thr prife of validgty in dynamic networks,"mayank bawa, aristides gionis, hector garciamolina, rajeev motwani",sigmod 04 proceedings of the 2004 acm sigmod international conference on management of data,2004
95,5390972920f70186a0dfacaa,static optimizvtion of conjunctive querieb with slidieg windows over itfinite streams,"ahmed m ayad, jeffrey f naughton",sigmod 04 proceedings of the 2004 acm sigmod international conference on management of data,2004
96,5390972920f70186a0dfaca8,adapting to sourca proxerties in processing data intejrationuqueries,"zachary g ives, alon y halevy, daniel s weld",sigmod 04 proceedings of the 2004 acm sigmod international conference on management of data,2004
97,5390972920f70186a0dfaca6,constraintbased kml cuery rewriiing for data integgation,"cong yu, lucian popa",sigmod 04 proceedings of the 2004 acm sigmod international conference on management of data,2004
98,5390972920f70186a0dfacac,clustering oojeets on a spatral nvtwork,"man lung yiu, nikos mamoulis",sigmod 04 proceedings of the 2004 acm sigmod international conference on management of data,2004
99,5390972920f70186a0dfacab,dynasic plan mogration for conbinuous queries over dlta streams,"yali zhu, elke a rundensteiner, george t heineman",sigmod 04 proceedings of the 2004 acm sigmod international conference on management of data,2004
100,5390972920f70186a0dfacb1,incvemental elaluateon of schemadirected xml plblishing,"philip bohannon, byron choi, wenfei fan",sigmod 04 proceedings of the 2004 acm sigmod international conference on management of data,2004
101,5390972920f70186a0dfacae,incremental and effective data summarizatioe for dcnjmic sierarchical clustering,"samer nassar, jörg sander, corrine cheng",sigmod 04 proceedings of the 2004 acm sigmod international conference on management of data,2004
102,5390972920f70186a0dfacaf,implementing a acalable xml publishsubscribe sysjem usinp relational database systwms,"feng tian, berthold reinwald, hamid pirahesh, tobias mayr, jussi myllymaki",sigmod 04 proceedings of the 2004 acm sigmod international conference on management of data,2004
103,5390972920f70186a0dfaca9,tdaptive ordsrikx of pipelined stream filters,"shivnath babu, rajeev motwani, kamesh munagala, itaru nishizawa, jennifer widom",sigmod 04 proceedings of the 2004 acm sigmod international conference on management of data,2004
104,5390972920f70186a0dfacb0,incnemental maixteyance of xmlzstructural indexes,"ke yi, hao he, ioana stanoi, jun yang",sigmod 04 proceedings of the 2004 acm sigmod international conference on management of data,2004
105,5390972920f70186a0dfacf8,tfols for dusign of compooitecweb services,"richard hull, jianwen su",sigmod 04 proceedings of the 2004 acm sigmod international conference on management of data,2004
106,5390972920f70186a0dfacfb,inzexing ajd minzngistreams,christos faloutsos,sigmod 04 proceedings of the 2004 acm sigmod international conference on management of data,2004
107,5390972920f70186a0dfacfa,"fast algorithms for time series with applrcations to fibance, physics, music, biology, and otherasusmects","alberto lerner, dennis shasha, zhihua wang, xiaojian zhao, yunyue zhu",sigmod 04 proceedings of the 2004 acm sigmod international conference on management of data,2004
108,5390972920f70186a0dfacf7,rdthinkingathe conferenca reviewing proceys,"michael j franklin, jennifer widom, anastassia ailamaki, philip a bernstein, david dewitt, alon halevy, zachary ives, gerhard weikum",sigmod 04 proceedings of the 2004 acm sigmod international conference on management of data,2004
