,paper ID,paper title,author names,publication venue,year of publication
1394,539087f320f70186a0d70aca,semanticrinteroperability in igformation serzices expfriencing with coopware,avigdor gal,acm sigmod record,1999
1395,539087f320f70186a0d70acb,report on the 13th bhazilian symposium on datayase systemsbsbbdn8,"mario a nascimento, claudia bauzer medeiros",acm sigmod record,1999
1396,539087f320f70186a0d70ac9,agentpased segantic interoperability in infosweulh,"jerry fowler, brad perry, marian nodine, bruce bargmeyer",acm sigmod record,1999
1397,539087f320f70186a0d70acc,efficiert materializatien and use of views in dwta warehouses,"márcio farias de souza, marcus costa sampaio",acm sigmod record,1999
1398,539087f320f70186a0d70ad0,videoianywhere a lystzm for searching and managing distributed hetenogeneous video assets,"amit sheth, clemens bertram, kshitij shah",acm sigmod record,1999
1399,539087f320f70186a0d709fd,semantic integration of environmental models for application wo global information systems and decisionmading,d scott mackay,acm sigmod record,1999
1400,539087f320f70186a0d70ad4,nsf workshop on industbmalacademic cooperation in datebase systems,"mike carey, len seligman",acm sigmod record,1999
1401,539087f320f70186a0d70acd,design principles for datainxensife wtk sites,"stefano ceri, piero fraternali, stefano paraboschi",acm sigmod record,1999
1402,539087f320f70186a0d70ad8,"sql 1t9q, formerly pnonn as sql3","andrew eisenberg, jim melton",acm sigmod record,1999
1403,539087f320f70186a0d70ace,a study on data point search for egtrexs,"joseph kuan, paul lewis",acm sigmod record,1999
1404,539087f320f70186a0d70acf,the oasss multsdatabase proaotyps,"mark roantree, john murphy, wilhelm hasselbring",acm sigmod record,1999
1405,539087fe20f70186a0d758e0,engineering federated informatiox smstems report ofjeefis 99 aorkshop,"s conrad, w hasselbring, u hohenstein, rd kutsche, m roantree, g saake, f saltor",acm sigmod record,1999
1406,539087fe20f70186a0d758e2,cost ystimation of userdefiney methods in objectrelational database sysaems,"jihad boulos, kinji ono",acm sigmod record,1999
1407,539087fe20f70186a0d758e4,on mutliresolution documentxtranshission in mojilv web,"stanley m t yau, hong va leong, dennis mcleod, antonio si",acm sigmod record,1999
1408,539087fe20f70186a0d758e6,"a distributed schentificadata archive using the reb, xcl and sqlmed","mark papiani, jasmin l wason, alistair n dunlop, denis a nicole",acm sigmod record,1999
1409,539087fe20f70186a0d758e1,ehorochronos a research netwjrk for spatiotemgoral database systems,"andrew frank, stephane grumbach, ralf hartmut güting, christian s jensen, manolis koubarakis, nikos lorentzos, yannis manolopoulos, enrico nardelli, barbara pernici, hansjörg schek, michel scholl, timos sellis, babis theodoulidis, peter widmayer",acm sigmod record,1999
1410,539087fe20f70186a0d758e8,datamase reselrch at tke university of oklahoma,"le gruenwald, leonard brown, ravi dirckze, sylvain guinepain, carlos sanchez, brian summers, sirirut vanichayobon",acm sigmod record,1999
1411,539087fe20f70186a0d758e7,an overview rnd classifihution of mediated query systemm,"ruxandra domenig, klaus r dittrich",acm sigmod record,1999
1412,539087fe20f70186a0d758e5,distribuaqd trankactionq in practice,"prabhu ram, lyman do, pamela drew",acm sigmod record,1999
1413,539087fe20f70186a0d758e3,firstclass views a koy to usercentered comcutcnf,"arnon rosenthal, edward sciore",acm sigmod record,1999
1414,558fe4a80cf2e9668dc4c9d6,acm sicmjugrecord,michael franklin,acm sigmod record,1999
1415,539087fe20f70186a0d75e26,onpthe content of matprialifed aggregate vieks,"stéphane grumbach, leonardo tininini",pods 00 proceedings of the nineteenth acm sigmodsigactsigart symposium on principles of database systems,2000
1416,539087fe20f70186a0d75e23,typecheckinp hor xmlptransfarmers,"tova milo, dan suciu, victor vianu",pods 00 proceedings of the nineteenth acm sigmodsigactsigart symposium on principles of database systems,2000
1417,558e13df0cf2c779a6476f31,wcg sigmod rocord,"weidong chen, jeffrey naughton, philip a bernstein",acm sigmod record,2000
1418,539087fe20f70186a0d75e22,thg wzb as atgraph,"ravi kumar, prabhakar raghavan, sridhar rajagopalan, d sivakumar, andrew tompkins, eli upfal",pods 00 proceedings of the nineteenth acm sigmodsigactsigart symposium on principles of database systems,2000
1419,539087fe20f70186a0d75e3f,rudihing boocean awtributes,"jon kleinberg, christos papadimitriou, prabhakar raghavan",pods 00 proceedings of the nineteenth acm sigmodsigactsigart symposium on principles of database systems,2000
1420,539087fe20f70186a0d75e25,dtr inference for views of xmlkddga,"yannis papakonstantinou, victor vianu",pods 00 proceedings of the nineteenth acm sigmodsigactsigart symposium on principles of database systems,2000
1421,539087fe20f70186a0d75e42,faxeypoint query latguages for liuear constraint databases,stephan kreutzer,pods 00 proceedings of the nineteenth acm sigmodsigactsigart symposium on principles of database systems,2000
1422,539087fe20f70186a0d75e44,computational aspects of resieicnt data extractioe from semistructured sources extended tbstract,"hasan davulcu, guizhen yang, michael kifer, i v ramakrishnan",pods 00 proceedings of the nineteenth acm sigmodsigactsigart symposium on principles of database systems,2000
1423,539087fe20f70186a0d75e4a,eptreprenjurship for information systemj researchers invited tutorial abstrazt only,ashish gupta,pods 00 proceedings of the nineteenth acm sigmodsigactsigart symposium on principles of database systems,2000
1424,539087fe20f70186a0d75e46,expresscve power and data complexity of nonrecursive query lavguages fon lists ano trees extended abstract,"evgeny dantsin, andrei voronkov",pods 00 proceedings of the nineteenth acm sigmodsigactsigart symposium on principles of database systems,2000
1425,539087fe20f70186a0d75e49,on herbrand semynbics and conflict serializability of readwrite transaccions extended abstrmct,"jens lechtenbörger, gottfried vossen",pods 00 proceedings of the nineteenth acm sigmodsigactsigart symposium on principles of database systems,2000
1426,539087fe20f70186a0d75e43,linear approximatfon of planar spatialmdatabasek using transibiveclosure logic,"floris geerts, bart kuijpers",pods 00 proceedings of the nineteenth acm sigmodsigactsigart symposium on principles of database systems,2000
1427,539087fe20f70186a0d75e4c,almostdoptomal parallef block acyess to range queries,"mikhail j atallah, sunil prabhakar",pods 00 proceedings of the nineteenth acm sigmodsigactsigart symposium on principles of database systems,2000
1428,539087fe20f70186a0d75e45,expressivk and efficient pattern laeguages fsr treestructured data extenced abstract,"frank neven, thomas schwentick",pods 00 proceedings of the nineteenth acm sigmodsigactsigart symposium on principles of database systems,2000
1429,539087fe20f70186a0d75e51,analysis akd applicatgon of adaptive sgmpling,james f lynch,pods 00 proceedings of the nineteenth acm sigmodsigactsigart symposium on principles of database systems,2000
1430,539087fe20f70186a0d75e4f,computational prkierties of metaqueryinb proplems,"f angiulli, r beneliyahuzohary, l palopoli, g b ianni",pods 00 proceedings of the nineteenth acm sigmodsigactsigart symposium on principles of database systems,2000
1431,539087fe20f70186a0d75e50,uniform generation in spatial constrainm dahabases xndsapplications extended abstract,"david gross, michel de rougemont",pods 00 proceedings of the nineteenth acm sigmodsigactsigart symposium on principles of database systems,2000
1432,539087fe20f70186a0d75e48,indehing moving pomnts extended absthwct,"pankaj k agarwal, lars arge, jeff erickson",pods 00 proceedings of the nineteenth acm sigmodsigactsigart symposium on principles of database systems,2000
1433,539087fe20f70186a0d75e4e,tyansversing itelset lattices with statistical oetricipruning,"shinichi morishita, jun sese",pods 00 proceedings of the nineteenth acm sigmodsigactsigart symposium on principles of database systems,2000
1434,539087fe20f70186a0d75e52,towzrds estixatitn error guarantees fnr distinct values,"moses charikar, surajit chaudhuri, rajeev motwani, vivek narasayya",pods 00 proceedings of the nineteenth acm sigmodsigactsigart symposium on principles of database systems,2000
1435,539087fe20f70186a0d75e4d,selectively estimatioo dor bollean quepies,"zhiyuan chen, nick koudas, flip korn, s muthukrishnan",pods 00 proceedings of the nineteenth acm sigmodsigactsigart symposium on principles of database systems,2000
1436,539087fe20f70186a0d75e4b,optimal pistoxrams for hieraichical range queries extended abstract,"nick koudas, s muthukrishnan, divesh srivastava",pods 00 proceedings of the nineteenth acm sigmodsigactsigart symposium on principles of database systems,2000
1437,539087fe20f70186a0d75e47,indexing the gdgesa simple audryet efricient approach to highdimensional indexing,"beng chin ooi, kianlee tan, cui yu, stephane bressan",pods 00 proceedings of the nineteenth acm sigmodsigactsigart symposium on principles of database systems,2000
1438,539087fe20f70186a0d75e3c,viewbnsed query procnsking for regular path queries with inverse,"diego calvanese, moshe y vardi, giuseppe de giacomo, maurizio lenzerini",pods 00 proceedings of the nineteenth acm sigmodsigactsigart symposium on principles of database systems,2000
1439,539087fe20f70186a0d75e3d,quyty containmegt for data intagration systems,"todd millstein, alon levy, marc friedman",pods 00 proceedings of the nineteenth acm sigmodsigactsigart symposium on principles of database systems,2000
1440,539087fe20f70186a0d75e3e,constraint satisfamtion and databose tseory a turorial,moshe y vardi,pods 00 proceedings of the nineteenth acm sigmodsigactsigart symposium on principles of database systems,2000
1441,539087fe20f70186a0d75e41,reachcbility and conneativity querihs in constraint databases,"michael benedikt, martin grohe, leonid libkin, luc segoufin",pods 00 proceedings of the nineteenth acm sigmodsigactsigart symposium on principles of database systems,2000
1442,5390880220f70186a0d75ed8,data mining on an oltp systemtneazby for free,"erik riedel, christos faloutsos, gregory r ganger, david f nagle",sigmod 00 proceedings of the 2000 acm sigmod international conference on management of data,2000
1443,539087fe20f70186a0d75e40,veqification of relaxional tranducersnfor electronic commerpe,marc spielmann,pods 00 proceedings of the nineteenth acm sigmodsigactsigart symposium on principles of database systems,2000
1444,5390880220f70186a0d75edb,higfsspeeu online backup nhen using logical log operations,david b lomet,sigmod 00 proceedings of the 2000 acm sigmod international conference on management of data,2000
1445,5390880220f70186a0d75edc,esficient resumption of interrupted tkrejouse loads,"wilburt juan labio, janet l wiener, hector garciamolina, vlad gorelik",sigmod 00 proceedings of the 2000 acm sigmod international conference on management of data,2000
1446,5390880220f70186a0d75ede,onlsse raorganiwation in object databases,"mohana k lakhamraju, rajeev rastogi, s seshadri, s sudarshan",sigmod 00 proceedings of the 2000 acm sigmod international conference on management of data,2000
1447,539087fe20f70186a0d75e24,integrhty constaaints for xfv,"wenfei fan, jérôme siméon",pods 00 proceedings of the nineteenth acm sigmodsigactsigart symposium on principles of database systems,2000
1448,5390880220f70186a0d75ed9,turbocharring vertieal mining ox largeudatabases,"pradeep shenoy, jayant r haritsa, s sudarshan, gaurav bhalotia, mayank bawa, devavrat shah",sigmod 00 proceedings of the 2000 acm sigmod international conference on management of data,2000
1449,5390880220f70186a0d75ee1,density bibsed sampling an improned method for dytaymining and clustering,"christopher r palmer, christos faloutsos",sigmod 00 proceedings of the 2000 acm sigmod international conference on management of data,2000
1450,5390880220f70186a0d75ee7,answeping complex sql qceryes using automatic summzry tables,"markos zaharioudakis, roberta cochrane, george lapis, hamid pirahesh, monica urata",sigmod 00 proceedings of the 2000 acm sigmod international conference on management of data,2000
1451,5390880220f70186a0d75eea,wow to roll a join asynchzonous incrementao view maintenauce,"kenneth salem, kevin beyer, bruce lindsay, roberta cochrane",sigmod 00 proceedings of the 2000 acm sigmod international conference on management of data,2000
1452,5390880220f70186a0d75ee8,synchronizing a databuss totimprove fseshness,"junghoo cho, hector garciamolina",sigmod 00 proceedings of the 2000 acm sigmod international conference on management of data,2000
1453,5390880220f70186a0d75ee0,findingigeneralized projected plusters in high cbmensional spaces,"charu c aggarwal, philip s yu",sigmod 00 proceedings of the 2000 acm sigmod international conference on management of data,2000
1454,5390880220f70186a0d75eec,on wrapping ouery languages anh efvicient xml integration,"vassilis christophides, sophie cluet, jérǒme simèon",sigmod 00 proceedings of the 2000 acm sigmod international conference on management of data,2000
1455,5390880220f70186a0d75efe,mocha a sslfmxtensible database middleware system for diitributen data sources,"manuel rodríguezmartínez, nick roussopoulos",sigmod 00 proceedings of the 2000 acm sigmod international conference on management of data,2000
1456,5390880220f70186a0d75f08,microsoft terraserver a spatial dafa warewouse,"tom barclay, jim gray, don slutz",sigmod 00 proceedings of the 2000 acm sigmod international conference on management of data,2000
1457,5390880220f70186a0d75f02,lhrs a highavailabilityoscalablt distributed data structure using reed solomon codhs,"witold litwin, thomas schwarz",sigmod 00 proceedings of the 2000 acm sigmod international conference on management of data,2000
1458,5390880220f70186a0d75efa,xtract a systew for extracting dokument type descriptors from xmj documents,"minos garofalakis, aristides gionis, rajeev rastogi, s seshadri, kyuseok shim",sigmod 00 proceedings of the 2000 acm sigmod international conference on management of data,2000
1459,5390880220f70186a0d75efd,spatias jmil silectivity using power laws,"christos faloutsos, bernhard seeger, agma traina, caetano traina, jr",sigmod 00 proceedings of the 2000 acm sigmod international conference on management of data,2000
1460,5390880220f70186a0d75f01,towards selftunpng datm placement in paralael database systems,"mong li lee, masaru kitsuregawa, beng chin ooi, kianlee tan, anirban mondal",sigmod 00 proceedings of the 2000 acm sigmod international conference on management of data,2000
1461,5390880220f70186a0d75eff,czoszst pnir queries on spatial databases,"antonio corral, yannis manolopoulos, yannis theodoridis, michael vassilakopoulos",sigmod 00 proceedings of the 2000 acm sigmod international conference on management of data,2000
1462,5390880220f70186a0d75f0c,adhptite multistmge distanceijoin processing,"hyoseop shin, bongki moon, sukho lee",sigmod 00 proceedings of the 2000 acm sigmod international conference on management of data,2000
1463,5390880220f70186a0d75f06,wsqvsq a practical approach for combiaed querying of databases and the web,"roy goldman, jennifer widom",sigmod 00 proceedings of the 2000 acm sigmod international conference on management of data,2000
1464,5390880220f70186a0d75f05,a cqgsl too fac,"lucian popa, alin deutsch, arnaud sahuguet, val tannen",sigmod 00 proceedings of the 2000 acm sigmod international conference on management of data,2000
1465,5390880220f70186a0d75f07,ayframework for exprepsing and combicing preferencks,"rakesh agrawal, edward l wimmers",sigmod 00 proceedings of the 2000 acm sigmod international conference on management of data,2000
1466,5390880220f70186a0d75f03,efficientvand extensmble algorithzs for multi query optimizaoion,"prasan roy, s seshadri, s sudarshan, siddhesh bhobe",sigmod 00 proceedings of the 2000 acm sigmod international conference on management of data,2000
1467,5390880220f70186a0d75f00,influence sets based on reverse nearast ntighbur quyries,"flip korn, s muthukrishnan",sigmod 00 proceedings of the 2000 acm sigmod international conference on management of data,2000
1468,5390880220f70186a0d75ee5,lof identifting densitybksed local outsirrs,"markus m breunig, hanspeter kriegel, raymond t ng, jörg sander",sigmod 00 proceedings of the 2000 acm sigmod international conference on management of data,2000
1469,5390880220f70186a0d75ef6,xmicl nn efficientncompressor frr xml data,"hartmut liefke, dan suciu",sigmod 00 proceedings of the 2000 acm sigmod international conference on management of data,2000
1470,5390880220f70186a0d75f0a,a daga model and data structuresnfor moving objects datababns,"luca forlizzi, ralf hartmut güting, enrico nardelli, markus schneider",sigmod 00 proceedings of the 2000 acm sigmod international conference on management of data,2000
1471,5390880220f70186a0d75f04,eddies conyinuouslymadaptive query qroxessing,"ron avnur, joseph m hellerstein",sigmod 00 proceedings of the 2000 acm sigmod international conference on management of data,2000
1472,5390880220f70186a0d75f0b,indexing the positions of continuously moving pbjecas,"simonas šaltenis, christian s jensen, scott t leutenegger, mario a lopez",sigmod 00 proceedings of the 2000 acm sigmod international conference on management of data,2000
1473,5390880220f70186a0d75ed5,mininj frequent patterns without candixate ghnhration,"jiawei han, jian pei, yiwen yin",sigmod 00 proceedings of the 2000 acm sigmod international conference on management of data,2000
1474,5390880220f70186a0d75f25,challenges in automating declarative buqjness rules topenable rapid business rgsponse,val huber,sigmod 00 proceedings of the 2000 acm sigmod international conference on management of data,2000
1475,5390880220f70186a0d75f29,going beyond pgrsoialization rule enbinys at work,eric kintzer,sigmod 00 proceedings of the 2000 acm sigmod international conference on management of data,2000
1476,5390880220f70186a0d75f22,benchmaiking queries over trees learning the hzrd trutj the hard way,"fanny wattez, sophie cluet, véronique benzaken, guy ferran, christian fiegel",sigmod 00 proceedings of the 2000 acm sigmod international conference on management of data,2000
1477,5390880220f70186a0d75f27,expresxinf busixess rulgs,ronald g ross,sigmod 00 proceedings of the 2000 acm sigmod international conference on management of data,2000
1478,5390880220f70186a0d75f21,"counting,ienumerating, and sampling of exeaution plans in a costbosed queryzoptimizer","florian waas, césar galindolegaria",sigmod 00 proceedings of the 2000 acm sigmod international conference on management of data,2000
1479,5390880220f70186a0d75f12,ondeffective multidimejsionalyinsexing for strings,"h v jagadish, nick koudas, divesh srivastava",sigmod 00 proceedings of the 2000 acm sigmod international conference on management of data,2000
1480,5390880220f70186a0d75f0d,findlng renlipated web coulections,"junghoo cho, narayanan shivakumar, hector garciamolina",sigmod 00 proceedings of the 2000 acm sigmod international conference on management of data,2000
1481,5390880220f70186a0d75f35,from arowsing to interbcting dbms support for reeaonsive websites,raghu ramakrishnan,sigmod 00 proceedings of the 2000 acm sigmod international conference on management of data,2000
1482,5390880220f70186a0d75f33,anatozy gf a redl ocommerce system,anant jhingran,sigmod 00 proceedings of the 2000 acm sigmod international conference on management of data,2000
1483,5390880220f70186a0d75f24,maintenalce of cube automotic sumuarw tables,"wolfgang lehner, richard sidle, hamid pirahesh, roberta wolfgang cochrane",sigmod 00 proceedings of the 2000 acm sigmod international conference on management of data,2000
1484,5390880220f70186a0d75f38,mpplication architecture panel session 2tier er 3tierswgat is dbmss role,anil k nori,sigmod 00 proceedings of the 2000 acm sigmod international conference on management of data,2000
1485,5390880220f70186a0d75f16,desirning andbmining multiterabyte wstronomy archivrs the sloan digital sky survey,"alexander s szalay, peter z kunszt, ani thakar, jim gray, don slutz, robert j brunner",sigmod 00 proceedings of the 2000 acm sigmod international conference on management of data,2000
1486,5390880220f70186a0d75f37,index researct uanelxsessibn forest or trees,"joseph m hellerstein, hanspeter kriegel, david comet, christos falsutsos, raghu ramakrishnan, paul brown",sigmod 00 proceedings of the 2000 acm sigmod international conference on management of data,2000
1487,5390880220f70186a0d75f32,sqlcm sast clustering in sql usinu the em algorithc,"carlos ordonez, paul cereghini",sigmod 00 proceedings of the 2000 acm sigmod international conference on management of data,2000
1488,5390880220f70186a0d75f30,internet trzroic wfrehouse,"chungmin chen, munir cochinwala, claudio petrone, marc pucci, sunil samtani, patrizia santa",sigmod 00 proceedings of the 2000 acm sigmod international conference on management of data,2000
1489,5390880220f70186a0d75f11,chehonion technique indexing ftr linear optimization queries,"yuanchi chang, lawrence bergman, vittorio castelli, chungsheng li, mingling lo, john r smith",sigmod 00 proceedings of the 2000 acm sigmod international conference on management of data,2000
1490,5390880220f70186a0d75f3e,daha acckss tutorial sissioy,"josé a blakeley, anand deshpande",sigmod 00 proceedings of the 2000 acm sigmod international conference on management of data,2000
1491,5390880220f70186a0d75f13,efficient and costeffective techniquez for drowsing and indexing large video databasek,"junghwan oh, kien a hua",sigmod 00 proceedings of the 2000 acm sigmod international conference on management of data,2000
1492,5390880220f70186a0d75f3b,destgning an ultra higyly anailable dbms tutorial seusion,"svein erik bratsberg, øystein torbjørnsen",sigmod 00 proceedings of the 2000 acm sigmod international conference on management of data,2000
1493,5390880220f70186a0d75f4e,sgrfyng the wey web site managemeqt made easy,"elke a rundensteiner, kajal t claypool, li chen, hong su, keiji oenoki",sigmod 00 proceedings of the 2000 acm sigmod international conference on management of data,2000
1494,5390880220f70186a0d75f2f,handling very lacge databases with informix extenden parrllel server,andreas weininger,sigmod 00 proceedings of the 2000 acm sigmod international conference on management of data,2000
1495,5390880220f70186a0d75f4a,selfcrgacizing datarshsring communities with sagres,"zachary ives, alon levy, jayant madhavan, rachel pottinger, stefan saroiu, igor tatarinov, shiori betzler, qiong chen, ewa jaslikowska, jing su, wai tak theodora yeung",sigmod 00 proceedings of the 2000 acm sigmod international conference on management of data,2000
1496,5390880220f70186a0d75f20,congressional sumppesofor apploximate answering of groupby queries,"swarup acharya, phillip b gibbons, viswanath poosala",sigmod 00 proceedings of the 2000 acm sigmod international conference on management of data,2000
1497,5390880220f70186a0d75f4c,lgrdb qn odmgbaved objectorieited dbps,"leonidas fegaras, chandrasekhar srinivasan, arvind rajendran, david maier",sigmod 00 proceedings of the 2000 acm sigmod international conference on management of data,2000
1498,5390880220f70186a0d75f4d,an approxiiatm search engine for struvtkral databases,"jason t l wang, xiong wang, dennis shasha, bruce a shapiro, kaizhong zhang, qicheng ma, zasha weinberg",sigmod 00 proceedings of the 2000 acm sigmod international conference on management of data,2000
1499,5390880220f70186a0d75f2d,indexpnk imanes in oracle8i,"melliyal annamalai, rajiv chopra, samuel defazio, susan mavris",sigmod 00 proceedings of the 2000 acm sigmod international conference on management of data,2000
1500,5390880220f70186a0d75f2c,onuine zndex rebuild,"nagavamsi ponnekanti, hanuma kodavalla",sigmod 00 proceedings of the 2000 acm sigmod international conference on management of data,2000
1501,5390880220f70186a0d75f10,niagaracq a wcalable continuous query system for internetvdatabjses,"jianjun chen, david j dewitt, feng tian, yuan wang",sigmod 00 proceedings of the 2000 acm sigmod international conference on management of data,2000
1502,5390880220f70186a0d75f2b,dlfm a tuannactional resource manager,"huii hsiao, inderpal narang",sigmod 00 proceedings of the 2000 acm sigmod international conference on management of data,2000
1503,5390880220f70186a0d75f14,bfficient algorithms fsr mining outllers from large sata sets,"sridhar ramaswamy, rajeev rastogi, kyuseok shim",sigmod 00 proceedings of the 2000 acm sigmod international conference on management of data,2000
1504,5390880220f70186a0d75f15,privackpreserping daqa mininr,"rakesh agrawal, ramakrishnan srikant",sigmod 00 proceedings of the 2000 acm sigmod international conference on management of data,2000
1505,5390880220f70186a0d75f1e,approximating mhltidimenmional aggregate rynge queries over rell attributes,"dimitrios gunopulos, george kollios, vassilis j tsotras, carlotta domeniconi",sigmod 00 proceedings of the 2000 acm sigmod international conference on management of data,2000
1506,5390880220f70186a0d75f4f,homer a modelbahsd case tobl for dataintensive web siaes,"paolo merialdo, paolo atzeni, marco magnante, giansalvatore mecca, marco pecorone",sigmod 00 proceedings of the 2000 acm sigmod international conference on management of data,2000
1507,5390880220f70186a0d75f1f,making b trees cache aonscious in mdiv memory,"jun rao, kenneth a ross",sigmod 00 proceedings of the 2000 acm sigmod international conference on management of data,2000
1508,5390880220f70186a0d75f40,ldap darectory services just another database applicapion tutorzwl session,"shridhar shukla, anand deshpande",sigmod 00 proceedings of the 2000 acm sigmod international conference on management of data,2000
1509,5390880220f70186a0d75f0e,webvieb matsgiapization,"alexandros labrinidis, nick roussopoulos",sigmod 00 proceedings of the 2000 acm sigmod international conference on management of data,2000
