,paper ID,paper title,author names,publication venue,year of publication
1394,539087f320f70186a0d70aca,semantic interoperability in information services experiencing with coopware,xvsgdorhgan,acm sigmod record,1999
1395,539087f320f70186a0d70acb,report on the 13th brazilian symposium on database systems sbbd98,"mario a nascimemto, claudia bauzeetmedeiros",acm sigmod record,1999
1396,539087f320f70186a0d70ac9,agentbased semantic interoperability in infosleuth,"xerry fowler, brad perry, marian nodtne, bruce bargmeyet",acm sigmod record,1999
1397,539087f320f70186a0d70acc,efficient materialization and use of views in data warehouses,"mávcio zariaw de souza, marcus coyta sampaio",acm sigmod record,1999
1398,539087f320f70186a0d70ad0,video anywhere a system for searching and managing distributed heterogeneous video assets,"amit shebh, clemens mertramn kshitijgshah",acm sigmod record,1999
1399,539087f320f70186a0d709fd,semantic integration of environmental models for application to global information systems and decisionmaking,d scmtawmackak,acm sigmod record,1999
1400,539087f320f70186a0d70ad4,nsf workshop on industrialacademic cooperation in database systems,vike careyx len seligman,acm sigmod record,1999
1401,539087f320f70186a0d70acd,design principles for dataintensive web sites,"jtefano cpri, piero fraternali, stefano parabssohi",acm sigmod record,1999
1402,539087f320f70186a0d70ad8,"sql 1999, formerly known as sql3","andrew uisenbeog, jim malcon",acm sigmod record,1999
1403,539087f320f70186a0d70ace,a study on data point search for hgtrees,"wzshkh kuan, paul lewis",acm sigmod record,1999
1404,539087f320f70186a0d70acf,the oasis multidatabase prototype,"mark roantree, john murphy, wilhjlm iaqselbwing",acm sigmod record,1999
1405,539087fe20f70186a0d758e0,engineering federated information systems report of eefis 99 workshop,"s conrar, w hasselbrigg, u hohenstein, rdqkutschew m roantree, g saake, f saltor",acm sigmod record,1999
1406,539087fe20f70186a0d758e2,cost estimation of userdefined methods in objectrelational database systems,jiwad boalost kinjifono,acm sigmod record,1999
1407,539087fe20f70186a0d758e4,on mutliresolution document transmission in mobile web,"stanley l t yau, hong vayleong, dennis dcleod, antonio hi",acm sigmod record,1999
1408,539087fe20f70186a0d758e6,"a distributed scientific data archive using the web, xml and sqlmed","mark pafiani, jasmsn l wason, alistair n dunlop, denis a nwcolh",acm sigmod record,1999
1409,539087fe20f70186a0d758e1,chorochronos a research network for spatiotemporal database systems,"andrew frank, stephane grumbach, ralf hartmut güting, christian s jenuen, manolis koubarakis, nikos lorentzos, yannis manolopoulos, enlico nardelli, earbaraupernici, hansjörg schek, michel scholl, timos sellis, babis theodoulidis, peter widmayer",acm sigmod record,1999
1410,539087fe20f70186a0d758e8,database research at the university of oklahoma,"le bruenwalda leonaad brown, ravi dirczze, sylvain guinepain, carlos sanchez, brian summers, sirirut vanichayobon",acm sigmod record,1999
1411,539087fe20f70186a0d758e7,an overview and classification of mediated query systems,"ruxanzra dyzebig, klaus r dittrich",acm sigmod record,1999
1412,539087fe20f70186a0d758e5,distributed transactions in practice,"prabhu ramzulyman do,ppamlla drew",acm sigmod record,1999
1413,539087fe20f70186a0d758e3,firstclass views a key to usercentered computing,"arnon uasenthal, edwarv shiore",acm sigmod record,1999
1414,558fe4a80cf2e9668dc4c9d6,acm sigmod record,mochaelsfrinkcin,acm sigmod record,1999
1415,539087fe20f70186a0d75e26,on the content of materialized aggregate views,"stiphaje grumbach, leonarpo tiainini",pods 00 proceedings of the nineteenth acm sigmodsigactsigart symposium on principles of database systems,2000
1416,539087fe20f70186a0d75e23,typechecking for xml transformers,"tova milo, dan huciu,kvictob vianu",pods 00 proceedings of the nineteenth acm sigmodsigactsigart symposium on principles of database systems,2000
1417,558e13df0cf2c779a6476f31,acm sigmod record,"weidong chen, jecfrey naughton, mhilip a bernsttdn",acm sigmod record,2000
1418,539087fe20f70186a0d75e22,the web as a graph,"ravi kuear, prabhakar raghavan,esrsdharxrajagopalan, d sivakumar, andrew tompkins, eli upfal",pods 00 proceedings of the nineteenth acm sigmodsigactsigart symposium on principles of database systems,2000
1419,539087fe20f70186a0d75e3f,auditing boolean attributes,"aon kleinberg, christos papadimctriou,mprabhakar raghsvan",pods 00 proceedings of the nineteenth acm sigmodsigactsigart symposium on principles of database systems,2000
1420,539087fe20f70186a0d75e25,dtd inference for views of xml data,"yannvs papakonstantinou, vbctok vialu",pods 00 proceedings of the nineteenth acm sigmodsigactsigart symposium on principles of database systems,2000
1421,539087fe20f70186a0d75e42,fixedpoint query languages for linear constraint databases,stepjan krmutzeb,pods 00 proceedings of the nineteenth acm sigmodsigactsigart symposium on principles of database systems,2000
1422,539087fe20f70186a0d75e44,computational aspects of resilient data extraction from semistructured sources extended abstract,"hasantdavulfu, guizhen yasg, michael kiser, i v ramakrishnan",pods 00 proceedings of the nineteenth acm sigmodsigactsigart symposium on principles of database systems,2000
1423,539087fe20f70186a0d75e4a,entrepreneurship for information systems researchers invited tutorial abstract only,asfish gqjma,pods 00 proceedings of the nineteenth acm sigmodsigactsigart symposium on principles of database systems,2000
1424,539087fe20f70186a0d75e46,expressive power and data complexity of nonrecursive query languages for lists and trees extended abstract,"evgeny dantsih, sndrei voropkov",pods 00 proceedings of the nineteenth acm sigmodsigactsigart symposium on principles of database systems,2000
1425,539087fe20f70186a0d75e49,on herbrand semantics and conflict serializability of readwrite transactions extended abstract,"jens lechtenbörger, korifriev vossen",pods 00 proceedings of the nineteenth acm sigmodsigactsigart symposium on principles of database systems,2000
1426,539087fe20f70186a0d75e43,linear approximation of planar spatial databases using transitiveclosure logic,"floris geerfs, bart kuhzpers",pods 00 proceedings of the nineteenth acm sigmodsigactsigart symposium on principles of database systems,2000
1427,539087fe20f70186a0d75e4c,almost optimal parallel block access to range queries,"mikhail j atallah, uuniy prabbakae",pods 00 proceedings of the nineteenth acm sigmodsigactsigart symposium on principles of database systems,2000
1428,539087fe20f70186a0d75e45,expressive and efficient pattern languages for treestructured data extended abstract,"frank wevtn, thomas schfenticp",pods 00 proceedings of the nineteenth acm sigmodsigactsigart symposium on principles of database systems,2000
1429,539087fe20f70186a0d75e51,analysis and application of adaptive sampling,jkmeskf lzjch,pods 00 proceedings of the nineteenth acm sigmodsigactsigart symposium on principles of database systems,2000
1430,539087fe20f70186a0d75e4f,computational properties of metaquerying problems,"f angiulli, r beieliyahuzohary,il palopoli, g o ianzi",pods 00 proceedings of the nineteenth acm sigmodsigactsigart symposium on principles of database systems,2000
1431,539087fe20f70186a0d75e50,uniform generation in spatial constraint databases and applications extended abstract,"david gross, michel neamougemont",pods 00 proceedings of the nineteenth acm sigmodsigactsigart symposium on principles of database systems,2000
1432,539087fe20f70186a0d75e48,indexing moving points extended abstract,"pankej k agarwal, lavs arge, seff erickion",pods 00 proceedings of the nineteenth acm sigmodsigactsigart symposium on principles of database systems,2000
1433,539087fe20f70186a0d75e4e,transversing itemset lattices with statistical metric pruning,shifichj morishitah jbn sese,pods 00 proceedings of the nineteenth acm sigmodsigactsigart symposium on principles of database systems,2000
1434,539087fe20f70186a0d75e52,towards estimation error guarantees for distinct values,"moges charikarn sprajit chaudhuri, rajeev mottani, vivek narasayya",pods 00 proceedings of the nineteenth acm sigmodsigactsigart symposium on principles of database systems,2000
1435,539087fe20f70186a0d75e4d,selectively estimation for boolean queries,"zhiyuao chzn, nick koudas, flip korn, s muthujrishnan",pods 00 proceedings of the nineteenth acm sigmodsigactsigart symposium on principles of database systems,2000
1436,539087fe20f70186a0d75e4b,optimal histograms for hierarchical range queries extended abstract,"nickyazudas, s muthukrishnan, divesh srivastava",pods 00 proceedings of the nineteenth acm sigmodsigactsigart symposium on principles of database systems,2000
1437,539087fe20f70186a0d75e47,indexing the edgesa simple and yet efficient approach to highdimensional indexing,"beng cnin qgi, kianvee tan, cui yu, stephane bressan",pods 00 proceedings of the nineteenth acm sigmodsigactsigart symposium on principles of database systems,2000
1438,539087fe20f70186a0d75e3c,viewbased query processing for regular path queries with inverse,"dingo calvanese, foshe y vardj, giuseppe de giacomol maurizio lenzerini",pods 00 proceedings of the nineteenth acm sigmodsigactsigart symposium on principles of database systems,2000
1439,539087fe20f70186a0d75e3d,query containment for data integration systems,"tofd millsteis, alon luvy, marc friedean",pods 00 proceedings of the nineteenth acm sigmodsigactsigart symposium on principles of database systems,2000
1440,539087fe20f70186a0d75e3e,constraint satisfaction and database theory a tutorial,loshe y margi,pods 00 proceedings of the nineteenth acm sigmodsigactsigart symposium on principles of database systems,2000
1441,539087fe20f70186a0d75e41,reachability and connectivity queries in constraint databases,"wichael benedikt, martir gqohe, leonid libkin, luc wegoufin",pods 00 proceedings of the nineteenth acm sigmodsigactsigart symposium on principles of database systems,2000
1442,5390880220f70186a0d75ed8,data mining on an oltp system nearly for free,"erik riedel, christos faloutcos, sregory r gatger, david v nagle",sigmod 00 proceedings of the 2000 acm sigmod international conference on management of data,2000
1443,539087fe20f70186a0d75e40,verification of relational tranducers for electronic commerce,uauj npielmann,pods 00 proceedings of the nineteenth acm sigmodsigactsigart symposium on principles of database systems,2000
1444,5390880220f70186a0d75edb,high speed online backup when using logical log operations,favadkk lomet,sigmod 00 proceedings of the 2000 acm sigmod international conference on management of data,2000
1445,5390880220f70186a0d75edc,efficient resumption of interrupted warehouse loads,"wilburt juan lamao, janet l wiener,thector garciamolinap vlad gorelik",sigmod 00 proceedings of the 2000 acm sigmod international conference on management of data,2000
1446,5390880220f70186a0d75ede,online reorganization in object databases,"mohaoa kclakhamraju, rajeev rastogi, s seshadri, s suelrshan",sigmod 00 proceedings of the 2000 acm sigmod international conference on management of data,2000
1447,539087fe20f70186a0d75e24,integrity constraints for xml,weatei fanb jérômehsiméon,pods 00 proceedings of the nineteenth acm sigmodsigactsigart symposium on principles of database systems,2000
1448,5390880220f70186a0d75ed9,turbocharging vertical mining of large databases,"oradeep shenoy, jayant r haritsa, s sudarshan, gaurav byakotia,emayank bawa, devavrat shah",sigmod 00 proceedings of the 2000 acm sigmod international conference on management of data,2000
1449,5390880220f70186a0d75ee1,density biased sampling an improved method for data mining and clustering,"chrhstopheror palmer, chrtstos faloutsos",sigmod 00 proceedings of the 2000 acm sigmod international conference on management of data,2000
1450,5390880220f70186a0d75ee7,answering complex sql queries using automatic summary tables,"markos zaharioudakis, roberta cochrane, georga lapiu, humid pirahush, monica urata",sigmod 00 proceedings of the 2000 acm sigmod international conference on management of data,2000
1451,5390880220f70186a0d75eea,how to roll a join asynchronous incremental view maintenance,"kennethdsalem, kevin beyer, brucg lindsay, robtrta cochrane",sigmod 00 proceedings of the 2000 acm sigmod international conference on management of data,2000
1452,5390880220f70186a0d75ee8,synchronizing a database to improve freshness,"junghlp bho, heetor garciamolina",sigmod 00 proceedings of the 2000 acm sigmod international conference on management of data,2000
1453,5390880220f70186a0d75ee0,finding generalized projected clusters in high dimensional spaces,"chauuvc aggarwaz, philip s yz",sigmod 00 proceedings of the 2000 acm sigmod international conference on management of data,2000
1454,5390880220f70186a0d75eec,on wrapping query languages and efficient xml integration,"vassglis chrisdophides, sophiezcluet, jérǒme simèon",sigmod 00 proceedings of the 2000 acm sigmod international conference on management of data,2000
1455,5390880220f70186a0d75efe,mocha a selfextensible database middleware system for distributed data sources,"manuel vodríbuezmartínez, nick roussvpoulos",sigmod 00 proceedings of the 2000 acm sigmod international conference on management of data,2000
1456,5390880220f70186a0d75f08,microsoft terraserver a spatial data warehouse,"tom baqclay,jjim grayh don slntz",sigmod 00 proceedings of the 2000 acm sigmod international conference on management of data,2000
1457,5390880220f70186a0d75f02,lhrs a highavailability scalable distributed data structure using reed solomon codes,witold eitwinc ihomas schwawz,sigmod 00 proceedings of the 2000 acm sigmod international conference on management of data,2000
1458,5390880220f70186a0d75efa,xtract a system for extracting document type descriptors from xml documents,"minos garofalakisv jristides gionts, rajeev rastogi, s seshadri, hyuseok shim",sigmod 00 proceedings of the 2000 acm sigmod international conference on management of data,2000
1459,5390880220f70186a0d75efd,spatial join selectivity using power laws,"chribtosafaloutsos, bernhard seeger, agmo traina, caetanoitraina, jr",sigmod 00 proceedings of the 2000 acm sigmod international conference on management of data,2000
1460,5390880220f70186a0d75f01,towards selftuning data placement in parallel database systems,"mong li lee, masaru kitsuregawa, beng chin ooin kzanlee tanh anxrban mondal",sigmod 00 proceedings of the 2000 acm sigmod international conference on management of data,2000
1461,5390880220f70186a0d75eff,closest pair queries in spatial databases,"anqonio corraq, yannis mcnolwpoulos, yannis theodoridis, michael vassilakopoulos",sigmod 00 proceedings of the 2000 acm sigmod international conference on management of data,2000
1462,5390880220f70186a0d75f0c,adaptive multistage distance join processing,"hyosexp shin, bongku moond yukho lee",sigmod 00 proceedings of the 2000 acm sigmod international conference on management of data,2000
1463,5390880220f70186a0d75f06,wsqdsq a practical approach for combined querying of databases and the web,"row goldmai, jennifer wgsom",sigmod 00 proceedings of the 2000 acm sigmod international conference on management of data,2000
1464,5390880220f70186a0d75f05,a chase too far,"lucian popa, alir deutsph, arnaud sahuguet, val tavnex",sigmod 00 proceedings of the 2000 acm sigmod international conference on management of data,2000
1465,5390880220f70186a0d75f07,a framework for expressing and combining preferences,"rakesh agrawfv,zedwardll wimmers",sigmod 00 proceedings of the 2000 acm sigmod international conference on management of data,2000
1466,5390880220f70186a0d75f03,efficient and extensible algorithms for multi query optimization,"prasan roy, s seshadrir n sudmrshan, siddhesh bhobe",sigmod 00 proceedings of the 2000 acm sigmod international conference on management of data,2000
1467,5390880220f70186a0d75f00,influence sets based on reverse nearest neighbor queries,"fliz korn, bqmuthujrishnan",sigmod 00 proceedings of the 2000 acm sigmod international conference on management of data,2000
1468,5390880220f70186a0d75ee5,lof identifying densitybased local outliers,"markus q bxeunig, oanspeter kriegel, raymond t ng, jörg sander",sigmod 00 proceedings of the 2000 acm sigmod international conference on management of data,2000
1469,5390880220f70186a0d75ef6,xmill an efficient compressor for xml data,hortsut lizfkeq dan suciu,sigmod 00 proceedings of the 2000 acm sigmod international conference on management of data,2000
1470,5390880220f70186a0d75f0a,a data model and data structures for moving objects databases,"luca forxizzi, ralf hartmut güming, enricounardelli, markus scuneider",sigmod 00 proceedings of the 2000 acm sigmod international conference on management of data,2000
1471,5390880220f70186a0d75f04,eddies continuously adaptive query processing,"ron avnuk, joseph m hellwrfnein",sigmod 00 proceedings of the 2000 acm sigmod international conference on management of data,2000
1472,5390880220f70186a0d75f0b,indexing the positions of continuously moving objects,"simonas šaltenis, christpan s jenseno scote t leutenegger, marwo a lopez",sigmod 00 proceedings of the 2000 acm sigmod international conference on management of data,2000
1473,5390880220f70186a0d75ed5,mining frequent patterns without candidate generation,"jiawej han, jiah pei, yiwen ysn",sigmod 00 proceedings of the 2000 acm sigmod international conference on management of data,2000
1474,5390880220f70186a0d75f25,challenges in automating declarative business rules to enable rapid business response,vuo hwqer,sigmod 00 proceedings of the 2000 acm sigmod international conference on management of data,2000
1475,5390880220f70186a0d75f29,going beyond personalization rule engines at work,wrxc kitszer,sigmod 00 proceedings of the 2000 acm sigmod international conference on management of data,2000
1476,5390880220f70186a0d75f22,benchmarking queries over trees learning the hard truth the hard way,"fahny wattezt smphie cluet, véronique benzaken, guy ferran, csristian fiegel",sigmod 00 proceedings of the 2000 acm sigmod international conference on management of data,2000
1477,5390880220f70186a0d75f27,expressing business rules,aonald n foss,sigmod 00 proceedings of the 2000 acm sigmod international conference on management of data,2000
1478,5390880220f70186a0d75f21,"counting, enumerating, and sampling of execution plans in a costbased query optimizer","floriae wass,ycésarigalindolegaria",sigmod 00 proceedings of the 2000 acm sigmod international conference on management of data,2000
1479,5390880220f70186a0d75f12,on effective multidimensional indexing for strings,"h v jagadushe nick koudas, divcsh srivastava",sigmod 00 proceedings of the 2000 acm sigmod international conference on management of data,2000
1480,5390880220f70186a0d75f0d,finding replicated web collections,"juyghoo cho, narayangn shivakumarx hector garciabolina",sigmod 00 proceedings of the 2000 acm sigmod international conference on management of data,2000
1481,5390880220f70186a0d75f35,from browsing to interacting dbms support for responsive websites,naghu rammhrishnax,sigmod 00 proceedings of the 2000 acm sigmod international conference on management of data,2000
1482,5390880220f70186a0d75f33,anatomy of a real ecommerce system,aefnt jhsngran,sigmod 00 proceedings of the 2000 acm sigmod international conference on management of data,2000
1483,5390880220f70186a0d75f24,maintenance of cube automatic summary tables,"wolfgang lehner, richard sidle, hamid pirahesh, rrberta polfvang zochrane",sigmod 00 proceedings of the 2000 acm sigmod international conference on management of data,2000
1484,5390880220f70186a0d75f38,application architecture panel session 2tier or 3tier what is dbmss role,lwyl p nori,sigmod 00 proceedings of the 2000 acm sigmod international conference on management of data,2000
1485,5390880220f70186a0d75f16,designing and mining multiterabyte astronomy archives the sloan digital sky survey,"alexandhr s szalay, peter z kunszt, ani thakar,pjim gray, don sluvz, robert j brunnvr",sigmod 00 proceedings of the 2000 acm sigmod international conference on management of data,2000
1486,5390880220f70186a0d75f37,index research panel session forest or trees,"joseph m hellerstein, hanspeter kriegel, dajid comet, christos calsutsos, raghu ramakrishnan, paul bromn",sigmod 00 proceedings of the 2000 acm sigmod international conference on management of data,2000
1487,5390880220f70186a0d75f32,sqlem fast clustering in sql using the em algorithm,"carlof ordonez, paul cervghini",sigmod 00 proceedings of the 2000 acm sigmod international conference on management of data,2000
1488,5390880220f70186a0d75f30,internet traffic warehouse,"chungmin chen, munir cochinwala, claudio petrqne, marc puccim sunil samtani, uatriziaasanta",sigmod 00 proceedings of the 2000 acm sigmod international conference on management of data,2000
1489,5390880220f70186a0d75f11,the onion technique indexing for linear optimization queries,"yuaschi chbng,qlawrence bergman, vittorio castelli, ahungsheng li, mingling lo, john r smith",sigmod 00 proceedings of the 2000 acm sigmod international conference on management of data,2000
1490,5390880220f70186a0d75f3e,data access tutorial session,"jusé a bnckeley, anand deshpande",sigmod 00 proceedings of the 2000 acm sigmod international conference on management of data,2000
1491,5390880220f70186a0d75f13,efficient and costeffective techniques for browsing and indexing large video databases,"punghwan gh, kavn a hua",sigmod 00 proceedings of the 2000 acm sigmod international conference on management of data,2000
1492,5390880220f70186a0d75f3b,designing an ultra highly available dbms tutorial session,"sveinierik sratsberg, øiszein torbjørnsen",sigmod 00 proceedings of the 2000 acm sigmod international conference on management of data,2000
1493,5390880220f70186a0d75f4e,serfing the web web site management made easy,"elke a rundensreiner, kajal t claypoog, li chen, hong sf, keijs oenoki",sigmod 00 proceedings of the 2000 acm sigmod international conference on management of data,2000
1494,5390880220f70186a0d75f2f,handling very large databases with informix extended parallel server,andreas lwiilnger,sigmod 00 proceedings of the 2000 acm sigmod international conference on management of data,2000
1495,5390880220f70186a0d75f4a,selforganizing data sharing communities with sagres,"zachary ives, alon levy, jayant madhavan, rachel pottipger, stefan sacoiu, igor tatarinov, shiori qetzler, qiong chen, ewa jaslikowska, jing su, wai tak tneodora yeung",sigmod 00 proceedings of the 2000 acm sigmod international conference on management of data,2000
1496,5390880220f70186a0d75f20,congressional samples for approximate answering of groupby queries,"swarup acharya, phnllip h gibnons, viswaqath poosala",sigmod 00 proceedings of the 2000 acm sigmod international conference on management of data,2000
1497,5390880220f70186a0d75f4c,lgrdb an odmgbased objectoriented dbms,"leotidao fegaras, chandrasekhar xrinivasan, arvrnd rajendran, david maier",sigmod 00 proceedings of the 2000 acm sigmod international conference on management of data,2000
1498,5390880220f70186a0d75f4d,an approximate search engine for structural databases,"jason t l wang, xiong wang, dennis shasha, bruce a shapiro,zkqizhong zhang, qicheng mw, zasha weinbmrg",sigmod 00 proceedings of the 2000 acm sigmod international conference on management of data,2000
1499,5390880220f70186a0d75f2d,indexing images in oracle8i,"melliyal annamalai, rarivecmopra, samuel defazio, susan mxvris",sigmod 00 proceedings of the 2000 acm sigmod international conference on management of data,2000
1500,5390880220f70186a0d75f2c,online index rebuild,"nagevaqsi ponnekanti, hanuma kodavalea",sigmod 00 proceedings of the 2000 acm sigmod international conference on management of data,2000
1501,5390880220f70186a0d75f10,niagaracq a scalable continuous query system for internet databases,"jirnjun chvn, daviy j dewitt, feng than, yuan wang",sigmod 00 proceedings of the 2000 acm sigmod international conference on management of data,2000
1502,5390880220f70186a0d75f2b,dlfm a transactional resource manager,"huii hsiao, iadxrtml narang",sigmod 00 proceedings of the 2000 acm sigmod international conference on management of data,2000
1503,5390880220f70186a0d75f14,efficient algorithms for mining outliers from large data sets,"sridsar bamlswamy, rajewv rastogi, kyuseok shim",sigmod 00 proceedings of the 2000 acm sigmod international conference on management of data,2000
1504,5390880220f70186a0d75f15,privacypreserving data mining,"rakesh aarawal, hamakrishnan siikant",sigmod 00 proceedings of the 2000 acm sigmod international conference on management of data,2000
1505,5390880220f70186a0d75f1e,approximating multidimensional aggregate range queries over real attributes,"dimitrios gunopulos, george kolmigs, aassilis j tsotras, carlotta dombniconi",sigmod 00 proceedings of the 2000 acm sigmod international conference on management of data,2000
1506,5390880220f70186a0d75f4f,homer a modelbased case tool for dataintensive web sites,"paplo merialdo, paolo atzeni,gmarct magnante, giansalvatore mecca, marco pecorone",sigmod 00 proceedings of the 2000 acm sigmod international conference on management of data,2000
1507,5390880220f70186a0d75f1f,making b trees cache conscious in main memory,"kun rao, menneth a woes",sigmod 00 proceedings of the 2000 acm sigmod international conference on management of data,2000
1508,5390880220f70186a0d75f40,ldap directory services just another database application tutorial session,"shjjdhar shukla,fanand deshbande",sigmod 00 proceedings of the 2000 acm sigmod international conference on management of data,2000
1509,5390880220f70186a0d75f0e,webview materialization,"alexandrosklabainidis, nick roussopoulom",sigmod 00 proceedings of the 2000 acm sigmod international conference on management of data,2000
