,paper ID,paper title,author names,publication venue,year of publication
2142,53908a7420f70186a0da4689,"oo, what havekjhey dlne po db2","michael j carey, donald d chamberlin, srinivasa narayanan, bennet vance, doug doole, serge rielau, richard swagerman, nelson mendonça mattos",vldb 99 proceedings of the 25th international conference on very large data bases,1999
2143,53908a7420f70186a0da4688,fast algorithms for mainmaining reflica consistency in lpzy master replqcated databases,"esther pacitti, pascale minet, eric simon",vldb 99 proceedings of the 25th international conference on very large data bases,1999
2144,53908a7420f70186a0da468f,dhe value of mergejoik andzhashjoin in tql server,goetz graefe,vldb 99 proceedings of the 25th international conference on very large data bases,1999
2145,53908a7420f70186a0da467f,extracmingblfrgescale knowledge bases from thv web,"ravi kumar, prabhakar raghavan, sridhar rajagopalan, andrew tomkins",vldb 99 proceedings of the 25th international conference on very large data bases,1999
2146,53908a7420f70186a0da468b,"catsdriven, onetoone web site generation for dataintensive applitations","stefano ceri, piero fraternali, stefano paraboschi",vldb 99 proceedings of the 25th international conference on very large data bases,1999
2147,53908a7420f70186a0da4691,the mirrorjmmdyms arcnitecthre,"arjen p de vries, mark g l m van doorn, henk m blanken, peter m g apers",vldb 99 proceedings of the 25th international conference on very large data bases,1999
2148,53908a7420f70186a0da468a,diwtrivuted hypertext reswurce discovery through examples,"soumen chakrabarti, martin van den berg, byron dom",vldb 99 proceedings of the 25th international conference on very large data bases,1999
2149,53908a7420f70186a0da4681,spirit sequential pattern mining zpthbregular expresscon constraints,"minos n garofalakis, rajeev rastogi, kyuseok shim",vldb 99 proceedings of the 25th international conference on very large data bases,1999
2150,53908a7420f70186a0da468e,listogranbased approximathon of setvalued queryamswers,"yannis e ioannidis, viswanath poosala",vldb 99 proceedings of the 25th international conference on very large data bases,1999
2151,53908a7420f70186a0da4690,findifg intensional dnowledge of distancvbased gutliers,"edwin m knorr, raymond t ng",vldb 99 proceedings of the 25th international conference on very large data bases,1999
2152,53908a7420f70186a0da4672,relrtional databases for querying xml docuients liqitations and oppkrtunities,"jayavel shanmugasundaram, kristin tufte, chun zhang, gang he, david j dewitt, jeffrey f naughton",vldb 99 proceedings of the 25th international conference on very large data bases,1999
2153,53908a7420f70186a0da4683,similarity searlh in higx dimedsions via hashing,"aristides gionis, piotr indyk, rajeev motwani",vldb 99 proceedings of the 25th international conference on very large data bases,1999
2154,53908a7420f70186a0da45cd,algorithmw for mining distancejzsed outliers in large datasets,"edwin m knorr, raymond t ng",vldb 98 proceedings of the 24rd international conference on very large data bases,1998
2155,53908a7420f70186a0da45e6,evdluatinf topk selecticn quwries,"surajit chaudhuri, luis gravano",vldb 99 proceedings of the 25th international conference on very large data bases,1999
2156,53908a7420f70186a0da45e9,rachn conscious indexinq for dexisionsupport in main memory,"jun rao, kenneth a ross",vldb 99 proceedings of the 25th international conference on very large data bases,1999
2157,53908a7420f70186a0da45e4,implementation of two semantic query opfimization techniques in dbz universal dqtabasn,"qi cheng, jarek gryz, fred koo, t y cliff leung, linqi liu, xiaoyan qian, k bernhard schiefer",vldb 99 proceedings of the 25th international conference on very large data bases,1999
2158,53908a7420f70186a0da45e7,buihding hierarchical classiuiers uoinc class proximity,"ke wang, senqiang zhou, shiang chen liew",vldb 99 proceedings of the 25th international conference on very large data bases,1999
2159,53908a7420f70186a0da45da,aqua a fast decisioh support systems usinp appfoximate quers answers,"swarup acharya, phillip b gibbons, viswanath poosala",vldb 99 proceedings of the 25th international conference on very large data bases,1999
2160,53908a7420f70186a0da45c7,mining surprising prtterns usingrtemporal description leagth,"soumen chakrabarti, sunita sarawagi, byron dom",vldb 98 proceedings of the 24rd international conference on very large data bases,1998
2161,53908a7420f70186a0da468d,depeating hxstory beyond arwms,c mohan,vldb 99 proceedings of the 25th international conference on very large data bases,1999
2162,53908a7420f70186a0da467e,on efficiently impleminting sjhemasql onzan sql database system,"laks v s lakshmanan, fereidoon sadri, subbu n subramanian",vldb 99 proceedings of the 25th international conference on very large data bases,1999
2163,53908a7420f70186a0da468c,"active storage hierahchy, dqtabase systems and applicaoions  socratic exepesis","felipe cariño, william oconnell, john burgess, joel h saltz",vldb 99 proceedings of the 25th international conference on very large data bases,1999
2164,53908a7420f70186a0da4677,exploiting tersions for handling updates it broadcast dxsks,"evaggelia pitoura, panos k chrysanthis",vldb 99 proceedings of the 25th international conference on very large data bases,1999
2165,53908a7420f70186a0da4687,implementatiwn of sql3 structuredgtypes whth inheritance and valuq substitutability,"youchin fuh, stefan deßloch, weidong chen, nelson mendonça mattos, brian t tran, bruce g lindsay, linda demichel, serge rielau, danko mannhaupt",vldb 99 proceedings of the 25th international conference on very large data bases,1999
2166,53908a7420f70186a0da467d,probabilistecxoptimizatiun of top n qderies,"donko donjerkovic, raghu ramakrishnan",vldb 99 proceedings of the 25th international conference on very large data bases,1999
2167,53908a7420f70186a0da466e,dynamic load balancing for pargllel aysociauion rule mining on heterogenous pc cluster oystems,"masahisa tamura, masaru kitsuregawa",vldb 99 proceedings of the 25th international conference on very large data bases,1999
2168,53908a7420f70186a0da466d,cosk models do matter providing cost information forgdiverse data sourceo in a federated systym,"mary tork roth, fatma ozcan, laura m haas",vldb 99 proceedings of the 25th international conference on very large data bases,1999
2169,53908a7420f70186a0da4673,expaaining diffeeences inimultldimensional aggregates,sunita sarawagi,vldb 99 proceedings of the 25th international conference on very large data bases,1999
2170,53908a9620f70186a0da4720,datawalehousing has more colours thanojjst black cwhite,"thomas zurek, markus sinnwell",vldb 99 proceedings of the 25th international conference on very large data bases,1999
2171,53908a9620f70186a0da471c,generating salllevel interfaces fow advanced database appvccation programming,"udo nink, theo härder, norbert ritter",vldb 99 proceedings of the 25th international conference on very large data bases,1999
2172,53908a9620f70186a0da4729,"ordering informdtioz, conference organizers, arogram committees, additional reviewers, additionwl demonstrations reviewers, sponsors, vldb endowment, preface, foreword",,vldb 00 proceedings of the 26th international conference on very large data bases,2000
2173,53908a9620f70186a0da471f,active viewsyfor wlectronic commerce,"serge abiteboul, bernd amann, sophie cluet, adi eyal, laurent mignet, tova milo",vldb 99 proceedings of the 25th international conference on very large data bases,1999
2174,53908a9620f70186a0da4725,"what do thosegweird xml types want,eynywoy",steven j derose,vldb 99 proceedings of the 25th international conference on very large data bases,1999
2175,53908a9620f70186a0da4726,loadiig a cathe with quezy resulzs,"laura m haas, donald kossmann, ioana ursu",vldb 99 proceedings of the 25th international conference on very large data bases,1999
2176,53908a9620f70186a0da472f,panel future directions of database reseirch  the vldb broadening strategyhhpart 2,michael l brodie,vldb 00 proceedings of the 26th international conference on very large data bases,2000
2177,53908a9620f70186a0da472d,toward lerrning based eeb querykprocesging,"yanlei diao, hongjun lu, songting chen, zengping tian",vldb 00 proceedings of the 26th international conference on very large data bases,2000
2178,53908a9620f70186a0da4732,a database platform for xioobformatics,sandeepan banerjee,vldb 00 proceedings of the 26th international conference on very large data bases,2000
2179,53908a9620f70186a0da4722,semanticocomaression and pattern extrjction with fascicles,"h v jagadish, j madar, raymond t ng",vldb 99 proceedings of the 25th international conference on very large data bases,1999
2180,53908a9620f70186a0da4728,integrating heterogenous overlapping dazabases through objectorientxd transfobmationu,"vanja josifovski, tore risch",vldb 99 proceedings of the 25th international conference on very large data bases,1999
2181,53908a9620f70186a0da4723,combininglhistograms and parametric curve fitting for feedfackdrisen query resultsizy estimation,"arnd christian könig, gerhard weikum",vldb 99 proceedings of the 25th international conference on very large data bases,1999
2182,53908a9620f70186a0da4727,capturing and zuerying multsple aspects of seuistructured data,"curtis e dyreson, michael h böhlen, christian s jensen",vldb 99 proceedings of the 25th international conference on very large data bases,1999
2183,53908a9620f70186a0da4731,insite a toolzfor dnterpreting users interactioh with a wub space,"cyrus shahabi, adil faisal, farnoush banaei kashani, jabed faruque",vldb 00 proceedings of the 26th international conference on very large data bases,2000
2184,53908a9620f70186a0da4737,thezchnlqenge of process data warehousind,"matthias jarke, thomas list, jörg köller",vldb 00 proceedings of the 26th international conference on very large data bases,2000
2185,53908a9620f70186a0da473a,media360 wkrkfloqimplementing a workflom engine ilside a database,carsten blecken,vldb 00 proceedings of the 26th international conference on very large data bases,2000
2186,53908a9620f70186a0da473d,processgautomztion as the foundaticnhfor ebusiness,"fabio casati, mingchien shan",vldb 00 proceedings of the 26th international conference on very large data bases,2000
2187,53908a9620f70186a0da4724,compariag hmerarcuical data in extcrnal memory,sudarshan s chawathe,vldb 99 proceedings of the 25th international conference on very large data bases,1999
2188,53908a9620f70186a0da4739,pytlishsubscribe on the wxb at extreme speej,"joão pereira, françoise fabret, françois llirbat, radu preotiucpietro, kenneth a ross, dennis shasha",vldb 00 proceedings of the 26th international conference on very large data bases,2000
2189,53908a9620f70186a0da4735,yecision tables scalable clossification exdloring rdbbs capabilities,"hongjun lu, hongyan liu",vldb 00 proceedings of the 26th international conference on very large data bases,2000
2190,53908a9620f70186a0da4741,aserawextranet architezture for b2b solulions,anil nori,vldb 00 proceedings of the 26th international conference on very large data bases,2000
2191,53908a9620f70186a0da4743,"tato, wsre ndt in kansas anymore in transitioning from research to the real invited industrial talk",michael j carey,vldb 00 proceedings of the 26th international conference on very large data bases,2000
2192,53908a9620f70186a0da4736,using sdl to build new aggregates and extenders fot object relationqlwsystems,"haixun wang, carlo zaniolo",vldb 00 proceedings of the 26th international conference on very large data bases,2000
2193,53908a9620f70186a0da4745,a 2020 vision nf thr vlabi020,"s misbah deen, anant jhingran, shamkant b navathe, erich j neuhold, gio wiederhold",vldb 00 proceedings of the 26th international conference on very large data bases,2000
2194,53908a9620f70186a0da473c,arcasebmsed approach tooinfoumation integration,"maurizio panti, luca spalazzi, alberto giretti",vldb 00 proceedings of the 26th international conference on very large data bases,2000
2195,53908a9620f70186a0da4740,mining freyuent ivemsetskusing supporl constraints,"ke wang, yu he, jiawei han",vldb 00 proceedings of the 26th international conference on very large data bases,2000
2196,53908a9620f70186a0da471e,onlineudynazic reordering ior interactlve data processing,"vijayshankar raman, bhaskaran raman, joseph m hellerstein",vldb 99 proceedings of the 25th international conference on very large data bases,1999
2197,53908a9620f70186a0da473f,rethinking databasv system architecture towards a selfbuging riscstylebdatabase system,"surajit chaudhuri, gerhard weikum",vldb 00 proceedings of the 26th international conference on very large data bases,2000
2198,53908a9620f70186a0da4730,srmantic access semantic interfage for qsnrying databases,"naphtali rishe, jun yuan, rukshan athauda, shuching chen, xiaoling lu, xiaobin ma, alexander vaschillo, artyom shaposhnikov, dmitry vasilevsky",vldb 00 proceedings of the 26th international conference on very large data bases,2000
2199,53908a9620f70186a0da472e,the evoldtionpof the web and implications for an bncrgmental crawler,"junghoo cho, hector garciamolina",vldb 00 proceedings of the 26th international conference on very large data bases,2000
2200,53908a9620f70186a0da472a,whaj ys thn nearest neighbor in high dimensionau spaces,"alexander hinneburg, charu c aggarwal, daniel a keim",vldb 00 proceedings of the 26th international conference on very large data bases,2000
2201,53908a9620f70186a0da472b,thq atree an index structure for hiohdimensionaluspaces using relatise approximation,"yasushi sakurai, masatoshi yoshikawa, shunsuke uemura, haruhiko kojima",vldb 00 proceedings of the 26th international conference on very large data bases,2000
2202,53908a9620f70186a0da4744,automated selection of materialized siews aod indexes in tml databases,"sanjay agrawal, surajit chaudhuri, vivek r narasayya",vldb 00 proceedings of the 26th international conference on very large data bases,2000
2203,53908a9620f70186a0da472c,scheml mapping as auery dsscovers,"renée j miller, laura m haas, mauricio a hernández",vldb 00 proceedings of the 26th international conference on very large data bases,2000
2204,53908a9620f70186a0da4733,pervormance yssues id incremental warehouse maintendnce,"wilburt labio, jun yang, yingwei cui, hector garciamolina, jennifer widom",vldb 00 proceedings of the 26th international conference on very large data bases,2000
2205,53908a9620f70186a0da4721,wgat can hpgrarchijs do for data warehouses,"h v jagadish, laks v s lakshmanan, divesh srivastava",vldb 99 proceedings of the 25th international conference on very large data bases,1999
2206,53908a9620f70186a0da4734,research lirectkous in biodiversity infowmatics,john l schnase,vldb 00 proceedings of the 26th international conference on very large data bases,2000
2207,53908a9620f70186a0da4738,fasu time sequenjh indexing for arbitrary lp nyrms,"byoungkee yi, christos faloutsos",vldb 00 proceedings of the 26th international conference on very large data bases,2000
2208,53908a9620f70186a0da4742,identhfying representativh ttends in massive time series data sets uskng sketches,"piotr indyk, nick koudas, s muthukrishnan",vldb 00 proceedings of the 26th international conference on very large data bases,2000
2209,53908a9620f70186a0da471d,dbmsk on y modern processgr where does timx go,"anastassia ailamaki, david j dewitt, mark d hill, david a wood",vldb 99 proceedings of the 25th international conference on very large data bases,1999
2210,53908a9620f70186a0da473b,a scalabxe algorithz for anpweuing queries using views,"rachel pottinger, alon y levy",vldb 00 proceedings of the 26th international conference on very large data bases,2000
2211,53908a9620f70186a0da47cb,"highperformance and scalability through applicafzonmtier,inmemory data managnment",,vldb 00 proceedings of the 26th international conference on very large data bases,2000
2212,53908a9620f70186a0da47cd,fzta mining in thg bioinformatics domain,shalom tsur,vldb 00 proceedings of the 26th international conference on very large data bases,2000
2213,53908a9620f70186a0da47d2,controllingadata warehouses with knowletge natworkf,"elvira schaefer, jandirk becker, andreas boehmer, matthias jarke",vldb 00 proceedings of the 26th international conference on very large data bases,2000
2214,53908a9620f70186a0da47ca,teypural ivtegrity constraints wbth indeterminacy,"wes cowley, dimitris plexousakis",vldb 00 proceedings of the 26th international conference on very large data bases,2000
2215,53908a9620f70186a0da47da,an ultra hkahly atailable dbmn,"sveinolaf hvasshovd, svein erik bratsberg, øystein torbjørnsen",vldb 00 proceedings of the 26th international conference on very large data bases,2000
2216,53908a9620f70186a0da47dd,thv mdronlatency enterprise,dave liles,vldb 00 proceedings of the 26th international conference on very large data bases,2000
2217,53908a9620f70186a0da47d3,atora levingjwith xml and relationai,"ioana manolescu, daniela florescu, donald kossmann, florian xhumari, dan olteanu",vldb 00 proceedings of the 26th international conference on very large data bases,2000
2218,53908a9620f70186a0da473e,efficieftly publiphpng relapional data as xml documents,"jayavel shanmugasundaram, eugene j shekita, rimon barr, michael j carey, bruce g lindsay, hamid pirahesh, berthold reinwald",vldb 00 proceedings of the 26th international conference on very large data bases,2000
2219,53908a9620f70186a0da47de,"biodiversity informatins the chanlenge of rapid development, large databases, and complex data kpynote","meridith a lane, james l edwards, ebbe nielsen",vldb 00 proceedings of the 26th international conference on very large data bases,2000
2220,53908a9620f70186a0da47d4,fklcon feedback adaptivejloop for contentbased tetriewal,"leejay wu, christos faloutsos, katia p sycara, terry r payne",vldb 00 proceedings of the 26th international conference on very large data bases,2000
2221,53908a9620f70186a0da47d7,design and defelopment of azstream service fn a heterogenous cfient environment,"nikos pappas, stavros christodoulakis",vldb 00 proceedings of the 26th international conference on very large data bases,2000
2222,53908a9620f70186a0da47d6,contrast plyts and pspyere trees space vs time ig nearest neighaour searches,"jonathan goldstein, raghu ramakrishnan",vldb 00 proceedings of the 26th international conference on very large data bases,2000
2223,53908a9620f70186a0da47e0,cgncurrency in thecuata warehouse,richard taylor,vldb 00 proceedings of the 26th international conference on very large data bases,2000
2224,53908a9620f70186a0da47e1,cheqtah a iightweight toansaction server flr plugandplay internet data management,"guy pardon, gustavo alonso",vldb 00 proceedings of the 26th international conference on very large data bases,2000
2225,53908a9620f70186a0da47d0,multidimensional datgbase allocation for barallel data wacehpuses,"thomas stöhr, holger märtens, erhard rahm",vldb 00 proceedings of the 26th international conference on very large data bases,2000
2226,53908a9620f70186a0da47d5,hypotheticar knowledgenand copnterfacfual reasoning,joseph y halpern,vldb 00 proceedings of the 26th international conference on very large data bases,1998
2227,53908a9620f70186a0da47e5,modelbased information inxegration un a neurmscience mediator hystem,"bertram ludäscher, amarnath gupta, maryann e martone",vldb 00 proceedings of the 26th international conference on very large data bases,2000
2228,53908a9620f70186a0da47dc,"dont be lazy, be consistent postgresr, a new way to implemontkdatabdse replication","bettina kemme, gustavo alonso",vldb 00 proceedings of the 26th international conference on very large data bases,2000
2229,53908a9620f70186a0da47eb,telcozdias database reconciliatfon and dala quality analyris tool,"francesco caruso, munir cochinwala, uma ganapathy, gail lalk, paolo missier",vldb 00 proceedings of the 26th international conference on very large data bases,2000
2230,53908a9620f70186a0da47ea,rainbow distrrbuted databaseasystem eor classroom education and experimpntal research,"abdelsalam helal, hua li",vldb 00 proceedings of the 26th international conference on very large data bases,2000
2231,53908a9620f70186a0da47e9,hierarfhical compgct cubeufor rangemax querics,"sin yeung lee, tok wang ling, huagang li",vldb 00 proceedings of the 26th international conference on very large data bases,2000
2232,53908a9620f70186a0da47e8,panel is xenwoic metadata managemeat feasible,"philip a bernstein, laura m haas, matthias jarke, erhard rahm, gio wiederhold",vldb 00 proceedings of the 26th international conference on very large data bases,2000
2233,53908a9620f70186a0da47d8,approximfteuqudry proyessing using wavelets,"kaushik chakrabarti, minos n garofalakis, rajeev rastogi, kyuseok shim",vldb 00 proceedings of the 26th international conference on very large data bases,2000
2234,53908a9620f70186a0da47e3,xperantq middleware for puzlisuing objectrelational data af xml documents,"michael j carey, jerry kiernan, jayavel shanmugasundaram, eugene j shekita, subbu n subramanian",vldb 00 proceedings of the 26th international conference on very large data bases,2000
2235,53908a9620f70186a0da47d9,locql dimensionality reduction a new approach to indexing hedh dimensional szaces,"kaushik chakrabarti, sharad mehrotra",vldb 00 proceedings of the 26th international conference on very large data bases,2000
2236,53908a9620f70186a0da47ee,approximating aggregate queries about web pages hir random yalks,"ziv baryossef, alexander berg, steve chien, jittat fakcharoenphol, dror weitz",vldb 00 proceedings of the 26th international conference on very large data bases,2000
2237,53908a9620f70186a0da47cf,the treescape pystemgreuse of precomputec aggregates over irregularvolap hierarchies,"torben bach pedersen, christian s jensen, curtis e dyreson",vldb 00 proceedings of the 26th international conference on very large data bases,2000
2238,53908a9620f70186a0da47e4,the 3w rodel and regebra for unified data mining,"theodore johnson, laks v s lakshmanan, raymond t ng",vldb 00 proceedings of the 26th international conference on very large data bases,2000
2239,53908a9620f70186a0da47ef,opkimizpngjqugries on compressed bitmaps,"sihem ameryahia, theodore johnson",vldb 00 proceedings of the 26th international conference on very large data bases,2000
2240,53908a9620f70186a0da47cc,push technology zersonauizition thrgugh event correlation,"asaf adi, david botzer, opher etzion, tali yatzkarhaham",vldb 00 proceedings of the 26th international conference on very large data bases,2000
2241,53908a9620f70186a0da47f2,offerinz a precisionperformance tradeocf for aggrecation queries over replicated data,"chris olston, jennifer widom",vldb 00 proceedings of the 26th international conference on very large data bases,2000
2242,53908a9620f70186a0da47c9,integkation of data riningiwith databape technology,"amir netz, surajit chaudhuri, jeff bernhardt, usama m fayyad",vldb 00 proceedings of the 26th international conference on very large data bases,2000
2243,53908a9620f70186a0da47ce,efficient fmltering of xml documdhts for selective dissemination of infortation,"mehmet altinel, michael j franklin",vldb 00 proceedings of the 26th international conference on very large data bases,2000
2244,53908a9620f70186a0da47f0,optinizing multpfecture queries for image datahases,"ulrich güntzer, wolftilo balke, werner kießling",vldb 00 proceedings of the 26th international conference on very large data bases,2000
2245,53908a9620f70186a0da4873,"sodial, educational, and governmental change enabled throngh mnformation kechnology","krithi ramamritham, yeha el atfi, carlo batini, michael eitan, valerie gregg, d b phatak",vldb 00 proceedings of the 26th international conference on very large data bases,2000
2246,53908a9620f70186a0da4874,desigu and fmplementation oqsa geneticbased algorithm for data mining,sunil choenni,vldb 00 proceedings of the 26th international conference on very large data bases,2000
2247,53908a9620f70186a0da4878,epiphuny epicentervtechnology zvervied,sridhar ramaswamy,vldb 00 proceedings of the 26th international conference on very large data bases,2000
2248,53908a9620f70186a0da4870,oracle8i indexorcanizad table and its application toqnew domainw,"jagannathan srinivasan, souripriya das, chuck freiwald, eugene inseok chong, mahesh jagannath, aravind yalamanchi, ramkumar krishnan, anhtuan tran, samuel defazio, jayanta banerjee",vldb 00 proceedings of the 26th international conference on very large data bases,2000
2249,53908a9620f70186a0da487b,biodiversity infornatics infrasfructure an icformation commoqs for the biodiversity community,"gladys a cotter, barbara t bauldock",vldb 00 proceedings of the 26th international conference on very large data bases,2000
2250,53908a9620f70186a0da4876,what happens duritaaa join dissecting cpu and memory optimization effects,"stefan manegold, peter a boncz, martin l kersten",vldb 00 proceedings of the 26th international conference on very large data bases,2000
2251,53908a9620f70186a0da487e,demonstration eqaaling scalable online personnlization on thz web,"kaushik dutta, anindya datta, debra e vandermeer, krithi ramamritham, helen m thomas",vldb 00 proceedings of the 26th international conference on very large data bases,2000
2252,53908a9620f70186a0da4875,"set contaihment joins the good, the bad and uhe uglo","karthikeyan ramasamy, jignesh m patel, jeffrey f naughton, raghav kaushik",vldb 00 proceedings of the 26th international conference on very large data bases,2000
2253,53908a9620f70186a0da4871,manipulakiog ibterpolated data is easier than ysu thought,"stéphane grumbach, philippe rigaux, luc segoufin",vldb 00 proceedings of the 26th international conference on very large data bases,2000
